class_index,review_title,review_text
2,"Not for ""Every Working Woman""","This book applies to women who are in leadership positions, which I am not, so I despise the title ""Nine Secrets Every Working Woman Must Know"". It's misleading. I'm currently reading this book and have only found a small paragraph that applies to ""every working woman."" Given the title, I thought the book would give helpful tips on getting ahead for the average working woman, but it doesn't. Needless to say, it didn't do me much good for where I am currently in my career."
1,Do not buy,"This is an awful DVD, they tried to make it too conceptual and it failed! it's boring you just see paul booth being ass kissed and there is no actual work ever done. There is nothing interesting about seeing him having a good time with a all these rick bands."
2,Could have been so much more,"Paul Booth is an amazing artist, and this DVD is entertaining but it could have been so much more."
3,American Fan,"While the CD is great, it is missing some songs I wish were on it from the American release."
4,Tom Jones - Help Yourself,Songs Include :Help YourselfI Can't Break The News To MyselfThe BedSet Me FreeI Get Carried AwayLauraElusive DreamsThe House SongSo AfraidIf I PromiseIf You Go AwayMy Girl MariaAll I Can Say Is Goodbye
5,I wish I had this book when I was just starting out,"I have been scrying for over a quarter of a century and yet this book was able to teach me new things about my old craft. The best thing about Mr. Hawk's book is that it contains a complete set of instructions. From selecting a scrying device, to preparing it, to clearing it of past influences, to linking it with your own psychic nature, and (most importantly) to actually scrying, this book is solid gold. It is delightfully free of dogma and the writing is clear and easy to understand. ""Exploring Scrying"" should be in every psychic's bookshelf."
5,Exploring Scrying ... from a novice,"This delightful little book caught my attention...drawn to it perhaps??? Regardless as to the reasons why, I found the material to be entertaining and informative. The author addresses his reading audience in a humorous, well written, to the point manner. He approaches the subject so that the novice can read, absorb the information and not be timid in her/his attempt to begin to learn and understand the ancient art of scrying. One is encouraged to learn what ones skill may be in this area of the metaphysical.I found the presentation easy to read, understand and would recommend this book to anyone so interested. Looking forward to more from this augthor."
2,I could have saved time looking on an online wiki,This book is the basic of the basic. It was filled with lots of breathing exercises and how to's on choosing a crystal ball. At about chapter 7 was when they had a how to section and this was only about a page or two long. I could have saved time just reading this stuff on the web. I was a little disapointed and was hoping for a bit more in the how to part.
2,uuuuuhhh ok.,"This book is ok, thats it. You can do a search on the internet on skrying and come up with the same stuff. IMHO there are much better books out there on the subject. Here is how you skry: 1. Learn how to visualize anything with as much clarity as possible.2. Learn how to project these imaginations outside yourself as if they were seperate objects/beings/energies/etc. 3. When you reach a decent level of this take a solid color object (black/midnight blue/red/green...) 4.Imagine object are on surface. 5. continue to do this while building on your ability to *accurately* view things. 6. SkryIf your serious about skrying there are MUCH better books out there."
5,Beautiful in any language...,I bought this edition of this classic for my newest granddaughter. Her mother is from Mexico and I believe all children should know both their heritages. This book is wonderful no matter what language it is in. I wanted my daughter in law to be able to read stories to the baby in Spanish and English. I intend to give them a copy in English next time so her father can read it to her as well.
5,Lovely story - I strngly recommend it,I have a 5 years old daughter and she already has a picture from this book hanging in her room. When I saw the book I immediately bought it and read it to her the minute it arrived. She absolutely loved it!!!
4,Skate 4 ever,This is a very cool game I would have rated it 5 stars but I played it after underground. And undergound was better but this is still a sweet game. It's coooooooooooooooooooooooool!
4,Great game,"Very cool game, and I'm not a skater. A little frustrating at first, but you'll be doing fine in no time. Recommended."
3,Just a little too much for me and my son,"I'm an old guy; my son is 6. Together, we had so much fun learning and mastering Pro Skater 3 that we couldn't wait to try Pro Skater 4. Unfortunately, as advanced as the game is in terms of graphics and intensity, it's just too much for my son and I to enjoy together. I've tried and tried, using the strategy guide as my source book, but the game is just too difficult to master or enjoy. The game interface is so far beyond what a simple guy like me and my young son can do together. Teenagers may love it, but it's just too much right now."
5,the best skating game ever made!!!,"this has to be the best game this year. i played the demo on Kelly Slaters Pro Surfer, and this game is awesome. its so different from thps3. now you can skitch on cars, bust new tricks, and even talk to people. when you talk to certain people, they will give you an objective. you have a time limit, but it goes away when you finish the challenge. so career mode is like a free skate, but career mode all the same. there is also a pro challenge mode, where you start off as an amateur and as you do more things you become more popular. like i said before, this is going to be the best game ever."
4,Overall good game,"i have just recently gotten the new thps4. I have also played all of the other thps's and own thps2. In comparison with thps2 it is a very different game. they now have a free skate style for career and in the level there are icons that have certain tasks. the levels are bigger, but there are less of them. There is more career goals and they are vary in difficulty. The only downfall that thps4 has is that the graphics for the create a skater is terrible. It is extremely sloppy and you can barely tell what your person looks like. Other than that one little hitch i would recommend it."
5,"Even if you don't like Skating, you will dig this","Just a good all around game. I have never Skateboarded in my life but I ended up playing this while waiting for a friend and loved it. You can create and modify every inch of your player from tatoos to talent, you can climb walls, do a back flip, and land on a car on a skate board. I mean, what else do you want?In the top 3 fun titles for PS2 next to GTA Vice City (the greatest console game ever invented) and Grand Turismo 3."
4,Pretty Fun!,"Tony Hawk Pro Skater 4 is a very fun and interesting game. But THPS4 lacked the magic THPS3 THPS2 and THPS put out in it's game play. First level (which is college) is very easy compared to the next 8 levels ahead. you may get a bit confused as a guy runs up to you at the start and tells you that you have to talk to people to get goals. Talk to people!? Okay... As the level progresses, you will notice as you veiw your goals, that some goals will be locked. Wow. You need to even find the people that give you goals (which may take a while) There are TONS of new tricks and fun things to do in THPS4, such as spine transforing, flat level ticks while manualing and a while lot of new and improved specials. My fav. is the one called.... awww yeah. I'd reccomend renting THPS4 before buying it.It's one of those games where you either love it...... or hate it.Well. . . cheerio."
5,Wow!!!,"This is the best book I've read all year. It surprised me--The Secret Life of Cowboys is a book for anyone who has ever had a dream--of a different job, a different future, a different life--and wondered what it might take to pursue it. The book left me feeling energized to live my life to the fullest, to take a few chances, and to appreciate what I already have. It made me laugh, made me cry in places, and made me think. I recommend this book highly. Everyone should read it."
4,Culture shock,"Armed with not much more than an English degree, Groneberg responds to an ad in, of all places, the literary Utne Reader, for someone to work on a horse ranch in Colorado. Before you can say ""giddyap,"" he's working toward another degree in horses in Montana.There's a girl involved, of course, and you somehow suspect they'll ride happily off into the Western sunset together. But things take a darker turn...Beautiful writing; the effects of Groneberg's English degree show up in the beautiful and poetic language of this surprising and very good book."
3,The Secret Life of Cowboys,"I feel that this book was quite refreshing.I really enjoyed the book in the end, but at first I thought it read somewhat slow. I was very suprised at the way Groneberg pulled me in by displaying such a well written description of his life. Mr. Groneberg is a strong writer who keeps my attention, displays good organization/structure, however he could do a better job of giving definitions on certain ""cowboy"" terms that those from the city may not know or understand. Mr. Groneberg establishes his credibilty in this book by explaining that he has lived and worked on cattle ranches. He does a good job of giving descriptive details, personal experiences and observations, and examples and illustrations. Mr. Groneberg's book is recent and more applicable to this generation of ""wannabe"" cowboys. I enjoyed this book and would recommend it to anyone interested in the cowboy way of life."
1,Not very appealing.,"Once you get started reading, this book appears to be the real thing. Although it may be a true life experience, it becomes very hard to keep your attention and rambles on concerning some big dreams financed by his father's forture, only to become a total failure. To top the story, he must to turn to medication to keep his senses and continue to "" dream "" about being a cowboy. After reading this, I wonder what would have been the true outcome if he didn't have parents to finance his way, and stay away from the mood-altering drugs. Don't waste your money on this one, that is, unless, daddy is paying for it"
2,"Secret Life of One ""Cowboy""","I was really intrigued by this book but after the first section with Tom's working trail rides I had a hard time. Frankly, he went through what many go through trying to re-invent ourselves in a new line of work - a lot of problems. Frankly, I would rather have heard the perspective from some of the old time cowboys who were still able to get it done vs someone trying to get into the life and struggling. I appreciate Tom's candor in realizing that he was not up to par with those that have it in their blood, passed from generation to generation. I guess it is a good thing that at least he stuck with the elements that he was good at and gave up on the areas he struggled with vs moving back east to his old life. I was really looking forward to hearing the ""secret"" part of the life of cowboys - those who do it all."
2,He's not really a cowboy ... but wants to be,"Ok book about privileged young man who wants to be a cowboy. When he gets tired of surviving on his own making meager wages as a ranch hand in a pretty part of Montana, his wealthy father buys him a large ranch in eastern Montana, on the Great Plains. He really doesn't have the background, the grit, to succeed at this. The Great Plains and the life of a rancher who is responsible for the ranch, not just a ranch hand who is really a college-educated guy from suburban Chicago, is too much for him. His writing style is wearying in the constant present tense he writes in, a very flat tone and not lyrical or poetic. He moves back to the pretty and less harsh part of Montana so he can be a part time 'cowboy' and full time writer. His story is not compelling so I am not going to read any more of his writings. Too bad real cowboys don't have wealthy fathers!"
1,Could not finish this book.,"This book had great potential and, judging by the ratings of other posters, is a good read overall. But I couldn't finish it. I know these are facts of life, but I was disturbed to read about the suffocation of the calf and the killing of the deer. Both scenes were too graphic for me."
4,A pretty good system,"The Gamecube was meant for games, not music or DVDs. It focused on games and ONLY on games. This is probably why Gamecube costs less than PS2 or Xbox. People these days are into music and movies. Knowing this, Sony and Microsoft put DVD players and music players in their systems. The games for the Gamecube can be entertaining for a while, but not that long. The games are meant for kids, not adults. Sometimes, adults out there, when you need to take a break from the real world, this sytem will bring you out of it. When comparing the graphics of the next-gen systems, Gamecube comes second, trailing Xbox, but leading PS2. You have to be patient with Gamecube though, for it takes a long time coming out with games. PS2 and Xbox are just rollin' out with games by the month. The graphics are sleek, run-time is good, and the control has a nice layout(it can take a few days to get used to). Overall, this is a pretty good system. Follow my advice (I own the system)."
2,Why bother?,"I had a Playstation 2 then bought a Gamecube. You're much better off just buying a Playstation 2. Any extra games you could play owning a Gamecube don't justify its cost. I wish I had just spent the money on Sly 2, Jak 3, or Ratchet 3. It would have been money better spent. Live and learn."
4,This is the best video game system ever!,"Forget PS2 and Xbox Gamecube is definatly the best system ever. It has the best graphics, games, and features! You can hook it up to another gamecube and play an 8 player game!!!! This system is definatly not just for the younger kids."
1,Broken,"I received my gamecube on time, hooked it up and found out the controller was broken. I go out to buy a new one and when I return, I find that my gamecube can not read any disc."
4,"Game Cube, one of the worst systems ever!","Todays gaming systems are all very good and have good graphics and a lot of games. Wait. I take that back. Not all of the gaming systems are good. If you are thinking about buying a gamecube, I advise you not to buy it! It's one of the worst systems ever! It's a system for little kids! There are a lot of kids games for this system! Example? Super Smash Brothers melee, and Marrio Party 4. What stupid games! There are also very little games out for this system and the graphics are very bad. If you are looking for a good gaming system, you should buy a PS2. (Playstation 2) The games are good and there are a lot of them. The graphics are also very good and it can do more than just play games!"
4,i haet patatoez,"HHHHHHIIIIIIII like the Gamecube but,the games for it are Only pretty good.BBBBBBBBYYYYYYYYEEEEEEEEE"
3,Facts,"I used to own a Game Cube. I thought it was the best and the Xbox sucked, but now i have a PS2 and an Xbox. I think that the Xbox is the best system because its got everything you need.1. 8 gb memory (means no memory cards).2. it does have the best graphics (and yes the Game Cube does have the second best but the games are not good enough for the system).3. a great set of games, it didnt have much to start out but now there are a lot of games.4. Halo.5. the controlers are better (they used to be too big).6.and, I know its cool but, the games are too small for the game cube and get lost."
3,Game Cube,"I'm a gamer, through and through, but I just didn't like this system. It wasn't up to the same par as the other consoles that came out at this time. It doesn't play dvd's and it doesn't have a good game selection, especially not for people my age (19). Eternal Darkness was the best thing for it. I would say just wait until the next big Nintendo console comes out."
4,Quality Game System,This system is pure quality. Here are some of the pros.Pros.Good Grapics. Good Games. MultiplayerTheres only one con..Not as many games as PS2BUY IT!
1,All are great but what is the best?,"All the new consols ore great super, but only one is the best. Lets start with PS2. It got the widest variety of games, less than half are any good. it has the worst graphics of the three. Next is XBOX. it has a built in hard drive 20GB and a costomized Nvidia graphics card and xbox has never used it to even half of its capablity you will see wat i mean when halo2 comes out, only broadband online for faster gameplay onlline and it already has a built in adapter, the tightest first person shooters and sport games. And then there is game cube it is turly great chough chough. it is for two year olds There are only like three good shooters and no good sport games. The only good thing is mario man. You cant even play dvd's or cd's even though xbox and ps2 can. And xbox doesnt need the remote for cd's and you can download songs on the harddrive.So last is Game cube2nd Ps21st XBOXThing of the names Box and cube a card board box is bigger than an ice cube."
1,sad system,"I own 8 different sytems, and my gamecube is the new atari jaguar. Nintendo promised a great system with wonderful games and what we got was a second rate wanna be computer with old n64 rehashed games. The online play for gamecube is a sad joke. Only one game that supports online, pretty lame. Free downloads from XBOX live, chat in every game, less than a minute to get online. The XBOX exclusives are also miles ahead of the lamecube exclusives. Sorry ladies but lamecube suxxxxxxxxxxxxxxxxxxxxxxxxxxxxxxxxxxxxxxxxxxxxxxxxxxxxxxxxxxxx.XBOX has proven that the people will not tolerate second rate, pathetic graphics and sound of gamecube. . Poor quality in the games, no third pary support and no online play. Time to put the cube on the shelf next to my jaguar and n64. XBOX rulezzzzzzzzzz."
2,VERY UPSET,"IM DISSAPOINTED IN GAMECUBE. ALL OF THE OLD NINTENDO SYSTEMS HAVE HAD GOOD GAMES THAT HAD MAJOR ACTION AND VIOLENCE. IVE HAD THE GAMECUBE SICE IT HAS BEEN OUT.HERE ARE THE PROS AND CONS ABOUT THIS SYSTEM.PROS- 1)ORIGIAL GAMES LIKE THE MARIO CLASSICS.2)IT IS A SMALL SYSTEM THAT IS LIGHTWEIGHT.3)GREAT CONTROLLER STYLE.CONS- 1)GAMES ARE PATHETIC AND BORING TO TEENS(VERY FEW GOOD GAMES)2)SYSTEM FREEZES UP SOMETIMES OR CAN SCRATCH DISKS.3)MEMORY CARDS CAN NOT HOLD MUCH MEMORY.I WOULD RECOMMEND THE XBOX BECAUSE THE GAME CHOICE HAS GREAT TOPICS. THE GRAPHICS ARE UNBELIEVABLE AND MEMORY IS STORED IN THE XBOX.I HOPE YOU WILL LISTEN TO THIS. DON'T GET ME WRONG, BUT THE GAMECUBE IS A GOOD THING FOR KIDS 10 AND UNDER.FAREWELLAND BY THE WAY, MY NAME ISNT GLORIA, IM A BOY WHOS 14"
4,the cube rox,"i have a gamecube, with super smash bros melee, and turok evolution. i have to say that i like my gamecube alot better than Xbox. the controls are nice, they have few but fun games(with great ones coming out, i hear) and i enjoy it alot. GO NINTENDO!"
5,Gamecube Rox,"Gamecube rocks!I think it is the best system ever.I don't wantan Xbox because it freezes up and overheats.And plus it hastons of cool games like sonic adventure 2 battle,super smash bro."
4,"Great Console, Weak Third Party Game Library","Please know that I love Nintendo, and have owned all of their major systems. GameCube was the first of this generation of systems that I bought (I now own a PS2 and an XBox). I love Nintendo games, so I am happy with it. If I had to choose only one system, this would not be it.Pros:* Nintendo's own games (e.g. Legend of Zelda, Super Smash Bros. Melee, Metroid, Paper Mario) are some of the best in the industry.* The graphics and audio power of this unit are amazing.* The system is very portable, complete with a handle for carrying.* The controller is very ergonomic and easy to use.Cons:* Many major titles have not been brought to GameCube, even if they are on XBox AND PS2.* The system requires that you purchase memory cards, and a hard drive is not available.* Online gaming is not available (I think there might be one game), and is not encouraged by Nintendo."
5,Best M games,Gamecube has the least M games but they have the best M games like ETERNAL DARKNESS which got a 9.4 on Gamespot and has resident evil games only for gamecube GC also has hitman true crime and BMX XXX gamecube is best console
4,great sysyem,"this is the most valuable system.if you go anywere in a car,plane I recomend this You can buy a cable to conect toa gameboy Advance"
5,DUDE! THE BEST THERE IS MAN!,"I have a GC and I love the heck out of it. It is THE best because it focous the ENTIRE system on ACTUAL GAMING! Nintendo has like 200 games for it already so don't say they don't have a big library! The nice thing is the wavebird controler (dude it's wireless!) and it can run for 100 hours on 2 AA bats. Plus you can get it everywhere. sure they have ps2 wireless controlers but only at few stores and it's not sony brand. yes, wavebird is nintendo brand so it says quality! Overall, it's the best thing scence the ATARI came out. GET IT NOW! (P.S. I have an atari so I think I know if it's better or not!)"
5,GAMECUBE ROCKS! (Buy this now!!!),"I got this for Christmas 2003 and i'm tellin' ya, it's worth the buy. I got this along with The Legend of Zelda: Collector's editon and Super Smash Bros. (of course!) and some pretty sweet accessories. A couple of days later I got The Hulk for myGameCube. The GameCube may be small, but it is stuffed with cool features!!!!Whatever game console you buy, just buy the GameCube!!!!!!!!!!!!!Also remember to buy some accessories and games."
5,Grandkids loved the GameCube,The GameCube was received quickly and my 5 & 4 yr old granson's play their games on it daily.
5,Great for young kids...,I bought this for my 6 year old son because it seemed to be a basic system with the largest selection of kid friendly games. Our son really enjoys Star Wars Lego and this console is very simple to set up and use and the small size is nice. One note: I didn't realize that it only comes with one controller. We needed to by an extra one separately so his brother can play with him.
4,GAMECUBE over the rest!!!,Overall Gamecube is the best! When I played Ps2 it was fun but it was only capable of 2 people playing! For x-box it was a good system but the controlers were huge!Also x-box has a lot of shooting games which can be cool but I also want to play good adventure games. Finally I dont know what people are saying but Gamecube is NOT a 'childish' system so at last Gamecube is the overall best!!!!!
3,Great while it lasted...,"My son got the gamecube for Christmas. And LOVES it. But only after a month and a half of use it broke. The screen would freeze and then a message would pop up saying that it could not read the disks. It was too late to return to the store so we had to call Nintendo. They sent us to someone in our area who confirmed it was broke, and sent it back to them. We recieved a ""serviced"" Gamecube back in the mail a few days later. The guy we brought ours to said he's seen a lot have the same problem. I was satisfied with Nintendo getting another one to us quickly. And it was free since it was under warrenty. The problem is after a year if this happens again we will have to pay to get it fixed. Hopefully this problem isn't as common as the guy we took it to said it was.Otherwise the graphics are great, and was by far my son's favorite gift. But for the price of games and for the price of the system I do expect it to last longer then a month and a half or even a year for that matter!"
5,gamecube rules,"i think gamecube rules. im a child of 10/11. all my friends agree. theres nothing like gamecube. here are reasons.1: os2 is really nifty but most people already have a dvd player so that dosnt matter.for my age i feel that the games are pretty over rated. there are a few good games here and there like need for speed hp2 but thats on gamecube too.gamecube looks double as cool.2: x box is an exact copie of ps2, a gigantic thing and has a really anoing controlar.3: THANK GOD FOR GAMECUBE!"
4,"Nintendo Gamecube: Great Games, But Lacks Features","The Gamecube is a good system. It has the best games ever made and it has a cool design. Some of the best games on this system are Animal Crossing, Super Mario Sunshine, and Super Smash Bros. Melee.Unfortunately this console lacks features like online gaming and the ability to play DVD movies and music CD's.Overall: I recommend this console. However if you're looking for a console with lots of features, then get the PS2."
4,A good start to Nintendos new innovation revolution,"Is it odd that the only people who buy nintendo products are ittellectuals and Nintendo Fans. This system is a jump AHEAD of the PS2 and XBOX. The graphics are amazing. The console and game CD are so portible. The Game cube CD is less than half the size of a normal DVD. It has LAN play aswell. Many complain about the controller. Hmm. Maybe you have speant too much time on video gaming to learn how to use a simple controller. Sure it is hard at first but after practice, you'll get it. With innovative new controllers (Bongos and Microphone) for certain games make this a good start to the innovative revolution. It introduced the concept of handhelds(GBA) conecting to consoles(GC). And now the PS3 will steal that idea. You can even play GBA game on you gamecube with a Game boy player. The Gamecube is surely the best so far."
