class_index,review_title,review_text
5,Bad,"This cartoon is the worse tv show for kids nickelodeon tv shows nowadays is very lacking same with Disney channel they always Have new episode every day Back in those days that way kids don't lose interest , nowadays they always show the same episode and have one new episode once a week"
3,Great For The Young And The Young At Heart,"I'm 23 and have been a Spongebob fan since day one, and I was actually excited when this movie was released. But the film proved to be just a little disappointing. The movie starts off great, but like a lot of movies, begins to loose steam after a while. It really does feel like an episode off of TV that they have stretched to movie length. The sad thing is that there are episodes of Spongebob that are funnier and more entertaining than this movie. How long can a search for a king's crown last before it gets repetitive and a little dull? I would recommend this film to younger fans, the older fans may not find the plot suspenseful enough to actually keep interest. Spongebob is better as a 15-minute an episode show on Nickelodeon."
5,Full length movie for SpongeBob,My son and I thoroughly enjoyed this feature-length movie. Lots and lots of laughs!
3,Crazy Adventure,"This Spongebob movie is just crazy.It sure has lots of imagination, my grand kids love it!I think this one is aimed more towards children butthen again it depends on what you like.Definitely fantasy, you never know what crazy thing is going to happen next!"
2,Not so much...,"I like Spongebob, though not quite as much as my kids. This was an enjoyable, but not exceptional DVD. Around here the measure of a DVD is the encore factor. If they don't play the hell of of it, it isn't all that. (Doesn't explain El Dorado, that gets played far more often than it deserves.) It hasn't been played a second time, even by my 7 year old who watches SB every day. I wouldn't waste the cash on this one, you'll get more enjoyment out of the endless re-runs they play on Nick."
4,Great value for prep material!!,"Questions cover, with excellent difficulty, all areas of exam 70-229. These are the style of questions all Microsoft exams should contain to maintain the credibility of their certifications.This review is a good heads up on how Microsoft is changing their exams to cover hands on work experience versus fact regurgitation. Very handy sample Exam on CD with Questions randomly generated from the Readiness Reveiw.A better publication than the 70-229 Study Kit."
2,Not Really Accurate,"I had thought that this book and the sample Exam on the CD would be a realy close reflection of the exam content. But whan I took the exam, it didn't seem like that was the case. The book and sample exam seemed to focus on Admin. stuff while the exam seemed to emphasize SQL, TSQL and database design a lot more. I also don't think the book prepares you for security-related questions very well. But it might still be worthwhile for someone who feels ready to take the exam and just wants some practice."
1,A waste of time,"This book is an incomplete mess.Throughout the book there are sample questions to ""quiz"" the reader on the material. BEWARE! many of the answers in the book are wrong.For the harder topics this isn't even a guide at all. Only a list of study points.The CD with practice questions repeats many of the questions in the book and had incorrect answers.A good replacement for this book is a brick wall. Stare at it and you will acheive the same results as reading this book."
2,Only 126 questions !!!,"There are 6 domains and 20 objective, in those 6 domains, of Exam, so count how many questions are per domain (6!!!). Some topics have only 3 questions, and on Exam you will get 3 or more questions from that objective.Before every domain there is list of articles (Training Kit + Books Online) to read for that domain, and every time they write how to start Books Online (klik Start menu, Programs, etc.) 3 - 4 line for somebody that goes on 70-229!!!.1/4 (to 1/3) of almost every page is unused (empty).If 2 or more answers are wrong for the same reason, they will repeat explanation, several lines, again and again.Some questions are for total begginers, and for some you need a lot of expirience.During my web exam expirience I noticed that questions are a little bit easier than the most on the Internet.So if you are total begginer and you have extra money, buy it, but for expirienced people I recomend something like www.certportal.com or other web sites."
1,Not much help...,"Having passed the SQL Server 6.5 exam, I didn't even find this much help as a review or prep for SQL 2000... Had to get a better book immediately!"
5,Got the last one at $149,"I've been searching for weeks for a compact amplified speaker system that delivered full audio response at low volume. Then I stumbled across this rebuilt Bose clock radio made in an American factory in Framingham, Mass and I realized this could be it.Apparently the capacitors in this unit go bad after years of use and create static. If you replace the capacitors it continues to provide years of service .This rebuilt unit displays the time and offers a wakeup system with AM/FM radio but I only wanted it to plug my mp3 player into the RCA jacks on the back and listen to my favorite music in high fidelity with plenty of bass. The only thing you need to connect an mp3 player,laptop,or tablet to this unit is a cable with a male stereo jack on one end and an RCA male plug on the other. These are available online or at any electronics store."
3,Very cute but not so practical.,I fell for the cute design but my daughter complains that the head of the wolf gets in the way! Soft and cuddly but not so practical.
5,The Six Sigma Way Book Review,"The Six Sigma Way is an easy reading book and a must have for anyone contemplating the deployment or currently deploying Six Sigma. The book not only gives an A-Z detail on why,who,what and how to rolling out Six Sigma, it is also an excellent reference tool.The author's bring to life the usefullness of Six Sigma through rela-life examples from various industries.The Six Sigma Way practices what it preaches- it's customer focused and friendly."
5,Senior Leadership Team meeting goer,look how great i am.....i am a member of the senior leadership team which means i just go to meetings all day and really dont do any work....i just blowhard at work all day like i am blowing hard reviewing this book
4,The Six Sigma Way,"The book was very easy to follow. I found it especially helpful that the Six Sigma Way gave tips as to which chapters should be read for each level of Six Sigma implementation. Since my company already had it implemented and I was only reading the book for an understanding of what my company was doing, I was able to skip the unneeded portions about implementation. This was a big time saver."
2,Horridly boring.,"More power to you if you can get something worthwile from this book. I bought the book on CD, and it was easily the most forgettable experience I've had in a while. The information is presented from a 30,000 mile view. So ""big picture"" oriented that it's useless to try and consider the action behind the concepts presented.If you're looking for a way to appear to have read something complicated and high level about Six Sigma. you found your source. If you want real, usable information, look elsewhere."
4,Worth your money -- if you don't know anything yet,"This is a great introduction if you're new to the subject: you'll get the concept, why firms go Six Sigma, etc. The book is likely to gain you to the cause. At the same time, it's very superficial on methodologies and hardly tells you anything about similar efforts of effective engineering like Design for Cost, Design of Experiments, Taguchi methods, etc. Well written and entertaining."
2,Common sense branded and packaged as esoteric knowledge.,"I was amazed at how a book full of nothing new could be sold as if it contains some secret knowledge that only the initiated could comprehend (you know, like that Kung Fu martial arts stuff...take the pebble grasshopper).What it comes down to is an organized approach to identifying, measuring, and improving business processes. This is something I imagine has been going on long before anyone called it ""Six Sigma"".So, if you must have this book how about cutting the cost of acquisition to three bucks or so plus shipping and get a used copy to see if this is for you."
1,Incomplete Content,I couldn't read this book because it is incomplete. There is something wrong with the content in the Kindle version.
3,Good overview but little substance,"This audio book was more of a cheerleader for six sigma than a book to gain knowledge. It would be a good source of information if you have never heard of six sigma, but otherwise it is not very useful. The reader also has an annoying voice."
3,Front Panel broken,The case looks great but had to refund due to the front panel/face plastic inserts being completely sheared off. The front was not even attached and was hanging off.
4,Great case,I've built three computers for family using this case and they all love it. A bit wider than the sandard case but about half the height. Glossy black piano finish.... it only appears cramped if you fail to plan... I use modular P/S and tie down all the cords ...getting ready to buy another.
4,Very good option for mATX,"Unfortunately, this case isn't my ideal mATX case (I haven't found one yet), but it's very well made and attractive.Cable management is difficult, but not any more difficult than other mATX SFF cases I've seen.I would really have liked to see a things to make this excellent:1. Black powder coated inside2. A better cable management system3. Slightly repositioned HDD cage4. Larger case fans"
3,"Sturdy, well made but huge and heavy","Nice box, well made and sturdy but also huge and heavy. I thought when the product was called a LANbox that it would be compact and light but it is just as huge and heavy as my other full tower case and weighs the same so what makes it a LANbox? I guess because it is more box shaped than rectangular. If I was naming it I would call it a ""weighted companion cube"". I also had problems with the wiring being too short to fit my front panel connectors."
5,Heartwarming,This book has many heartwarming stories. It really discribes the way veterinary work was handled years ago. Mr. Herriot is a great story teller.
5,They're Human Being Stories Too,"In has been roughly two decades since I read James Herriot's salubrious ""All Creatures..."" series, yet when I picked up this ""best of"" concoction, many of the dulcet vignettes were as fresh in my mind as if I had lived them last week. Although trained as a vet, James Herriot had a true gift with the written word. These tales about pets and their two-legged counterparts shine a light deep into the mechanisms of human nature.While he succeeded admirably as an honorable animal doctor and found worldwide fame as a late-in-life author, perhaps he missed his true calling as a psychologist. The humor, heartbreak, and humanity that he so eloquently captures in these stories shows a sagacious mind. It's no wonder that his time on earth brought many smiles and caused many a tail to wag."
5,One of the best,"Easy reading, great subjects . Would recommend it to anyone. Am passing it around in the family. Great bit of humor."
5,"Great product, price & delivery","Really like using landscape plastic versus the landscape fabric sold in home improvement stores. The plastic does a much better job of killing the weeds below while preventing new weeds- the fabric sold in stores is more expensive and the root system of weeds actually thrive along the material. 4MIL black plastic is my favorite to use with stones especially. Product well priced, good quality, great shipping and made in the USA."
5,Ocean's 11,Poster was in perfect condition and it was sent to me in just a few days! Great Seller! A+
3,Warning,"It took a while to get going but once it did, I could not put this book down. However, be warned: ***spoiler alert*** if you have read Tess of the D'Urbervilles and didn't like the way it ended, do not read this book."
5,Doctors can they be trusted,This is a great true life story of doctor being deceptive with his patients. Melissa Gilbert does a great job in this movie as the victim of this arrogant doctor.
1,"great songs, horrible sound transfer","It is simply not worth wasting your money even on songs of the sixties so fine as these, since the sound qualities of this disc are so poor as to completely ruin the listening experience. I used to have this on vinyl lp and should have kept it. The sound was great back then. The CD is nothing but scratches and hisses. Disgraceful."
5,Trust the teller along with the tale,"This is a small book yet Lawrence's genius enables him to see big things in it, especially about those large writers like Melville he felt an affinity to. ""Trust the tale and not the teller"" is one of his motto's here and he tries to show how the great works go beyond the intentions of their creators.One objection. He is especially hard on Franklin who he makes into a priggish, petty prune of a minor moralist. Franklin was a many - sided genius who was open to kind of creation Lawrence had no sense of."
4,Always interesting but often wrong,"This passionate brief survey of American Literature contains much spontaneous flowing masterful and original writing. Lawrence famous 'Trust the teller not the tale' is the motto of the work. It argues that the true creative work takes on a life of its own that even its creator cannot completely define and control.Perhaps the most famous essay in this book is Lawrence's hatchet- job of Ben Franklin who he found to be a spiteful, penny- pinching, calculating dead soul. In fact old Ben could be in certain places as lively and probably more lively than Lawrence himself.What however is most important is that Lawrence in this work understands the great subterranean and mysterious genius of a kindred spirit for him, the literary creator of the Great White Whale."
1,Not what I ordered,"The statue pictured is not what the recipient got! I wish that this company would show exactly what they are shipping, not what is pictured here. I will not order from this company again."
5,My son loves this shirt and wears it weekly!,It was a perfect form fit for my 11 year old. We bought the small and it fits exactly how he likes it.
1,Material fell apart after 6 to 8 wears,"I purchased one of these shirts from Sport Check and paid $30 for it. It was comfortable and I had no problems with it until 1 day I noticed some white flakes on the front of it. When I tried to wipe them off I saw that it was the material that was flaking off in a perfect circle. The more I brushed the bigger the hole grew. Now you can see through the center of my shirt like some nylon stockings, which looks pretty girly. For a $30 shirt I sure expected to get a lot more wear out of it."
1,Under Armour Heat Gear,"This is the first time I've had anything negative to say about Under Armour,and my complain is not really about the product, but the company, as the 2 shirts I ordered was to be short sleeved, and they arrived as sleeveless,It was a birthday gift to my grandson, and he assured me it was OK. I went along with him, but when I received this letter asking if I would rate the transaction, I had to tell you.I will think twice before I order again, this was a plain and simple order, and you messed it up.If I had had time I would have returned them for the right kind, but they were delivered on the birthday so I gave the package to him as it arrived,ibg1105"
4,The best compression shirt,This is probably the best compression t-shirt in the market... I used Nike pro Ultimate before and I have to say that this one is far better in terms of compressing your body... it fits perfectly however the length of the t-shirt is pretty short for me... I wear size s ... I think the new design it's better than the one in terms of fitting... I think Under Armour really listen to customers and continue to provide great products to customers ....Personally I think short sleeve t-shirt is more convenience than the long sleeve t-shirt since most of the time you gonna wear it underneath your t-shirt...
4,boyfriend loves it,"I purchased this for my boyfriend who is a marathon runner and weight lifter. He wears it on his shorter, usually 10 mile runs, and also in the gym. I like the way he looks it in, he likes the feel. I purchased the dark green and it seems to fit true to size. Will probably purchase another for Christmas."
3,too tight,"I love UA products and buy only compression fit. I am a medium at 155 lbs. 5'7"". I ordered a large and it was way too tight in the armpits due to the shortness of the sleeves. Hence the reason why UA is now making them with the longer sleeves. I wish they would carry the 3/4 sleeve more."
5,Great,Great shirts. I bought this for work and they work great they keep me dry and fresh when its not
4,Very thin,The shirt was for my husband. It was very thin and can be used under some other stuff but he wouldn't wear it by itself.
2,Runs Small!,"Nice shirt but runs really small. I understand they are to be worn tight, but my 14 year old couldn't get it over his head. Have to return it."
2,Men's heatgear compression shortsleeve T-shirt,"I did not expect this top to be skin tight. The other Armour exercise shirt I have is a comfortable fit. It is partly my own fault because I did not realize the significance of ""compression"" fit."
2,Way too small!,"Great shirt in most respects, but way too small. I bought the Adult Small for my 12-year-old son, who is 5 ft even, 115 lbs, and it is so skin-tight he could barely breathe in it. I'm exchanging it for the non-compression version."
5,A good product,"I got the XL size and found it was a little tighter than I thought it would be. I would get an XXL next time around, but otherwise it's a great product."
4,Keeps my pizza belly from sloshing around during workouts,With any luck I won't need these to hold the belly before long. I just have to keep up my will power and keep excerizing.
4,"Good, but size runs small","The quality is good, but be aware that Under Armour shirts tend to run very small and tight. Since I always wear medium, I ordered a medium but it was way too tight and I needed a large."
3,Beautiful-but defective,"12-26-11:Well I must say the rod is beautiful, lightweight, and seems very strong, however when I put the 2 parts together I noticed that the second largest guide was not aligned with the other guides. It was the second largest guide that was offset about 1/2 an inch. Of course I re-packed the rod, filled out the return paperwork, printed a label and mailed back this morning. Of course Amazon paid for the return shipping. I recieved a very prompt email from Amazon saying that they have already processed a replacement rod with estimated arrival time 12/30. This is why I do business with Amazon. I do believe this rod will be most excellent for the amount paid. I will provide an update after I recieve the new rod.UPDATE:12-29-11Well I sent the package baqck via UPS as instructed by Amazon on 12-26-11. I recieved the replacement this afternoon via FedEx 12-29-11. The rod is very nice, I think I will really enjoy it this early spring if not sooner."
4,Shades of Gray,"After watching this film, I enjoyed it to the point of tracking down my own copy. If you're a firm, die-hard believer in UFO's and the array of sub-cultures that have sprung up as a result of the first reports back in 1947, you won't like this film. If, however, you are interested in examining some of the people behind the phenomena of the modern-day UFO, and especially the Men in Black reports, this film is a must have. Be aware it is a bubble-bursting, serious look at the lives of Gray Barker and some of his contemporaries. These are the people who nearly single-handedly have set a place in history for the modern UFO enigma. It's funny, it's sad, and it is definitely eye-opening."
5,Shades of Gray,"Great awareness raised on the real person, Gray Barker, who is responsible for the making of hollowood movies that we have enjoyed. I did not want to miss a second of this documentary. Applause for a well thought out and put together documentary. Great Job!!!!"
3,Shades of Gray,"This was also a Gift. I suppose they liked it. I haven't had any complaints from the recipient. Therefore, I assume they liked it."
1,SHADES OF GRAY,"I HAVE READ, LISTENED TO AND VIEWED 100'S OF BOOKS, MOVIES ETC. SHADES OF GRAY VIDEO IS BY FAR THE ABSOLUTE WORST PURCHASE I'VE EVER MADE. THE BOOK HOWEVER PROMISES TO BE SUPERIOR READING BY ALL ACCOUNTS, I ENDORSE THE BOOK IN ADVANCE TRUST ME. I AM ABSOLUTELY MIFFED AT THE INFERIOR QUALITY OF THE DVD WHICH ALLEGES TO SERVE AS A PRELUDE IN SOME WAY. I MAY NEVER PURCHASE AGAIN FROM AMAZON BECAUSE OF THIS VIDEO. ALL OTHER MATERIAL AND SHIPPING ISSUES HAVE BEEN SUPERIOR. I LOST 10.00 ON THE VIDEO."
3,Stirring up the Waters,"Is it actually possible that pristine 1966 LP copies of THE REAL FOLK BLUES contained the same anomalies as this MCA/CHESS CD? Were that album's tracks 2, 5, 6, 8 and 11 equally filled with surface wear and crackle? Back then, did CHESS records not have clean sides available for mastering this Muddy Waters compilation? And is owning the more recent double album two-fer worth it if 40% of the tracks are far from perfect? That decision must be left up to the individual. You can't fault the performances, regardless of iffy masters.Eight page booklet includes bio, session personnel and original LP notes written by Wille Dixon.TOTAL RUNNING TIME -- 34:48"
4,Woke up this morning,"This album by Muddy Waters was released in 1966. It was basically released to capitalize on the folk and blues revivals (hence the title). The songs consist of a random assortment of songs that had not previously been on an album. The songs were recorded between 1949 and 1964, so the album doesn't really have a uniform sound to it. The older tracks are pretty worn out and scratchy sounding. Despite the audio shortcomings of this CD, there are a lot of classic performances here. If you can find a cheap copy of this CD, it will be worth picking up."
4,Muddy is Clear,"Someone reviewed this CD and said it was Muddy's best and I beg to differ. ""Hard Again"" is probably his best CD but this one is very good. The selections are all well known but it doesn't matter. If you like the blues and appreciate the various nuances that performers can add to their presentation then you know that no matter how many times you hear Muddy perform, say, ""Mannish Boy"" (No B ooh chile), each time presents a different revelation. McKinley Morganfield, through his music, remains a giant."
3,factual but unedited,"I read this book cover -to -cover, eager to find out all I could about my ancestor Samual Adams. This unedited version was tedious to read due to it's many spelling errors and interruptive footnotes in the middle of paragraphs. I would be interested to read an edited version if one is ever published. Needs to be reformatted for Kindle readers. The content was factual and interesting."
2,Not impressed,"I have tried similar products in the past, but wasn't very satisfied. After reading the excellent reviews for this one, i gave it a try. I am disappointed. Even though it comes in precut shapes and is cold wax, it did not do a very good job on my eybrows. It left a lot of hairs. The shape of the precut wax strips isn't very good neither - it didn't match my eybrows very well. My conclusion so far from my experience with at home wax products is that nothing does as good of a job as you get in a salon."
1,Does not work,"These strips are nothing more than scotch tape in the shape of eyebrow removers. They may take off one or two hairs, but they don't come close to doing what they are supposed to."
1,Hair Off Instant Eyebrow Shapers Cold Wax Strips 18's,Hair Off Instant Eyebrow Shapers Cold Wax Strips 18's didn't really did not work for me so I will not be buying this brand anymore
1,Don't work:(,"They don't work!!! It pulls the hair, it just doesn't take it off... Maybe it works different for other people, but they did not work for me."
2,Hair Off Instant Eyebrow Shapers Cold Wax Strips 18's,This product does not live up to all its claim. It doesn't work! It barely takes off the hair from my eyebrows.
1,Stupid,I bought these because I read a bunch of positive reviews but they really suck! They look like little pieces of tape and they barely remove any hair. I don't recommend this product to anyone.
4,"Good, but one size does not fit all!","I got some like this at a store. I like them a lot, BUT the shape they give you may or may not fit your eyebrow shape. I had to use scissors and trim each one to fit MY eyebrow shape. Have to use more than one to get it all. Once you cut them to your size they do work really well.Easy and fast."
5,Fast,Really works and is convenient. I don't have to go to the salon anymore. The cold wax is more effective than hot wax.
1,Absolute Waste,I purchased this product last week and discovered that it was garbage. The strips shape is terrible and it does not remove the hair. Complete waste.....:(
1,Not impressed,"This product didn't work as well as I had hoped. It doesn't hurt, but it also doesn't remove all of the hair. I had to go behind and pluck my eyebrows (even longer hairs that should have been picked up by the strips). Save your money and buy wax instead."
5,great product,product disappeared from store shelves here. Glad to find them online. Very quick and easy to use.
