class_index,review_title,review_text
3,Need to fine tune the product.,"Goes together easily, construction a little flimsy, comes in three sections, sections do not bolt together so if you want to move the rack to a new location you can't in one movement. Biggest draw back rack bearly fits two bicycles."
2,It Works But What A Pain,"There was another review that was right on the mark: the pieces do not fit together well. In fact, I had to pull out my tool box and in particular my hammer (the ""Persuader"") to get it together. It was quite an undertaking. Once assembled, it was ""wobbly"" and I anchored it to the wall even though it is a ""gravity"" rack. So much for gravity. All in all, I won and beat the beast and it does work. It was, nonetheless, poorly made and a complete pain to assemble. Be warned, you will need to work to get this put together."
3,You Get What You Pay For,"The price was right on these bike stands. They were the least expensive I could find, but they were a challenge to assemble. There were some welding bumps where the supports were supposed to hook into the main part of the frame. In order to hook up the supports, I had to spend about an hour filing down the bumps. Also, the plastic end caps for the base will not stay in. They keep popping out.Once I got the things together, they seem to work just fine and I'm glad I got them."
3,Practical space saver for garage,"I just received this bike stand, and putting it together was super easy requiring no tools. Note that it requires at least one bike on the stand to be able to stand upright, otherwise it falls backwards (they could have extended the U-shaped base just a tad longer towards the rear.)Unfortunately, one of the arm brackets had a faulty weld that held the hook holding the bike resulting in the arm hook detaching off the arm bracket. Looking at the design of the arm hook assembly, I'd warn anyone to be careful when attempting to twist the hook to a different angle - first loosen the Philips screw under the rubber cover.I'm hoping I can return just the arm bracket without having to ship the entire package back."
3,Holds the bikes but it's not really a freestanding,"I bought a couple of these stands and mounted four of the bikes I had on them (two each of course). The problem is that unless the bike is big and well balanced (front/back) the stand will bend over due to the middle joint. It's on the verge of being dangerous and so I don't let my kids be around it. Of course it comes with screws to attack to the wall, but it's supposed to be free standing and the screwed are against a child pulling the bikes rather than a permanent fixed solution when holding bikes passively.The stand is holding the bikes gently and in place using a rubber coating on the hooks and you can adjust the hooks' height.I wouldn't use this stand as a free standing bike rack.Pros:- Holds two full size bikes- Gentle firm holding of bikes- Looks nice and impressiveCons:- Rather unstable- Requires perfectly balanced leveled ground."
2,"It could work, but it did not for me","The ""Gravity Freestanding Bike stand"" did not work for me. I could see the product working if it was firmly bolted onto a wall, but ""free standing"" did not work. In the instructions it recommends you put the safety bolt, but as poorly as this product stood up, it would just have ripped the bolt out of the wall. It needs to be fastened securely to a wall with more than just what it came with.One good thing is that it was very simple to assemble. Also, the material felt sturdy... it just didn't manage to balance as advertise, at least not for me.I don't recommend this product unless you plan on bolting it to a wall."
2,"Poor quality, look elsewhere","We purchased this bike rack a little over 2 years ago. Not only does the rubber covering easily tear and come off the two pieces of metal used to hold each bike, but the metal column does a poor job of holding the top bike without a constant fear of it collapsing on whatever you have below. Have something custom made at your local metal fabrication or welding shop instead of buying this poorly made product."
5,Great bike rack!,Very happy with this product. Installed in our garage to help with clutter and they have done the job. I would highly recommend using included screws to secure top of stand to a stud. Makes them much more stable.
4,Great Product,"I looked and looked for a bike rack that suited my needs. This one was it! I've since mounted this thing to my wall in my garage, and have my wife's and daughter's bikes securely out of the way. I gave this a 4 star because I wish they incldued a longer lag bolt (which I went to the local hardware store and bought) and some sort of clips so you could latch the bikes into the arms once they're hanging (for safety reasons)....but I will most likely buy another one as I recent purcahsed a bike for myself and love the fact of getting it up off the floor and out of the way (especially in winter when it's not being used at all)."
4,Novel and useful,"Definitely does the job. Easy to set up and use. Does work as free-standing unit, though a bit unsteady. The directions recommending using an included fastener to attach the top of the unit to the wall, but I haven't done so, and it hasn't fallen over. I would recommend this to a friend."
3,pakscott,"They should rename this the gravity fall down rack. To safely store bikes, plan on securing it to the wall. I'm using it in the garage, so it wasn't a big issue. Spent $1.99 on cement. Filled the base tube and the first vertical tube. Added some weight to the base, but not enough to compensate for the rack's inherent instability. I looked at adding lead to the base, but the cost exceeded that of the rack. If you truly need a free standing bike rack, look elsewhere."
3,Not bad but a little flimsy,"Pros:inexpensivelooks niceeasy to installholds men's and women's bikescons:must be secured to the wall (not sure why it's called ""Freestanding"")cannot support my bike that has a bag rack on the back (the metal arms bend because of the weight distribution)"
1,Just like the picture - but USELESS,"The stand looks and does just what it should. But it's in no way a space saver. Infact it take a lot more space then the two bikes put next to each other. You need a whole wall of empty space to use this stand, while I could have put two bikes between any two things in a space filled with stuff. So I will be returning it. The only thing it does is keep the bikes off the floor...if that's important."
1,Gravity too much,Put the stand together. Lifted the bike to the top rack and the hook immediately broke off. Looked to see that the spot weld was very poorly done. Makes me think the rest of the welds may be as bad. Think this stand would be prone to breaking apart.Poor workmanship. I'm done with Racor.
1,Buyer Beware,"Buyer Beware! This rack is not as advertised.To start, the box that the rack came in was so disheveled it looked like someone had already opened it. Additionally, the pieces themselves were dirty and had scratches all over. Assembly of the rack was easy, however the pieces of the vertical post do not lock into place tightly which results in complete instability. The top section of the vertical post leans away from the wall ~1/2 foot instead of resting against the wall. When I placed a bike in the top rack, the whole thing almost came crashing down because of the severity of the lean.I do not recommend this product which is unfortunate because I was really looking forward to it."
3,I agree with others,"I agree with many of the other posts. When you join all the pieces the stand is way too wobbly. I won't hang a hat on it much less 2 bikes. Per the advice of one person's post, I ordered 2 braces to see if I can clamp the pieces tighter together. The rack is barely standing on its own in my garage. Once I get the brackets, I will see if it works better. Otherwise, the rack looks nice."
4,Bike stand,The bike stand was very easy to assemble. It fits both my bike and my son's bike easily. You have to work a little to adjust the arms to hold the bikes level. I did not secure it to the wall but it supports the bikes without any problem and doesn't seem to have any problem with staying upright.
1,not recommend,this stand is definitely not freestanding. One must screw the stand into the wall in order to secure the bikes.Not claimed as it advertised.
3,Pretty good product,"It arrived several days late in spite of my trying to rush the order. It is somewhat unstable unless you use the stabilizing screws against the walls which are labelled as ""optional"". Take my advice, it is NOT optional. You also have to realize that the bike support hooks all come facing in the same direction and that you have to loosen the screws holding them and turn them to the right direction, if you do not, they will all face in the wrong direction making them unusable. This step is not in the assembly directions. I would put them there for neophytes like me. Once I got all the pieces working and stabilized it on the wall, it is a very sturdy stand and it looks good!"
4,good buy,purchased this Item from amazon easy to assemble don't understand why some people had trouble?? Only complaint they give you a 3inch screw to hold it to wall but directions say to use a 4 inch screw. would recommend to a friend
4,Saved my garage,"This is the second Racor Pro PLB-2R Two-Bike Gravity Freestanding Bike Stand that I purchased. Without these stands I would not be able to fit our bikes (2 Road / 2 Mountain) in a small one car garage. They ship in a suprisingly small box, are easy/quick to assemble and a great way store your bikes whether you ride daily or on a less frequent basis."
5,Great product!,"Have owned this product for a few months and I've enjoyed it. Never had a problem with it.One small complaint:I live in an apartment so obviously I couldn't really take advantage of the hook you connect to the back. Instead I have to just lean it against the wall, which isn't a problem. but it would be nice if the company offered some optional cushion that you can easily remove if you'd rather use the hooks.I was okay taking care of that problem myself though. I just got an old yoga mat and measured a piece big enough for the area that would be hitting the wall and super glued it. Problem solved!"
1,Junk Rack,"This is a piece of crap. The advertising is all BS. You WILL need to anchor this piece of crap down to a wall stud with a screw if you don't want the whole thing wobbling around. Certainly NOT as advertised.The three pieces never seemed solid enough when they were put together, and the box it came in was very battered. Some of the flanges were bent on the rack.Overall, this is trash. Save your money and go elsewhere. Any business that falsely advertises their products don't deserve your money.I rate this one stars just because there's no option to rate it 0 stars. AVOID!!"
1,Piece of Crap,"I'm not exactly sure how this thing has gotten such high praises, but it's nothing short of worthless. It's highly unstable, unless it's attached to the wall, at which point, I question why I would buy this unit, when I could just buy a wall mount, which takes up less space.I put my bike on it and it toppled over and we're not talking about a 100lbs huffy, we're talking about a 20lbs carbon bike!I don't recommend buying this! There are better solutions out there."
3,Good for road bikes,"This bike rack is great for some and truly bad for others. It will work great if you have two light road bikes. If your bikes are pushing 20 pounds, things are going to get interesting. Like other reviewers' have said, this is a lot of shaped metal for $50. If you are creative and have access to Gorilla Tape, tools, and a drill, most of the problems with the poor fabrication can be easily modified. When I received my rack (that's what she said) the top part was not even drilled out for the handles. Customer service was great and a new drilled section was shipped at no cost. Overall if you are looking for a no hassle fix look elsewhere, if you don't mind making it work, it's a cheap fix.One last note, if you are putting some expensive bikes on this thing you might want to reinforce the end of the handles because the welds are extremely weak."
1,Not happy at all,"I first starting putting this rack together the moment I got it. Once I really got into it, I thought for sure there were pieces missing. It was not stable at all and swayed if I even touched it, forget putting bikes on it. So I tried screwing the top portion into the wall with the screw and anchor provided. It still was not at all stable and the entire thing came crashing down on me. I've now taken it apart and put it back into a box. I'm going to contact the company and ask for a refund and will never recommend this product to anyone."
2,"Flimsy, and poorly constructed","The bike rack is easy to assemble, and does (sort of) stand up on its own, but leans away from the wall and should probably be anchored with the optional hardware. One of the moveable arms had a poorly welded piece, and doesn't fit right in the slot that it is made for. I had to pound it in place, and now it is very dificult to remove."
2,Misleading,"This product says that it is freestanding when in fact it needs to be mounted to a wall, nore do I see what advantage gravity Takes on in this product"
2,Bike Rack,I expected it to be a liitle more sturdy. The piece that holds the two straight pieces together could have been designed better.
2,Very unstable and dangerous rack,"This product is NOT a free standing bike rack. It is very unstable and will fall over easily. Do not buy if you can't drill into the wall to hold it up. Even with the stand screwed into the wall, the different pieces do not line up straight, so it is still not safe and looks tacky. Do not buy this product. Spend a little more and buy a safe rack."
1,Not what described,Beware. This is NOT a freestanding rack. I called the manufacturer and they say it must stand against a wall and for best results you should anchor this to the wall with the bracket provided.
1,tripsteam,Piece of junk. I would put my bikes outside and rust before I use it. Amazon was great on the return.
2,DO NOT TRUST REVIEWS OR STAR RATING,"Amazon is mixing in the reviews from the PLB-4R and the PLB-2R and giving both products the average of ALL the reviews. Which is why you see awesome reviews on the PLB-2R page talking about how good it is at being completely freestanding... and negative reviews on the PLB-4R talking about how you need to secure the top to the wall.If you expand all the reviews and look close enough you'll see which product the review is ACTUALLY about.This is likely happening on many more products on amazon. So NEVER trust the 5-star rating average information, you need to read the reviews and make sure it's about the product you're interested in.I'm giving 2 stars because I'm forced to put something. I'm placing an order for the PLB-4R and will review once received."
3,Basic Function,"Works Ok. I lean it against the wall since it won't freestand too steadily. The bikes, even when the holders are max spread, still hit each other unless I move them this way and that, primarily the top tire on the bottom handle bars. So big bikes may have a real issue. Otherwise, it does OK"
4,Not Freestanding,This looks great but beware; this stand must lean against the wall to work. It is NOT freestanding.I do not have the space for that and had to return it before assembly.
3,Racor Freestanding Bike Stand,"This product is only ok. It is not tall enough to be able to keep 2 full size bikes separated. In other words, the tire of the top bike hits the seat or the handlebars of the bottom. Disappointing."
4,Serves the purpose.. a little awkward though,"I guess it serves the purpose for the price. It is a little awkward though. The two bars that form the vertical column dont fit in perfectly while leaning against the wall as a result of which there is a slight angle at the joint.. makes it look a little unstable. I did have to bolt the thing into the wall.And yeah - trying to hoist two bikes (one ladies and one mens) was next to impossible. I can see putting two mens bike, but with the slope that a ladies bike has, it makes it imperative to put one bike on the floor..."
3,Not a free-standing stand,"I expected this to be a free-standing stand, but the instructions tell you to put the unit against a wall and recommend that it be secured to the wall. It holds my bicycles OK."
3,Functional,"I was looking for a rack for my garage. For the price this rack is quite adequate. The box came in pretty bad shape; scraped, dented, and taped together. Some of the pieces inside were slightly bent, but nothing I couldn't fix. The rack is extremely easy to put together.If you are looking for an inexpensive rack for your garage this is a good choice. If you are looking for something to put inside an apartment/house, keep looking and plan on spending more money."
3,Assembly was far more difficult than it need be,"The assembly of this item requires bolting through a series of pre-drilled holes in tubular parts that are male-to-female fitted, the second hole threaded. This is on the oval base assembly. If the pre-drilled holes don't match exactly you will have a problem. They didn't and I did. I got it together with a lot more work that it should have been, and with the threading on one hole stripped.The U shaped bike holders bend much too easily to suit me.Not all of the tools listed listed for assembly were there, not a problem for me but might be for those who do not have tools, and some of the hardware was loose in the large carton.The design of this item is excellent. The manufacturing engineering, mmmm, not so much."
2,A bit shaky,"Thought I'd purchase this to better organize my garage. The vertical bar is composed of three pieces: top, middle, and the base. There is wiggle room at the connection joints. As a result, the unit will bend towards the front and lean away from the wall, even when it is not loaded. My unit pulled away from the way at least three to four inches. You will definitely want to install this where you have something to strap the vertical bar to; ideally some studs where you can anchor the screws for the straps."
3,freestanding?,"i enjoy the need for no tools to assemble, and the general shape and size of the stand...but there is absolutely 0% chance of it free standing or even leaning on a wall without the mounting screw..which others have complained is too short but it worked fine for me, the fact that it needs to be mounted though means you need to find a stud which means its actually only useable in a limited amount of places, i got lucky that there was a stud where i needed one."
5,Great stand.,I needed something stylish and solid in my newly refinished garage. I purchased two stands and they worked wonderful. They're very solid and hold the bikes well. Very pleased with them.
3,Decent stand,I agree with the other review which advise this stand is not very sturdy. Once you put the bolt through it and into the wall it helps a lot. They should have included bolts which would have connected the individual pieces. I ended up going out and doing so in order to make it sturdier. Overall it does the job needed.
2,Made me nervous,"This rack is very flimsy and made me nervous even after screwing the top to a stud. There are multiple pieces that loosely fit together. I am really surprised that many people give this product 4 stars. In the end I had to drill holes into the metal and used ""L"" brackets at the top and then used some pieces of metal to hold the pieces together better. Now, it is sturdy, but this was after a few hours of ""alterations"". It is not a product ready to go out of the box. I wouldn't recommend buying it."
5,Perfect for Apartment,"This storage bike rack worked out better than we thought, especially because it is so easy to use! It's balanced so well that even my wife, who's 5'5"", can get the bike off the top holder without it toppling over. Excellent purchase for any situation."
2,Spend More Money....,"I just got this today. It was extremely easy to set up, which worried me since it will be loaded with two bikes.First of all, it swayed and leaned considerably. So I took the bikes off, re-arranged everything and tried again. No luck, it leans even more now. Not to mention while trying to get the bottom bike off it caught on the top bike and everything came tumbling down on me. That was fun.I bought this because I live in an apartment complex where I can not mount anything to the wall. However, this does need to be mounted, otherwise it is dangerous. It does come with screws to mount it, but this does me no good. It may be a good buy if you can mount it.Also, it is not much of a space saver. Imagine two bikes side by side, they would take up less space!All in all: KEEP LOOKING and SPEND MORE MONEY,(This is priced low for good reasons!)"
3,Racor PLB-2R Gavity Bike Rack,"I was disappointed in how unstable it is when put together. The individual pieces themselves are very sturdy, but as a unit, it wobbles. I don't see how you could use this as a bike rack without inserting it into a wall stud, which they list as ""optional""."
2,Too much sway to be safe without mounting to wall.,"Product components are constructed well (by themselves -- read on). The bike ""arms"" attach to the rack securely. However, the main vertical spine of the rack joins together so loosely, that there's too much sway in the upper portion of the rack with a bike mounted on it. Securing this rack to a wall is a must, or, adding hardware of your own to firm up the joints in the product. I would NOT purchase or use this product otherwise."
2,Bendable material,"The bikes hold and it's stable, but the material is bendable and cheap. The was not welded properly and I had to manually fix it in order to put the pipes together. The first time I use dit one of the handles bent the first time I used it with the weight of the bike.It's made of cheap, bendable materials and not put together very well. It works, but I wouldn't recommend it unless you want a really cheap price and cheap quality option."
1,Not Freestanding,I don't know why it says freestanding in the name because it has to be placed against a wall to keep from falling backwards when the bikes are removed. It's not freestanding so I'm returning it.
5,Great and Works Perfectly!,"I will cut to the chase and will be briefly. I am a consumer who always relies/checks the reviews of a product. I bought this rack 8 weeks ago. Based on this span of time and my observation, this rack...Rocks! It works perfectly and it is really a space saver. And it is easy to set up. It is pretty sturdy I didn't even use the screw anymore. I use this rack for my bike and my wife's bike. I highly recommend this rack."
2,Poor sense of balance,All parts and pieces were in the box and it was easy to put together. But the floor legs are so short that it will not stand upright unless there is at least one bike hanging on it. The three sections of the frame fit together loosely and tend to allow sagging in the upright when bikes are loaded on it. It is also not tall enough to put our two adult size bikes on it and keep them separate. I will keep it and bolt it to the wall. I just wish this had been better engineered in the first place.
4,space saver,"It is a definitely space saver, easy to install, and ""stable"" if you use screw that comes with it and screw it to the wall. Hence, I'm very satisfied with my purchasing."
4,Excellent Bike rack for the money.,"I looked at a couple bike racks and most were priced 2-3 times this price of this model. This was easy to assemble and does the job, holding 2 bikes securely in a relatively small space."
3,Somewhat disappointing,We tried it a couple of different places and decided it was easier just to leave the bikes on the floor. It leaned and really didn't save any space. Just put the unit on sale on Craigslist.
1,worst purchase ever,"The pieces would not fit together, after hours of trying lube, force and then the hammer, nothing worked. One of the tubes finally split and now there is no hope of making it work. It seemed like a good idea, but I was just taken for $60.00.Don't buy this product"
1,"Doesn't hold one bike, much less two","I purchased this product to hold two ""city commuting"" type bikes (ie not mountain bikes, not racing bikes). Setup was very easy, but it was unable to hold even one of the bikes without tipping over. I can't say for sure if it is because our apartment floor is slightly uneven or whatnot, but regardless, this product wasn't able to handle it."
4,Easy set up.,I put this together in 10 minutes and hung 4 bikes on it with no trouble. Worked as advertised. I could use another one. Great space saver.
5,Great rack,"Saves me heaps of space in my apartment. I am thinking of getting another one, because I seem to not be able to stop getting new bikes."
1,waste of time,"This stand wouldn't even hold itself up, much less two bikes. We live in an apt were I'm not able to secure to the wall. Don't waste your time or money on this. Amazon does stand behind what they sell, which is the only bright thing about this transaction."
