class_index,review_title,review_text
1,You must be kidding!,"I have read a lot of science fiction books, mostly television spinoffs or continuations. I have also read the previous books by Mr. Hatch. This 3rd installment should never had seen the light of day. It was the most confusing, poorly written, wandering novel since the ""Prometheus Design"" or ""Mirabile"".I question the wisdom of reading or purchasing the next book. In my opinion, ""What a miserable addition to the Battlestar Galactica universe""."
2,disappointed with this webcam,"I bought this webcam from Staples this Thanksgiving. I have been felt very disappointed about this product. I am thinking to return it.1. The image of the webcam is too sharp, the contrast is too strong! I was like a ghost in the webcam when the light is not bright. Even in the daytime, if the light in the room is not bright, the image is still very dark. This device couldn't adjust itself well according to the brightness of the light.2. No built-in microphone. Maybe it is my fault since I assumed it should have. This feature is important to me since I don't want to always wear the headset.3. The base of it is not secure enough."
4,very good buy,the web cam is really worth the price with all its features. the best part is that the image quality is very good. i would recommend this webcam.
3,Works fine,"The camera works fine, but I hoped for more improvement over the $5 webcam that it replaced. Picture is better, but not that much."
5,Great product for the price,"I have this camera for a year and a half now - it's working great, clear picture, and is very convenient."
2,Just Average,"I received the camera and was not happy when I found a cheap mic that was attached to the cord of an ear peace instead of the the superior sound mic advertised in the ad. I called Amazon, they had no appolgies and said the most they could do was refund my money.On another note the picture quality was ok but froze at least 2 times or better per use, as for sound I had to put the mic up to my mouth before the person on the other end could hear me.Not very happy"
4,Good price!,Works well. software can be installed easily. Good resolution. So far do not have any issues with the CAM.
4,Great Webcam,"Good picture quality, good colors and auto focus. Comes with software that does animations for the live pictures, its fun. Would recomend it"
2,Great picture quality. Bad design.,"I love the picture quality of CL's WebCam Live, but it designed to sit on a flat surface only, it seems. Putting it on my desk would leave too great of an angle between the lens and its object, so it is sitting on top of a pc speaker, which gives it more height. However, there is no way to steady it, so continual adjustment to keep the camera as still and as leveled as I need it is necessary. It has three legs, two of which are ""clawed"" at the ends, so I don't understand how it fits a notebook or an lcd monitor. I just don't like the design. It is picture quality is fantastic though."
2,sucks,"poor image quality. cant see anything unless it is daylight, or you have ten lights on. its stand is akward and doesnt really fit on anything, and the cord is a little too short."
1,Not Vista Compatible,"I really liked this webcam when I had XP on my desktop. Sadly, Creative has decided not to develop drivers to enable Vista compatibility, and believe me, this camera wont run on Vista. Too bad they decided to go the route of forcing people to buy a new camera (hopefully theirs). I wont be one of them."
4,Not bad after rebate,Good but video is kind of slow. It's USB 1.0 not USB 2.0. If you have broadband spend a little bit more and get the Live! Pro USB 2.0.
3,It's OK,"I will rate this webcam as a OK webcam. It got installed without any hassles the picture quality is also good but the frame changes are very slow. Sometime I think I am watching a movie in a less speed. I got this in a good deal in amazon , in about 20 bucks. On that price it is a ok webcam"
1,No Windows Vista Driver Planned,"I bought this about 6 months ago. Now that I have installed Windows Vista on my computer, this webcam is a paperweight. Creative has decided NOT to provide a Windows Vista driver for this webcam. DO NOT BUY this if you plan to upgrade to Windows Vista."
2,Creative Labs WebCam Live!-- Is not Good,The WebCam is not good at all. The picture quality is very bad. It is stuck every time..
2,Software is useless!!!,"I bought this camera to use for motion detection as an extrasecurity device at home to email me if motion is detected.The jocks at creative have helpfully failed to include the option for smtp authentication so no email you try and sendwill ever get through unless you have one of the rare few emailaccounts where the smtp server does not require a password, ifyou do it wont last for long.[...]Aside from that the camera is good but I'd suggest getting another one with software that is useful because this is a bigfeature."
4,"good deal,neat design,made in Korea","actually you can manually adjust brightness and contrastness, as well as gamma correction.good picture quality,a little bit slow caused by data conjestion ? via LAN connection,but where you can find USB2.0 at this price?btw, I believe Koreans' made after I bought 3 iRivers MP3 players."
1,DO NOT BUY THIS PRODUCT,"We bought two Creative Labs WebCams and we could not get the sound to work on either one. (one was for grandma). We worked with Creative Labs to try to get it resolved and never could get the sound to work at all. By the time we got done working with Creative Labs, we passed the return time with Amazon, and Creative Labs would do NOTHING to help us. Now we are stuck with two useless web cams..... TERRIBLE customer service. What should have been a wonderful Christmas gift turned out to be a pain in the you know what all around. DO NOT BUY FROM THIS COMPANY!!!"
5,Amazing Amazon's Creative Webcam Live!,"I liked the webcam a lot. It has a good picture quality. I also liked the handy headphones with the microphone, it was a pleasant surprise."
4,"Image quality is good, easy to install, affordable.","I am using this webcam since the last 6 months. No issues whatsoever.It was easy to install, took just minutes. Plz install the software and then connect the webcam as specified in the manual.I use it for video chat and everybody says the image quality is good.It sits nicely on top of my laptop display. does not slip or fall.Also got a collar mike with this webcam which was plug and play. No drivers needed.Creative Webcam Live will not disappoint you."
2,"Camera works fine, but drivers/software are making me nuts","I installed the camera, and it works fine and has a good picture. My biggest gripe is with the software that came with the camera. If you install the camera webcenter software, it will launch repeatedly on its own and start filming and snapping photos automatically. If you uninstall the software and leave the drivers installed, you keep getting an error message from the windows image acquisition software. To get rid of this, you have to uninstall the drivers, which disables the camera. I'm not sure if my problems are typical, but I find them highly annoying. In this day of privacy concerns, I would have expected Creative not to introduce something that behaves so suspiciously."
4,Works like a charm,"I got this camera a couple of weeks ago so that we could do video conferencing within our geographically dispersed team. The camera works great, as does the software supplied. We are using it with Viack, which is another great product."
4,Good Webcam,"clear imagewide anglewise design of standthe only thing i dont like is that as long as it is attached to the computer and the computer is on, the green light on the web cam is always on"
4,Webcam Live works well with 3rd party software,"The camera works very well. We use it to communicate with family and it's been great. We've been using 3rd party software from Yahoo IM to make the video conferencing happen. The only problem we're experiencing is difficulty getting the voice data through the microphone that comes with the camera. We usually use the land-line for sound. Otherwise, the camera works very well."
4,Rock n roll say HELL-O to Satan.,"Wow, what a terrific off beat Dario Argento type satanic horror film. Has neat Heavy metal soundtrack and real interesting plot premise about the end of days and Satan coming round the bend. With a nifty climax this movie is one of those you love to tell your friends about. Recommended. If you like The Omen you will like this."
1,this DVD has NO English subtitles,"Although it's a NTSC Region 1 disc, there are no English subtitles. Do not buy this unless you happen to speak Spanish fluently."
4,Nice quality,These are great finger puppets. The kids adore them and they are a good price. I actually broke up the set and gave them out individually as gifts.
1,Now that's what I call nonsense.,"A cute and interesting read. Not bad toliet reading at that. Nice cover, promises much, but delivers little beyond that promise. You can do the same thing on a skateboard too, with skill and practice. Read and enjoy, but you won't get anything beyond another book for your sinister collection of ""dark knowledge"". I think the author has hit on a new way to sell bad fiction. I suppose that's a magick of a sort."
1,Faulty bracket,"Purchased this CAN AM rear trunk box new from our local ATV dealer and used the standard quick release bracket to secure the box to our ATV. During the first trail ride, the bracket released and the box fell off the ATV during the ride. Spent the next three hours searching the trail by foot to find the box and its contents. Once it was recovered we resecured it using a lock. Second trail ride, same thing. Half way through the ride the box fell off, only this time we were NOT able to recover it. This faulty bracket cost us hundreds of dollars of equipment including 2 custom helmet's. We will not be returning to CAN AM for our next ATV accessory purchase."
1,Plano rtv box,"The latches are a joke,the tie down straps are useless,thank god they supplied u bolts to mount it with also."
4,Plano atv box,"I really like the box ,it fits atv perfectly and allows me to carry plenty of gear,would have preffered different hold down system ,but overall great box"
4,Holds a Lot,I've had this box for a couple of years now and have even flip the Grizzly a couple of times and it is none the worse except one of the bungee latches came up missing. As other posters noted the latches are quick but leave something to be desired.
2,SHOULDA COULDA WOUDA,SHOULDA BUILT THIS BETTERCOULDA BEEN A GREAT BOXWOULDA GAVE IT A BETTER REVIEWSHAME ON YOU PLANO YOU LOST A CUSTOMER
3,Bad latches and mounting,"I've been using this box for a couple of years now. The box itself is great, but falls short in the latches and in the mounting system. I've had to replace both twice now. Finally went to bolt thru mounting using some steel strap after the straps rotted away again. I ride a lot, so the bike is outside a lot. The bungee latches are a poor idea. I'm looking now for a replacement steel cam style latch that I can bolt on. Should be able to come up with something once I can spend some quality time in the hardware store. Over all a good box, but disappointing in those two regards."
3,Durable,Very duable but the rubber cords that hold the lid shut suck. could of had a better way to keep the lid shut.
4,Very Simple,"Great inexpensive box for an ATV, I did shop this box and I found it to be twice the price at several other companies. I'm very happy with the price of the unit, I couldn't see paying anymore then what Amazon offers it for... Simple to put together."
4,Nice product for the money,"It's a nice storage box that fits a lot of stuff, and it seems to be sturdy. I was a little disappointed that there was some assembly required. It only took 20 minutes or so, but definitely was something that could easily have been done at the factory. I was also expecting the seal to keep more of the dust out. Maybe the seal needs time to settle in, as I used it for the first time in cold weather...we'll see. Finally, the mounting straps tend to loosen up after riding for a while...they just need to be tightened every so often."
1,Do not Waste your money,"This thing doesn't work at all, It doesn't broadcast the signal 12 feet away with no walls. I think wireless internet and wireless phones are afecting the signal. Anyway do not waste your money like I did!!"
1,Not what I expected,"I was highly disappointed. I plugged Transmitter into my Satellite receiver and the reciever into my Television in my Den, less than 8 feet away and 1 wall between them. The picture had static and the sound was squelching. Tried and tried to adjust and could not get it to come in. I have purchased another unit similar in nature and plugged in and worked immediately, no adjusting at all."
1,Don't waste your time,"It seemed like such a good idea! Unfortunately, when I got it, it didn't work as expected. I hooked it up to my DirecTV box and hooked the other end to a TV in the same room (about 12 feet away). The 2 units were pointing directly at each other. I was using the a/v connectors, and not the cable connector. The picture was satisfactory, but the sound was obscured by hissing. Although it has 4 channels to choose from, none proved to fix the problem. I do not recommend buying this."
2,works well under Ideal conditions,If you have a clear line of sight not over 50 feet this device works well. However if over 50 feet and have to broadcast through walls its performance degrades rapidly.
2,Not worthy,This book is not worth to buy it. It's outdated and the content lacks in depth details. Pictures are old some of them b/w. I would not recommend this book. The off road bible is a lot better book compare to this one.
5,Good refrence,"Handy no nonsence book on fourwheel drive stuff, how to for various situations. As a guy it is sometimes hard to admit to needing instruction, we should have all knowledge through osmosis, this book gives the foundation all that is required after is practical experience."
1,A good book for the ladies,"If you just bought someting like a Ford Explorer, this might be good for you. This is a basic, basic treatment of the subject. The subject has been covered much better in other books that are now out of print. If I had seen this book in a store, I would not have bought it."
4,Rago 6206 Panty Girdle,Excellent fit and the shaper really helps support lower back. Gridle is very well made. I want to try a smaller size for even more support. What I find confortable is the rise and wide band make the fit stay put. It is difficult to find a support girdle for everyday wear that does not create a 'sasuage effect' and is not binding. This is the best overall back support girlde I have found.
4,Almost everything I hoped it would be. . .,"Although the artwork is more than up to par, in a good portion of the book, it's too small to enjoy it fully. If a magnifying glass was included with the purchase, it would be five stars all the way."
4,A very attractive figure,"Fortune is a good figure. She has a very attractive outift equipped with very attractive...er...sunglasses. The figure is fairly easy to pose, but she cant go into complex poses like the Olga figure can. She comes with a pistol and a very cool gun.I had a little difficulty fitting the guns and such into her hands, but they fit fairly well. The figure is very good at standing up.Overall, a solid buyThe good:Great sculptingcool gadgetsThe bad:figure cannot go into very many posesthe ugly:The sunglasses dont fit on very well, and get get very easily lost.Summary: A pretty good figure for the money"
3,MGS 2 Fortune,"Received this product in a timely fashion. I mostly bought this for the RAY piece, and I'm an obsessive completest. Fortune stands find on her own with no attachments. Her little hair thing that covers her eye fell out when I pulled her out of the packaging. The sunglasses stay on as long as she is stationary. The pistol fits well in the holster, but looks silly in her hand with the way her hands are posed (shes meant to hold the rain gun. The raingun is the major problem with this figure. It does not fit well in to her hands, and the little rubber strap broke as soon as I put it over her shoulder.All in all, a decent figure, if you never ever move her after you spend 15 minutes getting her in a decent position (and even then I have to have her subtly lean against the shelf wall."
2,predicatble,"Playing the hold'em a few times I was frustrated with the predictability of play. In the satellite games it became to easy to get enough money to play in the ""main event."" Each time around the same seat raised and after a flop the players would call the first time and then the next would fold. Hands did not seem to be random as too many time I was dealt K7-K7-K7 followed by J6-J6. And if it only happened once maybe but sequences like this were all to common. In the main event rather than play poker it was a study of what the game would deal me in order to take my chips. I played it and uninstalled and then gave it another chance and then uninstalled and trashed it.The satellite game was no fun because it was too easy to win and similarly the main event was no fun because of the nature of cards dealt and contrived play to take chips."
3,No what I had hoped for.,"The fact that you only get advice on No Limit Hold'em was a great disappointment. But I guess for the price it's what I should have expected. Plus, I should have read all of these reviews before ordering. I'm looking forward to playing Wilson's Turbo Texas Hold'em which is currently on it's way to my mailbox."
1,False Advertising,I ordered this game because it stated that it was compatable with Windows 98. My father wanted a Multiple poker game that would work on an old computer with Windows 98. When they received it it would not work. They called the manufacture and they stated that it would not work on Windows 98. They need to list the correct systems this game will work on.
4,Very good Poker Trainer,I am a begainer at texas holdem and wanted a tool to get me started and the program worked as advertized. The tips are great for a new player and it's good that they can be turned off when you've seem them a few times also it's good that the speed of play and player comments have controls all in all a good investment
2,"like the man said, it's scripted","After only a day of use, I can already guess what's coming. Lots of full houses that get beat by better full houses. I've seen lot's of these and they're all the same. I guess they can't do all the analysis if the hands are random. TJ's tips are probably based on specific hands, not generated by some sort of rule.But I only paid $10, so it's not all that bad for my first software poker purchase."
3,Center pole problems,"My baby, who is 7 months old, loves the table, and although she doesn't quite understand pushing the rings in the hole she loves playing with everything on there.Unfortunately, two days ago (about a week after we received the product) she realized if she takes all of the rings off, she can pull the center pole out and chew on it. She does this the moment we put the toy back together, and it is the first thing she does when she goes to the table if we repair it while she's doing something else.Since the reason we got the table was to give her something she could pull up on and cruise around, it still serves its purpose and is a good price for the value. I just wish there was some way to make the pole stay on (other than glue it, which I may have to do eventually)."
4,Entertains babies age 9mos - 2 years,"This toy is easy to assemble, battery free, and loved by my 15 month old and her 2 year old cousin. Our baby loves the stacking rings, but is especially happy about the slot feature. The slot is also a favorite of the 2 year old. My child has never gotten her fingers stuck in the slot, as mentioned in a previous review, but I can see how it could happen.On a side note, we bought this table to encourage our baby to stand and play in the hopes that standing play would encourage walking. It seems to have worked."
1,Don't Buy,"This table is not a good product. Once the kids through the rings and activities on the floor, which is the first thing they do, there is nothing left to do. Buy an activity table were everything is connected so they can continue to enjoy the activities."
4,Sneakers,"I purchased these shoes for my son, for school. The shoes are great, but run narrow in the front. He is a size 12.5, so I figured I would get him a 13 to grow into and they are just right. So, I guess it wont be long in these shoes before he needs a new pair due to just size and not wearing them out. A wide version would have been nice to see in these shoes."
5,Great shoe for a small foot,"My daughter has very small feet for a 15 year old and finding good tennis shoes has been a struggle. These shoes were perfect! Great fit, very comfortable and good support. She wore them for a match on the first day without any problems."
4,Good Guide,"I like that this book because it actually rates hikes. I need an opinion when I am provided with such vast natural beauty to choose from as in Hawaii. He also tells you the best sights for spotting so apart from referencing wildlife, fauna and marine life as you come across you can seek it out. A good reference to use before and during your trip to the islands."
5,Informative and helpful~,I'm moving to Hawaii in February for four months to work outdoors and this book has been invaluable for planning my weekend backpacking trips when Im' not working!
2,"Poor research, poor logic","Stanton's presentation in his book ""Marriage on Trial"" is transparently bigoted and anti-Christian. To suggest that a same-sex set of parents is an affront to a parent of the other sex is petty as well as illogical. To say that a lesbian parentage implies to men they are not needed shows his insecurity about his own effectiveness as a father. I'm a man, and I'm not threatened by lesbian parents I know. Glenn's logic does not hold, for in his view a successful single-parent would imply the same thing. It's nonsensical.This man is simply threatened by homosexuality. Is he above God? Stanton's love is selfish, exclusive, while God's love is inclusive of all. It is not afraid, like this man is. I feel sorry for him, and pray that someday he will be saved and see the true love of Jesus."
4,A Must Read for All Teachers,"I read Marriage on Trial with an open and curious mind. Marriage on Trial draws from hard evidence and well-known studies to back up their facts. I could find no hate for homosexuals in this book, only love for the person and an exposure of lies and myths.This book should be the definitive guide to equipping open-minded citizens in answering questions about homosexuality. After reading Marriage on Trial, I walked away educated, concerned yet feeling compassionate. A good book for K-12 teachers."
3,Not too bad... but there is better...,skateboarding is skateboarding... if you feel you need to have every video out there... then get it. But other wise... go pick up the new Blueprint video (Wainting For The World) its much better.
2,not the same,"the watch that came was not the same of the picture, even the color of the straps were changed..."
1,Did not last very long,"This was a very capable recorder while it worked. I bought it in 2006. It is now 2008 and I am without a working DVD recorder. It will not load the DVD so it will not play, much less record. I think the drive failed. The exact model drive is not available so I purchased a Plexar which list the same specs as the Pioneer. The symptoms changed but it still would not work. I installed the drive into my computer and it would not work, whereas the Plexar did. For the price of the piece of equipment, It should have lasted much longer. This is not to say all of these units are bad. I have owned a lot of Pioneer equipment over the years and have never had a problem until this one. I would not advise anyone to buy this model as it may have a design flaw."
5,"Solid Band, cheap price","I was very impressed with the band, especially for the price. I purchased the bands thinking they would a low quality since they were so cheap. I took a chance and ordered some. I was surprised to see that they such good quality and thick. I'll never go to a sportings good store again for my headband and wrist band needs! I will definitely purchase more from this seller."
3,too small,quality is good. but its too tight for my wrist and not with a huge wrist.. cant give it more than 3 stars
5,Very absorbant sweatbands!,Our summers are so hot and humid anymore that I needed something to wipe my sweat on. My t-shirt sleevesll weren't cutting it anymore. lol. I am an avid gardener and tend to the yard/flowers daily. These are great. I got the wristbands too. Absolutely no more sweat running into my eyes! I recommend these!
