class_index,review_title,review_text
4,Elvis Song,"The Elvis Song in the movie ""The Rookie"" is called ""Run On"" It's a gospel song Elvis did in the 60's. I wish it was on this Soundtrack. EP Enterprises may have not granted permission to put it on the soundtrack. Who knows? It's a great upbeat Gospel song. Elvis Gospel songs are excellent. I recommend - ""Elvis Presley - Amazing Grace"" The Double CD collection - if you are looking for that Song"
4,Great value for the price,"Excellent soundtrack and great price through sbcglobal.net (Amazon Marketplace). Excellent turn-around time, received item within a week."
4,missing song title,The name of the song when they are celebrating in the locker room is called 'jump around' originally by House of Pain. It is also in the movie from1993 called mrs doubtfire.This is a wonderful movie and can be enjoyed by the entire family. I highly recommend it!!
3,Looking for info,Does anyone know the artist / song title played in the movie during the locker room scene after the team won the district championship?I thought that was a great scene with the players dancing in the and his son laughing.
4,Something missing,"There is a song missing from the soundtrack. It think it played right after ""Stuff That Works"" and ""Slow Turning"" - it sounded like Elvis Presley, and it was pretty upbeat. I know it played when Dennis Quaid was pitching to his high school students for the first time. Does anyone know what the title of the song is, and who sang it??"
2,Trailer Song,"I don't have the CD either, and probably won't get it - only because it doesn't have LIGHTNING CRASHES by Live (song on the advertisement)."
3,Elvis Song,There was also an Elvis song in the movie that isn't on the soundtrack. Does anyone know the title?
1,*CAUTION* Swallowed Ball,"I was lying down to go to sleep when I felt something weird in my mouth. Well it turned out that the top ball from the tongue ring had some how undone itself, and fell in my throat. This is not the first time that one of the acrylic tongue rings that I have orderd from this web site have done this. Most of them the ball from the top cracks and it just comes off. It's quite irritating."
5,Beautiful,"My dad's birthday came around and we looked high and low for a tie bar locally. None of them were all that stunning. My mom and I picked out this one on Amazon and my dad loved it.Well made, and looks as stunning as the picture. It came with a nice box and shipped really fast (note the shipping price, they really did ship for the amount, so it was worth it)."
1,Winter Wonderland,I thought this video was terrible. I could not believe most of the video was taken from a camera pointed out the side or back of the train and turned on to record. The only good part of this video was the archived footage from the steam locomotives that were included in. This video can not keep the attention of my four year old son who loves trains. I clearly expected better.
4,A Great Sampler,We may be zone 4 for DVD and PAL television (not NTSC) but we have our methods of beating the system.Found this to be a great introduction to Amtrak services with great views of the US countryside and informative commentary. Particularly liked the fact that where the scenery or train dominated the screen the narration stopped. Very rare in this type of program.The side excursions on preserved lines were interesting and whetted the appetite to try them myself.Having always intended to tour the US and Canada by rail I can only say keep lobbying your government to keep Amtrak funded - its an asset worth keeping.Also purchased 'Travel the World by Train - North America' (don't bother) and The Great Trans-American Ride (not bad).
1,lifeless and Dull,"lifeless and Dull one more time. The masters used for this recording and digital processing just plain ripped the sparkle and air out of these 10 tracks. It's just awful to try and listen to this as I loved Nat style but this will never see my CD player again and let alone be ripped to my computer.Save your money and shame on the Canadian Company, Legacy for surely damaging or at least tainting a great singers work.10 tracks, 28 minutes."
5,whats in the attic,"Excellent and enjoyable reading for preschool children.My sons loved it and they have asked me to read it almost every night since I purchased this inexpensive, entertaining and colorful book."
2,"Half Games, Half Comedians","GGW is advertising their Games dvd again, as if it were new, but it is clearly this same old show. This so easily could have been excellent - clever games, naked women. However,(1) Some of the ""games"" obviously had not been tested: the spinning bed ""game"" doesn't work, it just slips off and there is no way to judge who won.(2) It is censored - there is very little nudity or shots below the navel. By and large this is a bikini and topless competition.(3) Some of the women are genuinely beautiful, but there are more 7s and 8s than you would ever see in a Playboy or Penthouse video.(4) An awful lot of time is spent without any women on the screen (it seemed almost half the running time) as the comic hosts tell bad jokes.This should have been better."
4,A must have for any Sport Erotica Enthusiast,"Although it's not the best Girls Gone Wild video you'll ever see, it certainly is up there. It is the best erotic sports movie I have ever seen. The only reason I give it four stars is that it is not as good as the commercial let on.The DVD That usually comes along with this is not that bad either. Another Standard Girls Gone Wild vidoe. What I find nice about it is that it dosen't beat around the bush. It gets right to the action, unlike some other naked sports videos. It also lets you see behind the scenes a little wich was extreamly hot and sexy. If you are considering to get this DVD, stop thinking and just get it. You wont regret it."
2,Not so great,"Girls gone wild games takes place on fantasy island. The girls are split into teams and compete for points. The girls are supposed to be ""naked"" but they are mostly just topless. There are cutscenes interrupting the games and the games really aren't too wild. This old title could be a lot better"
3,Escape to paradise ..,"Bikini babes on the beach is what the Beach Guru loves .. and this video provides tons of those! and playing games as well! Hot, hot, hot! So, put this DVD on, and escape to paradise ... wish there was more stuff like this .. in Brazil, Thailand, etc .. for more like this, but with better music, check out ""Wild Girls Thailand"" (ASIN B000F6YVRW)."
3,"Works, but needs to be more powerful.","I've had this product for over a year, and I still use it from time to time. It's somewhat effective to use for spring cleaning, but quite time consuming as it is not powerful at all. It cleans my leather couch better than any chemical cleaner I have used, though. I wish it was more powerful to clean grout better. I have dogs, and I must say that steaming the tile gets any odors out, but I personally wish I would have gone with the McCulloch MC 1275 (more powerful) one."
3,Steamfast cleaner,"After having read many reviews on this product, I decided to try it. The first time I used it was on my kitchen tile floor and it did a great job. The second time was in my bathroom which has small tiles and it was harder to clean the floor with all the grooves. So, overall it isn't bad and does clean my kitchen floor much faster and better than any mop. It would be nice however if someone would make an industrial strength floor steamer that was affordable.Virginia Beach,VA"
4,Happy in Portland,"This steamer worked great on my kitchen floor. In fact the steam was so hot I had to turn it down to medium, because it was actually lifting the linoleum up from the floor. It took off many years of gunk that I could not have gotten off otherwise.The steamer however, in the shower, did nothing noticeable. I wanted it to clean the grout , but did not see a difference."
5,Excellent little mop with super cleaning power,"I struggled with which mop to buy, and decided on this based on the reviews here. I have not been disappointed! It is compact and easy to store. It heats up VERY quickly - even faster than we had anticipated. It has clips in the top, so any microfiber or terry cloth towel works as a ""mop head."" The cord is short, but we simply attach a 10 ft. extension cord and it does just fine. The short cord keeps it out of the way while mopping. I'd highly recommend this product - it's fast and easy to use. I will be keeping my floors cleaner - a necessity with two young children and a dog - with this mop."
1,single use only,"Case worked perfectly for the first few days on shallow dives. Seal wore out after 4 uses. Kinda useless then isn't it? Also, cannot find replacement seal."
3,Be very careful!,"The product worked well until we forgot to dutifully check the seal one time. Oops. There must've been a hair or piece of dust that compromised the seal. Our camera met its match in the salt water. Luckily, it was the second to last day of our three week vacation, and we were able to salvage the memory card. My advice to folks who buy this product is to ALWAYS check & double-check the seal. I would also recommend dunking it in freshwater before taking it into saltwater. If there is a small freshwater leak, you can usually dry it without the devastating corrosive effects of a full-on saltwater leak."
4,Great for what its for!,"This case works pretty good. Used it for 3 days snorkling in Belize and got some great pics. Only problem I had was it is hard to see the screen when there is really bright light. Those that bought this for diving, probably should read the limitations on it before they buy, because it shouldn't get a bad review because you are too lazy to read the specifications."
1,Not for Diving!,"If you would like to take a picture of the bottom of your pool, this product is awesome. Otherwise, it's pretty useless. Why does Canon only deliver 100-foot rated underwater cases for SOME of their cameras? I made the mistake of buying the SD450, and am now stuck with a camera that cannot be used for diving... unless you're will to risk taking it down in this POS case."
3,Swiss Blades,Not impressed. Some came with no teeth at all and some don't last well at all and I have been piercing for 3 years
4,"Nice square whiteboard, not so nice marker","Whiteboad is a good fit for our mud room wall - use this as a freezer inventory board for our food in the garage. Easy install with good mounting and easy marker attachment (and I'm not handy at all).Marker itself didn't last very long though. Good first time use, then dried out and had to get new markers."
1,Depending on your political persuasion,"""It is neither honest nor objective to describe popular teaching practices in a neutral manner if they do not stand up to the standards of social justice or education research. We do not believe that the world is a neutral place or that teaching is a neutral profession."" Introduction to Teaching, etc.Be forwarned that this is not a textbook that even tries to be objective about the history of teaching and learning. It is vehemently anti-traditionalist, and glowingly pro-constructivist.For traditionalists or people looking for a balanced view of the history of American schooling, this work rates 1 star.For constructivists or marxists this would be a 5 star."
3,Entertaining but weak in writing skill and quality of advice,"I enjoyed the first more-than-half of the book which dealt with various kinds of social engineering attacks. Each was at least plausible and usually interesting. I was constantly aware, however, that the titles of the chapters only vaguely correlated to the examples given: there must be a better way to structure the content (possibly starting with defining various kinds of attacks then identifying those techniques as they come up in the examples.)The latter part of the book dealt with corporate solutions and fell short of its mark. For instance, the audience is constantly reminded to keep their employees vigilant and interested because it's easy to let security policies slip, yet the methods advised were right from the corporation playbook: the kinds of things office workers love to make fun of and always circumvent for convenience. I was disappointed to find such a lackluster set of solutions."
3,Make sure you don't get hacked,"Don't support this con-man any more than you have to. Go to the library and read it there, or find a nice coffee/book shop and read it in-store. If you have to own it, buy the book used.These strategies will help you reap the ""benefit"" of this book just as much as anyone else and the author and publisher only get paid once. Share the love!In short, I don't believe in legitimizing Mitnick's criminal past by turning his exploits, stories and strategies into ""advice"" for those of us that should already know better. However if you're interested in the subject then you might as well read the book."
1,No Hack Just Con,"It's amazing that on the book jacket bio of Kevin, it is NEVER mentioned that he was in jail.Kevin is a criminal and even less of a hacker than a complete con-man. Kevin positions himself as a Security Expert when all he could really advertise himself as a BS-Detector Consultant.I agree the legal system failed in the case of not actually charging him while holding him for so long. But he ain't exactly Snow White, he had MANY chances to go straight after being constantly caught, yet he kept up like an addict.The only Art of Deception in this book is the con of getting you to buy this."
1,Mitnick was never a wiz kid - he was a criminal though.,"Hmmm. Amazon seems to have deleted my earlier review - I'll make it short. Mitnick is not a great hacker, he's a con artist. After reading his book there is virtually NOTHING about protecting yourself from hackers but maybe some ideas about protecting yourself from ex-convict con artists."
1,Kevin Mitnick Book,"I'm sorry, but a book by an ex-hacker who got caught in 1981 isn't my idea of hacking educational material. Those who know Mitnick's background know exactly why he is being pushed upon us as a 'reformed' expert hacker. A 'hacker' who last practiced his criminal behavior in 1981 knows less about today's technology than an AOL user does."
5,Mitnick sticks to his guns,"Mitnick never described himself as a ""hacker"" but rather a ""social engineer"". Good at it and well articulated in this text. Shame a crook can make so much ill gotten gain from being good at his illegal endeavors"
3,Very interesting book,This book seriously highlights the stupidity of people in the world. It shows how clever people go very far by asking basic questions to get what and where they want. The samples are entertaining and worth reading. This is some great education for the naive people of the world.
2,The Art of Deception ...,Mitnick shows that he is a master of the obvious. Guess what? Untrained users are the weakest links in your company's non existent security policy. The book is a set of long rambling stories about fictitious amateur con artists designed to be thinly veiled as Mitnick's own personal conquests... There isn't anything in this book that would help anyone but the truly clueless and seems to be written for young misguided computer enthusiasts.
2,fun read but outdated,"The stories told by Mitnick in this book are very entertaining to read, but I do think that businesses today (certainly enterprises) have done a lot of work in countering practices described by Mitnick. After a story, there is always an explanation of the con and what you can do about it (which is usually not much). These comments are very obvious most of the time. So of the 368 pages, there are about 200 that are an entertaining read. The last chapter covers how you can improve the security (and security procedures) of your company. Again, some are obvious, some of these notes are already widely implemented today. It's a fun read but the book hasn't aged well."
2,Too corporate self-help,"Kevin Mitnick was a gifted social engineer, so I was looking forward to reading about the tricks he'd used. Instead, I was disappointed to see the book is totally geared to the corporate director that has NO clue about computer security. The vast majority of the 'lessons' are embarrassingly common-sense:- lock your computer- don't write down passwords or codes- don't give out confidential information- check everyone's creditentials or IDThat's about it. Of course, you're missing out on the pages upon pages of rehashing the same lessons over and over, but if someone needs that kind of reinforcement to learn, maybe they need this book. :)"
2,Quite trivial,"I purchased this book based on several reviews including the few in amazon.com. What a disappointment. The book is a compendum of anecdotal evidence presented as ""true stories"", all of them of varying degrees of credibility.All the stories can be summed up in two words: identity theft. each story is told twice, once as Dr. Watson would have seen it at first, and once as Mr. Holmes would have explained it.At the end there is a review of what are the ""best practices"" of security, which is quite superficial to be interesging or valuable. All in all, the Sherlock adventures are a better reading; and a serious approach when drafting a security policy would be more useful than wasting time on reading this book.Get it from the library."
2,Terrible,"This book starts of interesting however the book goes on and on and on about scenarios involving people over the phone,it rarely mentions person to person or online scams.The book suggested solutions to preventing social engineering attacks is really poor,I enjoyed the book for a few days but its really same old all the way through,many of the stories read like Hack Philes you can find on the net,full of lies and waffle.You will find your self bored of the book,there are plenty of copies of it on e-bay for a reason,buy it for sentiment only and because its black.I can't believe its by Mitnick"
3,Meh...,"Overall, presents a good perspective of social engineering from a layman's point of view. Most of the stories Kevin tells in the book are related to exploiting the phone system and ""mainframes"", so you have to shift his theories and points into today's frame of reference in order for them to be relevant. That said, Kevin is a cornerstone in the information security arena and this book is considered a classic among professionals. Buy it, read it, and then pass it on. Not something I'd read twice..."
3,DECEPTION,"WHILE I FOUND THE BOOK WELL WRITTEN AND INFORMATIVE, I FELT THE SUBJECT MATTER WAS NOT AS FULLYINFORMATIONAL FOR THE MANAGEMENT CANDIDATE THAT WOULD READ THIS....ESSENTIALLY I FOUND THE EARLY PARTOF THE BOOK TO BE ABOUT DECEPTIVE PRACTICES BEING USED 20 YEARS AGO.....MUCH LIKE WATCHING AN OLDMISSION IMPOSSIBLE TV SHOW....I WOULD CERTAINLY RECOMMEND THIS FOR ANY NEOPHYTE, BUT I PERSONNALLYWAS LOOKING FOR MORE ""CUTTING EDGE"" IDEAS AND PRACTICES...I SUPPOSE THE AUTHOR WOULD(AND DOES) RESPOND THAT WITH EVEN THE BEST SECURITY SYSTEMS, THE HUMAN ELEMENT IS ALWAY THE WEAKEST LINK AND FOR THAT FACT, I SEE THE VALUE IN THIS PRODUCT.HOWEVER, FOR THE SAVVY MANAGEMENT, LOOK ELSEWHERE FOR THE LATEST TECHNOLOGY(DIGITAL RECOGNITION) AND PERSONALITYRECOGNITION TESTING..."
3,The Greatest Hack,"Kevin Mitnick&#65533;s &#65533;The Art of Deception&#65533; is his greatest (to date) successful attempt of the &#65533;hacking&#65533; on a mass scale. Not only he got to disseminate the craft cleverly bypassing probation restrictions, but also in doing so he legitimately got paid. Bravo.The content - amusing (hence 3 stars) mix of anecdotes and corporate manuals, presents no news to a professional. Better books were written on the subject. It is also unfortunate that the term ""social engineering"" stuck, though the desire of the con man to call himself something other then scumbag is understood."
4,great book!,"This is a great book for managers.It is very non-technical and very interesting.If this book does not scare the heck out of managers, nothing will."
4,Nice,"Interesting book. If you are bored or just need a book to read, read this one. It can provide some incites"
3,"Starts ok, becomes repetitive & boring.","I'm a big fan of social engineering. I find it supremely interesting. This book starts out alright, with a couple of interesting examples, but as you get deeper into the book, it becomes repetitive, and ultimately, boring.I couldn't even force myself to finish this book. Every example boils down to this: people are gullible and dumb, and if you display any sort of confidence, you're more likely to be believed."
5,Excellent insight into social engineering,"I'm responsible for securing our company's network, which includes writing security policies and guidelines for users to follow. Like many people in the industry, much of my security training has been focused almost exclusively on the technologies used to attach and defend networks. But more and more, I think we are all beginning to realize there is a very important human element involved as well. Mitnick does a great job in this book of giving the security professional insight into the social engineering techniques used to take advantage of either weakness or ignorance in a particular target. I've found this book as useful as any in my library."
3,You're already a victim,"If you're reading this, you're already a victim of ""social engineering"" as Mitnick calls it. You somehow believe that reading these reviews will tell you whether the book is OK or not. But these reviews can be entered by anyone. Perhaps Mitnick has entered most of them himself or his publisher did the same; you'll never know.So instead go down to the local bookstore, handle a copy and determine for yourself."
4,"Mixed feelings, but still a useful book","Kevin Mitnick IS a criminal. I have problems abetting his profiting from his crimes. However, that aside; this is a useful book. I am also put-off by his boastfulness.A well-run and maintained network is difficult to attack. Not impossible, just difficult. The easiest way to subvert most systems is the weakest component - the people. People want to be helpful and too often are not aware of the impact of even simple slips. People are also lazy. They write down passwords, circumvent security systems that seem burdensome, and do not report obvious attempts to access system.Mitnick show us that the most difficult part of any security system is to educate the users and to obtain their buy in that a secure system is a benefit."
3,"very repetitive, very repetitive","ok, kevin, so people are gullible. you can fool them into trusting you, even when they shouldn't. but does it take hundreds of pages to say this?thanks to mr. mitnick, we now have another voice telling us that there are bad people out there that are willing to take advantage of anyone they can to further their own purposes. nothing really revealing or new here, and the book tends to repeat this theme over and over and over.next time you try to drink out of the milk container when noone's looking, just think how you could be exhibiting early signs of a security guru."
4,Definitve Text on Social Engineering,"Definitive discussion of ""social engineering"" or deceptive practices to gain access to a company's data. Typically information security discussions center on technology (antivirus, firewall, intrusion detection), but this book makes clear that the weakest link in most security chains are the people in the organization. Only through a good policy and training can this weakness be addressed. A must read for anyone seriously interested in information security."
2,Dated Material,The book was OK but it's a few years old. The techniques the author used to defeat computer networks and the people that use them have changed a bit. Interesting stories but not as relevant as they were when he wrote them.
3,Worth Checking,"I was in London the week of this movies release so I can say Ive been lucky enough to have seen it.There has been a wave of so called hood movies coming out of Britain at the moment, and this film focuses around the lives of a girl gang (hence the derogatory term, Sket) and the (naive) main character. It also features ""Asher D"" from Get Rich Or Die Trying.Being one who enjoys international films (Harry Brown, Adulthood), I personally enjoyed this and think it worth watching. However, its in no way a classic."
3,Okay I guess but way too small,"It plays my MP3's, but the thing is TINY. It barely fits on me and folds the tops of my ears down. I'm hoping it will stretch out with time, but it really should have been either larger or adjustable. If I had bought this locally, I would have taken it back for that reason."
3,does not resume playback in middle of mp3 file,"I listen to mp3 lectures from The Teaching Company on this thing, and I am annoyed that when you turn it on, it does not resume playing an mp3 file from the same point where it was turned off. It just starts playing from the beginning of the track. That's very inconvenient if you have huge mp3 lectures, because it takes you 5-10 minutes to find where you left off.My other mp3 player does this, but it is not ""wireless"". In other respects, I am content with this player."
1,"Great idea, bad execution",Multiple problems with these headphones. I use them for voice tracks so I have no comment on sound quality. There is no display so there is no way to know what is happening with the system when you press a button. There is no repeat function. The headphones will only play one track over and over again -- I can't forward to another track. I'm very displeased and am going to return them.
