class_index,review_title,review_text
2,merely mean spirited,"Ricky Gervais and Stephen Merchant are mean to the ""round headed buffoon"" Karl Pilkington, an ""everyman.""The meanness however has no mercy, no glimmer of insight or self awareness.If Pilkington was allowed to do some reversals and get back his two tormentors once in a while, it would have been funny. However, he is truly one dimensional, either in real life or as a character, no meanness, no vengefulness to look forward to.Ricky you really have to see visually - he really is a short fat man who is physically captivating to watch. This animated podcast format does not do justice.I rarely stop watching a series, but this series, I really faded out towards the last two episodes, and I cannot swear that I watched it to the end. I honestly do not remember - that is how repetitive and droning the mean Pilkington jokes got."
2,Disappointing!,"If you are a Gervais fan because you appreciate his clever style of comedy, blending situational absurdity with witty sarcastic comebacks and balanced well with his simpleton, uncouth friends (as in Extras), then you'll be bored with this series. They just make fun of his bald, doofus sidekick in a manner that gets really tiresome - and really fast!"
5,A great saw,"Having owned this saw for 10 years and working in construction, loghome building, and timberframing I have found this saw to be very reliable. It has the torque to power thru any wood or log necessary for the job at hand. The saw is versatile and can be used with different accessories made for it. I would definitely recommend this saw to anyone for any type of construction."
5,Great Saw,I just bought the 8 1/4 inch saw today. I immediately went to the shop and started cutting. We are making Curly Maple Pencil Post beds for an upcomingshow. Using 3 inch / 12/4 curly hard maple for the post and needed to cut them out of a plank. I think this thing thought it was cutting butter as it made the cuts without effort. I love my wife but I think she has competition now. Do not tell her that or I am in big trouble. I so far see no problems with it. By the way No it does not cut 4 inch material unless it gets flipped over.
1,A TOTAL WASTE OF MONEY,You have to struggle and pull this on over your hips and butt to get it over your tummy. Cheap material that doesnt even hold you in! I wore it once and put it in the trash after.
3,As Seen on TV - The Invisible Tummy Trimmer,"No it is does not tied as on TV or picture, just a little bit..."
5,Place In This World,"It is an awesome book that I knew would be a great read....written by a great songwriter and story teller, Michael W Smith"
5,Al Green had it.,Good quality product. Tons of tunes. Top notch vocals are Al Green's trademark. Plenty of soul. The only drawback is that the producer recorded lame horn arrangements.
1,Horrible customer service,"I ordered this koozie for a Christmas gift. When it arrived, it was a completely different koozie than is pictured above. It is a red collapsable koozie. Clearly, that is not what is pictured above. I sent multiple emails to the contact I was provided and have yet to receive any response. I am strongly disappointed in the customer service of this shop. I would not recommend ordering anything from this store."
4,Great DVD storage,"I've had this DVD shelf for 1 1/2 years. It's been great and is holding up well. Only complaint is that after tons of spinning it (once in a blue moon) seems to get at ""the end"" and you have to spin the other direction--again, very rare. Other than that I would have given it 5 stars."
1,Fell apart in less then 4 hours,"Returned for refund. The first time worn it didn't last 4 hours before one of the stones fell off, then the clasp ring fell off. This is a real piece of junk!"
1,"Long John Thermal Dog Pajamas, Large Pink","My Items never came and the seller only refound the price of the items descounting the sending price, BUT HE DIDNT SEND IT"
3,Good for introduction for fundraising,I used this book to introduce fundraising in my classroom. It was ok but not exactly what I was looking for
2,A little too much for one book,"I liked the idea of this book when I read the description, but it's really A LOT to be in one little children's book! It's hard to follow and keep up, and there's just too much involved. I bought it for a lesson on money, most of the children were disinterested pretty quickly. A little disappointed."
5,Excellent tool!,"Well made, quality tool with ample power for most tasks. Well balanced too. Only drawbacks are lack of wrench storage, cheap original blade, and no case (but this saw gets used enough it would spend little time in case anyway). Deduct 1 star for these faults if you see fit."
5,Still going strong after 22 yesrs.,"I bought this saw 22 years ago and have used it since. I am a professional electrician and use a circular saw from time to time on the job for wood braces and supports. The saw has never been serviced or repaired. Some 7 years ago, I bought a Freud carbide blade from Home Depot. That's all I've done to it, and it keeps on going and going. When it no longer works, I'll get another. But, at the rate that it last and last, who knows when that will be."
5,skillsaw review,Great saw by skill. I have used the 5510 saw for over 20 years now . Probably one of the best saws i have ever owned . I'm a professional carpenter and have used many saws over the years but this one is my favorite. I have let other carpenters use it while on the job and they were impressed . Some have even gone out bought one for themselves after using mind. I still use the first one i bought 20 years ago .
2,"Great saw, wore it out.","This is a great little saw. Powerful, light, fast and accurate. But if you're not careful you can spin the blade on the shaft. I did on a job rough cutting some 1"" hardwood planks. Didn't really notice till the end of the day that the saw blade was running out of round. When I took the blade off I found the blade had cut a grove on the shaft. This should never have happened, the shaft should've been hardened.I will probably buy another and be more careful."
2,Saw has design flaw.,"While the saw works great as I used it to cut through some interior doors I was replacing but it has a big design flaw! There is a guide plate that has about an inch on one side of the blade and over three inches on the other. If you were making a cross cut and wanted to slide this guide against a straight edge you would want to use the 3+ inch side to have more support for the saw, right? The makers of this saw built the motor so low to the guide plate that it cannot slide against anything more than an 1/8 tall. This is really stupid. The saw works with the guild plate if you are cutting something thin like plywood, because you can raise the saw up (making the cut less deep) to clear your straight edge. The solution: for cutting something thick like interior doors, where you might want to use a straight edge - you have to use the one inch side. Not great support for the saw - but it works."
5,My wormdrive is collecting dust,"I really like this saw. I was able to find blades at Home Depot. The power is more than adequate, far more powerful and comfortable than a battery saw. That said, I wouldn't use this tool to cut 2 X 12s all day. I think that would stress it. But I've been using it on 1X, plywood (where it really excels, and 2x. It has no trouble plowing through a 2 X 4. I just used it yesterday to cut slots for 2 x 4s into a 4X post that was in the ground. I used to do this with my 18 pound skilsaw. With this little guy, its a breeze.I've seen people complain that it won't cut a 2X at 45 degrees. Most of my 2X cuts are 90 degrees and if I need to cut 45 degrees, I'll dust off my worm drive.Bottom line: I am very pleased with this saw."
5,great little saw,"I do remodels. bought this saw a yr ago after using another old 5 1/2 for many yrs. This is the easiest cutting saw I have ever used. Handle position is great for straight cuts. cross cuts on 2Xs are a breeze. no problem using a rip guide for long, straight, accurate cuts.Only drawback is blade selection, as mentioned before. Only have 1 tooth choice locally of carbide blades.After several cross jobs with different crews, everyone who picks it up & makes just 1 cut, loves the saw.This is one tool I recommend without qualification."
3,"Great saw, good luck finding blades for it.",Great saw. Light weight. Left side cut is great for right handers. Cuts 2-by with ease. The Light weight makes it the choice for cutting off rafter tails. But...good luck finding a replacement blade for it. Amazon does not sell them. Neither does Loews or Home depot. Black and Decker did make a blade for it but I have not seen them for some time. Buy the saw but find a source and stock up on blades for it.
2,delicate,"At first I was very happy with this purchase, but the depth adjustment bar got bent and tweaked everything else out of alignment. It is ok for occasional use, but if you intend to use it a lot I would go with the 7-1/4"" porter cable."
2,"Worked great, for a month.............","We bought this to replace a cheapo ryobi circ saw.Worked great for a month. we cross cut a lot of hardwood moldings.just over a month later, its sitting on my desk smelling pretty burnt up.we'll see what skill has to say"
1,[price] item,"Well, I couldn't wait to get my hands on this saw. For what they cost, I figured it would be good quality. It's cheaply made stamped guides and adjusting mechanisms were out of adjustment and the saw would not square up. It won't cut straight following the guide, you must watch the blade only.The first thing I did was get a decent carbide blade and that didn't help.The 6.5 amp motor struggles on 2X4 cross cuts.1/2""-3/4"" plywood better be all you try it on. I use it daily in my business,and I recommend something with more power and better quality. For [price] skil should be ashamed"
2,Hard to hear,"I bought the phone based on the good user reviews but was disappointed with the volume of the phone. Some people I called were quiet compared to my other phones, and others were nearly impossible to hear even with the volume turned all the way up. In fact, I found that turning up the volume mostly just increased the volume of the static.Another problem with the phone is its ergonomics. For me anyway, I had a hard time finding a comfortable ear position, and it was not designed to be held between ear and shoulder. It really requires one hand on the phone at all times."
1,Say what??,"This phone stinks. And for one reason only: Even when turned on Max Volume it is difficult to hear the person you are speaking to.And no, I do not have any hearing problems."
1,Terrible Sound Volume,This phone makes you think you need your hearing checked. Turning the volume to maximum only increases the static. I sent mine back. What were they thinking??
5,Great Phone,"I bought this phone last week, and at first I didn't think I would like it, although it was very clear. I took it back and purchased a Panasonic model with caller id/call waiting. I had previously bought a Panasonic 900 mhz phone that was really clear. This Panasonic had a lot of static, which was very irritating. So, after two days, I returned the Panasonic and re-purchased the Uniden. I've been very pleased with it. It is very clear and easy to use."
1,static and more static,Call goes thru and then the static assault begins. I almost threw this phone at the wall. Junk.
2,Decent features but poor sound quality,"It's a decent phone, but just barely. The base doesn't take up much space, and the phone supports both regular Caller ID and Call Waiting Caller ID. The memory function would be better if you could see the list while you're already on a call (to enter your voicemail or long distance code, etc.), but it serves its purpose. In other words, as a basic cordless phone, its feature set is just what it should be.My biggest complaint is with the sound quality. The sound generally is muffled, difficult to hear, and quite low-volume. Because of that, I wouldn't really recommend it to anybody."
5,Astounding Cinema!,"I love Mr. Harris's exciting camerawork and editing! Beautiful and kinetic and kinesthetic energy! all of the movies on this disc are excellent and entertaining but I think ""Organism"" steals the show. For me it's stronger and more thrilling than even ""Koyaanisqatsi"". Some of the shots are unbelievably dynamic, huge, and mind-blowing. Highly recommended!"
3,Trashy and fun like a bad B-movie is fun.,"Have you ever watched a bad movie just for the fun of it? You know, a movie like ""The Legend of Boggy Creek"" or any old 70's horror movie, for that matter?Well, reading this book is kind of like watching a movie so bad, it's good.Oddly, the writer is actually technically rather skilled, so the book itself is an easy, unjarring read. It's the wacky, zany, zaftig plotline that causes the raspberries.I don't know for sure what I think about Amityville -- it scared the dickens out of me as a kid, but as an adult I have to wonder if it was just a lucrative hoax. Yet, reputable researchers like Ed and Lorraine Warren claim it was real. Maybe the whole Amityville phenomenon was true to begin with, then became exaggerated as time went on.But never mind about the truth or falsity of the phenomenon. This book is worth picking up used. It will give some chills, some laughs, and a big dose of nostalgia for the 70's and early 80's."
3,The Passionate Brood,"As a big historical fiction fan, I am amazed that I have not read this author before. The back of the book showcased several of her novels, all of which sound good. I will have to read more by this author at some point. In this book,Richard the Lionheart is the historical figure of focus. Thrown into the mix is if Robin Hood was Richard's foster brother. This book holds true to the genre with jousting, warring, and using women as pawns to power. The writing style is similar to that of Philippa Gregory, whose writing I love. This book is well-written and the author obviously has done her research. I always cringe at the plight of women in this time, as they really had no say over who they would marry or where their lives would take them. I recommend this book to fans of historical fiction.I received this book from SourceBooks to review.[...]"
1,You're in the 21st century,"I was going to buy ""Passionate Brood"" but the author's foreword left me cold. ""I'm going to write in present-day English, and I make no apology"". Well, that just shows she doesn't want to put forth a little extra effort. People in the 14th century may have had the same human feelings, but their attitudes and their speech were shaped by their time, their religion, and their rigid social class. Dialog helps get that across. Go ahead and read ""Passionate Brood"", but then read ANYthing written by Sharon Kay Penman......you will see the difference immediately."
5,Should be 20 stars,"I have a lot, if not most of tibetan bell/bowls CDs. This artist is absolutely the most talented. I play Tibetan bowls myself and cannot even come close to duplicating what Tillman can do. I have bought every CD of his I can locate. His work definetly puts the listner in a deep altered state. I know there are several other ones that are available, that Amazon does not carry. I found on the website. If your into meditation or sleep or stress relief..this may be a great find."
2,"If you KNOW you want a 'plastic' airplane, move on...","Good book, unless you know what you want. If you are looking at building, and are looking for options, then check this one out. It covers several different composite kitplanes (and one-offs) and a generalization of how they are assembled. If you are designing or already building, move on. Sorry, but its just too general..."
2,Not too good.,"I guess the book gives a decent overview of composite construction in homebuilt aircraft. But I concur with the other reviewer that it is poorly edited (written), a little incoherent, and (this bothers me the most) contains illustrations with no text directing the reader to them. I guess you're supposed to figure out for yourself which drawing goes with the text you're currently reading. Frustrating, i tell ya."
4,A good book for the graduate level,This book is a good book but does not talk about the design of planes very much but talks more about putting the planes together and how it is done.
3,Funny,"Just have to say that if you want to watch something where you can laugh, this is the movie! Go ahead!*Sponsored Post"
1,I don't think I can take anymore,"This is my first and as far as I can tell only experience with this author. She seems to have come up with a facinating plot and then proceeds to mess it up almost beyond belief.Her main character never seems to dominate the novel. She constantly tells us how smart and formidable her heros are and then they prove her wrong by not being able to find or figure out anything. She has no sense of drama or suspense. She constantly changes the people driving the book, we go from Monk, to his wife, to Rathbone and if it doesn't fall in their lap they would never get there. One thought illustrates this point to a tee, she tells us Rathbone is the greatest barrister in the relm, then at the start of the trial she tells us Tobias defeats him as often as not, from the way it goes from there that is an understatement. Sometimes I give things a second chance but not this time thanks."
4,"Wonderful, as usual!",This book was gripping until the end - though without the usual tension between Hester and Monk to add that extra bite we've been used to in this series of books.
4,A True Victorian WhoDunIt,"I have read every book that Anne Perry has written and I enjoy every one, but I particularly like The William Monk series. I find this series is darker than the Pitt ones and every book has fine examples of Victorian British courtroom drama. I marvel at the way that Ms. Perry can portray the Victorian mindset - the prejudices and the close-mindedness. Improbable as it seems to us in our modern day world, being quick to censure and to judge others against some impossible ideal was very prevalent in late 1800 England. There are a lot of plot twists and turns in this book, and it has its usual surprise ending. In some ways the ending seems less probable than other books in the series, but it doesn't impair the fun of the read."
3,"Anne Perry does it again, and again and again...","Although I will continue to read any and all of Anne Perry's Victorian novels that come my way, I am ALWAYS ready to scream at her habit of having her characters echo themselves and each other constantly. She reiterates actions, thoughts and opinions to the point of making me cry out, ""I get it, I get it."" And do we really have to have numerous characters speak of another as ""poor little thing"" or some such stereotypical phrasing? Really...it's like the same person with different names saying THE SAME THING in the SAME tone about the SAME incidents. She also goes into much too much rehashing of plot."
4,Perry does it again!,"It is amazing that Anne Perry can keep coming up with such marvelous and convoluted plots! Her newest, Twisted Root, again saves its major surprises for the end, just when you think there's no way to work out a satisfactory answer. Again, it also give insightful info about the Victorian era and it was nice to finally see Hester and Monk married, although this part of the story took a back seat to the plot. All in all, it's a very enjoyable read!"
4,William Monk,"the character of William Monk is well developed and intriquing. The detailed description is , as usual in most of Anne Perry's books, transport the reader to the time and place of the story."
3,Still Worth Reading,"I suppose it's difficult for an author to know how much background to reiterate when some readers may be first-timers while others have absorbed all the earlier books in the series. Still, I wish Perry would realize that it's also difficult for loyal fans to plow through yet another rehashing of nurses' plight in the Crimea and 19th-century England. I find myself skimming an author whose every word I used to savor. Also detracting from this book was the way characters - even whole courtrooms - kept jumping to ridiculous conclusions with scant provocation. Despite these complaints, I still enjoy the characters and the world that Perry has so carefully created. She's a skilled enough writer that it's fun watching how she gets from A to Z even when it's pretty obvious what Z's going to be."
2,Pretty Good,This was certainly not one of the best books that I have read but I enjoyed it because I read it with my classmates. I think you need to have a great imagination to enjoy this book. I think it is more exciting to children. Adults would probably not like it at all.
4,Anthropology or Social History?,"From 1947 to 1951, Maya Deren filmed a large number of Voudoun rituals in Haiti. In 2007, her heirs compiled and edited this film into the DVD we have today. Then narration was added from Deren's book of the same name. It's an utterly fascinating anthropologist's look at something which has been incorporated into many modern cultural phenomena, including jazz and subsequent music and dancing styles. Here, however, they have important religious significance.Basically the Loa (gods) take possession of the priests and priestesses, and are referred to as ""mounting"" the person, as a rider mounts a horse. This is, by the way, the reason my late husband declared that my totem animal is the horse. He mounted me as a god.I challenge anyone to see this film and not tap their feet or sway to the music."
3,Love LOVE the scent but doesnt last,"ALthough the scent of this deoderant is awesome, it does not work for me.It smells every bit like the mandarin orange sweetness with the potent but dark scent of patchouli, and I wish it lasted longer, but after about 15 minutes, it stops smelling so great and leaves the regular armpit smell...so I have to re-apply very often."
2,Key word patchouli,"If you like the smell of patchouli, you will like this deodorant. I personally don't and so can't recommend it."
3,great smell-scent,"this smell is so fresh and clean smelling, i really enjoy it. It works on BO for about 4-8 hours depending on the intensity of your day, reapplying is necessary but that is normal (i find) with a natural deodorant, unless it contains tree tea oil. If you shower at night and apply then by the time you wake up the next morning you might need a shower again, depending on how sweaty of a sleeper you are. I am happy with the results if I am just having a day around the house, but if your going out then go with a tree tea oil based one. Sometimes I combine the 2 types to get the nice smell of this one to cover up the tree tea oil smell...in my opinion much better then tom's of maine (smells good but is always sticky) but Jason brand or another with tree tea oil is much better, if you know those brands. Good luck."
3,not for me,"i love the scent, i love how it is natural. i wish it was better at deodorizing, however. it just didn't work for me."
2,Disappointing,"This product is cheaply made and has only a very mild smell that does not last. I am also not sure why the picture shows two of the product, because you only get one."
2,This really does not work.,I find that this really works no better than using nothing. I will go back to using magnesium oil spray for deodorant. It works great and I get my magnesium.
2,"smells ok on it's own, but does nothing whatsoever for my BO","i am not a particularly stinky or sweaty person, but i was looking for a less chemically deodorant when i became pregnant. i tried to like this, i really did, but my BO was hideous when i wore this - worse than when i just went without altogether. it is also pretty slimy. i gave up and went back to dove."
2,"Good concept, not effective","I really like the Nature's Gate soap, shampoo, and conditioner products and was hoping the deodorant would be equally good. However, it was not able to handle the task as effectively as other stick deodorants on the market. It smells great, but the consistency is almost like soap and difficult to apply. The baking soda is not able to keep sweaty areas dry or absorb body odor enough."
1,"Very, extremely disappointed","I feel I got tricked into buying this. DON'T BUY THIS!!! By the way, the deorderant DOES NOT smell like fruit. I don't recommend this item unless you want your armpits to sweat and smell. I'm not happy with this product>:["
4,great stuff for your hair,"this gel is amazing, from its smell to the look it creates. Even though this is the light hold, you get enough hold to get you through the day and with a natural look. Try some, worth the price."
3,Padded Cycling Shorts,"The shorts are good for the price. As stated in other reviews, the padding is thin and more for experience riders. I wish the spandex was of a better quality, but they do the job."
1,Girl Biker,"I went to the manufacturer's site for these shorts and thought they sounded like they would be great. Upon receiving them and wearing them, the fabric is thin, the padding is thin, and they're the only bike shorts I own that I can't wear to spin class due to the thin padding. I mountain and rode bike and was extremely disappointed in the quality of these shorts. Needless to say, I won't be purchasing another pair of shorts from this company."
