class_index,review_title,review_text
1,Poor Quality,I was looking for the Wearever version of this and upon conducting the search this showed up. Poor quality and it was dente/very pliable.Run for the hills when you see this piece of garbage.
1,disappointed,I am very disappointed in this product. For several yrs I have been using non-stick and found the only one to stand up to cooking for a large family is Farberware and old fashion cast iron. After many tries I have decided to go back to the cast iron cookware. It is just as expensive as some non-stick and less than others but always there to perform. It does not scratch during the first few weeks of use....or ever. Now days you REALLY need to get your monies worth.
3,"Average pan, with a major warping issue","I have owned this pan for almost a year now. This is my only frying pan, so it gets a fair amount of use.Pros:- The handle is made of a soft, grippable material.- The nonstick coating is staying on pretty well.Con:- The pan warped almost immediately. The metal of the pan is pretty thin, so it's no surprise that it warped.If I had it to do over again, I would spend a little more money on a thicker pan."
3,Kind of flimsy,This jumbo cooker is okay. It is very light and does not cook as evenly as the T-fal pan I bought. I should have bought the T-fal version of this pan instead.
5,Really like this pan alot,This pan is really nice. I just recieved it a couple days ago. I have used it alot already . I have cooked bacon in it with the see threw and steam release lid on it. Worked really nice and I had no grease to clean up either. Cooked scrambbled eggs in it worked great no sticking no mess just wipe it clean. I love this pan. I take skin off Itailian sausage before I cook it sticks on my old pan but not on this pan. The price of this pan is reasonable to. Thank you very much a very happy customer
2,You get what you pay for...,"This pan has some good qualities. Nice non-stick surface, even heating, great size. The draw back? I've had this pan for about 3 months. I've used it 1-2 times per week. The handle has started to loosen. And tonight I discovered that the bottom is starting to warp, as it will no longer sit flush on my stove. I have a Calphalon pan that is almost identical to this one. I have had it for almost 2 years and it is still in perfect condition. As I said, you get what you pay for."
2,Good Music But Not What I Was Looking For,"I am a guitar player. I was looking for a video that would ""teach"" me FingerStyle Acoustic methods. Instead, it's just some people playing the guitar. They're very good guitar players, but it wasn't what I was looking for. I am probably to blame for my disappointment."
5,I love this story..wish it was a memoir,"I love this story, I wish it was a memoir, but that would mean it would have to be true. and there is enough going on in the world today , we don't need this story to be one that is seenon the news. However, it IS a very good read. I suggest that organizations that deal with children who were abused and neglected need to read this book, it relates to the childrne. It makes the reader keep reading to find out what happens to the little boy. I am older than a teen, but study things for children. I think this is a good teen or adolescent read for children who have been through this situation.Has a great ending, you will love it"
4,Great Book!,I think this book deserves this award. It is a great book but not the best I have ever read. I think this book was a little depressing but at the same time joyful. This book is suspenseful. If you like suspense you'll love this book. I would recommend this book to ages 11 and up and anyone who loves dramatic endings.
4,"A very disciplined read, but very worth it.","Gilson's work on the philosophical side of Aquinas is a masterful work. It reflects a very mature appreciation of Aquinas, which serves as a very good basis for his exposition of the philosophical side of Aquinas's theological work. Make no mistake, it takes a very focused reading to appreciate the extremely subtle insights that lay at the heart of Aquinas's reflections on Being. Without such a disciplined readying the exposition will dissolve into seeming endless, nuanced abstractions that even Gilson will not be able to surmount for you. Bringing such dedication to the reading will reward you with nothing less than Beauty and a true appreciation for why Aquinas is ""Saint Thomas Aquinas""."
5,New to Frescobol,"I bought these racquets recently and am very pleased. They are significantly better than the cheap kits you buy at local department stores. They are extremely sturdy with a very comfortable rubber-like grip. If nothing else, they come in very cool colors and designs. I've actually got 4 raquets now... all of different styles.The game is real easy and can be played almost anywhere and by anyone ... you certainly don't need to be an expert. I've played on the beach as well as in my back yard.Hope this review was helpful."
3,Yodora cream,The only objection I have is that the Yodora cream feels gritty and grainy when I apply it. I don't know if it is beyond the sell-by date or what.
2,Flat as a flippin pancake,"What happened to this one ... hows come is sounds so dead. Awful production. Someone pressed the 'suck all the life of it' button. I've noticed this on the occasional Incognito recordings before. Some releases are really bright and sharply recorded and produced, but this isnt one of them. It is not a Cd that will flatter your hifi - in fact the opposite. Its makes your nice posh system sound like a rank old bit of kit. Skip it. Poor. Next."
5,Nell Nugget and her little dog dust save the day and goldie the cow,"Such a delightful read. You and your child will get hours of fun reading this wonderfully whimsical book about how Nell Nugget and her little dog Dust save Goldie, her best cow from Nasty Galoot. Comes with adorable squishy toy cows so your child will have his or her own herd to go along with the delightful story.Nell Nugget and the Cow Caper"
1,Like something from Nickelodeon,"This book was written like it should be for children. It's very hard to read because it's formatted like a third grade English book. This is not a good book to learn HTML, CSS, or XHTML with, not even as a starter book.I can truly say this book was the most disappointing book I have ever bought. I'm sorry to be so negative, but this book is just ridiculous. Don't waste your money."
1,SLOOOOOOOOWWWWWW,"I TEND TO CRITISIZE THOSE WHO SAY BAD THINGS ABOUT A BOOK, BECAUSE A BOOK SHOULD GET CREDIT FOR JUST BEEN OUT THERE, BUT I COULD NOT LET THIS ONE SLIP BY.THIS BOOK IS EXTREMILY SLOW, YOU OPEN A GRAPHIC IN PAGE 5 FOR INSTANCE AND SEE THE SAME GRAPHIC IN PAGE 267 WITH THE SAME BLOCK SCROLLED TO THE RIGHT THIS TIME. THE AUTHOR WORKS WITH A PORTAL UGLIER THAN THE ONE EBAY HAS.THE FIRST LIKE 270 PAGES TALKS ABOUT HTML WITH A COUPLE OF TAGS REFERED OVER AND OVER AND OVER.IS NOT REPRESENTATIVE OF THE NICE SITES YOU SEE OUT THERE.VERY SHALOW CONTENT, (NOT EVEN THE JOKES ARE WORTH THE BOOK)SORRY GUYS, NOW I CAN SLEEP BETTER AT NITE."
3,Basic intro to HTML and Css,"For beginners, this would be a great book, but I was hoping for a bit more depth. I only got benefit from the last 100 pages."
4,A Great Book.,"Many people have complained about the fact that this book is for those with ADD, that it is too much fluff, or that the pictures look like their from Nickelodeon. For someone like me however, this is a great book.No the book isn't as deep as some would like, but for someone who doesn't have a lot of experience with XHTML & CSS, this is a great way to get started. For me it is important to know why something is done a certain way, why it is important. Head First does a great job at answering the ""so what"" of some basic things in web design. Because of that, I have a much easier time to learn it. I'm not ADD or watching Nickelodeon, but this book was a great help in getting me started on web design. If you are looking for advanced web design lessons, move on, but if you are just new to this thing and the ""so what"" is important, I'd highly recommend it."
5,I read the whole book!,"I don't know how many of these ""learning type"" books I have bought and only got 1/4 of the way through before I put it down and picked up another. Not to say I have no attention span, but this book really taught me something on every page. I have gone on to mastering .NET and java because of the basic knowledge that I recieved from reading this text. I recommend this book for anyone that wants to know basic html and css and how the internet works."
5,"Clear, easy and accessible reading.","I am only adding to all the good things that have already been said about this book. The book was never overwhelming nor intimidating. It broke down concepts in way even the most amateur of people could understand. And, the reading was actually a little entertaining."
5,Head First HTML with CSS &XHTML,"This is by far the best intro book for html, css, and xhtml. In fact who would believe that that an instructional computer language book would be enticing enough to lure you back after a session of study because it was fun...Who said that...Did I say that?!?!If you would have asked me before this book if that was possible I would have thought not. In the past books on topics such as this resulted in a fine night's sleep after a few pages. This one kept me up at night thinking so there you go one of the down sides is, it is not an effective sleeping aid. To those just starting to learn these skills I highly recommend the W3C schools free tutorials to accompany this book."
5,The best introduction,"I must admit I was surprised at how wonderful this book was. I read it from cover to cover in 5 days. I feel like I now have a very good grasp on XHTML and CSS.When I read the introduction, I was skeptical about the methods used to teach in this book. But then I realized that because so many teaching methods were used congruently, I learned faster and retained more information in less time than I have with the type of books I usually prefer: dry and directly on point with no personality.I was a little bothered by the curse words used in the book. But as a teaching text, it was excellent. Examples were clear and visible as well as verbally explained. Concepts were also visually represented and verbally explained. And both examples and concepts were shown visually and verbally explained a few different times in a few different ways. I think you get the point.I highly recommend this book and will purchase from O'Reilly again as a result of this book."
4,"Great beginners book, but the index is pitiful!","This book will explain the basics of CSS and HTML so that the reader will finally understand it inside and out. But the index lets you down. How could the authors and contributors, so thorough in everything else, have forgotten to make a comprehensive index? Other than that, it's a great book."
4,I used my head with Head First,"Although I haven't finished the book yet, it definitely makes it simple to learn HTML and how to program web sites. This is something that would usually make me yawn and fall asleep, but they keep it light and interesting."
4,Land on your feet,"Well written, an interesting approach to explaining the how to's of robust design with a fun and light hearted attitude."
5,Highly recomended,"I read the book from cover to cover (all 650 pages) in less than a week, and it really got me up to speed on CSS (which is what I was most interested in). It was so good that I bought another copy for one of my coworkers and another for my son (I wasn't about to give away mine)."
5,Very well written,The style of this book aids remembering the material. It's actually fun to read and do the homework. I find myself looking forward to reading the next lesson.
2,Really really slow,"I read this book so I could pick up HTML 5. I decided that I want to do some web pages and take a break from applications. HTML 5 looks fun. So I picked this book and this book has info but it really makes you grind through the book to get to it. It's really slow paced. I like how it has pictures, but there is limit. After a point it's like the book speaks to you like it thinks you take an hour to comprehend something. Just give a topic and move on. You don't need to drag something 5 times for another 50 pages, literally. I read 100 pages for the past 3 days and still have my webpage the same as it was in page one. Matter a fact, after page one you barely write code, you just grind read the same topic over and over again. This is first my review. I never thought I'd write a review, but seriously, how stupid do you think we are? We get it, move on. This isn't Jersey Shore."
1,Skips page locations in Kindle edition,"Is the Kindle edition supposed to skip from location 1624 to 1636? I can only get to location 1625 by manually keying in the digits after selecting ""Go to"" from the menu.I just returned my copy from Feb 15, made a repurchase five minutes ago, and I'm still having the same issue.Is anyone else having this problem?"
5,"A little cheesy at times, but in a good way","I've tried several websites and other books to try and begin learning HTML/CSS. Every time I start one, my interest begins to dwindle and I can't finish. Head First is the first book I have managed to finish. They kept it interesting and took some of the monotonous work out by providing you with some pre-written content. I thought this might detract from the learning at first, but discovered that it makes you focus on the more important aspects and rewards you with fast progress. By the end of the book, you will be proud of yourself for how much you've learned in a very short time. I think my next book may be diving into PHP and MySQL with Head First. If you are new to HTML, definitely give this a try and you won't be disappointed."
3,"Get To the Point, Please","This book contains a lot of good information about using HTML and CSS to create functional, stylish web pages; the authors apparently know the subject matter very well. However, this manual ""beats around the bush"" far too much in trying to make the information ""fun and entertaining."" I did not buy this book to be entertained; I bought it to get educated. Many pages contain nothing more than empty whitespace and corny, useless depictions. This publication contains about 700 pages, but could easily be trimmed down to about 300 to 350 pages if the information was presented in a more direct and concise format. The Freemans should stop trying to be funny and entertaining because they are NOT good it. They should stick to teaching HTML and CSS because I think they would be very good at that - once they eliminate all of the useless drivel."
2,280 pages to get to an IMG tag.,"This book could be cut down to a small pamphlet with no loss of information. 90% of it is pure fluff. It takes almost 300 pages to get to an .I recommend it for anyone who enjoys 4 pages of pretend conversation between anthropomorphic HTML tags.Lastly, my final complaint is that the crosswords at the end of each chapter, which seemed like a neat idea, only contain 3 or 4 actual questions regarding the subject matter (which is mainly die to each chapter having very little actual content). The rest of the puzzle is made up of non-information and puns. For example: ""which style tags do the authors WISH existed? The answer is some joke about the 50s."
3,BEGINNER BOOK,"This book is definitely for beginners. I found about 2 pages of pertinent/usable information on xhtml, I think the title of the book should remove the xhtml statement imho. It's style is a bit ""young"", meaning there is no serious tone to the book, probably good for someone with A.D.D syndrome :) I am giving this book 3 stars because it does, in fact, contain all the basics for html web design and it keeps it very simple. I took away 2 stars because I was expecting a more advanced book with more css + xhtml and the format was somewhat aimed at a younger audience."
1,Too much clutter,"There may be some valuable information in this book, but I couldn't see past all the clutter. Many pages are broken up by a host of info-tainment elements, including unrelated nostalgic pictures, deadpan comics, puzzles, handwritten notes and arrows all over the place, sidebars, and others. So the layout was a real turn-off. Some may prefer this mix. But if you just want the plain facts with some helpful tutorial material this is not the ""6-star"" book the most visible reviewers suggest.CSS: The Missing Manual is an exceptional CSS tutorial and uses the kind of clean, straight forward approach I expected from this HTML book."
5,"Buy this book, now!!!","This is not a reference book however it is an INDISPENSABLE learning tool!!! Even if you are a beginner or have been designing for awhile and want to learn to do it the ""right"" way, please, get this book! I paid around $40 for it and it was worth every penny!"
4,Good book for beginners,"Fun and interactive book for beginning Web designers. Even if you don't know HTML and CSS but are computer-savvy it's a bit slow at the beginning. But it then picks up and has you working on all kinds of projects that will help you in real-world situations. However, good luck later on finding specific commands using the index. It doesn't go into enough detail so you'll have to use the table of contents to find the command you're looking for."
4,Excellent Refresher,"I've been writing/editing/producing/managing sites for more than 15 years. I wanted to get up to speed with the newer HTML5 pages just so I could understand the funky styles better and how to build them (not just fix them). I'm self-taught or piecemeal taught based on work needs, so I never had a cohesive structural narrative and actually find the little notes adorable. Plus, even though I'm significantly further ahead than the usual audience, getting an easy narrative is very useful.Honestly, after years of CMS lethargy, it's easy to forget the basics. This is an easy, user-friendly book that brings them back as needed (and is easy to gloss over as needed when you are far beyond certain skill sets). And it's much more accessible than a smug, design-heavy/content-lite Wordpress blog about design creation that has poorly-written ""tips"" from idiot Millennials."
4,Great Book with Good Examples,"Great book, especially for a beginner. There are actually 3 projects that you work on through out the book and they are clear and easy to understand. My intent was to use this book for an HTML class I teach and when I emailed the publisher for a copy of the book to review for adoption I was denied as they do not waste their time with middle school and high school classes. They must be unaware of the fact that kids in grades 7-12 are the ones studying about computers and web design more than adults."
1,A Whole Lot of Nothing,"Just how stupid do these people think we are?I hate this book. Like the other one-star reviewers, I find the cartoony illustrations and jaunty hand-printed notes in the margins to be wildly distracting. I don't like having to sift through the intentional repetitions of the concepts just because other readers might have to read something 3 or 4 times before they absorb it. I don't, and if I do need to go over something again, I'd rather just go back and review instead of being forced to read the same thing phrased or staged in three different ways.This is the assigned textbook for an HTML class that I'm taking, and I'm going to complain to the instructor, too."
1,Ugly and unsporting,I absolutely hated the way this book was written. The layout was scattered and information was repeated too much. I felt ripped off. Like someone deliberately filled a book with half-baked ideas just to up the page count and price.I was originally going to give this book 2 stars. After reading other reviews I found that someone related to this book is attacking reviewers. That makes me trust the author and associates even less. 1 STAR.YOU CAN BUY TWO GOOD BOOKS FOR THE PRICE OF THIS REMEDIAL TEXT.
5,Excellent Women friendly book,"This book uses positive images of women, which was so refreshing and engaging, I actually thought yeh I want to be like those people who know HTML! There are many very helpful varieties of teaching techniques throughout the book.They almost trick you into learning!Before I knew it I had my first website designed and ready to fly! Thank you HEAD FIRST! I will be looking at your other titles now!"
1,I cannot stand this book,I see by all the other reviews that most people really like this book. I absolutely hate it. I don't like how the information is presented or organized. I have to use it for a college class and dread having to read the rest of it. I cannot recommend it whatsoever.
4,HTML FOR THE COMPUTER NOVICE,"This text is somewhat difficult for the computer novice. However it does take one very slowly through the steps required to start writting code. The explanations areclear and straight forward. For learning how to write code for the web, this is the place to start."
4,Very easy to understand,"This book is great for anyone with little knowledge of HTML and CSS. It is presented in a unique, fun and easy to use way.Highly recommended."
2,Sloppy testing of first exercise diminishes book's usefulness,"When I purchased this book I wanted more than a hip, new-age way of getting me to absorb the material, I wanted the exercises in the book to work. Like myself, the 30 or so other reviewers were influenced to purchase the book by the pictures, cartoons, and sometimes irreverent prose. None of us could test out the book's exercises in the store. I can't vouch for the other reviewers, but once I got the book in front of my computer I began at the beginning and in the first exercise, Uh oh, problems. I am not alone. One just has to go to the HeadFirstLabs online forums to read that the exercise apparently wasn't tested on the world's most popular browser, IE6. If the first, and what logically should prove to be the simplest exercise in the book is flawed, what disappointments and frustrations do the following 620 pages have in store for us IE users."
2,style over substance,"This is the first ""head first"" book I've read, and unfortunately it will probably be my last.I actually don't have a problem with the material covered in the book. It seems pretty complete. But to me, having to wade through all the ""cutsie-poo"" little pictures and notes and jokes and all that just leads to a book that is difficult to pick up and find the info you need. I suppose if your goal is to be amused, then by all means pick up this book. But if what you are trying to do is learn so that you can accomplish something in an effecient way, then I'd definitely buy something different.I'll leave the ""head first"" book to the teens, I want my medicine ""straight up"" and strong, not watered down like this."
5,Should Have Started Here,"I will keep my review simple. I have needed some HTML and CSS for one project or another over the years but have never held steady with it. I picked this book up as a refresher on some items and was blown away by its unique take on teaching a programming language. I wish I would have started here years ago! It was honestly a pleasure to read while most books of this nature are a labor simply to finish. I would recommend this to anyone, and look forward myself to picking up some of Head First Labs books on other topics."
5,Book,The book arrived very quickly and was in excellent shape. I will use this seller in the future if the books are available. Thanks.
1,"good book series, not so good for html","The head first series is really good, and simplifies things that can be complicated. however, that being said, HTML & CSS are not a subject that requires 800 pages, it really can be learned fairly quickly. The book goes on and on about such minute details that just make it more boring as it is, it is so basic that by the time you get done you only learn a few tags and almost no css. Anyone with half a brain would be able to learn html in a few days, don't waste all the time reading this book, thats ofcourse if you plan on going to sleep."
5,wow good book,"I book this book wanting to learn more about websites. At first I was a little skeptical/regretful about buying the book until I started reading it. I must admit i'm only on page 76, but so far the book has blown my mind. At first glance the cover may look like the book is a bunch of technical jargon thats going to overfill your mind, but once you start reading it you know that the 'head first' part of the title really means 'your going to learn this and its going to be fun'. I have started to learn how to make webpages and it has been fun. If you want to learn how to make web pages this is definately a friendly and fun (i'm not just saying that I'm enjoying learning through the book, and its jargon free' way to do so. Great book, 5 stars, exceeded my expectations."
4,Great help in updating my sites ancient HTML,"I've got several hand-coded HTML websites as well as other HTML code (a textbook on CD, for instance). This book was all I needed to upgrade my skills to the latest XHTML and CSS and revise my sites for better appearance.It's only fault is that it would be nice if it had a quick reference table of all the tags. Now I need to purchase a reference book as well because the book's organization makes it fairly worthless as a reference once you complete the tutorial."
4,Head First for Dummies?,"I only just started reading but I like the ""work your way thru it"" style. It reinforces the mental with the practical."
