class_index,review_title,review_text
4,This is an enjoyable compilation of British 60's pop.,"Since Dave Berry was only popular in the UK and Europe I had never heard of him until I came across his name and some of his available CDs while surfing on-line CD stores. Looking at track listings I was familiar with some of his songs as covers, but I had no idea how he sounded. His Top 5 hit ""The Crying Game"" was included on the soundtrack of the same name, so I sampled it at a CD store. I liked the sound enough to take a chance and buy this CD. I was pleasantly surprised to find the CD an excellent compilation of British sixties pop. I enjoyed it thoroughly. I wish I had learned of Dave Berry years earlier. As a fan of British beat music of '63-'66, I have a growing collection of CDs by many of the UK groups which did not gain popularity in the US. I believe Dave Berry should have. He was as good as, if not better than, many other male vocalists of the time."
5,relevant to continued existence,"the is the only place where the layman can hear the full truth about the impending carastrophe. i for one will expose everyone i can to this film and i beg others to do the same.its obviously too late, but we must try."
2,Big disappointment,"Too much text and too many pictures, not much information that you would not find in most PB books. Part tutorial, part reference, and part practical guide, but nothing special as a whole."
2,Not impressed,"I agree with Mr. Boyes. Having borrowed a copy of this book, I count myself fortunate I didn't pay for it. It is a basic tutorial for novices, without a clue on ""where do we go from here?"". The technical information appears to be a regurgitation of machanics availble from many other sources. Nothing new here...a basic anthology of known methods. I seriously wonder how many of these reviews were written by the author himself?"
5,Very Helpful,"The Definitive DataWindow by Richard Brooks has been very helpful to me. Recently I have been assigned to learn the application and without the opportunity to take classes I found it very challenging. Rik's book has been incredibly helpful to me. It gave me basic concepts and it provided me with detailed instructions on how to execute each command. Not only that, but Rik answers my questions online! He and his book have been very helpful and I look forward to an advaced book."
1,&1.50 was too much to pay for this,I saw this author present at tech wave on this same subject and he was incompetent and totally disorganized. I had hoped he was just having an off day but having picked up this book at a second hand book store I now know that he really is! This book is as poorly put together and thought out as his class was. The material is disorganized and when you find what you are looking for it is incomplete. I think these other reviewers are either friends of the author or work for the publisher because the $1.50 I paid for this book was too much! I sure hope Richard programs better than he writes!
2,Disappointed!,"The book is good if your first starting to learn PowerBuilder, or programming for that matter, but not if you have used PowerBuilder or are a PowerBuilder Developer. Too much of the book is dedicated to how to use the DataWindow painter and what the various controls are and not how to exploit the datawindow itself, the functions, datastores or templates.Entirely too much of the book focuses on normalization and database design....enough already...I wanted DataWindow 'Meat and Potatoes' and got a leftover 'tv dinner' instead!VERY DISAPPOINTED!Can I have my money back?"
1,The book's title is a lie.,"This is a terrible little book. The only good thing about it is the front cover (and that it is mercifully short). This book has little to do with Zen. The majority of the quotes are by people who are not Buddhists or Taoists of any stripe. The quotes themsleves have almost nothing to do with Zen. The quotes tend to be taken out of context and are much too short. The overall effect is to make great thinkers sound like followers of New Age mee krob (that's a South Park reference). The only purpose of this book is to make guests in your home think, ""Oh look, they have a nice pretty little book about Zen. They must be intelligent, enlightened people."" That only works if they don't actually open the book."
1,"typos, typos, typos","This book represents one of the poorest editing jobs I've ever seen. The number of typos, images that don't match content, and outright errors make this book a pain to read. While there is useful info throughout, the poor editing quality is distracting."
1,Awful !!! Thank God I can eat normal food,"I have been reading about the benefits of a gluten free diet recently and saw the Bob's cookie mix on the shelf and gave it a try...As usual I ate a little dough in the mixing process and the taste had me pessimistic .. but what the hay .. let's try it.. Well...They were dry and cooked up very strangely but were cookie-like nonetheless. So down the hatch and the taste and consistency was AWFUL !.. Lesson.. !! If you want to be healthy, eat a piece of fruit! - and have real cookie once in while in moderation.. If you have a gluten problem..eat something else..I am trying to think of how much beer I would have to drink to think these taste good.. a 12 pack at least ! I am serious."
1,worst gluten-free cookies,"I am a cookie lover so was really excited when I found a cookie I could eat! However, the prepared dough from this mix smelled really bad. I didn't even lick the bowl like I usually do. I hoped that the cookies would be good after being baked, but boy was I wrong. They were so bad I couldn't even eat a whole cookie, honestly! If you gluten-free folks haven't yet found the perfect gluten-free cookie, check out the line of cookie mixes from Colie's Cookies ([...]). It's a new business and the products are only available online. I tried the sample pack consisting of 6 different flavors.. and all 6 were super yummy! Even my non-gluten-free friends and family said they were EXCELLENT and couldn't taste the ""gluten-free"" aspect! If you haven't yet tried them, you are in for a real treat!"
2,weird taste,"At first I thoughts it tasted like soy flour was used as it had a similar smell; however, it is garbanzo bean flour???????????? This is the first miss for Bob's. I won't reorder."
5,Yummy,"Such a super tasting cookie! This is a very delicious cookie, just don't over cook it and it is perfectly sweetened!"
2,Don't waste your money!,"I made these cookies today for my daughter who has a gluten allergy and the rest of my family. The kids were so excited to try these and boy...were we disappointed! The substitute for flour in this mixture is garbanzo bean flour. Really? There are so many flour alternatives on the market and they put beans in this recipe. And the dough really does have a bean aftertaste. It starts off sweet and then the lasting effect is garbazo beans. Not what I want in a cookie. To make them better, we added more vanilla and then rolled the cookie dough in sugar. It was the only way to cut the bean flavoring. Also I think they only add 25 chips so be sure and add more to your own recipe. Betty Crocker's gluten free version is so much better!"
3,Gluten free choc chip cookies,"My son was recently diagnosed with Celiac disease. So now were on a quest to find good alternatives to wheat products. A hard job at that. Just baked these cookies today. Be warned DO NOT TASTE THE DOUGH. It tastes awful. Also, do not bake these cookies to be soft. They need to be baked through. You'll understand if you taste the dough. He's nine he'll eat just about anything if it's sweet. I will be trying other brands in the future with 5 stars and better comments."
5,So yummy and so easy!!,"My son is allergic to wheat, dairy, eggs, soy, rice, and oats (plus more). It is nearly impossible to find cookies he can eat as almost all wheat free cookie recipes call for rice flour or oats. We were hesitant to try these because the Bob's wheat free brownies are pretty bad, but I'm SO glad we did! These were delicious and free of all of my son's allergens (the chocolate chips contain soy lecithin but his allergist said that does not contain enough soy protein to cause a reaction)! Not to mention so easy to make! It has directions for substituting the egg right on the package, and we used Earth Balance Soy Free Buttery Spread instead of butter. I did have to cook them for about 21 minutes instead of just 15 as the package states, but they outside is nice and crisp while the middles are still soft and delicious. I will definitely be buying this mix again!!"
3,OK if you don't mind the bean-flavor,"These cookies are easy to make, and maintain a nice shape during baking. However, the flavor is not so great. Gluten-free baking has come a long way in the last few years, and you can find good recipes and mixes that don't involve bean flours. The bean flour flavor is pervasive and lingers in your mouth long after you eat the cookie. Since we gluten-free eaters are sometimes desperate for baked goods, we tend to overlook slightly off flavors, but this was too much for me. I will not buy the mix again."
5,"Chocolate chip cookies, sans chips","This is a great cookie mix. I have not found a better tasting glutin free cookie mix. Unfortunately, I don't like chocolate chip cookies, so I sift out the chocolate chips and cook my cookies without the chips. They are great.If I knew which Bob's mix was the same w/o the chips, I would buy it instead."
5,Nothing Better,"Agreed. These cookies are amazing. When my non-gluten-free friends come over they ask if we can make these cookies. Plus the fact that they require only 2 ingredients, these cookies are the only ones I will make at my house!"
2,weird after taste,After finding out that my girlfriend needed to eat gluten free we went on a search for a good chocolate chip mix. At first they have a good taste but moments later they leave a weird after taste. This is the first Bobs product I can't recommend. I guess I will just make them from scratch unless I can or someone recommend a brand to me...
2,Looks can be deceiving,"I also had one of those metallic tasting cookie experiences. The dough was a little nasty, but even after baking, they tasted off. You get the ""maybe this is going to make me sick/be bad for me"" feeling that generally accompanies food on its way gone bad. What is that metallic taste?!"
1,Not worth the money,"Unfortunately these chocolate chip cookies were a huge disappointment. The dough does not hold together very well and the taste is overwhelmingly ""ricey"". We won't be buying this mix again."
5,weber 426001,wonderful just what we ordered delivery was great can not wait to use it my hubby does not like to grill in any temp below fourty degrees
5,Great product,"Typical Weber, very good quality, I've had the Genesis for years, I use a Q220 for tailgating and now have purchased this. Great product."
5,great grill,"This grill was easy to put together and it took about 45 minutes. It heats up quickly and lights with a push of a button every time so far, I've had others that were hard to light and had to use a lighter every time. This is perfect for a single person or small family."
5,Weber Q300 Gas Grill,"I bought the grill to replace a larger Weber that came with my husband. I love the grill - it was easy to assemble, its size is perfect for our patio, and I like having two burners. It's everything I expected from a Weber.The only negative I have is that I managed to grab the front of the hot grill rather than the handle. It was a stupid error, but it has certainly made me more cautious about using the handle.There are no ""deals"" on this model because it is fairly new. But Amazon had a free shipping offer, so I feel like I got a bargain. And the grill arrived 48 hours later!"
5,Everyone was right,We've been too busy grilling to post a review.My husband is totally impressed by the quick & even heating and one-click start. I was looking for a smaller profile (have you seen the SIZE of some of these grills???) and non-stainless steel as I've heard they're a pain to clean.We're very pleased and would buy this again in a heartbeat.
4,Weber barbecue,The unit is very stylish and works well. Some parts are ordinary steel like the hinge rods and will rust with time but is almost impossible to find an all stainless barbecue without paying over a $1000 dollars.Mike
5,Delightful product,"This gas grill is delightful. I am horribly mechanically-disfunctional and I put this grill together.Wow! There are 2 of us now and the grill is just the right size, flames- up on a dime, is easier to clean the other models,and is small enough to fit in a corner out of the way. The grill itself gives all the food a marvelous ""gourmet"" char. I love it and have tried many new recipes and with great success."
5,Great Grill,"When I first looked at this grill, I thought that this grill would be too small because it looked so much smaller than the Webers with the large base cabinets. What I have realized is that the cooktop surface area is well proportioned and that the grill holds a lot of food. The cast iron grates leave wonderful line marks in the food and that not much falls through the grates.although the base holding the grill is not fancy, what the base lacks in the WOW factor, the quality of the grill makes up for it. For the price to have stainless steel componenets and cast iron grates, I feel I did very well for the $$Happy grilling to all who read this post!"
4,Great product // Very easy to install,"I have bought this product 1 month ago and I have to say, it is just perfect for my need.It is my first bbq, so without any other experience I cain't compare it to others.I really appreciate the way we can cook the meat , with 2 different pipe (external or center).I recommand it."
5,Great,We have this grill for more than a month now and we love it. It's a great grill for a small patio.
5,Wow! What a BBQ,"I have had the WeberQ 300 for a couple of months and I love it. I debated about getting this product because it is pricey. Now that I have it, it is well worth it. I have a small patio and the unit fits nicely. It was super easy to put together. Even though most of the unit is plastic, it is very sturdy. It has more BTU's than I will ever need. In fact, it has taken some adjustment getting the temperature low enough to avoid burning. I live in Southern California so use my BBQ several times a week all year long. I am looking forward to a long relationship with this grill. Highly recommended!"
5,Best of the best.,"The Weber Q Series is a great series of grills. I had the Q200 and loved it for the RV and camping. When my old grill passed away I immeditarely decided to order the Q300 for the home. It is even greater with the two burners. The porcelain coated cast iron grill is so easy to clean and the heat is so even. The price is a little high, but the quality and performance are certainly there and Amazon's price was the lowest with the free shipping. The only downside was the wheels were left out of the box. Weber got those to me very quickly and registered the grill over the phone. I am very happy with the grill, cover and drip pans."
4,Light and Simple,"Received the grill by 2 day shipping today. Took about 45 min to put it together by myself. Hooked it up and cooked dinner on it. Heats up to 550 F in 10 minutes just as the manual says. It's slightly misleading that it says portable, when they really just mean, it's easy to move around your back deck/yard. The steak and asparagus were perfectly cooked. I'm slightly skeptical that all of the plastic parts will pass the test of time but for now I'm pleased."
3,Beware of fires,The shape of the grill has a tendancy to trap grease. Last week we got to experience having the fire department put our grill out. Be careful and do not place on a deck.
3,BWG,"Grill is nice, had problem with burners clogging up, also grates are very hard to clean and keep from sticking even when wiped down with oil before use. Would not purchase this grill again."
5,Weber Q 300 BBQ,"Box beat up from shipping,but very well packed-no harm done! Took about 45 minutes to assemble. The igniter didn't work,but a call to Weber customer service had a new one on the way--recieved new igniter about 1 week later,now I have the BEST BBQ I've ever owned!!! Get the Weber cover,fits great,keeps bugs and debris out of it very well A++++++"
4,good little grill!,"Cooks like a champ,perfect for single guy,like me.Impressed by the even heating,unlike cheap grills...I'm smelling a faint gas odor when I cut on the tank,but have't taken time to track it down,yet.Also,only starts on the small burner,not the large as instructed...oh,well...used it about 10 times,with great results."
4,Weber Q 300 grill,The unit was dropped off at our doorstep by UPS with the package obviously damaged as it had been dropped somehow and the corner crushed. We opened the box to inspect and found that part of the handle had been broken. We called AMAZON and they arranged for a pick-up by UPS but we had to repack and re tape the box WHAT A PAIN ! Amazon did reship and we got the replacement unit a few days later ..opretty easy to assemble
3,I bought the E-310 instead,"This grill may be suitable for one person, a couple or small family. It will handle basic grilling well for a while. I decided to go with the Genesis E-310 instead. Why? The warranty for this grill's plastic parts and aluminum shell is only 5 years and 2 years for its paint. And the rest of the parts 2 years. Because there are no flavorizer bars covering the stainless steel burners they only have the 2 year warranty.The Genesis had a 10 year warranty on its burners. It has 25 years warranty on the cast aluminum and porcelain-enamel shroud. Also the Genesis allows a rotisserie to be added. Indirect heating is a bonus with 3 controlled burners too. That was enough for me. However, if you don't do a lot of grilling the Q300 may be just what you are looking for on your condo's small balcony. It all comes down to the function and necessity. I hope I have helped someone."
3,"Serious, are you really?","And now a review from the Gurrrlz. **UPDATE*08/2011*** Im docking 2 stars from my first review, as you should not have to offer fixes for this. Portable, if you mean around your yard, ok, I wouldnt take this to the park or beach. Porcelan coated grates, I have my doubts. A rotisserie- not even. Beer can chicken youll have to play with. Smoking roasts, and chicken thats on you to figure out. If you wanted a sophisticated BBQ this aint it, if you just want to cook steaks, burgers, sausages, pre-cooked ribs and chicken, and roast veggies, this is a perfect BBQ. For this ammount of money I would have expected more, but this is what I bought, so I have learned to live with it. So for everything this BBQ lacks, its back to my charcoal Weber."
3,Don't be shocked,"Okay I admit I haven't used this grill yet but I do want to let everyone who is considering this purchase know that other than the parts that ABSOLUTELY have to be metal this grill is ALL PLASTIC. I am replacing a ten year old metal and wood Weber (which now by my own admission I probably should have tried to fix!). I fear for the safety of this grill in a strong wind storm due to how light it is! Oh well, maybe my neighbors will enjoy it!"
2,A grill with no racks and one burner? COME ON!,"First off there are no racks in the grill, so you have to heat up buns on the grill itself? Then are you going to cook everything at the same temperature? No place else to put kabobs and corn except on the grilling surface. If you are cooking a lot ofone thing it is great. Not so great if you're cooking for a family with different needs and wants."
4,Review of the Grill,"The grill that I purchased is fantastic. It was easy to assemble, it cooks evenly, it is easy to opperate, and the style hides the unattractive propane tank, so it is asthetically pleasing. It did arrive, however, with a small plastic piece broken off of it. This may have been the result of careless shipping or faulty merchandise. From my experience with delivery packages, I would confirm it was due to carless shipping."
1,Non-existent Customer support,"I bought this for $30 and less than a week later, I see it is $24. I can definitely see why they dropped the price. I have sent several questions to Tech Service with no response. I sent a question to Sales and got a single line response and a FAX form to upgrade for $49. The electronic help is rudimentary at best. The program is a few versions old and has many bugs. I would not recommend this to anyone. They do not list a phone number for support and did not respond to my request for one. They used to win awards for a good product but this seems to have stopped around 2007. I think they are just milking it for suckers like me."
1,Peter's Rabbit Maintenance Formula,"Neither one of my rabbits like this food! I didn't even care for the way it smelled! If rabbits do not like the way something smells , they will not eat it!!!!!"
5,great for pain,"I was having serve pain in my right hip and was told I had degeneation in the spin causing the hip to become painful climing stairs and sometimes walking. I started the MSM and within a few days, it was as if nothing was there. I could walk and climb the stairs with almost no problem."
4,outstanding lyrics and rhythms!!,A very pleasant surprise for those new to African salsa...very well known band from Senegal and popular in the New York City latin salsa clubs. These guys will make you want to get dancing and moving to smooth salsa beats!!
4,Worked fine for me,"They shipped as expected. I ordered 2 coils for my old 1969 Johnson 25. My old ones did not check out with the ohms meter. These were a good replacement. Fit fine. Just had a little difference where the plug wire goes into the receiver on the coil. Didn't affect the results at all. So far, a good product for a decent price. AND, my motor runs like new."
3,PRO-CYCLE TACHOMETER,"ITEM WAS RECEIVED IN A TIMELY FASHION, COMMUNICATIONS WAS GREAT, PROBLEM IN DELIVERY BUT SITUATION WAS CORRECTED. AUTOMETER TACHOMETER IS VERY DURABLE AND LOOKS GREAT WITH THE COBALT BLUE BACKLIGHT"
2,Dog allergy,I gave this to my 70lb dog twice a day for two weeks and it did not stop itching. Not sure if it helps humans but definitely did not help my dog.
5,I use this for my cat.,I just started using this for one of my cats who has really bad allergies. I have been spending lots of money on vet visits and all they seem to do is prescribe antibiotics even after telling them about all of the sneezing she does. She just got done with zithromax after 3 weeks and she still sneezes and seems to have a lot of phlegm that she coughs up and swallows. I found this on Amazon and started using it. I had a syringe left over from when I have her antibiotics and I just cut half of the pill and crush it up and mix it with water. She seems to tolerate it well. I have only used it one day so far. We'll see how it works. I will update this with her progress.
1,Heed Side Effects Warnings!,"This medication did absolutely nothing for my dog's allergies and skin itchiness/inflammation but did give him dry mouth and diarrhea. He's a 58-lb pitbull and I gave him two 4mg tablets at night (I was worried about lethargy so I opted for a bedtime dosage). He didn't poop at all the next day, and didn't poop (or drop a puddle, frankly) until the following evening (that's TWO DAYS!). He also whined and cried and was often sitting in the ""sphinx"" position (indicating his cramping and discomfort) and he drank more water than his usual intake. I basically had to let him out every hour or so. Obviously I stopped after 2 days of the medication and the diarrhea stopped in about 18 hours or so.In all fairness, the side effects are clearly listed, I just want to encourage other pet owners to take them seriously. Now we're on a soap-free veterinarian-prescribed shampoo and good old-fashioned Benadryl."
3,Works for the most part,"This seems to help our dog's allergys, but not completely make them go away. Maybe her allergies are just worst then most."
3,works ight,"not the best but worth the price! only last for a hour or 2, got it for my dog- helps a bit"
4,It works.,I have tried other products but they did not do much if any for my dog. I can see the difference in his behavor.
4,Allergy relief for Irish Wolfhound,"A friend recommended this medication for dogs with allergies. It has calmed our Irish Wolfhound and saved his skin - thanks! But I was surprised to see it advertised as a dog med and the bottle was a people med.???Anyway, it worked without $100's in tests. Great!"
5,ggreat,Great product! My dog had really bad hives and they cleared up quickly. Nothing else worked. Quick delivery and the price is right!
4,Best allergy relief for my dog!,"My dog has terrible allergies, especially in the Spring. When she broke out with the hives, the vet gave me antibiotics and Chlorpheniramine 4mg tablets. She seems to respond to this antihistimine better than any of the others I've tried. 20 tablets cost me around $15 from the vet. I found them here, and 100 tablets cost me just over $8 delivered. OH HAPPY DAY! I received my order within a few days, boxed, and in a tamper proof bottle. If you're having trouble finding relief for your dog, I recommend trying these pills. 1 tablet twice a day for my 40lb dog. Also, I just received another product that has been highly recommended by a local dog rescue to help dogs with allergies...The Missing Link Canine/Feline Well Blend. They were singing its praises, so I'm jumping on board! Hope this helps, and good luck!"
