class_index,review_title,review_text
4,Passed Parts,"Even though I'm 10 years old I actually read this book I think that the book skipped some parts in the actual game.Also,it's different."
1,Awfull Manga based on a great game.,"First of all, this manga is NO GOOD, IT'S AWFULL!!! Before I read the book, I thought this book was going to follow the story from the game. Instead, it is rushed, the battle scenes are not detailed, and the plot is no good (Since it seems a lot of the story is missing). Although the art is good, it is MUCH better to play the game than reading this book."
3,NIN is terrible...,Gravity Kills doesn't sound like that horrible band that Trent Reznor created. The only thing that they have in common is they use effects in the music. I've heard this Gravity Kills album and the first one but haven't heard the second one (so I can't comment on that albums similarites to NIN) but both were good rock CDs. This CD isn't amazing and doesn't break any new ground or anything but at least its an enjoyable sound that I revisit every now and then. This is basically a decent CD for when you want something new to listen to.
4,Good follow up to two great albums,"If you like NIN, then you will like this and is worth getting. The cover of Personal Jesus is great and the rest of the album is a good mix of metal and industrial rock. I feel that the first two albums, which are by far the better of the three, came out too soon. The style of music they offer is much more relevant today than when they first came out. This is also a nice change from some of the music being offered today which sounds too much alike."
5,The Ease of Being is always new,"The really wonderful thing about this book is that it is seemingly ""new"" each time you pick it up. A line or paragraph that touched you in one manner at one time will inspire a completely new experience on a second or third read at a later date. Jump in anywhere and you haven't missed anything; it's non-sequential, just like the present moment. Every sentence carries the charge of the entire teaching. Highly recommended."
1,don't let the photo fool you!,"i have no idea why they have a photo of a 'buffy the vampire slayer' vampire on this item, it is NOT at all like the one shown in the picture. i have no use for it, as i wanted the one that is advertised in the photo online. don't order this item, because even if they let you return it, YOU have to pay the shipping and handling both ways even though they are falsely advertising it!"
3,Fun craft item,"The fabric rainbow dye kit came on time, and my grandaughter loved it but has not used it yet. I like that the dye is sprayed on rather than added to the washing machine."
4,RENEWING THE FAITH,"LIFE IS WORTH LIVING BY BISHOP FULTON SHEEN IS A COLLECTION OF 24 SHORTBUT DYNAMIC TALKS BY THIS UNIQUE SAINT OF THE CATHOLIC CHURCH WHO PREACHED ON TV DURING THE SIXTIES AND SEVENTIES...BISHOP SHEEN HAS ANEXTRAORDINARY ABILITY TO TAKE THE MOST DIFFICULT CONCEPTS AND SIMPLIFYTHOSE IDEAS INTO UNDERSTANDING AND HOPE.TOO BAD THIS IS NOT ON VIDEO AS IT WOULD BE EXCEPTIONAL FOR ANYONE TO WATCH..HOWEVER, QUIET LISTENINGWILL PRODUCE QUIET PEACE IN A TROUBLED WORLD."
1,Life is Worth Living,"I never received this product. It was something that I was very interested in reading on my Kindle Fire, but it never showed up either on the Kindle or regular snail mail. I am not sure what happened."
3,Cleans well; bottles leak.,"We purchased a 2-pack of these cleaners to clean the bathrooms at work. They were a reasonable price so we decided to give them a try. When they arrived, one or both of the bottles had leaked quite a bit and soaked everything in the box. I mopped things up, screwed the lids on tight, and used them anyway. This product does a fine job cleaning and the smell is fine, but the bottles continue to leak slightly when used. This can get annoying when you start to have cleaner running down your arm."
3,Dispenser top too big,Dispenser top was a bit too big - you're better off using the free one's from the pharmacy.
2,not good,This bra is extremely uncomfortable and doesn't give good support. I will not buy it again. Bali bras that I have worn in the past have been uch better.
5,Comfortable,I love this bra. It is very comfortable and fits well. The sizing options were very helpful when looking for a bra. Thank you.
3,Bali Women's Double Support Cotton Stretch Wire-Free Bra,"At first not very comfortable, but after a while feels ok. Straps are always showing out. Otherwise it's good for the price."
3,"A good bra, but slight problems.","The bra came on the date that was set. It's a pretty bra, but I think they sacrificed some comfort for aesthetic appeal. I don't recommend this bra to those with sensitive skin, it can get itchy.Overall, I'm happy with this bra. It's a great fit."
3,"Worth a try, but not for me.....","I am constantly looking for a comfortable bra for work. I am full-figured (40DD), and want something that doesn't poke me, yet provides support. This bra didn't poke me BUT I was ""adjusting"" all day. I found that I had bulging under the arm area, and it just didn't fit right.On the other hand, it is very well made, and the fabric is quite soft. It might work well for a smaller woman."
3,comfort bra,"This bra is just a little too tight. The cup size is true, but the band is tight. I am a 36B, I had to put it on the end closure and it doesn't stretch throughout the day. I guess that's good but it becomes uncomfortable the longer you wear it. If there was just a little more room in the band I would be happy with it. I was afraid to go up a band size because the cups would have been too loose.Update: I decided to try again. I ordered this bra in a size 38B. It fits goood after washing and drying it in the dryer. So if you order it make sure to order up a band size."
5,Great cotton bra,"The white bra has more cotton than the grey bra, but either way it's comfortable. I wear them daily for chores and working out. It's not good for under sweaters, because they don't hide protruding nipples. Just don't wash them with towels, or the lint will come between the two layers of bra cup. I especially like the machine wash and dry aspect."
1,Never arrived after 2 months!,I was eager to recieve it but after 2 calls to Amazon Customer Service it never arrived. Full refund of course!
3,Good basic underpiece,"This arrived appropriately packaged and is an attractive, all-around, every day piece of underwear. Good support, no excessive bouncing about, and no ""pain points"" like you find with many underwired bras.Bali Women's Double Support Cotton Stretch Wire-Free Bra #3036"
2,Not terrific just ok,"comfort is compromised by the inner band ---in front it is a scratchy bare rubbery substance . the support is lacking due to the overall stretchiness on cup fabric, but helps if you need more room than a DD---still looking for that 4D support that doesn't look like it came from Boise Girder and Truss!"
2,Cheaply made,"I was trying to find bras that were wireless yet comfortable and supportive. These are not that at all. They don't support larger breasts. They shrink and bind upon washing. The plastic adjusters they put on the straps broke after the first wash. These are terribly cheap made bras. I will now only buy more expensive, quality made bras I can try on first and see how they are constructed."
2,Not very pleased,I was not very pleased. This bra is so uncomfortable it feels to small yet it is the same size I always wear. I will never buy bra's from the internet again.
2,Thin layer of cloth..no support,"I am disappointed wit this bra. I ordered Bali before and loved another style so I gave this one a try since it has great reviews on here. I tried it on right away after i got it in the mail. It was very comfy, BUT no pad or support at all (I am not a big girl with size 36C). They are just like a thin layer of cloth and what make them unacceptable for me is that my nipples were poking out. I can see them though my t shirt and this is summer, not even cold out. I sent them back right away. If you are more than 36C, this may not be a good bra for you."
1,doesn't fit,Cup is sized strange and all the straps are too tight.It is much too thickI don't like it
1,Elastic too rough,"I'm sensitive to any type of nylon threads or fabrics in my bras. They scratch and make me itch like crazy. But 100% cotton bras are hard to find, because too many places don't take into account the elastic or seam support that may have a low cotton content. So I've been trying a lot of different bras hoping to find one that uses materials in their construction that don't bother me.This one didn't work. It looks and feel like it's well made, but the elastic around the edges is horribly rough. The ends of the weave on the elastic are looped back into the material in a wide loop, leaving thousands of small, stiff loops on the outer edges to rub against my skin. But not only were the edges rough, the flat part of the elastic is very rough as well and feels like harsh woven nylon.The shoulder straps and elastic edging were like sandpaper. I couldn't even wear it for five minutes."
5,I love these!,"I'm on a 34C--the smallest size you can get in these--but I have narrow, skinny, shoulders and have always had trouble getting straps to stay up. I've actually spent most of my life wearing racerback or cross-strapped equestrienne bras to get around this. Not any more! Now I can wear normal bras that don't further flatten what little I have, and I don't have to worry about the straps falling! I haven't had any trouble with the band riding up, and since these are full-coverage, nothing pops out of the tops, either. Hands-down, my favorite bras ever."
5,comfortable fit,Perfect comfort and easy to wear on a daily basis. straps do not fall down and the cotton no wire bra can be used for everyday or as a sports bra.
3,Didn't Fit,"It's not their fault. This item did not fit me properly. As any woman knows, finding a bra that fits properly is a task, so it was a stretch that I could order one online and find one that fits. I ordered the size I usually wair from other manufacturers, but as usual, manufacturers sizes vary. Sorry it didn't work out. Now I know I really need to go in person to buy like I always have before."
3,Not received,I have not received shipment yet so I am unable to review. The brand is good so hopefully the product will be also
3,a bit itchy,the fit of this bra was a bit awkward. the edges rub against your skin causing discomfort. they went back.
1,Bali bra too tight,I have been wearing the same size bra for about thirty years so I thought it safe to order the Bali bra size 34D. I was shocked at how constricting the sides were while the cup size fit. Let me explain that I am a very petite woman. Most women as small boned as me don't wear a 34D! So that is why I was shocked at how tight the bra is. I purchased a two inch extender at Walmart which helped and I am planning to purchase a second two inch extender. No point in feeling like Scarlett O'Hara. I recently heard that wearing bras can cause breast cancer because they constrict the lymph glands in the breast. Being a three year breast cancer survivor I now feel good about wearing my old bras that are loose. I have bought Bali bras in department stores in the past and they have been great but the one I purchased on amazon.com did not fit.
4,Bra good fit,This bra had a very good fit. I always wear Bali as it fits well. I would absolutely buy again
3,Sizing seems off,"Haven't quite figured this out, but the proportions aren't to standard and when I adjusted the straps, whole bra rode weirdly high. Not easy to manage the many hooks in the back. Awkward design?"
4,Excellent bra but cup size was an issue,"I love Balis cotton bras. They are the only bras I can wear with my sensitive skin and not have skin issues. Unfortunatly i have gained weight this past few years and I needed a bigger size. Bali does not really have ""plus size"" bras. 42DD is the largest and it isn't any bigger than the 42D I was wearing. So in that respect I was dissappointed as I got a good bra but still can't wear it. Hoping to lose weight and get back into these."
5,The perfect wirefree bra,"Excellent support even for a C cup, absolute comfort, soft cotton, pleasant shade of gray (doesn't get the grungy look of white that's been exercised in and washed a zillion times) . . . I like it so much I wear this style every day."
1,Terrible Construction....,"Just plain bad fabrication. Unacceptably scratchy and rough, the ribbon straps fold in two where they attach to the rings at the top of the cups. There is no way to straighten them out to lie flat, so they bulge out under T-Shits.Also, there is so little material under the cups to form a band which would support the breasts, that the bra justs cuts you off there, again, causing bulging (and sagging). The Bali Women's Double Support Cotton Stretch Wire-Free Bra #3036 looks nothing like the picture when you get it on; what tiny bit of fabric constitutes the band is immediately swallowed up by the large breasts it purports to support. The only wire-free bra for larger women that has a substantial support band is theGoddess Women's Alice Soft Cup Bra, which I discovered in a bra-buying binge this summer.Finally, Bali Women's Double Support Cotton Stretch Wire-Free Bra runs large. I wear anywhere from 40DDD - 42DD in other bras. In this, I wear a 40D."
1,Not the same bra as it used to be...,"OMG this bra is so ITCHY, it's ridiculous. It rides up in the front, no matter what position the back hooks or the front straps are. Bali has changed this bra - it used to be great. Very disappointed."
3,cotton bra,"very comfortable, for the most part, but the lace along the rib cage is just a little scratchy... washing improves softness. Altogether a very worthwhile bra."
2,Fabric tore after several months,"This is a very comfortable bra. However, after I wore it for a couple of months the cotton fabric above the cup ripped on one side. I'm disappointed that it fell apart that quickly."
3,ok,This bra is just ok for me. The grips that are built in the bra are a little uncomfortable for me.
5,Very Comfortable,Fits well. Hardly feels it. Straps stay in place and do not affect pressure points. Maintains it shape and color after repeated washes. Think I will buy some more.
1,NOT HAPPY WITH MYSELF OR THE BRA!,"It is my own fault, I see, that my bras were an unpleasant surprise. I saw the same number that was on my former bras and hurriedly ordered them. The new ones were a soft knitted fabric in an ugly grey, not like the ones I have worn for years. Why not assign a different number to one that is so different? Bummer! I lost my postage for both ways. The picture looks like my white Bali 3036."
3,Smaller than stated size,This brand is tight for the size I ordered. I don't know if Bali runs smaller sizing as some companies seems to do. That practice seems backward to me. Any way this brand should be ordered a size larger in band size then you are looking for.
5,DC sneakers,These shoes were great. I gave them to my son for his birthday and he loved them. They are a good quality and look as if they will last longer than other sneakers he has worn.
4,DC Quality and design,"The expected quality from a DC shoe.Resistant, durable and with ""that"" design that we know."
4,Fascinating,"This was far more interesting than I expected it to be. I love that it seems to be one of the very first cookbooks where they found it necessary to actually tell you how much of what to use and gave standardized measurements, of sorts.Excellent information about beef and fish and other ingredients and a wonderful bit of insight into history. Some of the recipes would be fun to try even now, which I didn't expect. The section on how to equip a kitchen was fun to read as well.If you're into old cookbooks or just like reading about food and they type of things they used in their kitchens back then, well worth the free download!"
2,Ho hum...Where's Plum?,"This was my first Evanovich novel, and I am wondering why so many people rave on and on. Based on other reviews, I can see that I need to try again, possibly with a Stephanie Plum book. Full House is shallow, mindless, and only occasionally fun. Most of the novel's plot seemed paper thin and too ridiculous to be enjoyable.I read most of this by the pool, and my suggestion is that's where it's best enjoyed. Otherwise, just don't even bother. If you want a quick romance, try the Red Dress Ink series."
3,Dissapointed,"After reading the Stephanie Plum series, I was really dissapointed in the supposedly re-vamped and re-issue of Full House. At first it seemed pretty interesting, but suddenly turned sour. Boring, no real thrill. Plot is the same ole thing. Boy meets girl, girl not interested then boy sweeps her off her feet. I was in the middle of the book and skipped to the last chapter and that seemed to be a little more exciting. Maybe that was the re-write portion."
1,"Bland romance, little mystery","Major disappointment. This book is neither a good romance nor a good anything else. I'm a big fan of the Stephanie Plum books but cannot recommend this book. Wait for the next ""plum"" instead."
3,ehhh...,"It was alright. Not great. It was a cute story, not in any way believable though. And whoever else said the editing was bad was dead on. The names kept changing on you. And just at a ""critical"" moment is when they changed Nick's name to Neil. VERY distracting! I'm wondering when in the world she hopped into bed with Neil, since Nick was just there a moment ago. And the whole Joel/Joey thing was bad. They also changed her minivan to a station wagon at one point. I've never read any of the Stephanie Plum series because mysteries aren't really my thing, but if this was any indication of her work I think I'd pass.I'm now reading ""Full Tilt"", the sequel to this story, and the editing is almost as bad in it.I'm not giving a recap of the plot since I'm sure you've already determined what it's about, but I'll tell you to save your money on this one. If you INSIST on reading it though, pick it up at the library!"
2,Not the best,"Was a little disappointed being that the Stephanie Plum series is such a great read. This book was pretty predictable, and often somewhat hokey. I can't believe they're going to make this into a series...a series of what?? Please please, I hope that by the next book in this series they will have come up with a more 'adult', convincing plot. Maybe Janet E. shouldn't have teamed up with someone?"
1,Full House,"I picked up this book at the airport, trusting it would be similar to her mysteries, although I understood it to be part of her earlier romance attempts. I was very surprised at the amateur level of the writing. The plots were very thin, and the characters had little of the endearing qualitites I love in her mysteries. Stick with the mysteries!"
2,A Dud,"Like many other readers, I bought this because I enjoy the Plum series. If I had the talent of Janet Evanovich, I would have kept this one buried. It is not funny, but it is trite. Save your money."
1,Life is too short and I am too old . . .,"Like many others, I purchased this book based on the fact that I enjoy the Stephanie Plum books . . . let's face it, they are not literature, they are a fun read and allow me to escape for a few hours on a weekend. Full House on the other hand was a waste of time . . .Did others wonder, as I did, what could have persuaded Evanovich to agree to the rewrite and the republishing of this book? I finally skipped to the last two pages and then put the book in the bag for the charity book sale at work (for 25cents --- it's not a bad buy at that price!)Hopefully Evanovich visits this page and reads these reviews . . ."
2,Thank goodness she's evolved!,"I love Janet's books and characters, and while this book has some interesting characters; the dialogue, plot, and character development leave a lot to be desired. I read it in a day, so at least I didn't throw it in the trash! The romance in the Plum series is better than this earlier ""romance"" novel. It's not a believable piece of work. I did laugh out loud once, so there is a hint of the Janet that evolved into the writer we know and love. We all have to start somewhere."
2,I wish I hadn't bought it.,"I'm a long time fan of Evanovich and I've read one of her romance novels before. It wasn't bad, so I grabbed Full House as soon as I saw it.It was pretty dire.I don't know what happened but it was like a reflection in a fun house mirror; all the elements of the Plum series were there but distorted.It probably didn't help that the heroine was 38 with two kids. So am I and reality kept creeping in. Where's the millionaire who's mad for me because I can bake cookies?The secondary characters were oddball, yes, but not in the least bit interesting. The spark between the two main characters wasn't there. Ranger had me drooling, this hero couldn't do that if I were biting into a lemon as I read.And the villain? Can we spell 'obvious'?I really felt cheated of my money. I should have got it from the library."
2,"okay for a ""happily, everafter""","this was a usual, handsome couple. one of which is always wealthy, meet, love, misundertanding, makeup. I think she can do better."
1,not good,"This book is just an ikky romance novel. If you don't enjoy ikky romance novels, don't buy it!"
3,Some readers are a little harsh....,"I read ALOT of books, different types of writing, and I guess forsome people this wasnt the best thing Evanovich has done but I read the reviews before I read the book and I think people were a little harsh in their reviews. It was like Plum with the crazy characters, and I LOVE Stephanie, but sometimes I think the Plum series is a little too ""clipped""- this had more detail, so it was just different but not necessarily bad. I enjoyed the quirky characters and it made me laugh. Sometimes thats all I need from a book. I noticed mistakes in the book too, and I agree the editingcould be done a little better, but that is nothing new, ive come across that with other books too. Anyway, I had to say, give the book a try, you might find that you enjoy it. Ill definitely read the next book, while waiting anxiously for the new Plum book!"
3,"Not Plum, but an easy, enjoyable read","I am the typical Evanovich fan. I will read practically anything with her name on it and so I wanted to try some of her older stuff. This definitely was not a ""Plum"" novel, but it was a lighthearted, easy read. I didn't find myself laughing out loud very much as I sometimes laugh to tears at Stephanie's escapades, but it did leave you with a good feeling in the end."
1,Not worth the trees they had to cut down....,"I really wanted to like this, because I liked her other books- alot. This was far fetched and at best just fluff and filler until the plot takes off. The big problem is that the plot never takes off."
2,Billie is no Stephanie,"This book is supposed to be for fans of the Stephanie Plum series. Don't waste your money, it's nothing like Janet Evanovich's newer books."
2,"An interesting read, but not the usual Janet","Picked up this book on the spur of the moment finding Janet Evanovich's books a must light read. For those seeking a fix before the next full length Stephanie Plum novel, this might not be the best choice. The tale is certainly light enough with divorced mother of two Annie finding love and excitement with handsome Nick. The story moves quickly with usual red herrings. But certain characters seemed more paper-doll cutouts. Overall, a definite library checkout or purchase for a hefty discount only read."
4,Funny and entertaining,It's a light romance with some suspense and mystery thrown in and a bunch of hilarious characters. I love Janet Evanovich's characterizations; she's in high form here; parts of this book were so funny.
1,Horrible!,I could not even get through the first chapter without having to restrain the urge to yack. Couldn't even force myself to read it. And I say that as a huge Stephanie Plum series fan.
1,wait for the next plum book,"Compared to the plum books, this novel is a bore, and overly silly, i am sorry i read past page three, hoping it would improve. save your money for the next plum."
2,Have a hard time believing she really wrote this...,"This book is a collaboration with one of Janet's friends, and I have a hard time believing that Janet actually had much to do with the writing of this book! It starts out as a VERY cheesy romance (hey, I'm an avid reader and have been known to read a few romance novels) novel and it's just awful. The second half of the book picks up a bit of speed and becomes slightly more interesting, but then at the ending the speed is so fast you can barely keep up. It was as if the authors decided they'd better make this all a little more ""Stephanie Plum"" to keep the readers interested in the ""Full -"" series, and... it just made no sense.Of course I bought Full Tilt (the 2nd in this series) at the same time, so I had to read that one. That one was a touch better, but I'll review it seperately (;In conclusion, if you loooove Stephanie Plum, um... don't read these just because you feel loyal to Janet, like I did."
