class_index,review_title,review_text
5,Home owner,"I recently purchased this saw, not from this website because they were not in stock at the time. I recently used this unit to cut some stringers and steps for some basement stairs. I have been putting off several projects because the power saw I have is a basic home owner Sears unit useful for light work but I would not like to use it for any heavy work...I am very glad I made the investment in this saw. I feel very confident in its overall construction and it just feels good to use this product."
4,Good Condition,"This book came is pretty good condition. The actual novel inside has 0 markings or underlining but the outside cover is a little crappy, but who cares!"
1,Doesn't work like it says!!!,"I got and it won't read my microSD using my adapter, which it clearly says it will on the box. It's a great idea if it would only work."
2,Doesn't mount,"When I put it in my MacBook Pro, the SD card doesn't mount. Sometimes Disk Utility will ask me to initialize it and format the drive, but it stalls. Then the camera asks me to format it too. Maybe it's just a bad one, but I'm going to have to return this."
3,works almost perfect,For me this was just what I was looking for. The only problem I'm having is that it doesnt work with microsd. If I use the adapter for microusb it doesnt work. Behalf of that its an exelent product.
5,perfect,works perfectly. you can hardly notice it and there no sleep issues on a macbook pro for me.
2,Works... for memory cards with low capacities,"It works well, but no where on the product packaging did it say that the high capacity SD cards were compatible with it. I assumed it would, but it doesn't. So cards with 1 GB or higher capacity won't work. Fortunately I could get by with 512 MB cards...One positive point is that drivers or installation software is not needed on Mac OSX Tiger or Leopard."
4,"Works fine, but not SDHC compatible","This worked flawlessly in my MacBook Pro, but beware it is NOT SDHC compatible, so you will not be able to work with large capacity SDs. The product preceeds the new standard, so do not blame them. So although it works well , I do not advise to buy any SD reader which is not SDHC. It is just not worth, since the most economic chips are now 8Gb in size. Wait for a new model, and get along with a cheat USB adapter until then."
3,"Okay, but not the originals...","I wish Disney would just stick to what works. Why didn't they just include the original versions of thes songs with and without the vocals. Beats me. This CD contains a lot of great songs, but they are not the originals. Also the orchestrations are childish and empty - they are not even close to the richness of the originals.Overall an okay buy. I still don't understand why they couldn't include the originals. Go figure."
3,For the most part...,"I personally think that this CD is overall very good. It has a good variety of fun songs from lots of Disney's best movies. The few things that I didn't enjoy quite as much were the fact that some of the songs were in ranges that didn't fit many singing types, and seemed only based to fit the singer's voice on the example tracks. Some of the songs were also shortened a bit. But my opinion is that it's a great opportunity to listen to the strengths of your voice and start to record yourself, or just have fun. And if you don't like it, just send it back. Hope this helped!"
1,"Perfect Gift,if you are into Karaoke,of course.","My neice love's disney. I thought this would be the perfect gift. How much better can you do than Disney+Karaoke. Well, come to find out she wanted a Ukelele. This is not a Ukelele. Email me if you know of any Disney Ukeleles."
4,PDD by Eppinger/Ulrich,"I'm taking this course at MIT taught by Eppinger, and it provides a good quantitative approach to a process that's otherwise very organic and unpredictable. Direct cause and effect approach."
3,"Is OK, but there are better options.","I have the pleasure of taking a seminar with the author, but I was disappointed at his writing. The book is hard to follow, and lack structure."
3,It's true what they say -- I got what I paid for,"Bought from merchant 'sophiaglobal' for $15, which is a great price *if* the product is equivalent. The quality of printing was fine. The cartridges themselves are unbranded and bubble-wrapped, not packaged as shown on the Amazon product page. I can't say they contained half the ink of an HP-branded cartridge, but they certainly didn't last as long. I was disappointed, and won't be purchasing any more ""refurbished"" ink cartridges from this or any other merchant."
3,Not bad cartridges; the free paper pack deal is excellent.,"I would rather they just sold these single; it takes me forever to use one cartridge (around a year) so having to buy two wasn't a deal for me.I did send away for the free paper pack and it came with a lot of things: envelopes, photo paper, card paper, etc. I'm not sure it's $20 worth of paper but its interesting."
1,A joke,"This item is misrepresented to be an interactive CD with 101 questions. Well, needless to say it is a PDF file! haha this is such a joke, so basically it now has to be printed out to be of any use at all. The total cost of this item was $10 with shipping, it was not worth 50 cents."
4,The Seeds of Time,"`The Seeds of Time' is a collection of short stories from John Wyndham and features many stories about both time and space travel. Some are longer, and some are better, than others but they all manage to grab your interest within the first few paragraphs and keep you hooked until the end. Some of the ideas and concepts really give you something to mull over and I often thought about them days after I had finished the book. If you are new to Wyndham then this is a good place to get a feel for his style, but you will soon want to get your hands on his other novels, which are just as well written as this. All in all this is perfect to dip into at odd moments and offers up some excellent science fiction story telling at it's best.Feel free to check out my blog which can be found on my profile page."
2,Basic and sometimes interesting,A nice little essay on SF cinema that doesn't feel that structured. Lots of nice trivia but the author is quite taken by Star Wars to the detriment of previous SF movies. The only memorable moment is where the writer starts slagging off John Boorman's Zardoz (a film I feel is a under-rated gem). Something to give your little brother to shut him up on a very long car trip.
3,Literature Is About Itself and A Dream,"Reduced to essentials, Literature (with a capital ""L""), Northrup Frye says, is about itself, a wish fulfillment dream, and it's also an anxiety dream. This news ought to knock no one's socks off. Living in a post-Freudian world, one wonders why this book is still regarded as significant, except in the littlest way. Reading this book for the first time in 1991, decades after leaving graduate school where this book was required reading, I was completely underwhelmed. ""Is that all there is?"" was my only response. Yes, that is all there is.156 pages."
3,From a Student's perspective...,"Very insightful. I know he meant to make this an informal style, but it's confusing. He keeps going back and forth, here and there, but he ultimately makes 1-2 good points in each essay. However, the one or two interesting point he makes in each essay really tickles your mind. Very philosophical....but..not recommended for those who thrive on fiction."
5,the best is back!!!,"I owned these boxer briefs when they were originally sold years ago. I looked and looked when they discontinued them and never found anything that even came close. So when Amazon listed these again, I bought 10 pair! The fit is perfect to the size listed, they keep everything in place without being too tight or too loose.I never take the time out to write a review but these are worth it. I want Calvin Klein to keep making these forever so I hope others buy then and ""see the light."""
4,NAME CHANGE,"THE ONLY SUGGESTION I HAVE IS IF THE NAME OF THE PRODUCT HAS CHANGED THE SELLER SHOULD NOTIFY THE BUYER. I BOUGHT GRIPPER JAM UNDERWEAR AND THEY CAME AS CYCLE SHORTS. I HAD TO INVESTUGATE THE WEB TO FIND THE NAME CHANGE. I WAS CONSIDERING RETURNING ITEM HAD I NOT FOUND THE INFORMATION I WAS LOOKING FOR, VERY TIME CONSUMING AND UNNECCESSARY IF THEY HAD JUST STATED IN PACKING THE NAME CHANGE"
1,calvinklein gripper jams,Very dissatisfied with product. They are cut very short in the rise and if one has a belly of any size they will not stay up.
4,Very Cute,"My two older sons were being ninjas and I searched high and low for a ""baby ninja costume"". It wasn't the best material but served it's purpose. He was the hit of the neighborhood with his little headband. It really was cute!"
5,Great little book!,"This was given to me by a friend five years ago, and I keep coming back to to look at old favorites and learn new ones. The occasion today is that I want to order a copy to give to someone else. When you get this, check out ""sonnet entitled how to run the world""... it's the best, although requires several readings. And know that despite all of the wierd punctuation, cummings' poems do work well when read aloud."
5,Great introduction to e. e. cummings,"e. e. cummings is one of my favorite poets, and this collection of his poems is a treat for any fan of his verse. The innovativeness of his language and the freshness of his images are continuously inspiring. It is sometimes hard to believe that most of these poems have been written well over half a century ago - they have all aged remarkably well. This is a testament to the simplicity and the permanence of the themes and ideas that e. e. cummings dealt with, and the original and inimitable way that he approached them. And if you are not already familiar with e. e. cummins' writings, this collection is one of the best places to start getting to know this great American poet."
5,Great Selection,"My old paperback from the '70s dog-eared and falling apart, finally died, so I replaced it with this copy, absolutely the same except for the cover. This is a great cross section of cummings' workand wonderful to read time and time again."
3,I carry you in my heart,"The book is what it is, I'm just sad a great poem like I carry you in my heart did not make the shortlist to be put in the book, while it's one of his most famous poems."
5,"a critc knows the way, but can't drive the goddamn car..","i don't know why so many people hate e.e. cummings. is it because he was so unconventional or because he didn't want his poetry placed in a box ? i'd have to say that he and amiri baraka are the two poets who have deeply influenced my work. his insanity with wordplay and the music of his language is stunning. "" somewhere my eyes have never travelled "" is one of the coolest love poems i've ever read. and cummings love poetry is equal to neruda's in passion. buy this book and fall asleep reading it..."
5,Start Here,"You may have heard of this infamous poet - or even read one or two of his pieces so frequently called ""avant garde."" His imagery is startling and perhaps his greatest gift was his ability to make those images musical, as though they roll off the soul. If you've wanted to get a taste of Cummings and didn't know where to start, this is an affordable collection of some favorites. Well worth the inexpensive price - compact but filled with the choicest selections."
4,A great starting point,"I am just now rediscovering poetry. I've always enjoyed it as a teenager, so I bought three books by word-of-mouth this year. I can't say this one was my favorite, but it is a classic! I am sure the effect of Cummings at the time was great, but I strongly suggest that readers take in the writers of our day. This book is a great starting point, but it only gives you a history of what's going on with more contemporary poets."
4,Very Nice Illustrations,The Illustrations were the best part of this text book. Since it was a required text for a coaching license the illustrations made understanding the material much easier.Structure & Function of the Body - Soft Cover Version (STRUCTURE & FUNCTION OF THE BODY)
1,Structure and Function of the Body,Be careful. I ended up with the study guide and not the book that I had intended to buy. Be sure you have checked the names of both authors as Thibideau is listed as author but the study guide is written by Linda Swisher...
1,"Watchout! Deceptive trick. Is only the ""Study Guide""","This is not the book. All you will get is a bunch of worksheets and crossword puzzles that go with the book titled ""Structure and Function of the Body""."
5,Brief Therapy,"Another seamless transaction, good customer service and quick shipping despite the holiday season. Great book and an easy read with some really practical information."
4,What's really strange ...,"... Is that it's a Will Ferrell movie, and it's actually good!I've never been a fan of ""Saturday Night Life,"" or any of its recent escapees. I've drank no Kool-Aid there. But Ferrell's Harold Krick shows a level of intelligence and maturity you'd never expect him to have. He's not some crass, overgrown child pretending to be a grown-up. He is a grown-up. A real, sympathetic, and still serious role.Krick lives a controlled, but drab life as an IRS auditor. Until one day he hears a narration voice in his head. He discovers he's a character in a novel, one which will eventually kill him. Emma Thompson is the neuorotic author Kay Eiffel and Queen Latifah is her somewhat protective assistant. Added into the mix are a delightful Dustin Hoffman, and a less delightful Maggie Gyllenhaal. All still put on a tremendous effort. I also enjoyed the continual phantom numbers and calculations, interesting touch."
3,Not quite strange enough,"What might have been just another high-concept trash comedy of the Adam Sandler variety - beige nobody discovers he's the central character in someone else's novel - thankfully becomes, in the hands of a great cast and skilful crew, something more. Zach Helm's screenplay doesn't have the Charlie Kaufman-style weirdness or complexity the premise deserves, nor the intellectual savvy of an ""I Heart Huckabees"", but as a tilt at the themes of mortality and meaning it's a worthy, if slightly too cutesy, piece."
4,Great Cast-Good Movie,"Stranger Than Fiction brings to the screen the unusual story of a very ""usual"" kind of guy. An IRS agent living a rather uninteresting life for the last 12 years begins hearing a woman's voice narrating his life. It turns out he might be right...The plot has elements of both comedy and drama making it rather difficult to label it as one or the other; it's actually a bit of both.Will Ferrell, Maggie Gyllenhaal (who is GORGEOUS!), Emma Thompson, Dustin Hoffman, and the rest of this AMAZING cast, carry out their respective roles very well.The setting, the plot, the dialogues, and the music are all good.In a nutshell, though not a masterpiece it will surely provide for an evening's entertainment."
5,Stranger Than Life,"Stranger Than Fiction is a pretty good movei. I thought it was will ferell's most non rediculous and insane films. It actually had a good plot to it. and a good story a unique one. This movie is about a man who can hear his life being narrated by a woman. He dosen't know how it's happening but he has to find out before it's to late, because this woman is a novelist and in all her novels she kills the main character. what she don't know is that her main Character Harold Crick(Ferell) is real. What's going to happen well find out go rent the movie."
4,Quirky,"This was an entertaining movie. Strange plot, a dweebie tax guy is the focus of a novel, and can hear the narrator describing his life. Starts out slow, but as he meets this entertaining baker that he's auditing, things get interesting. She wrote some crazy letter to the IRS explaining why she would only pay a percent of what she owed. So, of course, she got audited, and opened up his eyes to the life going on around him.His interactions with Dustin Hoffman, a college lit professor, who sort of becomes his shrink, is interesting. Hoffman is trying to find out where the novel is going, tragedy or comedy? There are some holes and weaknesses, which is why I didn't give it a five star review. But five star movies really are few and far between. I enjoyed it, and recommend it to my friends."
4,Excellent,"Truly enjoyable movie. Thompson creates yet another memorable character. She truly excells at portraying cynical characters. Gyllenhaal's character, although not as memorable, was well portrayed. Huffman was excellent as well. And Ferrell, well, it was good. His expressions' portraying a lost sad man living a completely uneventul life won me over. The movie, as opposed to its characters, refused to fall into cynicism. It is intersting to note that the most cynic of the characters goes outside of her own self involvement to write a ""good but not great ending""."
5,I did not want to see this film!,"I was taken to see this film almost against my will. I'm not sure why that is, but I'm glad I saw it. I'm amazed that this film wasn't more popular. It's beautifully written and is an incredible breath of fresh air for Hollywood that seems to be spending most of it's time pairing stars to do remakes of 80s TV shows or other movies. This movie is funny in a subtle way but also inspirational. I think I'd like to be buried with a copy."
5,I totally love this movie,"This movie made me a Will Ferrell fan for life. The rest of the cast is great, too. Such an interesting script. Just so unique, and so well done. I bought it, and watch it quite often. Fantastic film."
5,Excellent Movie,This is one of my favourite movies of all time.The story is amazing and the acting is excellent.
3,RICKY BOBBY GETS SERIOUS,"Will Ferrell joins fellow comedians like Robin Williams and Jim Carrey in assuming a more serious, downplayed character. He's Harold Crick, a really boring IRS auditor, who discovers he hears a woman's voice narrating his daily actions. And he hears that he's going to die. Seems the woman is writer Emma Thompson who is known for killing off all of her heroes. Thompson is displayed as a neurotic, tense workaholic who chain smokes and spouts meaningless philosophies. Dustin Hoffman shows up as a professor who tries to help Ferrell deal with his dilemma. Maggie Gynlenhaal plays a baker who Ferrell is auditing and ultimately falls for. The whole thing has an interesting premise but I didn't like the fact that there's never any explanation as to how this whole thing could really happen. The performances are overall good, with Gylenhaal and Thompson very effective. However, Queen Latifah's unusually lifeless performance as Thompson's aide is baffling."
3,Flawed DVD Production,"My opinion of this DVD is both the highest and lowest, which explains my medium star rating. On one hand, the movie is the best I have seen in several years. It is original, clever, and engaging. I loved it in the theater only.On the other hand, it simply won't play on my DVD player (Sony DVP-CX995V 400-disk changer). On my PC, the DVD launches the included ""Interactual"" player, but won't play in any other DVD application.This was true in two rental copies.Examination of the DVD file structure shows the usual, but at the disk's root directory, there is an Adobe/Macromedia Flash ""projector"" player file. I don't know if that's really the problem because the Pan's Labyrinth DVD seems to be designed the same way.Any thoughts?"
3,Love Gyllenhaal's Cookies,"After a very enjoyable first thirty minutes or so, I had a voice in MY head saying ""They'll never maintain this for an entire film"". And darn if that voice wasn't right. Gyllenhaal was the only actor to breath any life into her character. The scenes with Emma Thompson and Queen Latifah felt as colorless and bland as Thompson's apartment. Likewise, Ferrell and Hoffman's scenes were highly uneventful. I suppose Ferrell played his character about as well as could be expected considering the character was a simple guy who lived a very routine lifestyle, but he only seemed to shine while in the glow of Gyllenhaal's ever increasing star power."
3,Uhm...,"I was planning this to be a funny movie, because the main actor is only in comedy movies. I would suggest this to be rented but it wasn't good enough for me to buy and watch over and over again... There was a good plot, but I expected better."
2,"Farrel buys a guitar, and other slightly amusing scenes.","This film was one i have anticipated for a long time. Finally rented it, and once again will farrell failed to deliver. Should have come as no surprise considering his past work. Talladega nights was not funny. Anchorman was worse. I could go on, but i will spare you. I did enjoy this movie, mildly, however expected much more. The director's past films include ""Stay"", one of my recent favorites. This does not measure up. The ending left me without much thought. I derived no great message from this film. it did not move me in any way. The highlight involves the purchase of a guitar, and the performance of a song (one that i prayed when spoken of would be ""Fred's Slacks"", but was not). I think if stripped down, one could see the film for what it is. A two hour anti-tobacco commercial."
2,Boring and un-funny,I like these movies where a comedian decides he wants to stretch as an actor and try something different. Will Ferrell should stick to his goofy comedy movies because this movie was boring and pretty much was a snooze fest. I think it was an interesting and quirky concept but the finished product just didn't end up being that good.
2,"It's gotta get better soon, doesn't it?","The premise of the film was silly and that's what caught my eye. Well that and all the other reviews that said how wonderful it was.For me the film drug out and I kept hoping it was going to get better. The only reason I kept watching it is because I was curious on how it was going to end. Having seen the end I wish I hadn't. It was the end that irritated me the most, completely moronic. But I can't tell you about it or I would be ruining it for you. Hmm,,, maybe I should tell you. I'd be doing you a favor."
4,"Strange, and entertaining",We were entralled by the twists and turns of the story. A fun movie to watch. This is the only Will Ferrel movie that I have ever seen that he actually attempted to act.
5,interestingly different,"Stranger than Fiction was really good. I ended up having to buy it for 14.99$ because you can't rent it on here but ah well it was good so I don't care even though I am jobless I enjoyed my purchase. I have wanted to see this for awhile because Will Farrell is in it and I had the idea it was a comedy from the reviews and it was at times but just really really good and the ending is good too:):):):) I liked the premise of it, one I've never heard and it took me until Emma was in that interview in the Professors office to really be sure that she was a real person....I was confused, very confused about her ""reality"" Was she a real person???? I had no clue.....very good....I don't want to give it away.....anything because I'm not sure how people approach reviews....read them before or after so I will leave that be....but buy it......its worth it......"
2,Less than scintillating,"I am not a fan of movies in which the main character spends the whole film with a flat affect on his face, such as the one Will Ferrell wears here throughout. It gets a little dull. I grew antsy almost from the beginning here, when the storyline becomes apparent. Though seemingly original, I wasn't particularly entertained by it. Dustin Hoffman is again wasted, as he was in ""I Love Huckabees."" This is a supposed comedy, but there are no real laughs, perhaps just a smirk now and then. It's also a bit long. I had to pause it several times to get through it because it's just not that compelling."
2,Boring.,"I thought the concept of the plot was original and something refreshing but the movie itself was a drag. Something about Will Ferrell just irks me the wrong way. I don't think he's a good actor at all and I don't find his humor amusing. Also I don't believe this film was meant to be a comedy because it wasn't funny at all. Which is fine, it works more as a dramatic piece but the execution of it all was just all too dull for me."
5,Wonderful Film,"This is one of my favorite films ever. Every character is quirky and endearing. The movie's premise and how it plays out is gripping and kept me absorbed, so much so that I was literally holding my breath at the end to see how it would turn out. I've recommended this movie to everyone. The soundtrack also rocks. It's just a solid, lovely, wonderfully engaging film and Will Ferrell as a pure drama actor is magnificent."
5,Existentialism in reverse,"The 2nd best film of 2006. A comedy only insomuch as films like ""Being There"" and ""Being John Malkovitch"" are comedies. Brilliant script, story and perfs. from everyone. VERY nice perf. by Queen Latifah."
4,NOT a fan of Will,"I have never stomached any of his other movies. I find his style of comedic acting to be 100% STUPID!!! My 9 year old could make his comedy funny, but Will just looks like an idiot. That said, I liked him here! When he's playing the role of a regular Joe, he's likeable! I felt bad for him near the end!! When he's being real, he's good. When he's being funny, well, let's just say I'd rather hear knock knock jokes all day then see him do a comedy!!"
3,I dont' get it,"Just one question: What was the business with the watch? The only purpose I could see for it was that it saved Harold's life in the end, but other than that, what did it have to do with the plot?"
