class_index,review_title,review_text
1,Waste of money -- Does not work at all!!!,"This product is the worst purchase I have made for my ipod. I thought if I purchased the more ""expensive"" tape/adapter I would have a better chance at it working well in my car. Boy was I wrong. This thing NEVER worked. My cassette player in my car continually spit this out. I ended up going to buying the $9.99 RCA adapter at Kmart which worked perfectly in my car. Don't bother with this worthless thing. Buy the cheaper RCA adapter and you will save yourself $10 and have a product that works."
1,Doesn't work for me,"Recently purchased this unit. Works (kind of) in a 2003 Prius - rattles like crazy when inserted in the factory cassette. Doesn't work at all in my 1999 Honda Odyssey - factory sound. Reverses forward and back, forward and back, then ejects."
1,Tape Adapter is Trash,"I bought the Belkin because it is the ""standard"" brand for Ipod accessories. I should of read the reviews... doesn't work with Bose factory sound in my 2003 Maxima. Insert adapter and it switches from side 1 to side 2 and then ejects. I tried an XM radio tape adapter, and a Sony tape adapter and both worked. So it isn't the factory sound, it's the Belkin cassette adapter. Save yourself 20 bucks and find another brand."
4,"good dvd but showing its age, 1980's.","I ordered this to help train my lab, it is almost solely about using a shock collar. The quality is lacking but the information is good. I would recomend it but only for those who are serious dog trainers and have some experience with a shock collars use already."
3,FreeStyle Music,"CD was used but in great condition as advertised. Although each track is not seperate, two long tracks, A side & B side...."
3,I bought this album to sample the first 40 seconds of side B/ song2,"AND! It was phenomenal for that purpose. But just as one of the other two reviewers have mentioned, this is a typical type of freestyle album. But with the exception of the Intro to the song I like, ""love will keep us together"", there is a Pre Drama execution of sounds."
2,Dorcey 41-2498 1/2 watt led flashlight warning,"Nice flashlight, life long LED bulb but beware of changing batteries the front end has to be removed and four aa batteries installed. When closing the flashlight and attempting to screw down the unfriendly front end I broke the plastic parts that fit on the battery. This is poor design and I would like Dorcey International to replace the parts and change their design. What good is a lifetime bulb, when the whole assembly breaks the first time you replace the batteries. Contact info not available on the flashlight of course to provide feed back to the vendor."
1,Worked 3 times,"What more can I say? I got three uses out of it and now the little LED just glows feebly when i switch it on. Cleaned all contacts, replaced new batteries == no joy. :("
4,beginnings of judo,"This is currently only available on VHS, which is odd, because the 2nd film of this duo is out as a DVD. The quality of the images is not good, but the film is worthwhile, because it is one of the first attempts by a major director, Akira Kurosawa, to show something of the attitude toward martial arts in the Japanese culture. From today's standpoint a little simplistic in terms of action, but the film tells an important story, and represents an attitude that is little recognized in today's high-tech world."
1,Can't review it since it was never received.,"Better to buy it from a place that actually ships it, but I ended up picking mine up at Wal-Mart. Different brand, and different mg strength though."
4,What took so long?,"I've been waiting for this since the Higher Learning soundtrack. I'm only slightly disappointed. This CD has it all almost: A few classics, a couple throw aways, and an obligatory ""I was high when I wrote this song"" song.Yes ladies and gentlemen, every neo-soul album must have a weed song. Jill had one. Musiq had one. D'angelo had one. Bilal had one or two. Angie had one. If the new generation of soul have learned nothing else from the pioneers, they've learned that weed is fun to sing about.Why artists with so much talent would have to waste 3 valuable minutes singing about dime bags is perplexing. I'm like this: If you don't have anything interesting to say, then make an instrumental. I'd rather hear a Raphael guitar solo any day.Don't follow trends. That's what real soul music is about."
5,Why Did It Take So Long,"I am so happy to see this day. Raphael should have done this a long time ago. Even when he was with other groups, he was the voice that stood out the most and captured the soul and spirit fo anyone listening. I like the old stuff that he's done but after listening to the samples from his solo CD, I have to get it 'Today'. I'm a fan for life and the 'gift' the he's blessed with will go a long way in uplifting anyone listening. Thank you so much Raphael, keep up the great work!"
2,Not even close,"This man has clearly given away his best material. Can he play instruments well? Sure, but the songs don't fly with me. A lot of it comes off like him tyring to keep up with the young kids today and it isn't even very good at mimicing that."
1,Instant Disappointment,"I found this album profoundly disappointing. After hearing Saadiq's contributions to many other artists (e.g., D'angelo's Voodoo album), not to mention his work with Tony Toni Tone, I was really looking forward to a soulful, melodic, slightly funky album. Instead I found a watered-down, overproduced piece of sugary fluff. No soul, and definitely no groove."
2,Not trippin',"Frankly, one the most anticipated and most disappointing albums of 2002. I am baffled as to what Saddiq wants to do here. The Lucy Pearl album is a much better showcase of his talents - to say nothing of Tony Toni Tone's ""House of Music"", which was sheer brilliance. I rarely listen to this album and do not recommend it."
4,Decent,"I think that this album is overall good, but some of the songs are a little bland. Maybe some of the 2- or 3-minute songs could have been left behind, as they don't make as big an impact as ""Be Here"" and ""People"" do. Also, the majority of the album has production that makes one or two songs seem indistinguishable from each other. Other than that, Instant Vintage was worth the wait."
3,It's just okay,"I listened to this song and thought it was just okay. I don't the understand the rave reviews for this cd. If you're looking for an excellent nu soul cd, get ""The Love Experience"" by Raheem DeVaughn. He is excellent!!!!!!"
1,I really tried...,"Based on the reviews, radio plays of other RS songs I decided to take Instant Vintage for a spin.I'm really disappointed.The orchestration is good, the beginning track shows that...but after that the lyrics fall flat. I'm upset because there are some good collaborations that seem like they would work, but when you hear them they don't.And whats up with that track in the middle of the CD with the female group singing? Pointless.I think I want to get his latest (Way I see it) but I'm apprehensive if I'm going to get critically acclaimed fluff."
2,"Love The Groovies, But.......","The sound on this recording sucks. I love The Flamin Groovies, and I also like when a live recording has a raw sound, but this isn`t really a raw recording. It`s just a low quality one. If you can find it for $5 I would say it is worth picking up, otherwise look else where to get your Groovies fix."
3,Good protection but discolors with sun exposure,"This works great for low impact bumper protection but stayed clear for only about 3 months. It's now brownish from exposure to the sun. I tried painting it, but the paint refused to stick properly, probably due to car wax.I'm sure it would still be clear if I didn't have to park in the sun, but next time I think I'll get it in black."
2,Clear but HIGHLY Visible,"Thick Material, ,it is very Substantial, Almost TOO Much so.. not optically Transparent Hence SO Highly Visible, almost makes car look unattractive.. Detracts from Car's appearance!"
5,Pretty god item bumper protector,"I got it very quick. Installed pretty easy,and only complaini would have ,that is clear and is give you a purplish color tone,and the glue shows baubles, they should put some light color backingfrom close it looks not to god,but is do the job, i already hit cars bumpers with it and you see nothing on my car, that was the purpose for it, right.Good stuff i recomended"
2,Only deals with the simple web server load balancing,"This deals mainly the web based load balancing. This is the simplest solution since the sessions only last for ms. It has a good hands on approach to router configuration and network design but lacks hardcore application design that this topic deserves.There is no discussion on complex systems which require sessions to last for days and how to distribute state between multiple servers. There is also no discussion on locking mechanisms, determining load, primary/backup determination, latency across WANs, distributed objects, DB failover, server synchronization, heartbeat implementations, shifting load for scheduled down time, or dynamic router configuration or alternative scheduling mechanism apart from round robin.I think the title ""Web Server Load Balancing"" would be a more appropriate title and if that is what your goal is then this is the book for you."
2,At the title I was impressed,"But after digging into the content I was forced to re-evaluate my first impression. I looked to this book to guide me through numerous pieces and choices of server load balancing on a fair but balanced agenda. What I found was far too much information that was simply digested and reformatted from vendor and free areas.I look to an expert on a topic to give new insight and twists to anything they write. The lack of any personal commitment or recommendation was surprising. Which made the book more into a mid-level technical guide with no path or strategy summary as I would expect. A good beginner type book for the basic information. It was well organized and had decent flow. Chapter 5 seemed to offer the most promise, but never quite concluded with anything concrete."
3,Server Load Balancing by Tony Bourke,"This publication is good for an quick introductory view of server load balancers. Users of load balancing products from certain manufacturers will benefit from the configuration options discussed in the final section of the book. For a more in-depth discussion, I would recommend Kopparapu's text ""Load Balancing Servers, Firewalls, and Caches""."
3,"Good for background, but too much on hardware solutions","This was actually a very good book. It really explains the background behind server load balancing very well. However, the book only emphasizes hardware solutions for server load balancing. It doesn't discuss any of the software solutions, such as Windows 2000 or IBM Edge Server.The only reason why I rated this book relatively low is that much of the theory behind server load balancing can be obtained for free from various web sites.If you're only looking for information about the concept of server load balancing, then you're better off getting the info from web sites for free. However, if you're also looking for great tips on the various load-balancing hardware solutions, then it's worth purchasing this book."
5,Excellent architectural coverage and practical use,"I found this to be an excellent, clear and concise introduction to web server load balancing and configuration.Highly recommended."
5,Shred On,I bought this shredder to replace the old one we used to death. It shreds as advertised. The autoshut-off when full is great. I would like to have a deeper wastecan for it. Great product and I would reccommend it for any one for home or moderate office use.
3,shredder,"Is smaller than I thought but works well. There was a shipping snafu and was sent one when the original never arrived and then today, 3 weeks later, the original arrived and will now have to ship it back but Amazon is pretty good about taking care of that."
1,SAVE YOUR MONEY,"I have had three of this model. Shows what a fool I am. The cross cut and size of the shredded paper isa plus. The automatic switch however craps out in a really short time. This to me negates everything else. Three of them where the auto switch has died on all three. This is ridiculous. I don't shred much at all, maybe 10 sheets a day. Handles CDs well. But the near worthless auto switch overrules the positive factors. If I wanted a shredder without an auto mode I would buy one. When I do buy one with auto I expect that to work and not stop in a very few months. I think I have finally learned a lesson and will never again buy an Aurora shredder. As far as I'm concerned they put out garbage."
4,Very Good,This has done everything promised. We haven't had one problem other than I wish it had a bigger area for paper to accumulate.
1,Breaks Easily,"This is the second time I've bought this product. The first one failed after a few months, but I thought it was my fault because I used it a lot and when it failed I thought maybe I had overused it. I ordered another one because I would have two containers and I thought it would be better for changing out the basket when I was too busy to empty it. I liked the way the cutters looked - nice and solid. After a couple of months of average use (I tried to be more careful with the second shredder) it began to make a weird noise - like the cutters were binding. Yesterday I tried shredding 1 CD and it only made it about way through the CD before locking up. I removed it cleaned out everything from the cutter and now all it does is make noise. It won't shred anything . I just don't think this shredder is worth the money. I really need a shredder and now I have to find another one. I wouldn't recommend this shredder to anyone. It just doesn't hold up - even when you baby it."
2,Aurora AS1018CD: Never leave in Automatic mode!,"I purchased this model, Aurora AS1018CD, and the next smallest size model within about a week of each other; one for home and one for my office. Both have done excellent in terms of their shredding power and low instance of jams or binding up, however they have both displayed an issue which causes me great concern; they will suddenly without reason begin running and will not shut off. Both have now done this on several occasions, and without any possible reason I can find, i.e. my Aurora AS1018CD was emptied and even blown clean with compressed air about 3 weeks ago and not used since- and the other morning I woke to find it running non-stop, and getting very warm. This has led me to not only turn both completely off, but unplug both from now on just to be on the safe side until I can have them replaced."
1,Died after 6 weeks!!!!,"A shredder in this price range should last for a while. It should be able to do moderate amount of shredding. Well after a few pages, an awful smell came out of the machine like rubber burning. Shut it down for an hour and started again and a few moments later the same thing......this happened every time we shredded. Finally one day it just stopped accepting papers into the feed. End of shredder. Buying a micro cutter one with only good reviews."
2,craptastic,I specifically picked out this shredder because it was suppose to shred CD/DVD and it gets jammed every single time you put a CD in. I tried multiples just in case it was just bad luck on that first disk. It shreds paper fantastically but I could have gotten a regular everyday shredder that did just paper for a hell of a lot cheaper. Definitely not worth the price don't buy it.
3,Personal,The product works as expected. I have been using it on a backlog of material to be shredded and it keeps up fine.
1,Worked for 6 months only,"I bought this shredder in March. In September it stopped working. It still has 1 year warranty, but it doesn't worth the shipping."
2,Another piece of Chinese junk,Used it for a couple weeks until the shredders came out of gear and it started making a high pitched screeching noise. Nothing shreds or reverses. Needless to say I need a return and refund.
4,Tear it up,Unit works great. When I received it the bottom of the unit had a small hair line crack in it. Now it's gotton alot bigger from using it.Would have given it (5) stars all the way if not for that.
1,Smelled funny and died. Aurora broke-alis,"Walmart sold these cheaper and even at that I feel taken. I assumed frmo the start 10 sheets meant 5 and I was right. Even 5 choked the poor thing. After only 4 basketfulls over a few days with many long breaks it began to smell plasticky even using 2-3 pages at a time. It never could approach 10 and try a CD, the noise it makes made me run for the fire extinguisher. All of a sudden it won't shred anything even a tissue without choking. Ive checked in the mechanism but nothing is fouling it that can be seen and its pretty open to see.Maybe I got a lemon but you could too. Get a different brand, this thing is way to stressed to even approach its overly hopeful rating of 150 pages a day and 10 pages at a time. 10 sheets of cigarette paper maybe :-PMine was garbage and a total waste of money"
1,restockit,after much research i selected this shredder and it came broken and was obviously returned once if not twice before based on the amount of packing tape on this box. would not buy anything from restock it again if their policy is to just keep sending out defective merchandise hoping someone will keep it and pay for it.
1,Broke after a few CDs,"I bought this shredder to replace an older Aurora model and to be able the shred some old CDs.While it worked very nicely with paper, CD's were a different story: After only a few CD's the machine was history. One CD got stuck with a loud noise, which was the last sound of the motor. Even after disassembling (and voiding the guarantee) the machine and extracting the remainders of the half-shredded CD, it never started working again...I am very disappointed ;-("
5,Aurora AS1018CD 10-Sheet Cross-Cut Paper/Credit Card/CD Shredder with Basket,"This Aurora AS1018CD 10-Sheet Cross-Cut Paper/Credit Card/CD Shredder has worked very well for many months now.We load it to its capability limit, which often proves greater than its ten sheet advertised capacity. We use plastic bags in the basket, which facilitates cleaner and less messy emptying. It ain't quiet, but none of the shredders are at this price point range.Buy another? Sure, but not for several more years at the rate this one is performing."
5,Super Shredder!,"This is probably the best home/small office shredder I have ever used. You can feed it stacks of documents & cards & as long as you follow the directions of pages & time running it will perform 100% correctly & quickly. Although a bit noisy, who cares as long as it gets the job done properly!"
1,Find a better shredder,"Shredder lasted about 8 months and only works ""sometime"". The motor is slow and is jams when it does decide to work"
4,Solid shredder,"After 2 months of moderate use, including 2 or 3 days of very heavy use, the shredder is going strong with no signs of any problems. I generally don't try to test a shredder's sheet capacity claims, but certainly have shredded 7-8 sheets numerous times without any incidents of rebellion! Capacity is quite adequate for a smallish machine, since unlike many shredders, this one does not shut down well before the basket is full. So far, so good, which, when it comes to shredders, is a very positive review."
4,Working well one month later,"It has only been one month, but I've used this to shred a few CDs, credit cards and tons of paper. I have not had any problems at all. It is noisy when in action but I like to think it is the torque in action."
5,Excellent Shredder,This shredder is as advertised in the specifications. I use my shredder everyday. My last Aurora shredder lasted about 7 years.I have use the shredder for 2 months before posting this review. Very Pleased.
1,One bad unit,"I bought this product after reading the largely positive reviews here on Amazon. I guess I got one of the units that quality assurance missed.I shredded one full basket without problems. I was impressed with the speed of the unit and pleased that while the basket is relatively small, the cross shredding process allows denser packing of paper than the older unit I was replacing. I was careful not to exceed the 10 sheet limit, I did not try to shred any credit cards or CD's, and I removed all staples before shredding.As the red light lit, indicating the second basket was full, I heard a loud noise followed by a high-pitched whine. A call to tech support verified that the drive gears has stripped. I was advised to return the unit to Amazon to avoid a shipping charge to the factory in California. I got through to tech support with no wait and the person I talked to was knowledgeable and spoke colloquial english. I mailed the unit back today."
5,better then expected,"Purchased this item with a gift certificate.All members of the family have been using this shredder now, from shredding credit cards, several pages of paper....to shredding CD's and data disks.This shredder has taken everything in, and seemed to handle it effortlessly!I was very, very surprised about the sturdy design, and how heavy in weight it is. (Which is, no doubt, a good thing in this case!)I highly, highly recommend this shredder, not only for home use, but a business as well.I would buy again, without hesitation!"
1,AURORA AS1018CD,"After about a year the shredder stopped working; the motor ran but the cutters stopped turning. I disassembled the unit and discovered that the two main gears that transfer motion from the motor to the cutting assembly are made of plastic or nylon. The first gear contacting the motor shaft had stripped, rendering the shredder inoperable. This is a poor design; I would not recommend this unit."
5,The Oracle is Always Right!,"I got the a copy of The Ladie's Oracle in college - almost 16 years ago. My girlfriends and I swear by it - the Oracle has great knowledge, but we have found, she can be pretty rude too if destiny is not with you. In the end, she is always right,especially on matters of love. Trust in her, and don't use her on off days, and remember, you can always ask her again tomorrow and your fate may change.Don't hesitate to buy this - I've been looking for copies in print every year since the mid 90's, and this is the first I've seen. You will love her, and keep this book with you forever!"
5,FORTUNE TELLING AT IT'S BEST,"What a brilliant book, being interested in fortune telling, tarot etc,I was fortunate enough to come across this book ""THE LADIES ORACLE"". A group of friends and I sat all night asking the book questions, the hours of fun just rolled by. i would recommend this book to all the ladies out there, but ""BEWARE"", THIS BOOK IS ADDICTIVE.... happy reading."
4,Pretty good remixes that add diversity to the single!,"The sign of a good remix is how it alters the original without destroying the integrity and performance of the artist. David Morales, the primary ""composer"" for the first two of these ""restructurings"" of the Aretha hit, understands that, as does Charles ""The Mixologist"" Roane, responsible for the last two.While Morales ""ups the ante"" with strong dance reworkings, Roane slows the frenzy down with highly sensual versions, destined to get the listener in a different mindset.Track Listings and times:1. Morales Mix (radio edit) - 3:312. Morales Classic Mix - 9:253. Bump Mix - 3:364. Mixologist Bass Mix (with rap) - 3:36Total running time: 20:00"
1,BLOOD GORE AND IN-BREEDING TRASH,"I have a pretty flexible attitude when it comes to gore and/or sexual aberrations, but WEDDING SLASHERS pushes the limit. The tale of a young woman whose boyfriends end up dying horrible deaths at the hands of her multiply inbred family is ridiculously scripted and the acting is non-existent. The only ""name"" actor in the cast is Richard Lynch, who doesn't come in until close to the end as the potential bride's father. The movie treats its killings sadistically and there are characters in the movie who we never know who they are. A really bad and not one of those cheesy bad movies. Don't get engaged in this one folks."
4,"Good Switch, A Bit Cheap","These switches feel a bit cheap but work well otherwise. The construction of the base allows for easy mounting into a round hole. I've had one of these serving as a switch for some LED lighting inside my car and it hasn't failed yet, after 6 months or use. The Blue LED is starting to become a bit dimmer, though.Overall pretty happy. These are cheap enough to buy a few at a time anyway."
3,I've got to get an MP3 player,"I bought this CD for one song and it is beautiful. However,I don't like anything else on it. What's worse, I have found two more songs by Eddie Holloman on two other CDs that I would like to have. Needless to say, buying the three of these cuts individually, would not be as much as the one CD. I've learned my lesson and my next purchase will be an MP3 player!"
3,Great balladeer,"I basically wanted the CD for one song, ""You make my life complete"". Beautiful song! Rest of CD wasn't as good."
