class_index,review_title,review_text
1,Doesn't work. Doesn't last.,"I found this wrist rest to be a bit too low and too hard the entire time I owned it, but the kicker is that it didn't even last 6 months before splitting at the edge and oozing its contents onto my desk. There is no reason to buy this product. Ever."
1,One star for False Advertisement,"I do not actually have this product, so I am not giving the product one star. I am simply giving this item one star because it is falsely advertised. The picture Amazon shows is of three products- the keyboard rest, the mouse rest and the wrist rest. Now, I assumed that since thats what they show, thats what I would get. Well I called amazon, they could not verify what I would actually get. Instead they gave me the number to the products manufacteror. They confirmed to me that it is one product only, the keyboard rest. So if thats what you are looking for, go ahead and order this item. But if you are looking for a set, keep looking!"
3,"Nice pendant, however.....","As the picture shows, you should definitely wear this on a chain. I attempted to put this on a black silk cord, and the opening on the pendant was not big enough for the cord's clasps to go through.The product itself was ok as far as workmanship goes, although it did appear a slightly cheap looking; even with that being said, if I had a silver chain, I would still wear it."
3,Disappointing,"There was nothing really wrong with this product as it did what it said it would do, provide a hidden storage compartment. However, that compartment was small and it seemed to me that it could have been designed better."
2,Not Happy,"The can looks nothing like the picture, the colors are wrong and the logo is sideways so it doesn't look like a real can, so that's pretty pointless. It's also dented right on the top. I've had different ones before that looked perfect so this one is definitely a disappointment."
2,ehhh,can came dented up and was smaller then i thought it was going to be.i also was shipped Grape..lol and not ice tea like the photo
1,Loved the idea but...,It broke 2nd time I used it. It was also solid so anyone picking it up would automatically know it was a decoy.
2,damaged,"I was really excited to receive this in the mail and when I finally did, it was damaged and banged up. There are dents in the can and I probably won't be able to make much use for it."
2,Dented,My can arrived fast but also dented at the top. The top is jagged like someone just ripped it off when cutting it. I wanted it as a gift but am embarrassed to give it like this plus it is not packaged .....just the can.Would not recommend.
2,Yoo,"Looks like a real can, but if knocked over will dent and break extremely easily. Also, you can tell its fake if you pick it up."
2,not perfect,"My can was dented around the top, also the UPC label is horrible to peel off now I need to buy some sticker remover to even use this. I regret this purchase."
5,a wonderful collection of calmer chopin pieces,"A while back I decided to purchase Ashkenazy's Complete Piano Works of Chopin. It is a wonderful collection, and Ashkenazy is one of the masters of Chopin. I thought this ten CD box set would be all of the Chopin I would need.Some friends recently bought me this two cd set, and it has proven to be an excellent gift. The pieces chosen for this collection are some of Chopin's calmer and more reflective works. Barenboim, Vasary, Juisada, Ugorski, and Luisada are fine pianists, and it is nice to have different interpretations of theses works. A good collection for close attention or casual listening.Highly recommended."
1,Big Disapointment,"This 2 CD set was very disappointing to me. The album is subtitled: The Essential Chopin Collection. If this was the essential Chopin, I wouldn't be listening to his music at all. Considering that most of the pianists were first rate, I expected a much broader selection. To my ear, they were mostly the sweeter, more popular pieces, appealing to more conservative tastes. Granted that they were lovely pieces, they didn't demonstrate the breadth of Chopin's unique musical genius. I was expecting his more fascinating and adventurous works as heard in many of the Etudes, Preludes and Nocturnes. I'll look more carefully next time."
5,Truly Essential,"Well, I thought that I had purchased all of the Chopin that I would ever want. Then I borrowed this CD set from our public library and found that I just had to own it. I read the previous reviews for ""Music of the Night"" and they are all telling the truth. It is the most satisfying, peaceful collection of Chopin that I've ever heard; perfect for relaxing, or as background while studying or working."
5,This was a Great book.,This was a real page turner. I am looking forward to reading more of Malynda H K's work.
1,Undead DVD pack,Disappointed did not know the movies are old black and white classic movies wanted newer movies that where in color.
5,Really Good Alternative Music,"I think I like their first album a little bit better, but this is still a fantastic album that just grows and grows on you. Really punchy drums and a good recording."
3,pros and cons,"good: built in velocity stack/funnel in neck, stop inside neck for proper mounting and extra surface area ontop of filter.bad: the mesh is bonded/painted on both sides of media, which also flakes off on the inside, into the engine. some of the wire mesh also comes out of the rubber base it is bonded into, running the risk of being sucked into engine. poor filtering, inside the neck of the filter builds up grime after about 5K miles."
5,Amazing,Rockwell Church is definatly one of the best groups out there. They not only have amazing tunes but also the most beautiful lyrics. This CD is really amazing - and listening to it you are in amazment of how awesome the music is. The last track - Doves Outside my door - is so beautful that the first time I heard it I hardly could talk. Seriously this is one of the greatest groups of all time. BUY THIS CD!! Buy all their other cds! Visit the web site. Get to know this group before they blow up and are huge - beasue they really are amazing!!
4,Through The Fall,This is a great cd. Mix between pearl jam and Vertical horizon that blends wonderfully
5,Very helpful insights.,"Having previously read Rainer's, Breakout Churches, I was looking forward to Surprising Insights, but it was better than I thought. Drawing from the experience of people who recently rejoined a church or as adults began attending church for the first time, he was able to open up and clarify what drew them in and what helped them to stay. Rather than theory or ideas based on people who are not yet in the church, this strategy offers perspectives that have some meat. I was surprised at some of the conclusions and I believe anyone who reads will be both surprised and energized by what is shared."
4,Worth reading if you are serious about evangelism,"This book was recommended to me by a friend. It appealed to me because I am an engineer, and the book contains actual data, not just opinions and theories. The author interviewed hundreds of people who had been unchurched, but then became dedicated church members, and tabulated the things that were important (and unimportant) in their decision to join a specific church. As the title suggests, some of the findings were surprising, at least to me. For example, contrary to what I would have expected, folks who had not been church members were largely looking for a church which preached and held to a definite doctrine, and was not wishy-washy about what they believed. However, the denominational name was quite unimportant, as long as the church met other requirements. If you are looking to understand what appeals to the unchurched, this is a good resource."
1,Ho-hum,"Unfortunately when they said ""Goodbye"" they didn't mean it to be taken literally. Major disappointment."
5,A must have for Def Leppard fans!,"The extra songs make it worth every penny. Def Leppard is like a fine wine, they get better with age. The boys are still in town! Also, there is a different picture of the band on the inside cover. WOW! Check it out!"
3,A little disapointed,"I was so excited to get this one of a kind import cd of Def Leppard and found that after I got it, I paid more than I felt it was worth. The music was good... but the song lyrics were weak as well as the variety (there were only 5 tracks). As a long time DL fan... In my opinion, I didn't feel the CD was worth the price."
2,Not what I expected,The left boot had an issue with the buckle. It caused irritation on my leg. I had to send itBack
5,Wonderful and easy!,"I bought this book based on the other reviews, and because over the years I have enjoyed baking with the holiday season baking magazines put out by Better Homes & Gardens. I have had this book about two weeks and have made the Pecan Bars and the Banana Bars. I took the Pecan Bars to a party and within 2 minutes of putting the cookie platter down I had three people ask for the recipe. I made the banana bars yesterday, and thought that I had died and gone to heaven. They are so rich and wonderful especially with the browned butter frosting. I know that I am going to find all kinds of favorites in this book, and that I will have lots of fun baking new things!"
5,Sonic Alert SBD375ss Sonic Boom Dual Alarm Vibrating Alarm Clock,The Sonic Alert SBD 375sss vibrating alarm is the only alarm clock that will wake me with my hearing aids removed. The 'buzz' feature is not loud enough to wake me from a deep sleep but the vibrating feature really works!
5,I don't wanna get up!,"I am a shift working, life loving, aint got no time to sleep kind of guy. Sooo, getting up can be hard to do. I bought this alarm clock for my wife and I. You can sum up my review in two words... IT WORKS!!!! Enough said :0))"
2,Poor design and construction,"The first one I got was defective and the numbers did not fully light, so I exchanged it. The next one worked. That is, it met all the claims in the specs, but very poorly. Construction was flimsy. The buttons we small, including the snooze alram. This made it very hard to turn off the alarm. The volume of the alarm could be set higher or lower, but the control was so easy to move by mistake, you could turn the alarm to almost no volume without even knowing it. The alarm was a very unusual high pitched tone. Although you could adjust the tone, this control had minimal effect and the alarm remained unusual and high pitched."
3,Still not loud enough,"I must be a hard sleeper; this clock is still not loud enough to wake me up. Thank God its got the vibrating pad.Likes: The big display, vibrating pad and the overall size. You can even very the volume and how fast it beepsDislikes: Cost, the buttons I find them to be a little hard to hit with out moving the clock. The clock gets warm when the display is on high.I have this clock above my head and the vibrating pad between the bed and the pillows. Because disk vibrates against the wood of the bed it makes more noise than the clock does.Knowing what I know now I would not buy this clock again."
1,Was nothing Special...Regular alarm clock with a bed shaker,I was really hoping to get something special..All I got was a plain Alarm Clock...I thought it was going to be super load..The random alarm clock I bought at Wal-Mart is louder than this thing...Not worth the extra money...It is about as loud as the alarm on my phone...
3,Not as loud as claimed,"We had expected the alarm on the Sonic Alert to be extremely loud but it was not any louder than other alarms we have used. However, the vibrator works great when placed in an empty tin can on the bedside table."
1,Never recieved Item and billed for it,I never recieved the item. I tried to contact seller but never heard anything back. I do not understand why I have not recieved the alarm I ordered in Sept.
5,This will wake you up!,"My 19 yr old daughter can sleep through most alarm clocks! Well, that has changed. After receiving this clock, she has not been late for college or work. Finally! The only complaint is that it also wakes up her roommates."
1,Does not do the job,"People think this is loud? It does sound different, and it is not quiet, but it is not really all that loud. Between the bed shaker and the audio alert, it does get me out of bed.But then the problem: The 'off' button is the same size and is easier to locate than the 'snooze' button. So, if you are at all bleary eyed and stupid in the morning like I am, you are far more likely to turn it off than you are to hit snooze. I bet the other reviewer who said it sometimes does not work right was just turning it off in his sleep rather than hitting snooze. In my book this is a fatal design flaw.Nice big display; But it just does not do the job."
3,Sonic Alert SBD375ss Alarm Clock,"I purchased the Sonic Alert SBD375ss Alarm Clock because it claimed to have a 24 hour format display. Unfortunately, it turns out that the 24 hour format display only works correctly with 50 Hz power, not the 60 Hz power we have in the United States. I did open the clock up to see if it was possible to change this, but the clock chip that is used (Sanyo LM8562) will only support the 24 hour format when in the 50 Hz mode. Other than this problem, the clock is very nice. The large green display is easy to read and the alarm can be very loud. I have not tried the shaker yet.I have only had the clock for about one month. I gave it three stars because the 24 hout display format is unusable here in the United States."
4,Should have bought this years ago,"Firstly, this alarm clock is not so loud that you will go deaf. I put the buzzer thing in my pillowcase but not on the side I lay on. It usually startles me awake...which is perfect for me! If you have trouble waking up, give this alarm clock a go!"
4,Great Product,"I have recently purchased this clock and I have only used the vibration alarm, but I love it. I think it works great and love the dual alarms. The only bad thing I can say is that it is really bright even on the dim setting. I would recommend this clock even if you do not have a hearing problem."
3,good for waking you up,"I have the portable model for travel and the regular model for home. I bought initially for the shaker so I dont have to wakeup my companion if i have weird alarm times. I dont even use beeper and honestly do not know how someone would not be waken by just shaker. The shortcoming I see, is the limit to alarms. They have 1 model with 2 alarms, most models have just 1, but there should be a model with more than 2 alarms for persons with medical situations, which I think was why it was originally created."
5,Unforgettable voice!,"Johnny Maestro's music is magical, he has the voice of an angel. His music brings back wonderful memories. There will never be another Maestro."
4,Johnny Maestro in total control!,"Out of all the 50's & early 60's Rock & Rollers, Johnny Maestro has remained the one singer who sounds exactly the same as he did back then. It's hard to believe but if you close your eyes, you can't tell it's a 21st Century concert. The BB harmonies are right on as well. The only complaint, and why I did not give this 5 stars, is the interviews that pop up between songs. It would have been nice to see the concert with no interruptions. But, by all means, get this. You won't be disappointed."
4,Worth owning,"Great song selection. Would've given 5 stars if it had been widescreen, 5.1 sound AND they hadn't mixed the interviews in with the live songs. The interviews were informative but they should've had an option to listen to them after the concert, not mixed into it."
4,The US Arms Export Complex,"This book is a must read for anyone studying modern US military history and especially US weapons procurement policy. This is not a ""shoot em up"" book, but a well detailed account of US weapons export policy and what the US actually exports to its clients. The question is often raised as to what happens to all the weapon systems when they're retired. This book answers that question as well as other questions about contemporary US military weapons procurement. Anyone who is begining a career as a procurement specialist in and around the US military must read this book."
3,A good book but not a great book...,"This is a good book and it reads pretty well. The story often deviates from Hughes (especially in the second half) to go into stories about many of the pilots and engineers that worked with Hughes. This isn't unreasonable because these are the people that the author had access too and they also have interesting lives. However, I feel that this distracts from the Hughes story and I suspect is done to fill in the many gaps when no one knew what Hughes was actually doing. If you are interested in the aviator side of Hughes I feel its worth the purchase."
2,disapointed,"The unit came in a box which could have been better packed. The door does not close tight so that the sand blows all over the floor. It worked for about 2 hours then the gun started not work except when pulling the trigger halfway. Which reduced the air flow. I still have to do three more items to sand, so I'm in the middle of fixing the gun and the cabinet. Next time I'll buy a more expenceive unit. You get what you pay for."
2,why the fuss?,"I cannot understand why the fuss over this book. The text is disappointing: repetitive, opinionated, insubstantial, more like desultory notes than anything else. The images are all black-and-white and poorly reproduced, and again repetitive and disconnected.There is too much horror in it. Bataille associates violence, horror, terror, pain, cruelty, with eroticism, madness, ecstasy, the sacred. Perhaps intense cultivation of pleasure creates a corresponding accumulative cultivation of pain. Why should this be so? I don't know except that we have what it takes to explore and we can explore in all and any direction. It's as simple as that.It's possible to write books and essays that are lucid and meaningful and it's possible to write ""The Tears of Eros""."
4,WOW!!!!!,"I'm enjoying reading the book. I find the author habitually repeats himself. Other than that, it is a good book."
3,"Interesting Topic, Only Fair Execution","While the concept of emergence is quite interesting, this book lacks enough depth to really cover the material in a meaningful way. The book is more a collection of brief essays on various topics, and does provide a useful overview of the topic.However, the same material in a more masterful writer's hands could have been a fascinating work. Each of the chapters only contained a skeletal outline of the emergent behavior, with nothing to flesh it out. Because the facts were so sketchy (and often amounted to prose hand-waving) I wasn't always convinced that the arguments were sound."
2,If you want to grow to hate sports just read this book,"This book presents an incredibly grim view of sports. Is there no good sports writing that actually deals with sport or do writers today only deal with the personalities and the pains of sports? If you want to kill any joy left of sports in your life then open up this book and let these writers open your eyes to everything negative they can find in sports. Even the ""uplifting"" stories present a world crashing down around people who have only 1 positive outlet in life, the sport they play."
2,Not worth it.,"These do not fit well on my jack stands. Like the other reviewer said they tend to pop off and shift around while lowering the vehicle. I thought after I used them once the weight of my car would press them on and snug them up. They popped back off when I pulled them out from under the car. Another thing that I want to mention is that the picture on Amazon, as of 10-30-11, for this item shows a round service jack pad along with the jack stand pads. THIS DOES NOT COME WITH A SERVICE JACK PAD AS PICTURED!!!!I was under the impression that I was getting a service jack pad with the jack stand pads. Shame on me for not reading the description more thoroughly."
2,Hey What's the deal?,"I see a picture and place an order, I expect the order to represent the picture. I only see 2 jack stand covers in the box I recevied/ Where's the Lift pad as pictured? I guess I have to wish it. Oh well.... Try try again..."
3,The best of Bill's books,Well this is the best of Bill Cosby's books. It still falls way short though. Children learning to read need better than this. It stops and starts. The pictures are great - I can't praise Miss Honeywood enough - yet the story disappoints. Best of Bill but my oh my this is pushing it Oprah!
3,ACTIONLESS,"AS A PARENT, THE REFERENCES MADE BY EACH CHARACTER'S HOBBIES LACKED TODAY'S RELEVANCE/COULD NOT KEEP MY CHILD'S INTEREST. ALTHOUGH BILL COSBY OFTEN TRIES TO ENLIGHTEN TODAY'S YOUTH WITH HIS PERSONAL CRUSADE WITH BLACK ARTIST'S AND ATHELETE'S, HE NEEDS TO REMEMBER HIS AGE GROUP AND DECADES IN WHICH HE IS WRITING."
5,We love Bernard!,"I bought this for my two year old who is obsessed with Where the Wild Things Are. She loved this toy. It is very durable, and very well made."
3,Not cat proof!,"I purchased this item from my local Walmart. It is a good mousepad overall, put it is certainly not cat proof! My little monsters eventually stuck enough claws into it to make the gel, which is VERY sticky and gross to the touch, ooze out so as to make it unusable.Probably a great item for non-animal owners, but if your puppies and kitties like to get up near your cozy, warm computer...I would not recommend the gel-type mousepads."
4,Comfortable,"The wrist rest is incredibly comfortable even after many hours. The plastic surface on the pad section has started separating from the base after about two weeks, but it's not breaking and there is always glue when it becomes an issue. Otherwise a fairly good mousepad."
3,Just ok,The wrist support works extremely well however the actual pad part started falling apart as soon as it was out of the packaging. I superglued it back to the base and it's holding up well now.
3,Your wrist bone won't pop out after using this one,"I bought fellowes gel because it had a comparatively larger area and a large gel pad and a more affordable price. My optical mouse runs pretty smoothly on this pad, although it feels kinds rough at first. However, the gel pad is not soft enough, and your wrist will probably be ""uncomfortable"" even after using the pad. I would not recommend this pad for hardcore gaming because of its limited surface area, but the gel pad is an added bonus (eventhough it gets scratched easily). Another complaint would be that the gel pad is not uniform. So, the area where the wrist wrests actually feels harder than the adjoining ""cliffs."" Nonetheless, something is better than nothing!"
1,Inferior product,"I bought this as a second, to use at my office. It doesn't match the original. It has a plastic sheen over the wrist rest that makes it not as soft as the original Belkin ""WaveRest"". Also, the mousepad surface is too hard, causing the mouse to slip around too much. Not good. This is the ""Crystals"" version and not as good as the orginal ""WaveRest""."
3,Warning: misleading picture!,"The picture for this item implies that it includes the mousepad, keyboard wrist rest, and mini rest. But that is not true; you only get the mousepad.The product looks cheap in the picture, and the actual product when it arrived matched that impression. But while getting all three for that price would be a good deal, just one is not worth it."
3,"Comfortable, but doesn't last long","The wrist rest is comfortable, the only problem was that after a couple months the piece of plastic on top of the mouse pad came loose. I can't get it back in place so it bubbles up and messes with my mouse. The area underneath is sticky so you can't remove the plastic piece and keep using it. I purchased 2 of these and it happened to both of them."
1,gel mousepad,within 2 days the pad is peeling away from the surface will not purchase this again will not reccomend to others.
5,Very Comfortable,I'm a PURPLE person.... love everything Purple...its a great addition to my office desk. Very nice and comfortable to use.
2,Delamination is a problem,"I like the gel wrist rest but after a few weeks of use, the surface totally started delaminating on both mousepads that I had bought. Somehow an air bubble developed in the middle of one of the pads. I could probably have some rubber cement or something to reglue it, but that shouldn't be necessary."
1,worst reference book I have read,This is the worst book on programming that I have bought. Mr.Barrie Sosinsky didn't write the book in a proper way where the readers can learn the magic power of Visual Foxpro.
4,"A decent overview, good for people switching from non-Visual","Sometimes too many details, sometimes not enough, but overall a good balance. And the methodology of walking all the way through one project works."
1,Very little value to anyone with a little Foxpro experience.,I bought the book because it was advertised as being intermediate to advanced level. I do not understand this since it is more like an end-user book. It certainly is not for one wanting to develope software that produces printed reports which was the reason I thought I wanted it. END
3,Mixed,"I'd have to say this book is disappointingto an extent. I'm a beginner to VFP and thoughtthis book would help me gain a betterunderstanding of how VFP works. It has inthat it does a great job of explaining thedifferent VFP commands in the early chapters.However, while Sosinsky provides step-by-stepinformation for creating differenttables, showing off VFP commands etc, he doesn't haveany data to put into the tables so the tutorialscan be rather confusing. It wouldhave been better if he had includedsample data to connect the tutorials together."
