class_index,review_title,review_text
2,Grandmother,I bought this sleep enhancer for a child of nearly two years. She was terrified by sounds coming from a stuffed toy. She is not one to be terrified and she is very intelligent. My take is this would be OK for an infant or an older child.
2,Does not work for me,I am having hard time training my six-month to sleep by herself. I am so desperate that I gave the sleep sheep a try. The sheep is cute. But the soothing sounds did not work at all.
2,Thanks for waking my kid up...,"I love the concept and look of the Sleep Sheep, but there are a couple of features that I don't care for. Firstly, the sheep is on a 25 or 45 minute timer (which may work for some kids) but I really need something that runs all night. My baby wakes up as soon as it goes off. Plus, the only sound that is continuous (like a whooshing, and the only I can stand listening to since he sleeps in our room) is the rain setting. (Mother's heartbeat is just creepy... not conceptually, just this particular version) The other sounds are obnoxious and distracting- especially the whales, though my husband likes them. I guess I should have just used my current alarm clock on rain setting all night. Lastly, it needs to be much louder! All that said, I do use it- and could see other families having no problems. At $30 or whatever, it is worth the ""gamble."""
2,"If its so great, why am I on my 4th one in 9 months?",Adorable and really helped the transition from rocking to sleep. But we use the heartbeat sound exclusively - and the 3rd one just died. I'm so disappointed.
3,needs continuous play option,"Baby falls asleep, but timer only has 23 or 45 minute options. Sleep sheep stops, baby starts. I getless sleep when we use it because I'm constantly getting up to turn it back on. Continuous play option would be great."
3,Sound Machine Doesn't Fit,"Am I the only one whose sound machine doesn't fit into the sheep? The stuffy is cute and the sounds are nice, but they are two separate pieces and the cut out where the machine is supposed to fit inside the sheep is too small! Maybe mine was defect.....?"
3,"Cute, not so practical","This is cute and convenient that it can be easily moved, but in hindsight I would have gone with a normal sound machine that plugs in and doesn't turn off after 45 minutes. My daughter wakes up to changes in noise and resetting this gets old. Also have to turn the knob to turn this off which is inconvenient when holding a baby, but its for baby so the batteries aren't easy to change, don't want to waste them."
3,Not as nice as I thought it would be,"I was looking everywhere for a stuffed animal to put in the crib that mimicked a mother's heartbeat. This one does have that feature, however it does not sound true to a real heartbeat. The rain and ocean sounds are nice, the whale sounds are like something from a scary movie though. I will probably not use it as much as I would have liked. Also, the fuzz comes off very easily on the lamb. It would not survive being washed or even spot cleaned very many times. It does look cute in the crib though. I will still continue to look for a better one and will send this back if I can find a new one in time."
5,Sleep sheep is great!!,The sleep sheep is a must for our new little boy. He always falls asleep peacefully to the rain noises. I was never a believer in soothers and white noise machines until this came along. Great product!!
3,"Cute, but flawed.","I was so excited about the adorable sleep sheep! But it was practically useless for us because of one major flaw: it only lasts for 40 minutes. Every time it would turn off, my baby would wake up screaming. I spent a couple of months trying to sneak back into her room to restart it before it turned off, often waking her in the process. If you have a light sleeping infant like I did, I recommend just getting a regular sound machine that plugs into the wall and can run all night long."
5,great baby shower gift,"I purchased this item as a shower gift for my daughter, when I took it out of the package and inserted the battery it was everything I had hoped it would be. I am very anxious for her to open it up and start using it."
5,Great for young babies,"I put this by the bassinet when I put my baby down for naps or for the night and it's awesome. It has 4 great settings: flowing water, ocean waves, mom's heartbeat, and whale songs. I love the mom's heasrtbeat for my son. It really soothes him and keeps him relaxed when I put him down. I woudl recommend this to anyone with an infant. It's a real lifesaver. I may have to by the travel size as well for when we visit family. It's a must have."
3,Music box too big for giraffe body,"The product is nice as a plush toy, but the music box that's supposed to go into it is quite a waste. The box, for one, is too big. In addition, the sounds themselves are not all soothing, some a little jarring to the ears even - and these certainly dont help my 20 month old sleep at night!"
3,A little tricky but adorable toy,"Once I figured out how to assemble the musical insert, this toy made for a great addition to my little boys' room. The noises/songs it plays are soothing and seem to help them get to sleep easier. My complaint is that the musical piece that goes inside the giraffe was next to impossible to figure out how to insert."
1,"Defective Giraffe, choking hazard","I just recieved this giraffe as a shower gift. The volume knob on the bottom without any pressure, popped off in my hand. Its the perfect choking size. Make sure to check yours, I was able to pop mine back on and off and it only seems to pop off when its at a specific volume.I will be returning mine, and I don't think I'll be getting another."
4,She loves it...,"The first 3 months the Sleep Sheep did not seem to make a huge difference. She seemed to be on her own schedule regardless of her surroundings. Since she turned 3 months old, now she is 1 year old, she loves it and it is a must have. The back is helpful now that she is one year she cannot turn it off as easily and fall asleep. I turn it on the ocean wave sound. I fall asleep to it too on the monitor. It is so soothing and nice--better than a CD player, snugglier and portable. It is helpful to time it to her nap and goodnight time. Now, we can't travel without it! I put it in the car on trips, etc. Actually, we had visitors the other day and my best friend fell asleep to the sleep sheep in our bed to the monitor that was still turned on from the night before during baby's nap time, my best friend seemed in a coma I could not wake her up! And she often claims she can never sleep. She loved it so much she wanted to take it home. It works for adults too. :)"
4,Super Cute & Cuddly however...,"I noticed the hair comes out rather easily... and with a baby that likes to grab and then put things in her mouth I am a bit leery keeping this in her reach. However, I think this product is a good value - the sounds are nice and it's a toy that actually comes with batteries - hooray!"
3,Great product except for major design flaw,"The Sleep Sheep is a great product, except for a huge design flaw. The buttons to turn the music on and off are on the back, which makes it difficult to reach them because the animal is meant to be strapped to a surface such as a crib or swing. You have to move it every time you turn the music on or off. **The on-the-go Sleep Sheep has the buttons on the side rather than the back, which is a perfect design. It has the same great features as the regular size but without the design flaw of button-location. It is just a little smaller in size. If you are interested in this product, I highly recommend you buy the on-the-go version to save yourself a great deal of frustration."
1,Sound Machine and Velcro Problems,"I was hoping for this to be an attachment object for my kids at night, but they (3 and 1.5 years) both can't keep their hands off the velcro and sound machine buttons. I had to remove the velcro lasso and take out the sound machine on the first night."
1,Horrible waste of money!,"Horribly crappy product! I don't know what all the hype is about cloudb products and I'm disappointed I bought into it! I expected a quality gund-like stuffed animal. Nope! Such a CHEAP stuffed animal. The soundmaker is supposed to fit in a hole in its back - but it doesn't fit at all! It's not meant for cribs, so where or why would you use it??? Absolute waste of money, I will be returning it!"
1,"dont have item yet,,","i still don't have this sheep.. not sure if it is lost or what not. i live overseas on a military base and sometime things get lost in shipment.. are you able to help me out??? leaving here soon, so i would really just want my money back.. sorry but i really need an answer.."
3,Unable to be accurate,Unable to comment and review the item accurately as this was bought as a gift for a newborn in the States and was delivered to her directly. I have not seen the item although the parents say the baby loves it.
2,Great idea!,Love this product! It's a must have. Too bad I did not discover it earlier. It's great white noise that I can put/take anywhere and lull my little one to sleep. I believe the timer is for 23 mins which most of the time is adequate for my baby to fall asleep.
3,I really wanted to love this.,"I really wanted to love the Cloud B Giraffe, but so far I think it's just ok. Here's my thoughts:Pros:-It cute and soft-The sounds are relaxing-There is a variety of sounds to choose from-Volume control-Convenient handle to attach it to a crib, stroller, etc.Cons:-The ""fur"" seems to come off easily, I'm not sure how long this product to stay looking nice-The buttons are very sensitive and turn on too easily-The automatic shut off is too short, my son wakes up when it shuts off...the company should have a choice to just leave it onSo far, it's not the answer to my babies sleep problems...but it is cute!"
5,good,"The effect is quite good, beyond your imaginationJust started to buy just like the sheep of appearance, but received tried, found that the effect is really beyond my imagination, baby every day to listen to the sound of the waves to sleep. This is worth to buy!"
5,Love the Sleep Sheep except..,"I love this! My daughter is 9 months old and has used this every day of her life! It was especially good for her while she was in the NICU for 2 months. Just recently the sound machine stopped working, but i contacted customer service at cloud b and they are sending me a new one :) highly recommend!"
2,Did not work for my child.,"You may want to try this sheep for yourself, but it did not work for my son. He is now almost 4 months old and he has not cared about this sheep and its sounds from day one. I have the soothing seahorse and aquarium soother and both of these put my child to sleep fast. I would recommend those products, but not the sleep sheep. What attracts him most is the light and he prefers songs to the sounds of the sheep. I give 2 stars to the sheep just because it is super cute and I think we can use it later as a toy. It is also very soft, so I think my son will eventually like it once he can hold things."
1,Poor quality--shorts out,"While it worked, it was alright. However, after about 2 months of use it shorted out and will not work now. Same story with our CloudB giraffe. I also hate the 45 minute shut off and wish it would play continuously as to not wake him up. Save your money and download an iPhone app or go to a white noise website on the computer."
5,Adorable!,"The Cloud B Gentle Giraffe is a great way to distract/soothe a fussy baby! It plays different sounds, and has a velcro strap to attach it to carseat or stroller. Highly recommend!"
5,Love it,This is probably one of the best good ways to put my kid to sleep.We are loving it so much that we are using all the time.
2,Great giraffe but seam tore,I was given this giraffe at my shower. I love it and was hoping my son would too. Within 2 weeks of use (just for music as my son is too young to interact with it) the seam has opened up and the leg is falling off. I don't know how this happened as it hasn't been used much. I feel like it was just not stitched well. I have contacted the company so I hope they will replace the giraffe.
4,Sheep,Very sweet and soft with soothing sounds. Still a bit large for 5 mo. old. Baby will love it more as time goes on.
4,Sleep time,I bought this for my 7 Month old Son. We had a bassinet that played similar sounds which helped him fall asleep. He loves the Sheep its portable for when we travel. It seems to be well made.
4,Absolutely excellent gift for baby showers!,This is my new baby shower gift! I think it is adorable and the sounds are very soothing.
3,cute but unrealistic sounds,"The sheep is very soft, cuddly, and cute! I did not think the sounds sounded very realistic~more mechanical than sounding like an actual heartbeat or ocean, although the rainstorm option does sound nice. Despite my disappointment in 3 of the 4 sounds, I decided to keep it anyway based on the rain sound and how soft and cute the sheep was."
5,Excellent Baby Sleep Aid,We've used the Cloud B Sleep Sheep since our baby was born. The product is well made and has lasted 7 months thus far on one set of batteries (used nightly). Initially we tried the white noise setting which worked well when he was just born. Most often we use the whale noises and he goes right to sleep (it's the same on both the Sleep Sheep and Sleep Sheep on the Go). The heartbeat setting was also good since it mimicked my heartbeat.
3,sleep lamb,"I was a bit disappointed because it was obvious that the package had been opened, there was no instruction booklet and the lamb looked a bit ""used"". I think I got a used item and was charged for a new item."
3,Sleep Sheep,"Grandson (15 mos) took little interest initially, but is now enjoying. The white noise generated seems to be soothing ro him. Whether or nor it induces sleep remains to be seen."
2,it's ok...,"It's kind of big and awkward. The sound machine part that's supposed to fit in the ""spine"" of the giraffe keeps peeping out, so it's kind of hard when the baby bring it to her face. I feel like it could fit in better."
1,"Good idea, but has a few flaws","The sheep is very cute as a stuffed animal, but we ended up taking out the sound machine portion because it was too hard to turn it on when it was in the sheep and attached to the crib. And since it only stays on for a max of 45 min we had to restart it a lot. In the end this was also not loud enough. Save your money, time and sanity and purchase a sound machine that runs continuously."
4,"Perfect, but for one thing...","We've used this nightly and during nap time every day since bringing my 8 week old home from the hospital. We love the different sound options and the volume control (we turn it up loud during naptime since it's noisier during the day). Even my husband will say, ""turn on the lamb"" when we get in the bed. My one complaint is that there is no continuous sound option so I find myself turning it back on in the middle of the night. Otherwise, it's a perfect product."
5,"Sweetest, Most Comforting Thing!","I saw this Sleep Sheep on the NBC television show, ""Chuck"", and it looked so cute that I had to get one. I received it within 2 days of ordering it and I'm so pleased with it! The material is so soft! The different sounds that you can choose to play are very soothing. I don't mind admitting that I keep this for myself for when I'm having trouble falling asleep at night. My kids are too old for this, so I win!"
4,Adorable but Finicky,"I recieved this as a gift and instantly fell in love with it. I registered for a Womb Bear but this is perfect because our nursery is Safari themed.The only problem I have had so far was getting the sound box in the back. After 20 minutes of turning it everywhich way and seriously contemplating cutting a hole in the liner, I finally got it in. The trick is to get it perfectly lined up and then push it straight in. In other words, don't try sliding the top in first, then the bottom or vice versa. Once in, the volume button is a little hard to get a hold of and twist but it's totally worth it for how darn cute it is!"
2,Fundamental FLAW,"FLAWED.As a number of other reviewers have noted, there exists a fundamental flaw in this product's execution: the sound _SUDDENLY_ cuts out after the timed period. This can abrogate any beneficial effects the soothing put-down sounds have had, raising your child from the state of sleep they managed to reach.All it needs is a min or two long volume fade down in order for this to be a great product, rather than the sadly missed mark that it is.I emailed them in the hopes they might forward on the device's plans such that we could do a quick DIY hack on it to introduce our own fader, but they didn't address the question, instead choosing to advertised future products. Disappointing.I like(d) it, but then have to be grumpy about it. Oh well. Perhaps it teaches our child to deal with the sudden removal of nice things, a bit like life, like expectations (ahem, case in point)."
4,Great but...,"I wish the timer could be set longer than 45 minutes as it sometimes wakes my baby up when it turns off. Other than that, she LOVES it."
4,Pretty good!,"Not too bad, soft and plush, but sounds are pretty muddy. Overall, it does it's job and gives our little once something cute to look at!"
3,"Good idea, better options out there","Fortunately my son doesn't wake when this shuts off but I could see that being a problem for many parents as it is an abrupt end to what was a constant sound. My son does love the Giraffe, more so than the sheep - makes different sounds but the only one like white noise is ocean waves, he will cuddle up next to it at night and fall asleep. It doesn't get very loud especially when the batteries get low but is enough to comfort my son."
4,It was a gift!,Larger than expected and a 'dirty' white color. Sound features were good. Probably would have passed if I had seen it first.
3,It's okay... but I wish it didn't shut off automatically,"For all of you sleep deprived parents out there, let me do you a favor and make one thing very clear: the Sleep Sheep does NOT come with a continuous operation option.If your kid is like mine and wakes up as soon as the noise machine turns off (which is about the worst thing in the world), then skip the Sleep Sheep and go for something with the option of running all night long. TheHoMedics SS-2000 Sound Spa Relaxation Sound Machine with 6 Nature Sounds, Silverworked well for me - it is cheaper than the Sleep Sheep, you can choose whether or not you want it to run all night or shut off after a certain amount of time and, as an added bonus, it comes with an A/C adapter."
2,"Great idea, cheap, cheap, cheap construction","Short and sweet, great concept, the sheep is cute, sounds are pretty good (although we stick to the ocean sound usually), but we have gone through 3 of these so far and are ready to return the last one and try something else. All bought from Target, everyone of them has malfunctioned within 2 months. We got an exchange for the first one that would only work intermittently after 1 month of use. The second sheep would not switch to the 45 minute mode. Returned it for another one....after 2 weeks it will shut off if it is bumped slightly.....ugh. What a POS product. Would it kill the manufacturer to make a quality product and just charge us $5 more? Just a waste of a great idea."
3,Good but not great,"My mom bought this for us as a shower gift. It's been nice to have but not essential. First of all the heart beat needs to be slightly quicker. Second, the jungle sounds are a little too stimulating for my little one. She likes them when she is awake but as far as playing them at night...it keeps her attention so then keeps her awake. The white noise one is the best one overall. It does have a couple of different settings but I wish it would let me play it continuously instead of having set limits. I know I would go through batteries fasster but let that be my choice."
4,"Cute, sound box mis fit","This little sheep is adorable, and super soft. The sounds it makes are pretty soothing, but the sound box doesn't fit in the slot in the back all that well. I tried for several minutes with little success, but my husband was able to make it fit better. You just have to put the bottom end in first. I love it so far, except for that! Our little one isn't here yet to test the sounds out on him, but will update the review when he does get here."
3,cloud b sleep sheep,"Overall I like the sleep sheep, its soft and loud enough for baby to hear, but not overly loud for everyone to hear. I think the product is a good purchase if your child will stay asleep even after the sounds shut off. i wish there was no timer option, for my daughter after the sound shuts off she woke because of the silence.i would recommend product if you just need sound to get to sleep, but not if you want to drown out noises in the home."
3,only 4 sounds,"I bought this because of other reviews, I wish I had just downloaded a cd of white noise...we take it in the car and strap around his crib rail, the rain is the most calming sound for assisting getting our son to sleep. My husband falls asleep before our son with this on."
5,Baby Shower Gift,I purchased this as a baby shower gift for our granddaughter as it was on the Amazon baby shower gift registry. Everyone who already has younger children oooooed and ahhhhed at the Sleep Sheep and said how much their infant children responded to it positively.
2,"Good, not great","This product would be perfect if it had a continuous setting. We use the 45 minute option exclusively. It helps our four week old get to sleep, but he always wakes up when the noise turns off. We have to wake up and push the button again for him to settle back down. I would buy something different with the option to stay on all night."
3,Its just ok,"I was so thrilled to get this in the mail. I attached it to my son's crib and it didn't stay attached well. The musical box is in its separate area in the back of the sheep (too bad they don't show the back of it in the pictures) and its not a tight fit. The sheep itself is cute, the sounds are just ok, but the way it was crafted could be better."
1,Died after 6 months,"I put this giraffe on my daughter's wish list, and she got it from her aunt. At first, it worked fine, and my daughter loved it. After 6 months of gentle use, it died. Although a nice idea, this toy does not last and is not worth the money."
2,Creepy sounds,"The soothing sounds from nature were really very creepy sounds, very ominous and fuzzy sounding which was unfortunate because it is really cute and soft. We returned the item anyway because the sounds were just not clear or soothing at all!"
5,great product,I bought this for my baby due in Jan. Then I decided to try it out with my 1 and 3 year olds at naptime. It worked! They were both very quiet the whole time which is very unusual for them. The same thing at bedtime. If this keeps up I'm going to have to buy a second one for the new baby!
5,Do you want/need your child to go to sleep easier? Then get this SLEEP SHEEP!!!,"My wife ordered this ""Sleep Sheep"" for our six month old daughter. Our daughter has been sleeping through the night starting at 6-8 weeks old. But when she is over tired at night, we just put her down in her crib with this sheep and within minutes she is calmed down and sleeping. We even find he cuddling with her new little sheep.Once she starts at the day care provider (in three weeks) we will purchase another one to help her take naps in the new environment!!!!If you buy this ""Sleep Sheep"" you will not regret it!!!"
5,Wonderful,The little giraffe is so cute & cuddly. The sounds are so soothing. I think my new grandbaby will love it!!!!!!!
3,"Good Product, some major flaws","I actually became pretty reliant on the white noise to soothe my newborn and keep her asleep. This is a nice product, but has some major flaws. First off the timer settings really are a disappointment, the longest you can set the device for is 45 mins - which is too short. Most newborns sleep cycles will be 45- 60 mins, meaning that at the 45 min mark they will come into a brief waking point. If the device shuts off then your baby can awake fully and get upset that the very noise which soothed them asleep is now gone. I love how the device is easily transported and attached to a crib, stroller, car seat or swing, but I sure wish it had more variable settings. I also think that the velcro is a poor fastener, its rough and doesn't look nice. It would be great if it came off entirely or had snaps instead of hook and loop. An otherwise great product, apart from these two pretty major design flaws."
1,terrible/broken,Great idea. Used it twice and then it broke. I tried replacing the batteries but it still didn't turn on unless I banged it on something and then it turned off 10 seconds later. Got it as a gift so I can't return it or I would.
5,Great Product,"My Mother-in-Law bought this sheep for my son when he was 4 weeks old, he's now almost 7 months, and we're still using it. He loves falling asleep to the ocean water and falling rain sounds. I would recommend this product to anyone who wants to calm their baby or help them fall asleep."
5,Great!,"My baby loves the heartbeat sound. It makes him fall asleep immediately. The other sounds are lovely too and the sheep is adorable. It is not white, but a cream color that goes very well with any room decoration. I love it!"
