class_index,review_title,review_text
3,Nice but....,"I was very excited about this set. But as we started to put the chairs together we noticed the first one wasn't completely stained. For some reason a 50 cent piece on one of the legs has no stain on it at all and it completely stands out. So disappointing. Other than that, the structure itself is very good."
5,Great Table/Chair Set,"I decided to purchase this table/chair set after much research on-line and some in-store shopping. From what the reviews stated, it was the best one on the market for the price. I was excited to receive it a few days after purchasing and once the hubby and baby (17-mo old) put it together, I was very pleased. It is very solid and looks great. Definitely a good quality table and durable chairs for the price compared to the ones I checked out in the store. I highly recommend this purchase."
4,Great table and chairs,"We bought this set for my daughter and she loves it. She is not quite 2 and she sits here to eat, color, practice drinking water out of a cup, etc. So far it seems pretty durable (she likes to sit the chair on its side and sit/stand between the legs) and my husband had no problems putting it together."
1,VERY DISSATISFIED WITH THIS ITEM,"This table & chairs set was purchased because of the high ratings given by previous buyers. This was a Christmas gift for my twin grand children and it is not suitable for them to use for years as advertised. I am totally dissatisfied with the quality of the material used to make the table & chairs - very ""soft"" wood that marks easily with a finger nail & the table arrived with a crack in it!! Complained to the seller, sent pictures of the damage & received a new table top ONLY that was of the same poor-quality so-called wood. To get a new replacement that would hopefully be better I would have to pay shipping to return the defective set! Not very good customer service and really crappy product. Would NOT EVER recommend this product or seller to anyone!!! TOTAL WASTE OF $100!!!!!"
2,Smaller than I thought it would be,"I wasn't very impressed by the table and chairs. It was so much smaller than what I thought. It looked the correct size in the pictures, but in person it looks very miniture, almost like a doll's table and chair set. My daughter who is almost 2 will outgrow this set quicker than I'd like. It's good quality and the espresso color looks great, but the size of the table and chairs is a disappointment. This should be priced half of what it is. I think over $100.00 is overpriced for this item. Not very happy with this purchase."
2,Very cheap. Not good for children,"Sadly, my return window expired before I actually opened the product (I bought it for a holiday gift in Oct. and didn't assemble until the holidays)My children (a 2 and 4 year old) had this set so dinged up and scratched in 1 week from just using it to eat on that I was really shocked. The wood is very lightweight and very, very easy to muss. There was a giant gouge in one seat from a snap on a pants pocket! Not at all worth the $. I bought this thinking it would last until they were old enough to sit at the ""big"" table, but it looks so junky and it's only been in use for a month-I will be replacing it as soon as I can save the money. It's way too expensive for how easily it is damaged. If something is made in a child size, it should be able to take a little wear and tear easily. This has been in use for 1.5 months, and looks as if it's been used in a daycare for a year."
2,Chips very easy,"My wife bought the table for her in home daycare to replace a metal card table type kiddy table. I was afraid the wood might not hold up as well as medal. So far I'm not too happy with the wooden finish of the table, it chips very easily. We have 3 kids all around the age of 2 that eat breakfast, lunch and snacks at the table 5 days a week. The strength of the table and chairs seem to be ok for now, but its only been a month so we'll see how well it holds up over time."
2,After a year of use...not impressed!,"We decided to purchase this table for my 18 month old daughter (at the time) last year (2011) for Christmas. We were so excited to set it up and have her use it. It was great for about 6 months, now after a year of use, the finish is chipping horribly, the chairs are falling apart and it was not at all as durable as I had hoped. I would advise paying the extra money for a more sturdy durable activity table. Buyers beware if purchasing for a busy toddler, no chance in it lasting over a year."
2,table is ok. it is not sturdy at all and it scratches easily.,"I bought this table for my 1 1/2 old son. It was much redder that it looked in the photos. Also, it's very light-weight wood and not very sturdy. Lastly, the finish on the wood has already chipped off in several spots, and we've only had it a month. I woudn't recommend this table. If I were to do it again, I'd save the money to buy a better table, like the one from Pottery Barn Kids."
1,Piece of junk,"This table and chair set had soooo many problems. The table top had a huge split running down the entire width of the table. Assembling the chairs was a disaster as the pre-screwed holes are uneven and inconsistently sized throughout, causing all of the chairs to rock from side to side and in a bad way. Our daughther even slipped off the chair because the unevenness/rocking was so severe. The wood seems very soft and had several cracks near the pre-screwed holes. I'm definitely returning this piece of junk.I just don't understand all of the glowing reviews. I suppose if you're going by looks alone, it is a handsome set, but the construction and quality is CRAP."
4,Looks great - we love it - but it scratches easily,We bought this table for our 20 month old son and he took to it immediately. Looks great in our living room and was easy to assemble. Furniture is sturdy. I must criticize the finish on the table... it scratches remarkably easily (my toddler managed to make his mark within a week). But I would still recommend the product.
4,Durable structurally but scratches easy,"Great product, beautiful but scratches easily. I bought it for my twins (2) but my 6 year old can also sit comfortably. All they do is eat on it and the table top already has scratches. If they played games or toys on it, it would probably be scratched more. Easy to put together! I did it by my self in under an hour. Once I figured out the first chair, it was a breeze after that (no written instructions, only pictures but a little hard to follow - but easy enough to figure out)! I'm happy with my purchase!"
5,Great toddler table,"20 month old daughter loves this table. Great for coloring, reading, snacks or meals! Sturdy enough for us to join her. The color matches our kitchen table which she loves."
4,Could be a tad more stable,"Likes:Very easy to put togetherVery easy to cleanFour chairs for a great priceDislikes:The table is a bit light so it moves a lot.Chairs are also light so when getting on and off they tip over easilyTable is a bit small for four chairs.Overall a good purchase for us. If you're looking for something to last for multiple children you may want to splurge on something a little more ""solid"". Just the right height for my 18 month old (who is 95th percentile in height). I could seem him quickly outgrowing it though."
4,Quality kids table and chairs,"This kids table and chair(s) set was received in excellent condition. Care was taken to ensure it was received without scratches, dents or any physical damage. The quality of this product is outstanding with easy to assemble instructions. I would highly recommend this product for 2 -5 year olds."
5,Great Set!,"I have owned this table for my child for over a year. He is now almost 3 and this table still has room for him to grow quite a bit more. He is also very tall and big for his age. Over the past 1.5 years, he has eaten most meals here, colored, paiting, climbed, dragged it and the chairs around, etc. all the things toddlers do and this table and chairs have held up so well. They clean easily and are very sturdy. Anymore it is hard to find things made well and that don't break down. When we were shopping for a table and chair set it seemed like this was all we came across. We gambled on this one and it was a great choice. I would buy it again and again and I would recommend this to others for sure!!!"
4,Perfect toddler table,"I absolutley love this little table! It is perfect for my 19 month old to sit down and eat dinner or to do draw and paint and do arts and crafts,. He uses it everyday and I think he likes it a lot. We had the Little Tykes picnic table and he would fall off because the attached benches were not spacious enough for function. I am very happy with this table and the price on Amazon was unbeatable. The same table with just 2 chairs was $150 at a local toy store in New Orleans. I got the table with 4 chairs for $108 free shipping, no tax on Amazon. My only negative is the screws are visible. The wood is super solid and strong. I just do not think things are made like they used to be. Why leave the screws exposed? I got over it. Love it!"
5,Worth the $$,"After a lot of research and reading reviews, I decided to get this table set for my 19 month old grandson. I am so happy that I paid the extra $$ to get this! My grandson loves it so much.It arrived less than a week after I ordered it, no pieces were missing, nothing was broken and it was extremely easy and fast to put together.This is a sturdy set, my grandson loves climbing on it and sitting on the table. Best of all, it's the perfect size for him and it will last for years. I was concerned about getting a set that had unstable chairs but this is made of solid wood and he has no problem getting into/on the chairs.I have recommended this set to my family and friends."
4,Kids table set,"We love this table and chair set. The only down fall was that they used a pen on it, and it won't come out. On other tables, the pin did come out. It's very durable. Adults in our family sit on the chairs and they hold up great. It was a pain to put together. The screws were a little hard to handle. Overall it is a quality solid wood product that I would buy again."
5,Fabulous set for the $,"I was looking at a much more expensive (double the price) set at a well known high-end retailer... My friend has that set and this one (espresso) looks identical, PLUS has 4 chairs instead of just 2! It's lovely in my kitchen, matches other furniture and my daughter loves it. It was easy to put together and very sturdy. We couldn't be happier with it. My 2 yr old daughter colors, paints and eats every meal at her ""big girl table""."
5,Great Set,I ordered this table and chair set for my grandkids (ages 2 & 4) who live with me and it was one of the best purchases I have made. We have had the set for over a year now and the quality is fabulous. It is something that gets used everyday. I would most definately order Kidcraft again.
2,Looks great but is really cheap!!!,"When putting this together I thought it was very sturdy and durable. After less than a week of using this product the finish already started to peal off. I took the time to polyurathane this product in hopes it would protect it from the cheap finish. This has helped a little bit but the finish is terrible. If you are looking for a product with good quality, this is NOT the product you want."
5,Great quality,"This table is not only great quality for the price, it's just great quality in general. Easy to put together, sturdy, easy to clean and my 3 year old loves it."
3,Chairs were broke,The table is great and for the most part easy to put together. Everything went together with ease until the last chair. The whole for the cam was too big and the cam spins instead of the screw moving. Now I am stuck. Can't get the chair put together and can't get it apart. Called customer service for the manufacturer to only be on hold for close to hour and kept getting disconnected before I ever spoke to a person to explain the problem.
4,Perfect Table and Chair Set,"As with other reviews, I too am happy with the quality of this product. I've ordered other KidKraft toys with great success; it's reassuring to know they consistently produce top-notch items. The color shown is a true representation of what you'll get. It looks fantastic with our decor. It's the perfect edition to round out my 2 year old granddaughter's kitchen play area. Now she can cook and serve her meals for all to enjoy. I know she'll get plenty of use from it over the years to come."
4,Good Little Table,We got this table for our 15 month son. The chairs are just the right height for him to be able to climb into them. The table feels sturdy enough that he will be able to bang away and not cause it much harm.The chairs are sturdy and I (being 190 lbs) can sit in them without the fear of breaking them.We've had the table for about a week and it is exactly what we wanted and expected.
4,Tema muy bien tratado,"La eterna pugna entre la libertad de la madre de disponer de su cuerpo y el derecho a la vida del feto.Me parece que fue tratado con mucha seriedad y la manera en la que razona su voto el Ministro de la Suprema Corte, en la que involucra ambos derechos, ambas libertades, sus implicaciones; pero las liga con el derecho a una vida digna de los nios no deseados, creo que fue sensacional.Realmente la recomiendo."
3,"Fun to play, but over too quick",My first Nancy Drew game and I thought it was fun.It was just over too soon. I wish they had more levels and perhaps each time you play the game some options would change so it isn't always the same ending. Overall I did like the game play and if I had to I would buy it all over again.
3,Fun while it Lasted,"I got this game for Christmas and was excited to play it, I loved playing it but I finished it in one sitting. So it's fun if you want a quick game but if you want one that is tough and long and hard don't buy this one."
1,Over before it starts....,"I'm a huge fan of Nancy Drew and wanted so badly to love this game. Alas, it was not meant to be. By the time I figured out some of the mini-games, (which you can beat by randomly banging on buttons) Nancy is solving the mystery and its over.The dialogue screens become really boring with the same image flashing over and over again.The one thing I found fabulous with this game, was that Nancy, in not so many words, told her boyfriend she wasn't giving up solving mysteries to dote and spend all of her time with him... I had to laugh... the original Nancy Drew from the 30's packed her dad's revolver, they kept that same spunk by letting the boyfriend know it wasn't always about him."
2,Too short,"We bought this game for my daughter for Christmas. We gave it to her about 1 o'clock and she was done with it before dinner. That's too short a game for the money. She didn't even play it for that whole time, either."
1,Might be ok for kids,"Like the previous reviewer, I'm hooked on the Nancy Drew PC games and pre-ordered this one. There is no challenge to this game at all, you walk through rooms and everything that you are supposed to see is highlighted. The mini games that you play to make characters more willing to talk are extremely easy. It might be an ok game for a child, but if you're an adult and want something that even remotely resembles the Her Interactive PC games, don't waste your money on this."
1,HATED IT,"I Purchased this game and I wish I hhadn't It is soooo easy and when the mystery is solved thats it. I even wrote to the maker of the game to ask if this was a joke and maybe there was some kind of hidden games, they never responded. now i know why. PLEASE DON'T WASTE YOUR MONEY! DON'T BUY THIS GAME"
5,Great for younger Nancy Drew fans!,"I bought this game for my 9-year-old daughter. Her older sister & I enjoy the computer Nancy Drew games, but they are a little too hard/scary for my youngest. She really enjoyed this game -- it is perfect for the girls who want to play the other games, but aren't quite ready. It took her a few days to complete, and was just challenging enough that it kept her interested, but not frustrated."
1,This game sux.,"It's bad. If you want to play a fun DS detective game, get Touch Detective. With this game, it's hard to manuever around - you have to use the + keys, not the touch screen; it's mostly reading - not much sleuthing; the games are easy - like 5-year-old easy; everything is highlighted the minute you walk into a room. The touch screen is hardly used! The PC Nancy Drew games are fun. This one is a dud and a waste of money. I pre-ordered hoping it would be good. Blech."
3,Not like the PC game,It is a cute game but no where near as exciting as the PC games. I hope that they figure out a way to make it more like those.
2,Very little to do - Games Plays it's self,"I play the Nacy drew PC games and thought the DS games would be just as fun. They are, at least this one isn't. It felt like the game was playing its self."
2,A word of warning....,"I just thought that I'd jot a few words to let people who are interested in owning this figure know a few things.....First of all, it's 2 figures...there is the Tree-like Blair Witch, and the Zombie Blair Witch. The packaging and promotional material make no mention of that fact. I ordered the figure assuming (and rightfully so...) that I would be getting the Zombie figure I had been seeing for months in all of the print ads. Not so.....Second- I can't speak for the durability of the figure I REALLY WANTED, But the Tree Witch figure broke in 2 places as soon as I had it out of the box. It's VERY frail, and the hands are really easy to break.I'd advise buyers to beware...."
1,"""Hey, the Blair Witch isn't in the movie!""","That's what most people will be thinking when they see this new toy sculpture from the popular Movie Maniacs line. This is Todd McFarlane's personal vision of what he imagined the Witch to look like. Not being a fan of the film, I can't say if it's what I imagined, but McFarlane completists will want it, even if it is a bit wooden [ha!]. I'd stick to the Terminator in this series though, that's the keeper in this line."
4,Handy Guide,This is a very helpful guide to a vexing issue. The book is a very easy read and has a good bit of great information. Its only drawbacks are dated material and the habbit of rapid topic switching by the author. Neither issue is overly vexing but the latter dose require the reader to pay special attention at times.
3,tennis racket,This is a bit boring and my 8 month old got bored soon. At 1 year and 8 months she is still bored with it. Though it lights up and looks good.
1,This film is a waste of your time and money,Simply put it's one of the worst movies I have ever seen.
4,Very fun and cute,"I just happened to rent this out of the blue, and was pleasantly suprised. This doesn't have the biggest budget obviously, so the dance and song numbers can be underwhelmingly. But it makes for a sweet romantic comedy with a little bollywood fun thrown in. If you liked Bride and Prejudice, then you'll like this bollywood-lite film also."
4,West Side Story with a happy ending.,"This movie is suprisingly engaging. Though a simple plot, the subject matter is timeless. The movie was done tastefully and unlike American similar movies, done without sex and violence. Nice music, uplifting and entertaining."
2,It wasn't what I had thought it was.,"Unfortunately, this product was not what I thought it was going to be. I saw it and it just was what I had had in mind or what I understood."
3,it fulfill the need,"the scale is a bit odd, steps of 1.4 .... mmm kind of a design flaw, i was expecting something more like steps of 1 or 10... but it works"
3,"Good wrench, bad lower end torque","I bought this wrench with the intent of using it to torque my carbon fiber racing bicycle. While it does just barely make it to the torque specs I need, it does not go any lower than this so I can't torque my bike to a slightly lower tension than the max allowed."
5,A genre classic,"This is one of my favorite movies and a classic in the genre.Just watch it to be entertained, watch it to see an incredible imagination or really delve into the themes and questions it raises. I love the story line and the ""dirty realist"" approach to some off the strange settings and places.You can appreciate this movie on a number of levels, its story has ever twisting interesting events and the ending is a real surprise."
4,Memory foam,"This was a gift for my Uncle and Aunt, they loved them and sleep well on them. They were delivered on time ."
4,Good Paper Airplane book,My 9-year old daughter really enjoyed this book. She built all the airplanes and she included information on the aerodynamics in a book report. She is also happy to be able to use the right vocabulary when talking with her pilot grandfather.
2,"A lot to like, but not what I'd hoped it would be.","I suppose that it is what it is, and if I went in expecting it to be something else, then the problem is mine. But I'd thought there would be at least some footage of the Mats, maybe a bit of their music, even if both were de-emphasized. I should have done some research outside of watching the trailers, though I guess it should have occurred to me then that neither would be present in this film.Watching this film is a lot like sitting at a bar while someone who knew a famous guy tells you all about him. Technically it's great, it's assembled with care and well-edited. Grant Hart's interviews in particular are a real treat.But an hour and a half of that? I don't care who the chatty guy at the bar was, I'd have told him to shut up or just walked away mid-wistful recollection long before that.I can't think of a situation where I'd watch it again, and I wish I'd have rented it instead of buying it."
4,"Great movie, but a different spin on a documentary.","This movie is definately not for those who want to see interviews from Paul, Bob, Tommy, Chris and Slim. It's also not for those who want to see footage from shows or hear their music. However, it is a great look at the band and how they have impacted so many people. The Mats were never a huge band, and yet they have a strong following and influenced so many other artists and fans. The footage of other fans is really a neat way to know that there is a community out there who was as influenced by the music as I was and am. I would not recommend this if you want to crank the volume to 11 and hear Hootenany, but it's a great way to remember the band and the times you had with their music."
5,Great movie about an amazing band,"This film is an absolute must see for any Replacements fan. Neither the band members nor any of their music appears in this film. Instead, the story of The Replacements is told entirely through those who knew them best - their friends, their fans and their contemporaries. Throughout the film, you get the history of the band from those who were there seeing them in the early days, and the stories about the band from those who were there to witness their antics. It's a really well done film that's a blast to watch again and again."
3,This was fun - but would be better if The Replacements were in it,"It was great to learn so much about the early days, but it feels like half a documentary. Replacements performance and interview footage would have made this a home run. That said, there is so much to learn in the first hand stories about the band that are found here. Plus, the behind the scenes drama that only the insiders featured in this film could share is worth the price of admission. If you like The Replacements, then see this, just don't expect to see footage of the band.Best reason to watch this? Grant Hart and Greg Norton from Husker Du are in it."
5,Incredible documentary for an incredible band.,"The Replacements are, in my opinion, the greatest band ever and this film did them justice. From the time it starts to when the credits end, Color Me Obsessed had me riveted. The interviews are great and are funny one moment, moving and poignant another. I have been raving about this movie to whoever will listen."
2,A Good Idea with Poor Execution,"I watched this once and enjoyed parts of it. The filmmaker utilized a lazy and unbalanced approach and it shows. He uses the same graphic over and over in between scenes which becomes a headache almost immediately. One of the most annoying facets being his audible talking over crucial interview subjects. For a fan of the group this is worth watching, but this high school film project may not be worth the sticker price."
1,No Replacements Here,"No Replacements music (not a note). No Replacements (not one single band member represented). No photos, no nothing, just a bunch of yappers talking about how much they were fans. Bar none the lamest ""documentary"" ever made. Crap."
1,Boring,How could a film about one of Americas most raucous bands be boring? Let's start with the fact that there's no Replacements or their music in this thing. Some have called this an amazing choice. I call it idiotic. You REALLY have to want to watch hours of people just talking about them to enjoy this. I'd prefer THEM telling us about heir careers. I'd have thought they could have licensed a few of The Mats better songs. They thought there was no need for music in a film about music. Figure that one out.
5,Great Vest,"Bought this last weekend because I was sick of digging in my old vest pockets for items. This vest has so many different pockets, hangers, hooks that you can customize it to however you want to fish. Also, having two fly boxes built in is great if you, like me, fish two different areas regularly. Fits great over my waders. I use one for the tailwaters and one for the mountain streams. Overall, great quality and I am sure I will get years of use out of it!"
