class_index,review_title,review_text
4,Don't judge a boy by his Star Wars,"It's such a relief to know that Hayden Christiansen can really act, although the film is carried by the underrated Kevin Kline. I won't re-hash the plot, because all the reviewers have done so. I think this film was wonderfully directed and emotional without hitting everyone in the face. The only thing that's really unrealistic is that Sam, Hayden's character, turns things around a little too neatly and quickly. Otherwise, it's a look at one man's efforts to get things done before he dies. Also includes a nice come-uppance at the end."
5,"hayden's yummy, but the movie is still awesome. =)","absolutely an awesome, heart-wrenching-with-a-good-feeling movie. go see it, take tissues. it's a screwed up family film with a sad ending that leaves you with a good feeling in your heart. great acting, issues and events are easily related to."
5,Awesome movie,This is an awesome movie for anyone who likes drama type films. Has a great meaning and a good variety of characters.
4,A worthwhile water toy,"For the price this sub is a good value. It travels a decent distance when wound fully, and it does indeed rise and submerge. My three year old daughter cracked off one of the fins, but she's a bit hard on toys. My six year old son who loves subs had a lot of fun with it. We used it mostly in the bathtub, but it would be fine in a pool. I would not use it in a lake, since it would be too easy to lose in cloudy water. For the price it was a good toy."
1,Broke on first day...Christmas day...,"This was one small toy for my son on Christmas, but it was one that he was looking forward too. Wound it up twice (4 turns each) and it stopped working on the 3rd use. Too bad, but I guess you get what you pay for."
2,Sub prefers to lay over on its side...but it does move forward,"What a disappointment! This was one of (3) new bath toys that I purchased for my five year old for tub time. All three were basically junk. In this case, the sub falls over on its side as soon as it is in the water, but the wind up motor somewhat propels the listing sub in a crazy arc!"
5,Dive! Dive!,"I bought this sub for a friend on mine's daughter to play with in the pool. After a preliminary winding, we discovered that the propeller spins VERY fast, because it uses the water as the motor govenor. Clever! After winding a bit, it will scoot forward, then dive right down about a foot, travel underwater for a few feet, then come up again. Because of the spinning propeller it forces the sub to list a bit to one side, but it doesn't affect performance and actually helps it travel in a wide circle instead of a straight line. We explained this concept to his daughter, who is five, and she understood how and why it moved that way, making it a minor lesson of sorts in hydrodynamics. The plastic periscopes on top are a soft plastic that can take more punishment than the appear, which is a plus. All in all a good buy!"
1,Hard to wine up,Very hard to wine up the submarine. Top piece broke very fast. Once wind up it doesn't last very long. Wouldn't recommend it.
2,Ok,This toy is only ok in my eyes. flips on its side or upside down. My sons lost interstest in this toy after one bath.
5,Reminds me of my childhood,"When I was a boy one of my favorite toys was a submarine that would actually dive and resurface. When I saw this I immediately ordered it for my 7 year old grandson and he loves it. It has, so far, stood up to the abuse that only a lively boy can deliver and it is still working great. It shares his bath every night and he is looking forward to taking it to the local swimming pool this summer. A great toy and a good price."
2,Bad quality toy,"Worked a few a few times, maybe for a week, and then it stopped winding. Definetly Not worth the money."
3,Cool toy but not for 2 year old,Daughter got nicked by the propeller when she picked it up out of the water while it was still spinning.She is now scared of it.
2,bath tub toy... doesn't work very well,"I bought this for my son as a bath toy. The propeller works, but it's hard to wind and keep it going. It looks good and he'll just play with it without it being self propelled."
1,Broken,This item is not even worth a dollar from a dollar store... my son was able to wind it up twice before it broke and was no longer opperable. It is cheap but not cheap enough to risk the disappointment.
4,New firmware a vast improvement,"Shuffle mode and windows media support (and the fast forward works now)! And I am not seeing lockups anymore either... If it wasn't for the cover problem, this unit would be almost perfect. I use ""FortyTwo"" to upload videos on the mac side and it works well (this is a shareware program)Overall it's a great player for the kids who lust after my iPod+Video and only 1/3 the price."
4,ok but hard to put a moive on it,i bought this almost a year ago. when i first started i had a hard time putting stuff on it but i got the hang of it.the bad part of it is you have to use mp4s you have to use the software that comes whith it to change it to an mp4. the sceen is very big.i like that it has two head phone jacks. hope i helped you buy this
3,South Dakota - From the ground up.,"This is a dandy capsule history of South Dakota development. Using basic family stories, author Davis sketches the development of one small segment of South Dakota from immigrant soddy to motorcar racing to modern class reunions. Along the way he provides a snapshot of comic hardships and truimphs of hardworking Swedes who settled this treeless country of hard winters and hot summers. From blind mules to racecars to chicken stealing skunks, family stories provide insight to daily life on the prairie and progress to the present. Much of the book centers around Redfield, a small rural town and home of the author's wife, and one section provides details of Swedish meatball delights and Lutefisk. Lutefisk being a dish only appreciated by dyed in the wool Swedes.Author Davis concludes the book with a cook's tour of South Dakota, providing useful information and tips for touring the countryside.A delightful book highly recommended for history buffs."
3,Women's 5 or Men's 5???????,If only the description was more specific. Is this a men's or women's size 5. Perhaps some measurements would help? Come on!!!!!!!!!@!
4,Great,"great value! fit well, I listed to other's recommendation to round the size down, (I normally take a 10.5 ee shoe, bought a size 10 boot), and it fits comfortably, very satisfied with fit & overall quality!"
3,Seem rugged,"They are sized large. Other reviewers are correct. I have only had for a month... time will tell... if they dry-rot or crack in a year or two I will repost. Metal toe rubs on one foot... so, wearing for too long is uncomforable. For the price it is a decent muck boot."
5,Great boots!,I wear men's size 10 shoes and bought size 8 boots after reviewing the customer feedbacks. They fit perfectly and easy to put on or take off. I use them to walk in the little creek in front of my house. I highly recommend them!
3,massively oversized!,"I ordered two pair, sizes 7 and 10, for my wife and me. Even the size ""7"" was too large for me! so we're returning the ""10""--I'm keeping the ""7""--and going to try a ""5"" for her. Of course, each time have to pay shipping to ""try"""
5,"Not Used yet, but seem great","On-time delivery, and arrived in great shape. Smelled a little chemically because of the rubber but walked around the house and seemed to work great. Once rain comes tomorrow, I will know for sure :P If you don't hear from me assume that they worked as good as they were supposed to. This was a purchase for my fiance and thus far he seems satisfied. Men don't usually get that impressed or excited about shoes :P"
4,boots,Tingley boots are the gold standard in gum boots. I am pleased with the boots--I do wish there were a bit more room in the shaft for tucking in heavier pants during the winter months.
2,very heavy,"ordered this since i was not sure I wud b around to pick it and wanted it for a trip & as feared, it did not arrive before the trip. It is however quite heavy.. way too heavy to use for any normal use. but went for a cheap one because of the uncertainity. Didnt want to return since the cost would outweigh the purchase!"
4,Rubber boots,These fill my needs very well; I needed a heavy/protective kind of rain boot and these are doing the job very well.
5,Fits perfect,"Boot fits perfectly with some wiggle room at the toes. I wear size 9.5 but ordered the 9 hoping it wouldn't be too small. I plan on using these around the house for a lot of yard work, concrete cementing, and pressure washing so I got the one with steel toes. For the price it's worth it."
3,Boots run big,"I read the previous reviews, they said the boots run big. They do. I wear size 10 Mens, and purchased size 9mens. The boots are too big in the feet, but the tops are too small for my LARGE tree trunk calfs. But a few pairs of socks and some trimming down, and the will serve perfectly for the southern afghanistan rainy winter."
2,Low end and odd fit,"It seemed like a good price for a steel toed rubber boot, but this one's just too cheap. There's no lining and a really low-end sole insert. More importantly, the sizing is unusual. Unlike other comments that complain the boot is too large, I ordered a size up from my actual shoe size and discovered that while the sole was fine, the calf was way too tight. For rubber boots you want to be able to tuck jeans, etc. INSIDE the boot to keep them dry/clean, and you can't do it with this one. It's WAY too small in the neck, and with no lining, you're just going to rub your leg raw on the inside."
3,Great quality - poor sizing,My son for whom I bought the boots wears a pretty predicatable size 9. The size 9 I received was at least the equivalent of a size 10 or 11. How about providing a sizing chart of some type?
3,Solid Rubber Boot,"These boots have held up well. They have a steel toe for safety. I lowered the rating because I have to wear socks with these boots or they tear up my ankles. This was not the case for boots I bought in the past from local places.These boots do not leak and I have used them for a couple months. They do still smell, which was not the case with my previous rubber boots."
2,Depends what you need it for,"I returned these. My husband hated these as soon as he saw them. They were advertised as rain boots. These boots are way too heavy to wear just in rain. I could see these being good boots to work in if this type of gear is required. But definitely don't buy this if you're just looking for rain boots. There are better, lighter boots out there. It's heavy just picking them up, I can't imagine walking in these. Another note is that the sizing is off. These boots run very big! The plus is that it shipped out pretty quickly."
3,Too big,I bought these for a trip to the amazon. They are high quality. But size ten is more like a size 12.
5,As advertised,These boots were ordered as part of an emergency response kit. Delivery was timely and the boots were still in the original packaging. Hopefully we will never have to use them but if so they will ensure personnel safety.
2,"Great voice, but who wrote those songs?!?","Hayley Westenra has a very beautiful voice, and I honestly didn't know what to expect from this cd. The real reason I bought the cd was for the Ave Maria, which is my favorite song on the cd. But when I loaded this cd on my Ipod that was the only song I put on. This cd was just too much for my mental ""sweet tooth."" Singing about ice cream castles and angels, it makes me ask the question to whoever wrote that crap: what world are you living in? Are you here, on Earth?"
1,Boring,"I was hoping this would be at least as good as Pure I loved so much but this is just a huge step backwards. Every song has a nasal sound to it. I wanted to cry it was so below average, so blase. My sister has a better voice.Each song was more boring than the next. It took effort, real effort just to listen to them. Im so depressed.I kinda liked Both Sides Now and even then she sorta butchered that one, to. It made me sad cause I know she had a good voice before. I dont know what happened to it as its not the same as it was on Pure.I like Hayley Westenra. I only wish I liked Odyssey. It is a major disappointment.Heres hoping the next one returns to the greatness of Pure."
2,Bad Covers Honey!,"Don't get me wrong, Hayley is alright. She has a pretty voice in all, but doing an album of almost all covers?? NO!! Sarah Brightman did a totally better job on ""What You Never Know"" & NOBODY can do covers of Joni Mitchell. Hayley, honey, WRITE YOUR OWN STUFF!!!!!!!!!!!"
3,It's not 'Pure',"As I said in my comments about Pure, I am hooked on Hayley. This cd did nothing to change that. My opinion is that Pure showcased her vocal talents much better than this one. This is tough for me because I know very little about all the technical aspects of the music world, as some of the other reviewers allude to. On some of the numbers it seemed as if she was competing with the instruments. On others it seemed as if the songs didn't lend themselves to her talents, I felt as if she had to restrain herself to stay within the limits of the song. I do know that I cannot drive and listen to Pure, as her voice totally captivates my mind and diverts my attention. With this cd, I can drive with no problems."
5,"So Crisp, So Clear, So Refreshing","I ordered this cd because it was reccomended to me by Amazon. This gal has a fabulous voice. I was expecting more enya-ish music, but it is very different. She has a vocal range that reminds me of Sarah Brightman, but sings in a more lullaby-ish manor. Parts of the cd take an operatic tone and yet others take a little more of an upbeat tone. I was amazed to hear the variety and can't wait to hear more!"
3,Beautiful voice but disappointing album,"This is disappointing following the release of Pure and the DVD concert which Hayley gave us. I can only enjoy 3 or 4 of the songs, but the album as a whole is too slow and mellow. I'm sure if they'd bought the rights to and reissued Hayley's self-titled 2001 CD and released it to the world, the music would have been much better than what was produced. This is not a criticism of Hayley, for she has one of the most beautiful voices in the world today, but rather of the producers who couldn't come up with a much better selection of songs and arrangements for her. I really do hope that her 2001 albums will be reissued for the world at a much more affordable price ($35-40 is a bit much...). I look forward to hear what albums Hayley will do in the future."
3,"Lovely voice, dull arrangements","None of the songs on this album are actually bad, but there is nothing memorable either. Somehow the producer has managed to make a diversity of classical, pop and folk music sound almost exactly the same. By half way through I was willling it to end.On the plus side her voice has matured and she is clearly capable of attaining greatness.After the stunning Pure and her earlier New Zealand albums, this has been a let down, and she badly needs better producers and arrangers, and better guidance on song selection."
1,"Well, some of it is correct...",Not much to say except the bulk of this guide is wrong. Someone's even written a FAQ on GameFaqs.com to correct all the errors that are in this guide!Recommendation: Avoid.
1,Not worth it,"this guide is not worth it. if you are thinking of buying it. please dont. I play the game online, and I am more than willing to suply people with information when they ask. I have over 500 hours of experience, on this game, so I know what I am doing..but I have played with some people that were new to the game and had this guide...and it was more annoying to me than helpful to them. a lot of the information is bogus. its better to just ask for help then to think you know what you're doing and have someone get mad at you. take my advice. its not worth it:)."
3,Greek 101,"This is an excellent introduction to basic Greek for the busy traveler. I liked seeing and hearing the words both in print and spoken by Greek speakers. I also have the Pimsleur DVD set, which is better for really using the language, but takes a lot longer and lacks visuals.Unfortunately my ""Greek 101"" DVD is defective. It stops after the word ""Today"" in level 1 and breaks up; losng the audio in the numbers section. I think it would be great if it worked. It makes me wonder if I recieved an old used copy by mistake."
5,I love this,Its sharper than i expected it made my work feel so good its like using a razor to finish liining
5,One of the top books of all time,"Memmi captures the contradictions and destructive forces of colonialism from an individual perspective, but more importantly he provides us with a work that transends his subject matter and allows for greater understanding of the manner in which structural and institutional forces of other forms of oppression and inequality affect us today. A classic statement pertaining to the human condition and the potential for liberation."
5,Book,Thank you so much for this book. This was a nice smooth transaction and he shipping was quicker than I expected. I received the book in time and I look forward in ordering something from you again in the future if I need something. Thanks.
2,The Urban Poor,"This is a necessary reading for those working with urban poor families in their neglected communities. Memmi described how the circumstances of the colonized molded the way these people see themselves, interact with each other and the subsystems that intrude in their lives. This almost similar to the conditions of the urban poor who has to live in segregated communities where poverty is the main resident.Carlos Juan Sanchez, MACARLOSJUANSANCHEZ.COM"
3,Don't count on it,"Out of three cats, two of them don't mind the collar, and so far it's still on them. However, winter is not over, and they are not outside scrapping and doing whatever cats do.Chester, the fatty, sits back on his hind legs, reaches-up with his paws and yanks the collar off. He has done this 3 times, so it's not working for him"
5,Excellent value!,"This toolbag offers great value for the price. It's certainly as good as some I've seen at Sears for about twice the cost. It has a few pockets inside to keep smaller tools from getting lost on the bottom of the bag and 10 or 12 on the outside to keep more often used tools at easy reach. There's also a handy strap for holding rolls of electric or teflon tape. The zipper seems quite heavy-duty, as does the padded shoulder strap (both of which I never use). The John Deere logo is on the outside pocket flap. Made from a heavy canvas-type material, this is the best toolbag I've ever owned and at this price is a real bargain."
3,Not for all cats,"This medicine was listed as ok to give to cats. After giving the first dose, our cat had a severe reaction. Lethargy, breathing difficulty, vomiting, eye dilation, and foaming at the mouth were the symptoms exhibited. Please use caution when giving this medicine to cats."
3,#1-6 & #7-16 Like Night and Day,"This is a curious album, it seems like she had 2 different producers; one who told her who to be and one who let her be her. The first 6 songs on this album are pretty weak ball-grabbing ""I'm the jawn"" fare, and you just don't get the feeling she really is into all the bravado she is spitting. The second half is a different story, and tracks 7-16 as a whole make a 4 star album. There are still a couple flat tracks, but you can't expect every song to be a hit. From 7-16, I compare this to lady dynamite's debut album, and I will be buying her sophomore album.I do wonder though, why they even included the trash in the beginning when they could have had a 10 song album by only keeping 1 or 2 of the weak early tracks."
4,For Safety's Sake....Buy this Attachment!,"The Microplane graters are an absolute must-have in any kitchen. Cheese simply disappears into fluffy mounds within seconds. BUT...the sharpness of the blades creates a potential safety hazard. If your fingers come into contact with the blades, count on receiving a nasty cut. The slider attachment is a small price to pay for security.Hard cheeses and nutmeg are very easy to grate with the attachment although as a previous reviewer noted, you must use small chunks. The results will impress you. Soft cheeses however, are a little harder to grate. The cheese tends to mash against the blade unless you apply the right amount of pressure and keep up a steady grating motion. It will however, produce finely shredded cheese.That is a mere quibble with the attachment. It will 'complete' your Microplane grater set and you can confidently and safely use this remarkable product."
3,average dvd,I was not entirely impressed with this DVD. It is the standard fare of Playboy's playmate calendar. My disappoint with this DVD may have something to do with my lack of enthuthiasm for the women in this DVD.
5,Buy this one for Bingo alone!,"This is the best yet of the Mind's Eye series. The video quality on many of the animations are very crisp, unlike previous releases and the quality of the work is generally better than the most of the previous releases. While this collection still contains the prerequisite cheeseball student projects and Pixar parodies, the real shining star in this collection is the multi-award winning surrealistic Bingo by Chris Landreth and Alias/Wavefront. Even if this collection contained only this one animation, it would be well worth the price for any animation fan. Bingo was animated during the development process of Alias Maya and it was clear that Landreth and Co. aimed to show off what their new software could do. The attention to detail is stunning. All I can say is Landreth RULEZZZ! Other animations I liked are Pets (a hilarious animation done in the style of Nick Park's Creature Comforts), Vache Folle, The Persecution, and a few others which I can't remember right now."
4,Get this one for the kids,"My kids love this DVD for the cute animation and characterization. For example, there is a segment takeoff on rock, scissors, paper where they come to life and try to get eachother. No, it doesn't break and new ground in computer animation, with the exeption of Bingo, but it is among my kids favorites and I reccommend it for that genre."
3,"Coffe, tea or me?","A few sexy models--would be starlets--wear sexy stew uniforms on board a plane, and have some adventures on the ground. Not bad, there is a suggestion of a plot that keeps it almost interesting. Uninspired direction and plot make it less than awesome."
1,Elegant tables?,"Technically sufficient, however, for inspiration purposes it is sorely lacking. Take a sneak peek before making a purchase to be sure you will get some benefit from the content."
2,pretty weird,It turns out that our character's romantic rival is his dad? Can I return this? It's a bit too sick for me.
4,"Product review, not movie!","I mostly read written reviews in order to get some info on the product itself, i.e. picture/sound quality, aspect ratio, bonus materials, bugs and problems, etc. So I hope this review might be of help.The picture is good, although definitely not the best copy was used for this edition. Unfortunately, the frame cuts some of the picture at top and bottom, just like on the italian DVD (CVC edition, although the excellent VHS tape reveals the whole picture!). I would like to mention the english subtitles as the advantage of this edition though. Bonus interview with Tinto Brass is always welcome, just as in this case. Interesting, especially for those interested in his creative work.As for the movie itself - it is simply great!Subjective resume: worth paying money for the uncut edition."
3,Italian Pastry,"So, you like Italian films that are short on plot but long on nudity?Buy this DVD used and you won't be disappointed."
4,it was fine,it worked and arrived on time time time time time time time time time time time tiime time time time
2,Proved Myself a Voyeur,"Possible but unlikely sequence of events. Beautiful women, a rather stupid man. If this is how we come across with the women of the world, heaven help us. The scenes with the ""black"" woman and her lover were worth the price of the DVD."
3,Pretty women and a bit of a story too!,"This wasn't too bad, but it won't stretch your mind too much. Perhaps the biggest surprise is how the nurse keeps what little cloths she has on. Overall it is a dumb movie and I wouldn't pay for a ""new"" copy again. Oh year, the lesbian sex (soft core to the max) was not too bad either."
3,Good product,"These foam inserts are easy to load, remove, and do a great job of catching a lot of small debris."
4,"Great book, hard to find.",My daughter asked for this book for Christmas and it was really hard to find. I was excited to find it. I found it was a little expensive but that is expected for hard to find books. My daughter is 2.5 years so I do find the story a little violent (about war) but it will be great for her in a few years.
3,tells the story but for a golden book?,This book does recount the story of Mulan (disney's) but is a bit of a let down for golden books- The story is written for a bit of an older audience than those who read golden books. I have to adapt quite a bit when reading this one to my 3 yo. I bought it so she could get the strong female protagonist- other than princesses- not sure that is getting across though.
2,"I'll 2nd "" Mediocre also rans......"" review","Out of 17-18 tracks per CD- i might have found 3-5 i liked but no more than that.Reggae, especially 70's reggae is alot more of a mover than this pleasant-verging-on-blah compilation."
