class_index,review_title,review_text
3,Not as impressed,I was not as impressed with this pad as other reviewers. It is adequate & will serve its purpose. Amazon lists the regular price at $80. It is more like a 40-50 $ item. Would sell for 15-25 on sale at a place like Kohls.
1,It's not a cotton pad!,The New Point Home Deluxe 250-Thread-Count Cotton Damask Stripe Full Mattress PadThis is nowhere near a cotton mattress pad. The only cotton is the top cover.The rest is plain old synthetic stuff.The 1st time I washed/dried it it started to come apart and this was on lo heat to no heat.So it is not as advertised. Definitely not a cotton pad. I never write reviews unless there is a huge disparity between what it's supposed to be and what I got.I lost on this one.ps: Amazon wants to put this review in the kitchen. It's a bedding product.
1,It melts in the dryer on the lowest delicate heat setting!,This product is worthless...DON'T BUY. The care tag says to dry on low heat. Product is defective as the backing melted when dried on the lowest heat setting of my dryer.
4,Purchased for an air mattress; good value for price,"I bought this to top off an air mattress for use when company visits. It fits the mattress well, provides extra cushion/softness and stays on the mattress through several nights; would buy again for this purpose.Based on other reviews, I wash in hot water, but use the air dry (no heat) feature of the clothes dryer."
4,Good Value,"Product performing as advertized. No shrinkage after wash & dry. For aesthetics, I'd choose a flat surfaced, rather than quilted, pad in the future since the quilted lines of this pad show through the fitted sheet."
1,DO NOT BUY THIS!!!,"I haven't used the cover yet. However, the NEW cover already had numerous tears on the fabric upon delivery. I want to return this, but since I'm in the process of moving, I am forced to keep this defective item. The whole thing just looks like it's so cheaply made. Trust me, it's not worth your money."
3,Great for the price,"I ordered it for myself but the sheets i got were a little too small so i didn't need it. I gave it to my boyfriend and its VERY comfy. When it gets really hot in the summer, we would take the sheets off and just sleep on the mattress pad because its so comfy. However, i didn't notice a huge change between his bed before and after he put it on."
2,Could've been better,I ordered this to go over an air mattress. It does stretch well but I was not impressed with the amount of filling in this pad. The description makes it sound like it is really full but it fell kinda flat. If I were going to use it everyday I would definitely send it back!
5,"Cool, comfortable.","For the money, this is a very nice quilted mattress pad, and very comfortable for sleeping. Thick enough to protect my mattress, and actually seems to make it more comfortable."
5,Love this mattress pad,Received item in a timely manner. Was amazed at how nice this mattress pad was for the price. It fits my 17 inch mattress just right probably due to the elasticized material on the sides. And it is so comfy. Wonderful buy.
5,mattress pad,"Very nice quality. I'm glad I bought 2. Haven't washed them yet, but so far very pleased."
5,Newpoint Home Deluxe Mattress Cover,The material was quality material and all the stiching was stronly bound. The product seemed to have all the quality of a much more expensive cover.
4,Good looking mattress cover,"I like the way it fits my mattress, it is quilted and looks good. I have not washed it yet, so I don't know how it will withstand the wash and dry. If I revise this review it will be because it fell appart. So far so good. Not bad for the price."
4,matress cover,"i am very happy with my purchase. i dont know when matress covers became insanely expensive,that is why i got this one. it was on sale and well worth the $$$$$$. i would buy again"
5,So Far So Good,"I haven't washed this cover yet, so I'm not sure how it will do longterm, but it fits my bed very well and is nice and thick but seems breathable too. Our last cover was pretty thin, so this is a nice step up."
5,great product for the money,this is well made and very nice for the money. It is plush and the sides are much better than the mattress pads I've had in the past. I would recommend this product and will be buying another.
3,Thinner than most others,"This was the first time I actually read reviews before getting one of these, before I just got whatever the cheapest one I saw in the store. Bought based on Amazon reviews, but was quite disappointed, it was significantly thinner than all of my previous cheap ones, though it feels nice to the touch (which is of less importance than softness). Just be prepared that it offers virtually no extra padding, just something to separate the bed sheet from the actual mattress."
3,More Like a Thick Sheet,"Fit is good (king bed) but not much in the way of padding - I'd say 1/4 inch thick at best. No way it weighs 20lbs, more like 5."
5,Fantastic mattress pad!,I read the reviews on this product and was hoping for my reaction to be the same. It is!! This item is wonderful and a bargain to boot! I would highly recommend this item. I went back and purchased 4 more for the rest of my home.
3,Convenient and cheap but doesn't add much,"I bought this for use at college on my apartment bed. I liked the majority of the reviews - the only real negative ones came from those who had troubles with washing (well...drying) it. I've washed it several times already with my sheets then tumble dried it with no heat and did not have any problems. I've used it for about half a year now and feel like its so thin that it doesn't really add any comfort to the bed. I like that it's an extra layer between me and the mattress, but it's already gotten very worn down and flattened out a great deal. It's a good price, but I think I'm going to look into something more comfortable for next year."
1,Wierd material,"After washing and drying (low heat) the pad has large ""blisters"" on the bottom, it looks like a really bad sunburn.Why would a manufacturer make a mattress pad that can't be washed and dried? It's going back, get ready Amazon."
3,reviews misleading,"This mattress cover is really perfectly fine- it fits and seems like decent quality, but it is nothing special at all, and really not a ""pad"" at all, simply an adequate plain basic cover. It was not what I was looking for or expected from the reviews."
5,Exactly what I was looking for,"I decided to buy a new mattress pad when I bought a new mattress this month, and this was pretty much what I wanted. It fits my memory foam mattress perfectly; it's not too big or too small. I wasn't looking for something to make my mattress softer or more comfortable, so if you're looking for that, this isn't it.I haven't tried washing it yet, but when I do, I might just try to line dry it (in my tiny apartment)."
4,"It's a nice one, but shrinks after I washed it",It's is a very good quality pad. It looks nice too. I washed it and the pad didn't melt as other review said. But it does shrink a little bit after i washed it and used low heat as instructed. It doesn't fit my queen size matress very well now. I will buy another one and dry without heat.
5,Great Product,"I am very pleased with my purchase of this waterproof mattress pad. It does not have a ""noisy"" plastic sound when in use. It wears well, washes well and fits snuggly."
3,Home Deluxe Damask Twin XL Comforter,"This mattress pad was so-so. It looked nice and fit my bed fantastically. It had long sides to cover even deep mattresses. As far as comfort though, it really wasn't that thick. I used it for my college bunk and was really hoping for something nice and padded but this fell short of my expectations, especially from other reviews.I thought I was getting a super bargain at this price, but I guess it was too good to be true. One of my friends even sat on my bed and chided me for not buying a mattress pad. I would not recommend if you're looking for something above average."
4,Good product.,"I haven't used it for long time yet, but initial impressions are that this product will last long and will protect mattress."
1,STINKS!!! should be no stars,Literally. It stinks of chemicals. Washing doesn't remove the odor. If you like chemicals then this is the product for you. Another gift for Goodwill.
5,Thank you!,"Nice fit! And quite comfortable. I haven't washed it yet, but thanks to everyone's comments here, I'll use caution in the dryer. I ordered king size and it fit our deep, king size bed beautifully. Actually, the best fitting mattress cover we've found!"
5,"Good Quality, Priced right","I bought this as investment for my new Mattress. I want to keep it clean, fresh and looking new for many years to come. This Mattress pad fits easily over my extra thick mattress and stays puts! However in my quest to find the perfect nights sleep; I don't sleep on it I use a featherbed instead. So the comfort level is really unknown to me. But it appears nicely quilted and very well made. This is primarily used as a mattress protector.UPDATE:This is my second purchase. I bought a Queensize for my bed and re-ordered a full size for my daughter's bed. Very well made. Durable. Adds comfort and protects your matress. After reading some other reviews I wouldn't even think of putting this in the dryer! Line dry!"
3,A Pretty Good Buy,"It wasn't as thick at as I excepted and had a small spot on it when I opened it, but it's much more comfortable than just sleeping on the mattress."
5,great mattress pad for the price,"I bought a new mattress recently and ordered this pad on a whim. I was worried that it would be poorly made considering it's low price, but I was pleasantly surprised! It's made my bed even more comfortable and fits my mattress like a glove. If you don't want to spend a ton of money, I highly recommend it."
4,It fits!,"I liked the price of this mattress pad first of all--then when I received it, it fit my pillow-top bed perfectly. I had a different pad on before that constantly shifted and the edges never stayed put, and this one does! I have enjoyed it. I wasn't looking for fancy, and had I spent more money I may have found one that was a little more ""fluffy"", but this is very functional and in my price range. I had spent more on my last pad that didn't stay put, so I was reluctant to pay very much. I am very satisfied with the purchase."
2,You Get What You Pay For,"With a 2.5 inch foam topper, my mattress is 14 inches deep. This cover, which identities itself as queen size, probably measures an exact 60X80 when stretched and may fit mattresses up to 22"" deep BUT I seriously doubt that it will retain these dimensions after a wash.The top does cover the top of the mattress - barely. The sides do cover the sides of the mattress but there is very little extra fabric to tuck under the mattress. I think the claims of fitting a mattress much deeper than mine are very exaggerated,The quality is fine...all the threads are where they should be but I would have preferred a bit more generosity in terms of fabric - both on the top and the sides - and would have been willing to pay a bit more for that.It's worth the $20 it costs....barely."
2,A non-fitting melty pad....,"Got the pad back in september, and while it did fit better than our past mattress pad it still didn't fit completely. We've got a stupidly thick Englander mattress which this barely fit on the corners (slipped off after a couple of day) and didn't even get close to touching the edges of the bed.Then - it was overdue time to launder, doing so (following directions) provided us with a intact top of the mattress pad, but the underside backing had melted into little hard plastic clumps.Overall, I guess this would be a fine solution for deep mattresses (17""-18"" corners or less) and even better if you had time to air dry, otherwise I'd watch this closely in the dryer to make sure that you don't end up with a clump of polyester."
4,Nice!,"Great pad, great price. I don't like sleeping on something that is too soft, so for me the thickness of this is perfect. Fits the mattress nicely, too."
1,Terrible mattress pad,This is not a mattress pad - it is a mattress cover. It is about as thick as two sets of sheets and is not worth the money - no matter how cheap it is. Don't waste your time or money.
3,Ok for the price - but not on a memory foam mattress,"I recently purchased a luxurious (to me) 12"" memory foam mattress. I absolutely adore it, however I've run into one annoying problem. Regular mattress pads take away from the feel of the memory foam. Without a pad, it is perfect, as you can feel yourself slowly sinking down into the foam (a good thing). But with the 2 mattress pads I've tested so far, the padding removes a lot of the memory foam ""feel"" and the bed becomes much more firm in response.I purchased this pad based on recommendations that it works well with memory foam, but it does a poor job in my opinion. Great for spring mattresses, but look for a thinner pad if you'd like to use it with a memory foam mattress."
4,Damask Stripe Mattress Pad,This isnt as good as I thought it would be... Its not thick enough. But not too bad either.. Better than nothing..
2,Bad design,"This is the second time I have bought a mattress pad where the backing has ""melted"" when I put it in the dryer. I wash my sheets and bedding on hot, and throw everything in the dryer. We have two young boys, so we do a lot of laundry. It is beyond me why a mattress pad wouldn't be COMPLETELY washable and dryable on hot and/or warm settings. I like the top of the pad, which seems like nice quality cotton, and it fits the bed nicely. My complaint is that the backing is poor quality. I didn't order or expect anything waterproof. In fact, I would prefer all cotton. I really don't have time to pack this up and send it back at this point. I am not satisfied and would not buy this type of product online again."
1,A big turnoff,I love Amazon Prime with the fast shipping. This package arrived looking brand new and well packed but with a huge piece of hair on the mattress pad inside the package. You can see it w/o opening the package since it comes in a clear package. A huge turnoff. It just makes one question if these are all returned items. I believe there are laws against this sort of thing when it comes to personal items. What if there are bed bugs on this pad? Do I really want to introduce this to my home? The cost I would incur could be huge.
2,You can do better,"Well, it fits a king sized mattress. Other than that it is not especially soft or comfortable. If you have thin or nice sheets you would want to get a higher quality one. If you sprung for a king sized bed you might as well get a decent mattress pad, which this isn't. The quality and comfort of this pad is more suited for a kids bed or a guest bed that you hope people don't want to use often. The comfort of this item is really unimpressive."
2,"A COVER, not a PAD","The price seems great, and is great- if you're looking for a mattress cover to help protect you mattress. If, however, you were looking for a mattress PAD to add softness and comfort to your original mattress, this is not the correct product. I mistakenly bought this, thinking because it was a ""pad"" it would add padding. It does not. This product is very thin and flat. I'm returning it, and I bought a fiberbed instead."
4,Nice mattress pad,"I bought this pad because of the reviews and I would not change what they say about the product.I have used it for two months now and even it felt much more pad in the beginning, I still notice that it is beneath.If you are looking for a nice but not too expensive pad I would recommend you this product."
3,Too thin,"The size fit perfect, only problem is that it is too thin. If you are looking for thickness then this product is not for you."
4,Comfortable,"This definitely feels nice on the bed. I wouldn't say it's a MUST HAVE, but it does make the bed just fee a little softer, and that's always a good thing. Fits well, plenty of space to spare. I hope it holds up after some washings."
5,good,Perfect!!! I bought this for my boyfriend. He like it very much. I like Tommy Hilfiger so much. Good Good
5,Good Sleeping,"I was looking for a replacement for our worn out, shredding, mattress pad when I came across this one. I read a ton of the reviews and decided to buy it for us. It works well and doesn't make us sweat uncontrollably like some of the rubber back ones do. I haven't washed it yet but when I do I will post again. Overall an excellent purchase and works just like it was meant to."
1,The Worst Mattress Pad - Do Yourself a favor - DON'T BUY,"This is the worst mattress pad, the fabric is hard and poor quality! The backside has some gunk attached to it."
5,Mattress cover,This mattress cover is everything I expected it to be. The fit ws perfect and the quality was very good.
3,"Good, but not perfect","Bought this for my sons' dorm room bed, fits well on the extra long bed and does the job of adding some thickness to the mattress, but still moves around on the bed. Easy to wash & dry. Good value for money. Could spend more on something from potterybarn, but this does the job just fine."
5,Great mates cover for a great price!,"very comfortable and beautiful, quality fabric, fits snugly on our 10"" mattress without being too stretched out or to loose, No excess saggy fabric on the sides but could even fit over thicker mattresses. Perfect, would buy it again in a heartbeat."
2,Nice cotton top but poor quality underneath.,"The cotton damask top is nice and the elastic side material is durable but after a few machine-washes using regular laundry detergent (no bleach), the polyester material under the cotton top has begun to deteriorate."
1,Do Not Buy This product,"I read the negative reviews and still bought this mattress pad. I washed it once, put it on low dry and it still melted.Who is going to line dry their mattress pad these days? the other option is not to wash it and that's just gross.I returned it the next day. No problem. good customer service. Bad product."
2,Disappointing,Goal was to buy a high quality cotton pad to insulate me from the heat of my pillow top mattress. First disappointment was this is primarily polyester so it doesn't insulate at all. It's the hottest mattress pad I've owned. Second disappointment was the dismal gray color it turned the first time I washed it. I washed it alone with detergent and a little chlorine-free bleach and it turned gray! It looks awful. One of the upsides of this pad was it was pretty but not any more. The only remaining upside is the sides are really deep. It's a joy to put on because I don't have to struggle and stretch to get it over my deep mattress.
5,wonderful product,i purchased this product to use with my new king size mattress that we just purchased and i am extremely satisfied with it . it fits perfect with no wrinkles or bunching up . just a perfect fit and it sleeps so much better with this mattress pad and also protecting my new mattress and hopefully will get much better service and long use with using the mattress cover . i would def recommend this to everyone who wants a good nites sleep and mattress protection.
3,Watch out how you wash this,"This was a wonderful mattress cover. Until, my husband trying to help me washed it. The backing melted, and he only dried it on medium. So, if you buy this, make sure a. not to let a husband wash it and b. use no heat drying method. Other than that I liked it."
5,Best value for a mattress pad.,This is the second of these mattress pad's that I have bought. I love them both. High quality. Comfortable. Fit well on any mattress. And a great price!
5,Absolutely fantastic,"I just purchased the foam mattress topper and a quilt covering. Very easy to setup and the first night sleep was absolutely fantastic. My back pain was improved and did not feel the stiffness like I usually feel with my original mattress. It is very firm and molds to your body. To complement the foam topper, I also purchased the foam pillows and relieved the pain in my neck. My wife also told me that she slept better and relieved her back and neck pain as well. This is really a cost saving way compared to purchasing a good quality mattress. The foam itself practically had no odor and both my wife and I did not feel hot sleeping on the foam topper. I give it ***** and recommend it to everyone."
1,Melted - Even With LOW Heat,"I purchased this item only 1 month ago. On my first wash, it was dried on low and a small bit of the inner liner began to melt. I just washed it today for its 2nd time and the entire inside liner is completely melted. I used the lowest heat setting on my drier both times. This item is extremely poor quality and I would recommend everyone to look elsewhere."
4,Probably the Best Deal for an Inexpensive Pad,"I washed mine before using (gentle cycle, warm; tumble dry low) and it came out just fine and fits the bed.The underside of the pad is polyester nonwoven ""fabric"" like what cheap reusable shopping bags are made of. I took away a star for that because my experience is that that stuff is not very durable.Aside from that, these pads look great. Not super plush but enough filling to keep most things off your mattress. The ""skirt"" is a soft fabric and looks very generous. We don't have super deep mattresses so that's not an issue for us personally. The pad stays put on the bed.I am very pleased with this purchase and don't think you can get more bang for your buck. I am honestly clueless as to where the bad reviews are coming from. Fakes? Competitors?"
1,Why didn't I trust the reviews?,"Well...it's my own fault really...I didn't read the reviews and bought this mattress pad anyway. It arrived quickly and seemed like a really nice mattress pad. As with any bedding...I always wash it before using it on my bed. I washed the mattress pad on cool wash/cold rinse, then dried it for about 15 minutes on low-heat. Pulled it out of the dryer to discover that the entire back was melted. It's completely destroyed and I haven't even used it yet. I'm in the process of returning it. I knew the low price was too good to be true.I've now taken the time to read more of the reviews on this product. What I don't understand is why Amazon continues to sell this product? In all the years I've been shopping with Amazon, this is the first time I've experienced a poorly constructed product."
1,Melts When Dried According to Instructions,"As reported in other reviews, mine melted the first time I tried to dry it, even following the instructions on the tag. The plastic particles ruined set of sheets in the same load and even a shirt in the next load. Given that the tag on it even provides dryer instuctions, I just can't recommend this mattress pad to anyone."
2,pretty poor quality,"This is supposed to fit up to a 21"" mattress. Wrong. The workmanship is so poor it doesnt even have an elastic bottom to tuck it in. The overstuffed top is nearly none existant. Do yourself a favor dont order this. I cant wait to return it."
4,Mattress Pad,Very soft and comfortable. It is a little deep for my regular size twin mattress but tucks in well. I like the fabric on the sides. It's much better than the gauzy type found on some mattress pads.
1,Melts in Dryer!!!!,Do not buy this mattress pad! It melts in your dryer at any setting!!!! Don't buy this mattress pad!!! Do not buy!!!!
2,Won't Stay in Place,"The padding doesn't even cover the whole mattress on top, and the mesh isn't snug so the whole thing slides. So disappointed."
3,your average mattress pad,This was purchased based on the Amazon good reviews. I was expecting more. It's an average thickness and average quality mattress pad just like those found everyday at Walmart for around $10.00.
3,Good qualiity,The quality is good but we have a tempurpedic mattress and all other pads have slipped off at the top. We suspect it now to be the mattress.
1,"Barely fits over a 14"" deep mattress","I just received this today and put it on my bed after shaking it to fluff it a little. My mattress is X-long twin and 14 inches deep, which includes the pillow top. I've measured the mattress several times, so I'm absolutely certain of its depth. This brand new and purportedly wonderful pad is extremely tight on the mattress, and I'm floored at the claims that it would, in anyone's wildest imagination, fit up to a 22 inch deep mattress. It was quite difficult for two of us to even get the wretched thing on the bed initially, and the bottom of the pad skirt doesn't reach to the lower edge of the mattress. Heaven forbid I'd wash and dry it -- the shrinkage would be ridiculous. Altogether, this was a huge disappointment and I'm sending it back as soon as I can get my return label printed."
4,Surprisingly comfortable,"I used to sleep on memory foam mattress, but after getting a king-sized bed it became too expensive to buy a king-sized foam mattress. I bought this one because I needed a cheap alternative and expected it to be uncomfortable. However, although definitely less soft than the memory foam, it is actually very good and I haven't had troubles sleeping on it. I'll recommend it to people who need a soft mattress pad for a short period of time."
3,Was a decent price but ...,"sheets are rough. Nice design. Pleasant to look at. Seem relatively sturdy (like they will be put through the washer many times at college, lol) Fit the XL twin mattress perfectly."
