class_index,review_title,review_text
5,The Innocence of the 70s,"This is a book full of aphroisms that are often uplifting and enlightening. The 70s were a time of pop therapy, and often the ideas seemed to promise an inner peace, a spiritual utopia. I'm not sure how applicable these beleifs are to our era, as they now seem to be oversimplifications of a complex and alarming world. A bit on the polyana side of life. Nontheless, Prather's insights are good to dip into when you are feeling blue, and long for something with zen-like simplicity."
5,Best tea,"We had this tea in the UK while visiting some friends and vacationing. We asked what type of tea they were using since it was so good. We bought some Twinnings Everyday tea and brought it back to the states with us. After running out in a few months we were desperate,luckily we were able to get it through Amazon. Thanks."
2,A Deadly Yarn (Knitting Mystery),"I like the characters and setting in the novel, but the plot is rather thin and predictable. However,as a knitter, I find the frequent references to the various knitting projects that the characters are working on rather energizing.... it makes me want to get out my needles and work.A Deadly Yarn (Knitting Mysteries, No. 3) [Mass Market Paperback]"
1,Couldn't make it past page 50,"This book contains the most stilted dialogue I've seen in a long time. In nearly every sentence the characters address each other by name. ""Isn't it a nice day, Kelly?"" ""Yes it is, Curt."" ""I love days like this, Kelly."" ""I do too, Curt.""That's a slight exaggerations, but if you are used to skilled writing, find another book to read!Ugh!!!"
3,"story is good, printing is awful","The story is fine, if you can get past all of the misprints. I lost count, there were so many: at least 3 in the first sixty pages. As a stickler for spelling, grammar and punctuation, these many printing errors detracted from the enjoyment of this book. Errors included confusing two character names: Burt and Curt, in one place Curt is called Curl. If you can get past all of that, it's a good story. These errors may not occur in all printings."
4,More predictable,This one was a bit more predictable than some of the series but still good. It was nice to add in the weaving aspect but there wasn't really any information on weaving. That would have been nice.
4,A Spectrum of Sound and Emotion,"Cruiser provides 'Some Songs' taking listeners through a spectrum of sound and emotion. The album is a fascinating listen, full of interesting and original songs. It is a musical experience, not just another cd to pop in the player. There is no denying the amazing musician-ship of this band. Cruiser leaves me anxious to hear what they will produce next."
3,An alternative sound . . .,"The band appears to have influences from alternative groups like REM and The Cure. Good arrangement for a debut album, definately worth a listen."
3,One must ask. . . . .,"This album begs the questions: ""on what day did God create Cruiser, and couldn't he have rested on that day?"""
1,Muddy and Unrecognizable,Thought the live show was okay but the CD is muddy and unrecognizable. Maybe it was just a bad production job but the songs all sounded alike too.
2,Huh?,"Started out okay, but after a while it sounds like REM in a washing machine. Couldn't really hear the lyrics, I don't know how anyone else could."
4,Excellent first recording!,Cruiser's first CD is pretty darn good. I hope their show Friday night at the Drink is as good as the CD.
1,Not sure what I received,"Very disappointed with the product that I received. I have seen the Paragon chrome water filters, and this did not compare. I am not sure if someone swapped out a return, and that I received this unit on a later order... but the product that I received was really poor quality. The chrome all over the unit was blistering off, and the screws on the bottom were corroded. Definitely returned it."
2,"Looks good, taste, not so much,Chlorine odor anybody","I have just received this chrome countertop water filter, 36 hrs ago, and here is what dissapointed me:-Packaging is awful, no name on the box, box was falling apart, barely houses the product.-Instructions are poorly put together, no technical information whatsoever, I was stunned.-All the above was not an issue at first, however alarming. I installed the countertop water filter, no problem, let the water run for 15 minutes before drinking a glass. Water looks very clean in the glass, I was pleased, and here comes the bomb; the odor isn't odorless, chlorine odor is so pronounced it is as strong as the tap water.Twenty four hours later, same, chlorine odor, it reminded me of a swimming pool odor, you get the picture. I have just processed a return to Amazon, back to Brita till I find the right countertop water filter."
5,Excellent Countertop filter,"Sturdy construction, not plastic parts which have in the past leaked and broken on me, feels like it will last a long time, if it doesn't I'll be sure to come and update this review. Comes with a tool to loosen the unit to change filters. Yeah, it takes a bit of muscle to do it. Works great. The filter that comes with it is alright, but if you want a really good filter to go with it, the Omnifilter CB3 is the one I've been using for these style units for years and it really works well to filter out the impurities and improve the taste."
2,Not what I thought,"I had the paragon filter in the past and LOVED it. Don't be fooled...THIS IS NOT THE SAME! AT ALL! I have had it for a week now, waited a while before writing this review because I was hoping the taste would change. It has NOT. It tastes EXACTLY like drinking from the HOSE OUTSIDE! Everyone that has tried it has said the same thing without being prompted. It does look nice, and the pressure is amazing. It was super easy to install. But who cares, if it tastes worse than the water pre-filtered! I am soo unhappy. I seriously doubt it filters all it claims to. The instruction pamphlet was a JOKE. The product box it came in was falling apart. Not labeled or anything. That should have been the red flag. I fully plan on returning this filter. I'll wait to get a Paragon. Really thought this was going to be similar, but no way. It's so gross!! The aftertaste is the worst. No one wants to drink it."
1,Don't Bother,"I was not impressed with this unit. I've been using PUR and Brita filters and decided to go with a counter top model instead. But this unit added a more unpleasant flavor to the water than what it removed. I could never, ever, ever recommend this unit. I was totally disatisfied and immediately returned it for a full refund."
2,I wish mine worked,"Just returned this product. Looked great, but couldn't get the canister to not leak. The top just wouldn't seat to the base. It looked great and I was hopeful that it would work as good as it looked. I think is was just a flaw in the base seal not a overall fault of the product itself. Wish it had worked out. Now I need to shop around, again. Shopping through AMAZON is the only way to go. They addressed my issue and I'm pleased with their service."
4,as filters go,"I like it that it's chrome. It actually looks like stainless steel and to maintain the finish all you have to do is rinse and dry with a cloth and it shines like in the photo. I was a bit concerned about not being able to find the right filter but it was actually offered on the same page but not from the same seller. Then I was worried it would leak as so often happens with these models, but so far so good. It's 6 months so I changed the filter. A couple of times someone turned on hot water including myself so I figure even though it said the filter is good for a year we probably messed it up.I had the plastic housing for this model and it always leaked. I had to mess with it to get it to work properly. Sometimes just taking out the o ring gaskets worked but this model doesn't leak.Just put the new filter in and no fuss no problem - and I use the water for cooking. I still buy the bottled to carry and am just spoiled but this water is good no doubt."
4,it works fine EXCEPT for one thing..,"it works perfectly except that it doesnt plug in properly in the back USB port in my comp. but with a USB extention cable, it works fine. id recommend this product, but if it doesnt work in the back USB port, be ready to shell out another 5-10 bucks on a USB extention cable."
4,So far so good,It works great after open box. You can hook into key chain. It's doesn't require any drive. If you want to buy this. You should get bigger capacity up to 1 GB. A little bigger compares with some others but still O.K.
3,Better to wait for 2nd generation. It must come out soon.,"2nd generation MBA with 45nm Penryn will solve current problems such as storage, interface connector, blackout problem, while most of the beauty of it will remain the same. I need to emphasize that I LOVE MBA design. First, 80GB is so small that you will see more than 1/2 of 80GB is required by OS, VM and major applications. Performance is getting even slower due to its storage bottleneck. At least two USBs and Ethernet are must. It is sacrificing flexibility so much to reduce its size and weight but I do not feel it does not have a fair balance for regular users. I still encounter occasional blackout and freeze problem when I leave it for a few hours, which has not been solved even through Apple's technical support.I definitely think next one will be much better and Apple knows how we feel about MBA. I believe they could respond to what we feel very soon."
2,I REGRET Buying it :(,"I gave it 2 stars just because its an apple product. Don't fool your self you WILL need a cd drive and you will end up buying an external one anyway. its hard drive memory so small, its hardly can enable you to store ANY THING! so I ended up buying the time capsule too. One USB port is never enough and although I knew all these facts before I bought it and I do have another macbook older version I just struggle with this machine constantly. buy the time I am writing this review and after saving all my files on my time capsule, I have only 23 GB left (mostly consumed by the OS and the updates) on my hard drive. the machine getting so slow now and the hard drive is cannot be upgraded."
2,poor wireless capability,"I have my MBA for six month right now. Overall I am almost happy, but.... Wireless antenna is not as powerful as I need. My MB pro can ""see"" 15 networks near my home, MBA only 6!!!!Sometimes It takes more than 30 minute to have internet access at airports and other places.Each time I arrive home it says ""there is not preferred networks in range"" !!! and it is my Home network!.This beauty travels really easy, everybody looks at it and it is sturdy. The lack of connectivity, the insufficient USB ports, and the underperformance make me think that I have something nice but close to useless."
1,"beautiful to see and touch, broke immediately, no apple support","This laptop broke after just a few uses. Being the first time to choose a mac air, I was needless to say, very disappointed. Apple support, which I fortunately never needed to use for my ipod, was not the least bit helpful. I would recommend a netbook or a dell laptop, save yourself the headache."
1,Do not waste your time and money,"Good for checking emails, and very light word/excel processing work. Otherwise it is really more a gadget than a real computer. Hard drive is too small for using it as a standard computer as you cannot store much info/data. Processing power too slow and even airport does not pick up all signals. Nice gadget...that's all it is. I do not recommend it."
5,Know Thyself,"There are so many opinions floating around about this latest Apple innovation, my simple reply is to think what works best for yourself. The *plus* in one's views may be the *minus* in another's. The Macbook Air is the perfect answer for my way of using a notebook computer. Study the forums, learn the features, and decide if it works. When you read the negative reviews, remember it could just be the Air does not fit the user's needs. Just as most all other notebooks do not fit my needs. The Air is for the simple, uncluttered life. When you KNOW yourself, this removes much of the confusion. Apple has heavy-duty alternatives, while the Air simply does exactly as it was designed to do... keeping your life simple, uncluttered AND productive."
4,A good reference for fixed income securities,"A compact book focusing on fixed-income market, derivatives, and risk management. Highly Recommended for advanced undergraduates"
4,Very Imformational adn Helpful,"I thought this book was good. It has very, very helpful tips on advertisment, getting started, meal tips, and so on. I liked the part with questions answered and a place to write about jobs and other info. I wish they print more things to do with kids at different ages. I mean you can't play games all the time. But the part with what to do in emergencies was GREAT!"
5,A Serious Subject Which Needed To Be Addressed,'He Belonged To Us' by Aurora Borealis is a work of fiction.This book is about underage drinking and the fierce competition of high school basketball.Violence takes place in professional basketball and alcohol is a strong factor in this violence.Violence also takes place in high school basketball and underage drinking triggers this violence.I believe what happened to the young man in this story was over the competition of high school basketball.I purchased the book itself and found it to read very smoothly.In a perfect world all books would be written about happy positive fantasy land subjects.Thank you Aurora Borealis for writing a work of fiction on a serious subject that someone had to speak out against.
2,bugs,Good basic starter information for new gardeners. Serious gardeners and professionals should search other options. Book may be a bit dated given the 1994 copyright date and the lack of color photos.
5,"Great Price, Great Item!",I got this product think because of the price it would be flimsy. But I bought because of the other 5 star review. It felt very sturdy when I pulled it of the box. It also includes a microphone clip. A good microphone cable isXLR male to XLR female Microphone Cable - 15 feet.
2,Seems nice.....but we can't tell....,"Looks like a quality microphone, but since it ships without a connecting wire we can't tell. Bought this to go with a Christmas gift, so there are some disappointed children. My fault for not reading the description entirely, but it never occurred to me it would ship without a wire. Just make sure to buy a wire if you buy this mic."
5,good mic,this mic is awesome sounds amazing better than a $500 dollar mic sounds clear and crisp and pics up all ranges of sound
2,Too descriptive and slow-moving,"I find the novel boring mainly because at four volumes, it is way too long and slow-moving for me. The novel itself is interesting, with a lot of sexual exploits by the protagonist. Pearl S. Buck called it the ""greatest physical love novel"" of China. Still you might be better off reading the condensed version of the novel."
3,"""In the tradition of The First Wive's Club,"" it's NOT!","I love novels that feature a woman who's been done wrong by the man she loved, and makes a come-back that's bigger than anything she's lost. That's why I immediately snagged The Secret by Cynthia Victor. I was sorely disappointed.Rather than show the story of the heroine's inner struggle and strength, the author overwhelmed me with the endless muck of the rotton husband's disgusting character. It just went on too long. If she did that as a means of showing the reader, by comparison, the new hero's strong values, I feel that she failed there by making him too wishy-washy to qualify for the job.The reader has her ""revenge,"" so to speak, when the ex-husband loses it all (his mind included.) By the time that happens, I was kind of done with it all.I can't really say that I'd recommend The Secret, unless the premise just sounds so good to you that you can't resist. It wasn't that good for me."
4,Life's Lesson,"the Secret makes every woman realize how important it is to care about yourself and your well being. To have a happy family and home you must careabout your own state of mind. If you forfeit self respect you lose. It is a long way back. Well written and sad in so many ways. Great book, my book club loved it."
2,Expected Better,"Quite simply, I expected a better documentary based on the other reviews for this DVD; I expected better production quality and something at least worthwhile with regard to UFOlogy. I didn't see it in this DVD. First of all, the naration is terrible... the guy continues to repeat himself. It sounds like it was written by Seventh Grader trying to make sure his term paper has the requisite amount of words. The video is mostly stock video... and most of that isn't even from images in the 1970s. There are no re-enactments; a few drawings and a video of one abuctee speaking at some type of forum (this was the only thing that did make this worth watching). There is another DVD available here on Amazon about the various UFO incidents in 1973... I plan to purchase that one and compare the two... but for now, I'm feeling like I shouldn't have wasted my money on this one."
3,Startling Accounts and Historical Footage,"There have been several recent news stories about UFOs that may prompt you to want to learn a little more about the history of UFO sightings and this documentary provides a great introduction to the subject. The film ties in the historical events that were happening throughout 1973 and ties them in with the numerous UFO sightings during the time period. The pace of the film moves quickly at the beginning, moving back and forth from historical moments to UFO sightings. It focuses on a few more well-known UFO-related stories and offers photos and footage. As with aliens and UFOs, it is really up to the viewer to decide how much of the film is credible enough to be considered as fact."
4,I had no idea so many UFO related events occurred in 73,"UFO waves or flaps are nothing new. This documentary provides some excellent evidence from one of these events, the UFO wave of 1973. A good collection of these sightings were retold in excellent fashion via eye witness testimony, reenactments and news clips. Some high profile abduction cases and multiple witness sightings were also covered, including the Pascagoula Case involving Charles Hickson and Calvin Parker. Included in the bonus features was the 18-minute recording from Lt. Colonel Charles Halt (USAF) regarding the UFO over Rendlesham Forest encounter of 1980."
4,Rivetting wartime spy story.,"What a fantastic war movie this would make! A brilliant German spy has infiltrated the Army as a top officer and is determined to relay the plans for Operation Overlord,the landing of the allied forces on Normandy, to his masters in Berlin.A British Intelligence officer, Major Cuthbert Pargeter, a typical upper middle class military type, teams with his American counterpart, Colonel Linus Iremonger, a brash, outspoken former cop, to track down The Fox as they've dubbed the German spy.They follow a trail of destruction and murder to prevent The Fox from escaping to Germany with a copy of the war plans, even on to the beaches of Normandy. These events actually happened as was verified by the notes written by Colonel Iremonger in later life and was crucial to the success of D-Day."
1,Not worth reading,This book was very sour. I did not like the way it was written at all. I did not have the heart to finish it. It did not grasp my attention nor did I find it to be worth my time. The author spent too much time on the sexual aspect of the story and forgot all about the charms usually found in romance books. I would not recommand this book to anyone.
5,Take off your PC hat...and enjoy!,"MOONLIGHT MISTRESS is not politically correct by today's rather limited guidelines. But if you enjoy a very good, very sexy, very satisfying story about believable characters of the medieval age, then hurry out and buy MOONLIGHT MISTRESS. Phillipe is an arrogant, dominant alpha male, and Aelvina is the feistiest of feisty heroines. Their love scenes are often not tender, certainly not politically correct, but they are wonderful in fantasy romance, and there's a plot twist at the end that is so clever it had me saying, ""Of course!"" The only thing I can say about MOONLIGHT MISTRESS is I wish New York would publish more books like this. Feminists won't allow them to do that, though. It's really sad. MOONLIGHT MISTRESS is well worth reading, to anyone who still enjoys leaving reality for a bit and joining the world of fantasy medieval romance."
5,Love these dishes!,"Our family really loves these dishes, they are unique and very sturdy. I will probably be able to pass these on to my daughter when she is older, they seem that durable."
5,My Nephew Lost his,"I found him!!! My 2 year old nephew Nicky lost ""Turtle"" about 4 months ago when some posh child nabbed it from a tots music group my sister ran..the toy had lost his head (dog accident) and my sister had had to sew it all back together to keep nicky happy.. he loved turtle more than an thing they were permanently joined together.. they aren't for sale online in the uk and I had no idea what they were really called... after months of internet searches I found him! best toy I ever known! one happy boy when it arrives"
2,Clips break easily 2.5/5 stars,"Overall they are good and i would buy them again, but the little clips beak so easily just when you try to un-clip them. The picture you see is not what you get. The clip quality is much cheaper than shown. I bought five of these and they all have at least one broken clip but i have replaced them for about $.50 a clip."
3,Really was expecting more,"I really thought this book had a lot of potential. And it did in the first half but by the end, it lost it all. This book had a really good premise and interesting characters too. I loved the back story on every one and the exposition was interesting throughout. However, the ending didn't suit to well with me. Mainly because it felt anti-climatic and above all the villains don't die but get arrested. Really, just arrested after they killed how many people and destroyed how many lives?"
2,Mediocore,I was sorely disapointed in this book. It was an intersting idea and may have done well in the hands of a better author.
3,"Not bad - too much ""self hating"" racism though","This book is a gritty detective novel set in DC with both black and white characters. The local flavor is PERFECT. I think you can go to every single place mentioned and find it exactly as described.What takes away the stars is while the author is white, he can't seem to let go of ""white people = evil racist at worst or can't help themselves racist at best"" and he REALLY hates white-yuppie people apparently. My memories of the late 80s to mid 90s era Georgia Avenue corridor was a sea of ugly low budget low class strip mall type retail. The author, through his characters, seems to really dislike any attempt to improve this urban eyesore. Also the ending felt a little odd.Spoiler>>>>>.................Multiple murder is not what I would call the best solution to a problem for the good guys. Felt very odd."
2,Annoying,"Not much of a mystery - more like a sociological treatise masquarading as a mystery. Race is on center stage in this book, but only in a slipshod way. Basically, the black characters are drawn as multi-dimensional human beings, while most of the white characters are stock villians. As such, it starts to remind you of Blaxploitation literature of the '70s. As a resident of DC, I was also irritated by the endless moaning over how the city has changed in recent years, as though its a sin to open a decent restaurant downtown! All in all it was a decent read, but I won't be coming back for more."
1,right as rain,"i have read 160 pages and still am not compelled to continue this book to the end. the plot is boring and predictable . it does not pull you forward, wondering what happens next. the writing is very good, no question about that; but it proceeds too slowly and has not grabbed my interest. i will read lahaine, colben, crais, and connelly before coming back to pelecanos."
3,"Good read, poor Kindle edition",Right as Rain was my first read of Pelecanos' work and I picked it up mostly based on positive reviews. I almost didn't make it past the first two chapters because of the editing...which seemingly had every other word hyphenated. Between the hyphenation and jive talk character dialogue I found the book hard to read. Overall the story and characters were just OK for me and I'm not likely to read the rest of the series.
3,Good Story but lousy editing,"This is a gritty detective story based primarily in Washington, DC. It was action-packed, as we follow Strange and investigating the truth behind an old crime. My enjoyment of the book was marred by the author's annoying overuse of sentence fragments and sloppy editing."
3,Not Quite THE WIRE,"George Plecanos RIGHT AS RAIN is a perfectly acceptable crime action thriller. The protagonists are all flawed, and the plot is reasonable. But, it might be the rare case where seeing the filth and poverty and desperation that comes from drugs might be more powerful than the words."
1,Dead Boring,"Dull slow story, dull characters. I'd read Walter Mosley over this Pelecanos when it comes to stories involving black characters."
