class_index,review_title,review_text
3,"Good, not great","I have always heard great things about Jennifer Weiner, and was excited to dig into this book. I was a little disappointed, as it wasn't as funny as I would have liked. It was more fluffy than I would have expected. I wanted Cannie to be a stronger, more independent woman - her attempts to reunite with her hippie boyfriend who really was not good enough for her stank of desperation. I do find it charming that Weiner is writing about things she knows about - facing bias and prejudice for being an overweight woman, life in Philadelphia, PA, etc. But, if you are looking for a funny, smart book with a takeaway, you can move right along - it just isn't here."
5,"This book is ""Good in Bed""",Very funny and very hard to put down. I spent many nights reading in my bed not being able to put it down. I highly recommend it!
4,WONDERFUL!!!,"This is the first Jennifer Weiner book I've read, but I will definitely read more of hers! Cannie is a wonderful ""true"" woman with qualities and life time experiences we can all relate to. This is a romance novel that could be a true life scenario. A bit of a tear jerker with a VERY satisfying end. ENJOY!"
4,REALLY Good In Bed,I've heard some bad reviews about this book. Some said it was predictable and unreal. In my opinion this book approaches life just the way it is. Sometimes it's predictable and other times it's unreal. I loved the book because it was totally real and gave me (a plus sized girl) a little hope for something a little challanging and a little unexpected. Thanks Jennifer Weiner!
5,Close to Home,"I couldn't put this book down either...not even amid the stares of my fellow train passengers as I sat, half crying, half laughing my way through the book. I felt as if I was a part of the story, as if Cannie was a close friend, or even myself. The setting in Philadelphia may not be as close to home for others, but I'm surrounded by the places mentioned in the book and that made me feel even more a part of the story. I loved Cannie's sarcastic wit, which is what prompted me to buy it in the bookstore. I picked it up and flipped through a few pages, and I laughed at almost every snippet I read, and that sealed the deal. I'm already recommending it to my friends, and ready to start on it a second time."
4,awesome.,"I work as a bookseller at Barnes and Noble, and I have never been a big fan of ""chick lit"" but I have loved this book since it came out. Cannie's struggle to overcome what has been thrown at her is inspiring and this book makes me laugh out loud and choke up. Highly reccomended."
1,Please explain this book's charms?,"The only good thing about this book is that it makes me think I can quit my full-time job and write fiction novels, because apparently people will read anything. The main character is completely miserable. I also don't like the way she disparages against her mother's partner (and her mother), it borders on lesbian-bashing. I wouldn't be able to recommend this book to anyone other than to have them read it to see how even such poorly written material can do well these days. This book is a definite skip."
3,Could Have Been Better,"This book is not for anyone with self esteem issues. The main character Cannie is a co-dependent being. The author never allows the main character to find self without out a man,family member or friend.Cannie is made out to be an indiviudual that never comes to grips with who she is and never learns to stand on her own 2 feet or even love herself.There are some high points to this novel, but as a whole, I was thoroughly disappointed."
3,is good in bed really a good read????,"the amazon.com reviews of this book were so high that i struggled to not feel disappointed reading this book. i will admit if you can get through the first 2/3 rds, it has some rewarding moments. the story is half-fantasy, half-reality, but more fantasy. i wished it would have been one or the other. the book is based on the main character Cannie's ex-boyfriends column . Neither one really get delved into. It's only in the last third did I really have any compassion for her, but when those moments arrive they hit like a truck. The book is lengthy and I felt that there were areas of the story that weren't developed fully, but to mention them would give the whole story away. It's an easy read and you will laugh out loud a number of times, just don't expect a perfect story or how to learn to be good in bed."
5,it'll tickle your funny bone and touch your heart too,"I totally adore this book. The story hits the ground running right away, so you'll be sucked into it in no time! Cannie is one of the most believable women I've come across in a long time. Most of us women deal with body image issues no matter what size we are, so we can really relate to Cannie's insecurities and doubts. The author also portrays the other characters very well. I read this book in only a few days! (If I was on vacation I probably would have finished it in a day.) Trust me, women won't be able to put this book down. I'm not sure if guys would like this book, but women definitely will. Women ~ enjoy! Go out and get it!!"
5,Bravo,"Bravo and thank you Jennifer for bringing Cannie into life. ""Good in Bed"" caught my eyes in an Athens bookstore. I stood at the shelf and started reading the first chapter, then I sat on the floor and kept reading until the store clerk told me they were closing. I bought the book and didn't put it down the whole night and the next morning, until I got out of the train and sat on the bench in the metro to finish the last 7 pages before I'd go to the office.I can't find the right words to describe the thrill and satisfaction this book brings to a reader. I took an unforgettable journey with Cannie to her workplace, to her doctor and her friends and family, to the streets of Philadelphia, to her thoughts and fears, to her memories and not even once I found myself bored or uninterested."
5,If you've ever struggled with a weight problem.......,"If you've ever had a negative self-image due to some extra pounds, you simply must read this book!! After declaring ""Watermelon"" as my all time favorite read for years, ""Good In Bed"" is my new favorite contemporary fiction novel.Weiner develops the character of ""Cannie"" marvelously. She struggles to accept her lesbian mother's lifestyle, get over her pot smoking ex-boyfriend, and rise above a hypocritical, absent father. The thing that I liked most about ""Good In Bed"" is the many surprises that Weiner weaves into the story. This is not your average, predictable ""girl searches for boy"" story. There are several incidents that will make your heart ache, and many more that will make you laugh out loud!I did not want this book to end!! It truly impacted my own self-image. I am so looking forward to this author's next work."
5,Yay!,"What a delight. Yes, there are some bitter moments, but the way the book alternates between hard-won insight, humor, anger, and triumph reminds me of the use of dynamics in classical music. Float like a butterfly, sting like a bee, this debut novel has the empathy and charm of Maupin, the insight of Updike, the touch of the absurd from Vonnegut and the passion of, well, Weiner. Nice to have all that in the guise of a beach book. This book is simply a joy, on many levels.Hopefully this will end up as a film, where it could end up as something along the lines of Working Girl (the Melanie Griffith movie) as directed by the Hairspray-era John Waters.I also recommend her tour diary from the ... website. Perhaps the publisher will see fit to include it in the paperback edition."
2,Trapped by its own genre,"Bridget Jones pulled it off - and she remains the queen of chick lit. This book fits comfortably in the same genre; however, when the author tries to become more ""serious"" and gives her heroine a ""psycotic"" adventure, it becomes almost too painful to continue reading...The first part of the story is the most engaging - and the most clever. The periodic columns written by her ex-boyfriend works quite well in driving the story forward; however, after they cease to exist, the hum-drum starts. After the ""reunion"" with the uber-mean father figure, the plot skids downhill. Finally, the ending just keeps going and going - a more over-the-top finale is hard to imagine (did she perhaps just die and go to paradise?)A decent book for the beach, which the author probably was aiming for in the first place :)"
1,Author makes unforgivable mistake ...,"A pleasant-enough read until about halfway through, when Weiner FORGETS she has told us on page 3 that Cannie was imitating her mother's life partner, Tanya (also spelled Tayna in this poorly edited novel) when she first meets Bruce. Later, she tells us she and Bruce were dating the day she is devastated by the news that her mother is gay and that the woman who's been living with her is, in fact, more than just a friend. If the author didn't care enough about Cannie to get the details of her life right, why should we? Sloppily written and lazily edited; a complete disappointment."
1,Depressing Read,"I was looking for a good ""beach"" read, and thought this was the one. However, the main character is so depressing, and so self-deprecating, I am sorry I bought this book. Cannie is a self fulfilling prophecy with her laments about her weight issues, her disturbed childhood, her boyfriend problems, and her lesbian mother. I was very disappointed in this work, which surprised me as I enjoyed In Her Shoes. It's a depressing read, and I'm only on page 100. I'm putting it down and selling it to a used book store."
3,Not as good as I had thought it would be,"I was very disappointed in this book. It wasn't anyhting like I had expected. Maybe its just because I am all about happy, hilarious books that aren't depressing, and this book was not only depressing, it was in some parts totally unrealistic. Poor Cannie couldn't seem to catch a break, and yeah everything ended up okay, but only after a string of heartbreaking events. Why was she so stuck up on an ugly, immature, pot head ex-boyfriend that she broke up with? I didn't get it. I just couldn't relate at all. Being heavy set, I though I could relate. Boy was I wrong!"
2,Too much self pity,I was expecting a light-hearted romance and instead found a main character that was so depressing I could hardly get through the book. It was pitiful how the character kept deliberatly defeating herself only to finish strong in the end. I had a hard time getting involved.
2,Not that great...,"This book was recommended to me by a friend who described it as hysterical and an easy read. At least the later was true. Although the main character has a good sense of humor and whit about her, the story itself is tragic and depressing. I just kept waiting for this book to end! Although some great things happen to her, I think the awful things she comes across are too mournful to make the good things count for much. I will not be reading the sequel and recommend this book only to those in search of a story about the cruelties of life. I give it two stars because it was a quick and easy read and well written. I just did not enjoy the plot."
5,Very good read!,I loved this book. I thought it was light and humorous. I loaned it to my Aunt to read next because it was so good. I just bought the next book called Certain Girls and I am excited to read it.
5,Smashing!!!,"I loved this book! I read a lot of chick lit and this book is at the top of my list of ""must reads."" Cannie was someone that I grew to care about and couldn't wait to find out what was next for her-a real page turner. I loved the little-well, maybe major, surprises the author threw in to keep you interested. More than once I found myself saying, ""Wow, I didn't see that coming!!"" Don't miss it!"
4,If you love real life nuances...you'll love this...,"Although this book had a somewhat slow start, I found it to be funny, interesting and eventually hard to put down. The real-life experiences are hillarious and so right on target that it sometimes reminded me of my own life. It was a full circle of love, loss, love and self-awareness healing. Cannie is a down-to-earth character that embodies traits of every single young woman looking for love while dealing with self-acceptance issues and body image stereotypes. When she truly finds love it's right in front of her eyes and she ignors it - shoos it away and slams the door on it. What makes this book so good is that the author, Jennifer Weiner, doesn't reveal the ending within the story. I love to read a book without knowing how it will end. Some stories you can tell by the 3rd chapter or half way through, but not this one, it keeps you hanging on til the end. I highly recommend it for fun summer reading!"
4,Great read for the beach this summer!!!,"Once I started to read this book I could not put it down. It is a ""feel good"" book that almost any woman can relate to."
2,not as good as I had hoped,"This book started out well, but lost its steam. I was disappointed by the slowness of the book and kept waiting for it to get better."
2,Too slick for its own good,"This is a very canny novel about a woman named Cannie (what a coincidence). And by ""canny"" I mean slickly tailored to the prevailing literary market: young woman in publishing flails comically through relationship (and weight) issues in today's crazy mixed-up urban world. Much of the time this reads exactly like a Hollywood movie treatment, in fact the excerpt provided here ... gives you a swell idea right off the bat. If this is your thing, and you don't mind frankly unbelievable twists like Cannie (a reporter) bonding deeply with a movie actress she's profiling (happens all the time, right?), then I can recommend this novel highly. If you want substance and real atmosphere in a book about women's problems ...."
2,Not Impressed,"I decided to read this book based on the good reviews here. Sad to say, I was not impressed with this book. It's Jemima J meets I don't know who!! The story line seemed so hokey, predictable and unbelieveable to me. At times you want to knock some sense into Cannie for not having the self-confidence that I know is somewhere inside of her. Maybe I was disallusioned as I began reading the book...because I never expected to be so depressed about it after I was finished with it!"
5,laugh out loud funny,"I actually laughed so much when reading parts of this book that I woke my husband (I read it all one night in bed because I couldn't put it down). The story is great, the character is great (so human) and the writing is great. I cannot wait for the next book to come out in paperback."
4,Enjoyable Quick Read,"Big or small, short or tall; you will be able to relate to the main character of this book Cannie Shapiro. Cannie, is a reporter for the Philadelphia Examiner who just recently wanted a break from her long term relationship with Bruce. Its very obvious that Cannie and Bruce have very different ideas of what a break is. Bruce decides to write an article about loving a larger woman based on his relationship with Cannie for a national magazine. Because of this article Cannie begins to question everything in her life. Will Cannie every be happy, find the right man, find the love she deserves? You will have to read Good In Bed to find out.This may have been the first book I've read by Jennifer Weiner, but it certainly won't be the last."
4,a good read,"I really liked this book. After reading some of the negative reviews on the Amazon postings all I have to say is this: This is a good entertainment read, I don't think it was meant as a guide to live your life by. Cannie is very lovable and gives a great point of view. I loved that it was real-to-life with Cannie not turning into a super-model thin character. I am glad I made this purchase and I laugh that some people take entertainment so seriously and bag on every issue presentable."
3,???,"I agree with the one reviewer. It started out great and funny, then ended up being sad and miserable. She was a plus size... then she became smaller. Then bigger again... I liked the man she got with at the end though. He was a great 3-D character. I honestly could not figure out if I liked this book or not. I know that there are books that I liked much better and some that I thought were much worse."
3,Good at first - But then I have issues,"My book club had a month where we would read books that we were ""ashamed to want to read"". That meant a month dedicated to chick-lit. We had heard that this was the most un-chick-lit book of the bunch and decided to give it a try.Let me say that that is chick-lit. Yes, there are some twists and turns and a life crisis, but overall this is the same old story. Amazingly good things keep happening to the heroine that would never occur in real life. In addition, horrible awful things happen that are not really explainable.Everyone keeps writing about how they love the heroine in this story. Honestly at first I totally related to her. She was strong and fun and honest, but after a while I just started to say ""get over yourself and move on"".I'm giving this book three stars for the first 200 pages. I thought it was fun for a while, then it just tried to get too deep."
3,Enjoyable but not stellar,"As someone who has had a weight problem I can relate really well to a lot of this book. It's got a certain realistic quality regarding overweight women that it seems is quite lacking in a lot of books.The plot is rather all over the place, and as the book is written in a humorous and lighthearted style it is a little jarring when some of the darker parts of the story come along.Overall it was an enjoyable read, though it's probably one of those books that I'll be able to re-read in six months because I'll have forgotten everything that happens."
2,Definitely a first novel,"""Good in Bed"" could have been so much better. It has some funny lines and a few less-than-earth-shattering insights. But it reads like the author did little more than detail her fantasies. Like in most fantasies, dreams and daydreams, there are no logical, believable connections between Point A and Point B -- the instant movie-star friendship, for example. And, also, much of the ex-boyfriend's writing that Cannie (thus, the author) mocks as amateurish and superficial isn't really any worse than the author's own. The premise is great; I wish Weiner would have written it five to 10 years from now or at least had a better editor."
3,Disappointed,"Cannie starts out as an interesting character. The ex-girlfriend who is now public fodder for her ex-boyfriend's magazine column. The story could have been about Cannie's examination of her own issues, as well as the ex's. Instead, she's the selfish harpy brat. Ex-boyfriend's dad dies? Use the funeral to try and get back together with him by doing the deed with him that day! Of course, she gets knocked up. So she (subtly) tries to use the pregnancy to try and lure him back to her!Meanwhile, she steps all over her family and friends, and ignores the kindness and obvious interest of a terrific guy. She gets the Cinderella treatment from her Fairy Movie Star, takes away her ex's column, and whines all the way to the bank. Of course, Dr. Charming sticks around despite her being a grating, clueless, selfish jerk, and wins her ""heart"".Cannie a plus-size heroine? No, just a big fat brat."
2,Extreme Wish Fulfillment,"I picked this up at the Salvation Army. I enjoyed this book at first. Ultimately, however, I agree with the reviewer who said ""the heroine remains self-centered, self-pitying, immature, judgmental, condescending, elitist, and cruel throughout the whole book, and is repeatedly indulged by friends, loved ones, and [allowed] to dance through life without having to take responsibility for herself."" The only realistic part of this novel is the description of the verbally and emotionally abusive father - seems the heroine/author has adopted his voice without knowing it."
2,NEXT!!!!!!!,"Wow,the lesson I learned from purchasing and reading this book is- never assume that the New York Times bestsellers list is an accurate measure for a good read!Hyped as a great summer read, I looked forward to enjoying this book, however, instead of finding a story which could substantiate the media review raves, I read a girl meets boy-boy meets another girl-girl finds someone who really loves her predictable story, laced with cynical, self-abasing, slapstick humor. The continuous onslaught of big girl jokes made it hard to hang in there for the ""now I love myself just the way I am"" fairytale ending."
4,Why did it have to end??,I loved this book! The only reason I rated it short of five stars was because it ended to soon. I wanted to know what happened with Bruce and also Peter. It's an ideal book for any woman dealing with weight issues. I loved all the characters. Jennifer described them greatly. I'm hoping for a sequel to answer all the questions I have.
1,"If THIS is the best, what is the WORST???","I grabbed this book in between flights after a non-solicited suggestion in the airport. Wow, if this could be considered great, I can't imagine making it through the worst! The plot moved incredibly slow making every turn of a page painful. Cannie spends so much time sulking about a man who as described no other woman would appreciate much less, want. She does this (and complains about everything / everyone else in her life) without taking any responsibility or doing anything to improve herself or situation. A few big words are thrown in from time to time yet they do nothing to strengthen a weak, predictable yet completely unbelievable story line. Sadly, this book was a HUGE disappointment and the fact that I foolishly paid full price for it in the airport bookstore only heightens my annoyance.This was brutal and certainly NOT my idea of a good ""beach read"" - The only reason I made it to the end of the novel was the fact that I was stuck on a plane..."
2,Good in Bed,In Her Shoes was the first book I read by Jennifer Weiner so I thought I would read another book authored by Weiner. Good in Bed's character was a whinner and not very interesting. Didn't see the humor in any of the story and the book was wordy. Disappointing that this wasn't as good as In Her Shoes.
2,Maybe if I were on a beach....,"I'm sorry. I'm going to be the one who disagrees with everyone. This book annoyed me. Yes, I did end up finishing it...so something kept me reading it. I think I was always waiting for more complexity to these characters. I wanted to like them and I just didn't really care about anything they did. There was something so stereotyped about them.Just not my style of literature. It seems more like a very long non-fiction story from a women's magazine."
5,A great fast read.,I really enjoyed this book. Nothing too deep but a good story that keeps you interested. The author is very funny and I'm already looking forward to her next book.
5,Wonderful and funny,"I was in the book store just browsing when i can across the The New York Times Bestsellers table and there i found ""Good in Bed"". I read the back and though well this sounds good so i bought it. I didn't get to the book right away because i was in the middle of reading the Harry Potter's series. So when i finished up with Harry i started to read ""Good in Bed"". Well, i was hooked from the first chapter. Her characters were so real, genuine and funny. The main character ""Cannie"" is so much like every women i know. Insecure but not weak. Sometimes sad but still funny. Strong but in need of support. I would recommend this book to anyone that sees life for what it is. Someone who enjoys a quick, funny good read. Someone that can stand outside themselves and laugh with the best intentions."
3,A Great Start...,"I really enjoyed about the first half of this book - the character's razor sharp wit, and the ""real"" feeling of the story. I didn't like the ""fairytale"" qualities later on - suddenly rich, semi-famous, friend to celebrities, the perfect man pursuing her, ""getting back"" at the ex... it just became too sweet and perfect and something that NEVER happens to the average woman. I liked her better when she was fairly ordinary and everything wasn't falling so grandly into place."
2,I tried to like it,"I tried to enjoy this book but I found it irritating after a while. The narrator seems to have a real issue with vegetarians and she constantly takes pot-shots at them. (Her ex had the gall to be a vegetarian! A guest at her mom's Thanksgiving dinner had the nerve to eschew meat! A food critic is mad at vegetarians!) She seems to have some sort of ax to grind, and after the fourth shot was fired against vegetarians, I'd had enough and put the book down."
3,Definitely a book I wouldn't mind leaving behind at the airport,"Hey, not every book needs to be a new version of Hamlet or informative or wise or even a good story. So, if you're in the mood for filling time but not engaging your emotions or brains, go for it!"
3,Second half goes downhill....,"I think the first half of this book would be 4 stars, and the second half would be 2 stars, so I compromised with 3. The story hooks you in immediately and seems to set up a unique plot. The flashbacks to explain her relationship with Bruce and her family issues from childhood add some depth to the story and help develop Cannie's character. The book goes downhill fast after Cannie becomes best friends with ""Maxi,"" a famous actress she was trying to interview for a column. After this unconvincing friendship, the story becomes increasing ridiculous and unbelievable. The book was entertaining for the most part, but it was definitely frustrating toward the end. Worth reading if you are bored, but not a must-read."
