class_index,review_title,review_text
2,Get Hot Show and Saturday People,"First of all, I will get this off my back. Ashley, you're a child. Wow, so what is Prozzak says words that don't get censored on TV. Get a Clue sucks, its the worst track, because it's so Disney. It's not bad though, but the other tracks are better. I rather not buy this one, I already got Hot Show and Saturday People. I have always liked Prozzak, since their beginning in 1998. Disney ruined them. They even changed how Milo looks. Ashley, you're still an ignorant child."
1,only one good song,"I have only heard SMALL parts of each song and the songs are kind of obnoxious. I dont recomend this for kids.""Get A Clue"" is the only good song because it is related to disney so it has to be that way."
3,Savage insects,"More than half of this DVD deals with insects and birds. Now one would expect a DVD dealing with wildlife in Africa to concentrate more on the unique mammals of the dark continent. The title and director review imply footage of big cats hunting. however, there is not a single hunt by a pride of lions, a leopard, a cheetah, ...Overall I give it a generous 3 stars."
5,From The Director of Savage Secrets,"I am the director of Savage Secrets. Let me invite you to enjoy an extraordinary documentary made by one of South Africa's top cinematographers and the added interactive experience - a first of its kind! Stunning images will show you the fight for survival in the African savannah. Never before has the dance of predation been captured with such clarity and painful beauty. In addition, you can interact with the DVD by calling up explanatory videos, which, narrated by biologist Erik Holm will provide you with a deeper insight into the Savage Secrets of African animals. Additional features include a `Making Of....' in which award-winning cinematographer Fanie Van der Merve invites you to join him on an expedition to film animals in the wild. Rounded out by a photo gallery, this DVD truly provides a stunning window on life in the African savannah. Enjoy!Chris Sattlberger"
4,Good,"Good product, makes your hair soft and works great as a defrizzer (and for me, that's saying a lot - I have Hermione Granger hair.) The only complaint I have is the smell. It isn't a BAD smell...but it isn't a great smell either. Just smelling it tickled my nose and made me sneeze, and none of my hair products have ever done that before since I don't use hairsprays or anything like that. But, it worked so much better than the leave-in conditioners that I tried from the salon (Biolage products, for example). So for that, I will deal with the smell and give it 4 stars out of 5."
3,Nothing special,"I bought the smaller bottle of this leave in conditioner. Definitely not worth the hype and price. It left my hair more staticky than on the days that I don't use it. Everyone also raved about the smell, but I thought it smells like dish soap. It doesn't make my hair feel softer, shinier, fuller, etc..I'll probably continue to use it because I bought it and it's not like it ruins my hair, but I'd never buy it again. I have blonde fine hair."
4,Very Nice (but not crazy about the smell),"This leave-in conditioner is pretty amazing, it's pretty moisturizing but doesn't weight your hair down. It doesn't feel greasy or tacky. I do brush my hair after I put it on, in case there are small clumps. This conditioner is texturizing, and actually kind of volumizing. The only thing I don't quite like is the strong scent, it smells kind of pretty, but is very artificial. I don't like very highly scented products (lotions, shampoos etc.), so it might just be me being picky. The good news is that the strong scent wears off quickly after your hair's completely dry."
5,Great for smoothing out frizz!,My hair dresser uses this product and I loved the way it made my hair feel. It also works great to smooth frizzy hair. I use it every day!
5,AWESOME STUFF,"My hair dresser introduced the Smoother to me a few years back and I have used it ever since! It not only smells great but does a wonderful job for the shine, smell and thoes pesky knots! Highly reccommend this! I have been out of it for a week do to another company's mistake and my hair just isn't the same."
1,Rusk sensories leave in conditioner,"This product does not smell like passionflower at all. First of all I don't care if it is scent free or perfumed. I just want my hair shiny and smooth. This product made my thick hair dull and gross. My hair Texture became rough and it felt like I'm attracting dirt. I just spent a lot of money and I can't even use this product. I ordered the duo- Shampoo and Conditioner. I was expecting a shower conditioner not a leave-in conditioner. I will use the shampoo but I cannot tolerated the dirty feeling this leave in conditioner made my hair. I don't want to mail it back because then I will to go to post office and spend for mailing fee, too much of a bother for me. I'm totally disappointed."
3,Passionflower and Aloe Leave in Texturizing cream,I wish the procduct was pack better. The top part of the bottle was broken and the Leave In Conitioner was leaking all over the box. I needed up have to purchase a bottle to put the product in.
5,I love sensories smoother!,"The price very good, and the product excellent,leaves hair beautiful, do not need to rinse, I recommend it 100%, my daughter has very curly hair, I can control your hair with this product rusk sensories smoother."
3,Not wheat free,"This product has WHEAT in it. I couldn't tell from the listing. It smells fine, not too strong. But I have not used it on my hair because of an allergy. It is a pretty huge bottle and I hope my girlfriend enjoys it, cause I sure can't use it."
1,Worst,It makes my hair oily and got dandruff after using couple of times. I won't recommend this product to any.
2,Don't like it,"I don't like this leave in conditioner. I usually buy WEN products but was looking for something cheaper and just as comparable, but THIS IS NOT IT!!!! For one it smells terrible and my hair was greasy and thin when I used it. I guess I'll just have to save up for the WEN. It's to bad because this is a BIG bottle and I don't know what to do with it, it would cost just as much as the product to send it back."
4,An Exciting Cop Tale,"B.J. Whalen,s police thriller ""Justifiable Homicide"" is a hard to put down page turner. There is lots of action, with a high body count of baddies, plenty of injustice and even some redeeming vengence. It is a welcome edition to the cop-crook genre with a better than usual plot. Set in NYC it captures some of the up to date turmoil that often makes tabloid headlines. It is full of drug dealers, petty crooks, high paid lawyers and a few cops that sometimes stretch and even break the legal limits. Add some politics, a little sex, some humor and spred the story accross the state of New York and you end up with complex mixture that is often combustible and violent. A hard hitting, straight shooting tale that perhaps ought to have added a plural to its title. The reader will also have to decide if it is justifiable too! But the reader won't be bored!"
5,JUSTIFIABLE HOMICIDE,"B.J.WHALENS BOOK ""JUSTIFIABLE HOMICIDE"" WAS AN EXCELLENT READ. NOT ONLY A GREAT STORY LINE, BUT HIS KNOWLEDGE OF POLICE PROCEDURES WAS COMPLETELY ON THE MONEY. I WAS SORRY THE BOOK HAD TO END BUT I'M LOOKING FORWARD TO HIS NEXT ENDEAVER. ANDY SOVIA / RETIRED NYPD"
4,This CD has major soul,"I've seen Donna dozens of times, and I've seen Lauderdale play with them numerous times as well. I love Donna the Buffalo, but I have to say that they've never sounded better than backing up Lauderdale on this peach of a record. Their live shows together are unbelievably fun, rockin', and intense and this is the closest you'll get to that (unless you know one of the peple who tap into the sound board at Grassroots). All accomplished musicians playing and singing songs wiritten especially for their unique sound. You won't be disappointed."
4,Worked as advertised,It came well packaged. It installed in the unit with no problems. Good thing I had an installation tool... You could ruin it using a pair of pliers.
4,Jamie Escalante: Sensational Teacher,Knowing more of the man behind the Movie Stand and Deliver is inspirational to me. A good book for any math teacher to read.
5,Great Measuring Wheel,I am a landscaper and this measuring wheel is perfect for quickly measuring landscape beds and customer's lawns. Originally I had been using a reel type tape measure and by buying this measuring wheel it has saved me an enormous amount of time when I have to measure square footage as it relates to jobs I am doing. So far the quality seems great with this product. I would highly recommend anyone who wishes to measure things outdoors get this product.
2,"I love the A-Team, but these dvd's really stink.",It was a pleasure to see SOME of the episodes on these discs. Other episodes freeze up repeatedly during play and the others aren't viewable at all. I was very disappointed and would have loved to have seen all the episodes of this season. I just purchased season four and am having the same problems so far.
5,LOVED THE A-TEAM,GREAT DVD'S - MY 10 YEAR OLD GRANDSON LOVED THESE SHOWS AS MUCH AS HIS DAD DID WHEN THEY WERE ON ORIGINALLY.
4,The A-Team - Season Three,Excellent. Good quality. Wife enjoyed. I enjoyed. Been looking for the A Team series for a very long time. Glad that you had it available
4,Birthday gift,"I expect it to be wonderful, but it's a birthday gift that won't be delivered until early July."
4,Waiting for the movie!,What can I say. I'm getting myself ready for the upcoming movie. If you are a diehard fan you need to get this ! See ya at the movies...
5,DVD with a very good quality.,"The DVD presented an excellent quality so far. I didn't see everything yet, but so far it has been very good. There are scene selection, episodes plot for each episode, possibility of subtitles in English (I'm not deaf, but I still need it to improve my English!). Now, I finished the first disc and started the second one. Let's hope all the discs have the same good quality as the first one."
3,Nice season Dvds have problems,"For the first time ever as the package stats the set is presented in 3 Double Sided Dvds with the pros and cons they have.In the episode The Bend in the River I have some freezes on the playback which aren't serious but keeps me away of the events deplayed.These discs are more easily scratched than the single sided but in return they are cheaper to mass production and studios choose this also because more episodes can be included per side this way only 3 double sided discs are needed to fit the entire 22 episodes in single sided discs double discs will be necessary.Regarding the episodes another fine season with a lot of Guests Stars:Stepahanie Kramer(Hunter),Dennis Franz(NYPD Blue,Hill Street Blues),Richard Heard(V),Richard Lynch(Blue Thunder) and more.I will wait to see Season 4 my favourite."
2,Finally one without a scratch,I have ordered all the seasons for my son over the course of a year. This was the first season that had a disc without a scratch on it. You take your chances with this product.
5,"Murdoch in love,and,normal!!",Absolutely one of my fav episodes. Bounty hunters using Murdoch in an attempt to lure and capture the ATeam. What I particularly enjoyed was the fact that Murdoch's love interest was played by Dwight Schultz' wife. So sweet!
5,best shwow ever,I am glad they are going to bring this out again. I have been waiting a long time for the third seasonI will get it once it comes out.
4,Few books like this one.,"There are not many good books on chaos in both classical and quantum mechanics; this one is surely an exception. Gutzwiller is well known to be an expert in the field. However, it's a little bit disappointing that the book may be too ""qualitative"", that it loses the rigor as appeared in related journals. Afterall, this is a good book."
2,Close to Useless,"I am used to reading graduate texts where I have to fill in extensive portions of the logic. However, this book does not even begin to explain the results contained in it. It is simply a collection of results, with references to other texts with little explanation (although he does a good job motivating the results).As I was writing this review, I opened the book to a random page (279) and found the following: ""Zaslavski (1977) also starts from the trace formula; he gets a rather explicit expression for the spacing probability P(x) which involves the Kolmogorov entropy..."" How did he do this? Well, if you want to know then you have to go read Zaslavski to find out. The entire book is this way.Maybe this is a great reference for the researcher who already understands the field, but for someone trying to learn it from this book it's worthless."
2,We need more books on the subject,"While the question of connecting quantum theory to classicalmechanics, ODEs, PDEs, etc is a very deep one, and theauthor is a main contributor in the subject, the bookslacks of narrative momentum... Readers of, say, QFT a laItzkinson-Zuber will be accostumed to this, but I feel amore focused work on the subject is still to be written."
3,Damage? (I'm assuming it's from shipping),"I needed a ramp right away, but the 7' ramp delivered was very bent on one one side from what I assume was poor handling in shipping. It looked like someone had dropped it off a 10 story building. I would have returned it, but with my disability, It's too much of a hastle. Otherwise, it's a good product."
2,Edges dangerous,"This works well as a ramp, but no one wants to use because the rough metal edges are so exposed. Plus, it's really heavy,"
3,"Great to learn with, bad resources","This book is very good on teaching the basics of C#, and makes you think a bit. The tutorial driven approach enables you actually get experience in every chapter ( at the end of every chapter are good exercises). The problem is that you do not have the answers to the excercises available unless you have the Teacher edition ( this is a classroom book ) , and Deitel will not help you out in this area ( say if you are stuck on an excercise ).There are also 'Programming Challenges' at the end of every chapter that have you use command and concepts that you have yet to learn ( not in all but some ). Other than that, this tutorial is very good, just bad customer service from the authors."
3,The quality of the book is poor non the content but the material and lack of color,"I have the same type of book but for Java. It was a great book, same material but different language.This one seems somebody went to the Xerox copier and same the copy of the original.The CD does not come with the book but I can download the code. That is OK.I think the price is not justifiable but greed. This book should cost only $20 the cost of the bad paper copies.It is terrible that Dietel is loosing quality. It is not reason to charge that amount for this book. I do not return the book because the content and the way of teaching C# is my kind of tutorial that I like.I think somebody is making money just copying books. This books was not printed byt xerox copied."
2,Why bother?,I browsed the book and though it contains some helpful tips it is overloaded with episodes from the life of the author which I frankly find both uninteresting and out of place.I recommend reading a book from the antipatterns series instead.Anyway if you are still curious about the book why don't you download the freeware pdf version and decide yourself if it is worth buying it?
2,Disappointing!!!,"There is some useful information, but it's normally very hard to find because there is TOO MUCH DISTRACTING information such as kayaking and Mount Everest. Reading this book is very tiring because you have to try hard to separate the author's good programming advice from his programming career and, again, his kayaking experience. I am sure if the author tried hard enough to sum up the whole useful information, this book could be as thin as 50 pages.The author has to decide whether he wants to be a novelist or a computer book author..."
4,Good java anti-patterns book,good sections on the ejb and web tier with common anti-patterns illustrated. however most materials are introductory and i was hoping for more advanced techniques and advice to writing good j2ee app. this is definitely a good first book to understanding how to write/architect j2ee app the right way.
4,Very good.. finally understand beans..,"This book is very good at explaining some tricky situations in which we often get ourselves when programming web applications. It helped me weigh some stategies I had been using (sometimes improperly). In particular I benefited by the explanation of proper use of beans and the Command design pattern, which I had read about in numeros occasions but failed to understand until now.The book also plugs some holes that ""Effective Java"" should have covered.. like for example the NECESITY of calling dispose()/close()/destroy() functions in a finally block (my own personal favorite tip). I just regret the book didn't emphasize or practice it enough!My complaint about the book is that it seems to cover a few topics and then just abruptly ends.. I was expecting more."
2,Good for beginning developers,"This book is well written but I was expected something more advanced. If you have been a real J2EE developer for at least a year, you would probably have run across some if not most of the problems already. You also would have worked around them using solutions from other Java books you have.This is a good book for new developers. They should be able to recognize problems early on after reading this book."
3,Good But Could Have Been Better,"I'm mixed on this one. This books attempts to present refactoring in a way that inexperienced developers can understand. In that respect, I think the author delivers. If you're a beginner (or maybe into mid-level), get this book when you're past the fundamentals stage. Advanced programmers, however, will already be aware of most of the material from experience. I think it would have been better to target either either advanced developers with more complex topics and code, or just fine-tune this text a little to target advancing beginners to mid-level programmers."
4,Bitter - But Not Tasteless,"Bitter Java is an excellent example of how to balance real world Java development experience with more simplistic examples. Full of usefull development patterns, Bruce's choice of relavant examples will not deter an inexperienced Java Developer from gleaning good coding design and style.One of the nicest areas of the book where Bruce's experience shines is his use of refactoring to improve the performance and scalability of maintained code base. I certainly hope the importance of refactoring one's code is not lost on the reader. It is a must for everyday Java develoment; where code re-use is now being stressed as companies try to do more develoment with less resources.Bitter Java shows us the errors of our ways, but adds a bit of cream and sugar by providing us solid solutions for writing better client/server, JSP, EJB, and other J2EE code. Drink it down, while it's hot!"
2,Get the free PDF version if you really want to read it,"Don't bother buying the hard copy of this book. The so-calledantipatterns in this book are too simple for anybody who hasat least some common senses in using servlet/jsp/j2ee.Maybe useful to true beginners, but then the free PDF versionshould suffice."
2,"Rehash of other peoples work, with mistakes",The book has numerous poor examples or actual mistakes and whats good is easily obtainable else where.Where does the author get off reviewing his own book! Talk about cooking the ratings.
2,"Not bad, but very basic","Not a bad book really ...... if you never did (server side) programming. Or had someother decent education including topics like caching,modularisation, Model-View-Controller.For EJB there are better books (as Tate acknowledges)like Roman's Mastering EJBs or more general:Core J2EE patterns.So if you are just starting programming inuniversity, Bitter Java might give you a taste ofthe real world.Again, it is not a bad book, but very basic.A little bit wordy perhaps -- I do notmind his kayaking excursions -- but the text itself.Three years ago as a one-hourpresentation I might have liked to listen to Bruce Tate,but in 2002 as book this is absolutely boring"
5,Must for Java programmers ...,"Quite an intriguing title. The book opened up a whole new world of antipatterns. Good supplementary read to design patterns. Explores good techniques to develop Java applications.The author defies you to contradict the common sense of knowing antipatterns by giving interesting metaphors in real life.All in all, a ""must read"" book."
3,Another Cookbook,"I was happy to find this book about Lunar returns, a topic on which you will not find much literature. However, I was quite disappointed with the content. It's just another cookbook delineating planets in houses and aspects between planets. The delineations are well-written though. There is a short chapter on transits to the natal planets too and a (very) short chapter on New and Full Moon, retrogrades and eclipses. You will not find anything about the real standouts in the Lunar returns, nor about progressing the Lunar return chart, nor about important midpoint configurations, nor about the relationship with progressions or solar returns, nor about sensitive degree areas or exact conjunctions to prominent Fixed stars. There is nothing on the Lunar parallax. This book is a good beginning though and I'm glad somebody has written a book about Lunar returns."
1,Lunar Returns,"Please do not buy it! It is not worthwhile at all. No matter if you are a beginner or an advance student of astrology, the book is useless. The author has underestimated the reader using a kind of ""copy/paste"" method from any other kind of superficial book of astrology in order to explain the meaning of the planets in the houses and the aspects between the planets in a lunar return chart. You cannot learn a bit from it. Astrology is a very serious matter and books like this should not have to be published ever. I am very disappointed."
3,nuclear assault live in a hall loaded with seats?,"this is a good show but they did little more than just play,the sound was weak and some feedback(but ahaoh this is NA-feedback)great set list but the show lacked energy and a crazy crowd."
2,AURAL AND SENSIBILITY ASSAULT,"Nuclear Assault, featuring former Anthrax bassist Dan Lilker, have got to be the most monotonous, talentless thrash metal band in history. With a running time at just over an hour and 23 tracks it's obvious they pride themselves on playing songs that are less than two minutes long. It doesn't help that vocalist/guitarist John Connolly is adept at neither of his vocations. The only song that is memorable and comes close to being good is TRAIL OF TEARS. They butcher Led Zeppelin's GOOD TIMES BAD TIMES, which sounds unbelievably bad and B**TF**K is absolutely pitiful. Abominable, baneful and just plain rotten could sum up this video (yeah, I am checking my thesaurus). I'm only giving it two stars for TRAIL OF TEARS alone."
3,Wonderful Book; Poor Edition,"This is a gorgeous children's book; I had it as a child when it was first published, and I fell upon the re-issue about ten years ago and bought several copies for grandchildren and friends' kids. The illustrations were what made it so magical: beautifully conceived and drawn with lush colors.I ordered this latest edition, again for a new grandchild, and when it arrived I was very disappointed in the quality of the pictures. They look washed out and poorly saturated, as though the publisher were trying to save on ink. Comparing the two editions side by side, the difference is very striking. Although it's still a wonderful book, and not having seen the earlier editions a child won't know what he or she is missing, still some of the magic is gone. The fairy marbles no longer glow off the page and the silken scarf is a pale version of its former self. It's better than nothing, but what a shame to have taken the spirit out of those lovely pictures!"
3,Not a hit yet,"I have some other older fairy tales and golden books that my daughter adores. I thought this one would be good too, but the stories haven't been a hit with her as I expected."
5,Wonderful!,I remember pouring over this book when I was 4 or 5 years old (50 years ago). I couldn't read it all but I loved the pictures. My grandma read it to me at bedtime. She is long gone now but this book gave me warm fuzzies and I got teary when I found it.
5,Out of Print Classic,Fabulous illustrations to unusual stories I have never seen anywhere else- a classic from my childhood now given to my grandchildren!
5,Elves and Fairies Sparks Children's Imaginations,"The Giant Golden Book of Elves and Fairies has been a classic for generations. Its intricate illustrations of elves, fairies, pixies, brownies, trolls, leprechauns, and even a mer-baby spark children's imaginations. I received the book as a child, and the images and stories fed my imagination, and I drew from that in writing The Crystal Palace: Rescue of the Baby Fairy Prince. My granddaughter and grandsons were similarly gripped by the fanciful details. Stories in the book are best suited to school-age children, as some are too long for pre-schoolers. However, the poems, short stories, and illustrations lure the little ones as well. This book will be loved for generations."
4,My Favorite Fairy Tales,This book has wonderful stories and incredible illustrations! It was my favorite book as a child and I read and reread it many times. Even as an adult I'm searching for a new copy!
