class_index,review_title,review_text
5,A unique and intrigueing thriller!,"This excellent novel will definitely keep you reading on. There are well thought out cliff hangers at the end of each chapter. A bit of foreshadowing adds to the suspense and mystery. All of the characters that protain to this mystifying classic are well thought out, and well developed. With the help of it's convinvcing atmostphere, this story definately depics the Puritan ways, and gives the reader a unique picture of witch trials. Not only does this novel have a special edge, but it teaches the reader a lesson as well. The lesson that is told in the Witch of Blackbird Pond not only protains to the Colonial times, but could definitely apply to the modern age."
5,"A romantic, historical fiction novel about justice, love, courage, and friendship","Kit Tyler has lived her whole life in the beautiful, Caribbean country of Barbados. Her first glimpse at her new home in Connecticut tells her that her life in colonial America will be nothing like the beautiful and elegant world she has always known. She doesn't understand the stern and somber people here--especially not the mischievous sailor, Nat Eaton, who always turns up when she least expects it. In her loneliness, she develops a dangerous friendship with an outcast widow many of the townspeople think might be a witch. But how much will that friendship cost her?The Witch of Blackbird Pond is a wonderful story about coping with change and learning to be true to ourselves. Through the gentle affection of the Widow Tupper, Kit learns to find her vocation in life--and in love."
3,Footnote in Atlanta music history,"The defunct Atlanta act had been a crucial live fixture in the late 80s even before touring with the Indigo Girls and signing to their Daemon label. Sadly, they met the same national resistance that Kristen Hall faced, from radio stations who felt one act of denim-wearing guitar-playing Atlanta women was enough. This is despite the Society's very different, and aggressive guitar sound. Chris McGuire and Cooper Seay are awesome guitarists, and ""Squinting at the Sun"" is probably the best track. Little more than a local footnote now, it's a shame they didn't make it farther."
1,I Never got it,I never got this order even after i contacted the seller and attempted to resolve a problem i received a refund so i just doped the issue
4,Very please,"I just received my stroller, and I love it. Looks just like the picture, but better! Very easy to put together, very light to push! So far my dog liked it! I have a boston terrier and a boxer, obviously the terrier will be the one using it! THe only downfall I see so far is the buttons, they snap to the bottom, and it's a little difficult to do, but is do-able! All in all, this is a great product!"
4,Pet Stroller,This product is great. I bought it for my cat so that he would be able to go outside and he love it. I am able to carry a lot of my items in the basket under where he sits. I love it
1,Very good quality,"I was pleased with the quality of the pet stroller. It even has places for your water bottle, cell phone, purchases (bottom tray). Rec'd in perfect condition, and delivery time was quick."
1,Bulldog Ractical Leg Holster,"I purchased this holster at Cabelas and am very disappointed. Among the many things wrong with this holster is that, despite being advertised for a standard frame auto, it does not hold my Colt Model 80. If fact, the weapon moves around in the holster quite freely. Secondly, the leg straps are too short and I have average size thighs. Lastly, the holster flops out from my leg approximately one inch and there is no way to hold the holster tight against your thigh. All in all, a pooly made holster from a poor design. It is almost redundant to say that it was made in China. Do not purchase this product."
3,NOT FOR GRAD SCHOOL APPS,"I cannot comment on the utility of this book for applying to undergraduate schools. It may be fabulous. The author does use humor and lots of examples to help. However, I was applying to graduate school, and the essay style is completely different (at least it was for all of my applications).The graduate essay requires a wealth of specific information to be included. Specific, biographical information including past jobs and relevant experiences. This book discourages such broad essays - the very ones required by most graduate programs (at least in psychology). For grad school applicants, I recommend ""How to Write a Winning Personal Statement for Graduate and Professional School"" by Richard Stelzer. Not only is it thought-provoking and well written, it includes sections for specific programs (medical, law, business, etc.)"
3,college essays,This was purchased for a grandchild so I barely skimmed it before giving it to him. What I did read seemed to make sense and should be helpful to him.
5,Really Helpful Book,The book is short and very well written. It gives you the straight answers to a lot of admissions questions with a large focus on the essay part of the application. I'm convinced that the essay was one of the things that helped me get into Middlebury College. I'd encourage you to buy this book if you are going to be applying to college.
5,"harry bauld, great writer and teacher","harry is my english teacher and helped me complete my college essay. We are all given his book and it helped a great deal, along with reading it and his help my essay was fabulous and i was also accepted early decision to oberlin. this is a great book, the one you should buy if you are only buying one, it is written exactly as he teaches and ""sounds"" just like him and i strongly recommend it to all high school students. Its not just dry and boring he makes sure to add humor all through the book"
4,Highly informative book,"This book is great to aid people when they apply to major colleges. The author include tips and things that he notices, when he was/is an admissions councelor, to help people be accepted into college. The book also teaches the reader on ways the reader could prepare themselves for letters of recommendations, interviews, *essay writting*, and obvious course that students may take in high school that will appear on their transcript. Will definately aid people with college applications."
3,Sickening true stories of depravity,"This book is hard to read. It is hard to wade through the cruelty.There are stories here of families being split apart by an uncaring master class. Children were callously sold and permanently separated from their parents. Husbands and wives were similarly split up.Frankly, it makes you sick.Then there are the stories of brutality. Again it makes you sick. How could the slave owners have sunk so low?If you are looking for well written stories that bring the institution of slavery to life for you, this is not the book. What you get here are very short and very simple reports by individuals. There's nothing here that you didn't know already. This is not a great work of literature.This is just a punch right in the nose to make you wonder how slave owners could have been so cruel."
5,Happy Customer,"I am 5'10"" and purchased the long in both white and black. The reviews are accurate in saying that the long is truly a long, but I love this purchase. The material quality is high and the style is very nice. The adjustable straps allowed me to pull it up, and while the straps do slip a bit, I could easily pin them in place and adjust according to the length of whatever I have on. I am very happy with this purchase."
4,VANITY FAIR SLIP,"I ordered this slip online because it is getting more & more difficult to find larger size lingerie items in department stores--especially full length slips. I like the design and material. It does seem to run a little small, but that's OK becuse I want to lose weight!"
3,Shorter Than Expected,Probably my fault but this was way shorter than I expected. I kept it because I'm sure I can use it in the future but I need to order a longer one.
4,Good quality item,The slip fit perfectly. The adjustable straps allowed me to play with the positioning under my dress and the length was on target.
3,Sewing glitch- check item immediately,"Overall, a nice slip except for one of the straps. The adjustable loop wasn't connected and I had to tie it. I used the slip way after I bought it so I don't think I can exchange it."
2,"does job, but requires constant adjustment","This could be a really great item. The length is perfect if you are a knee length skirt/dress wearer. The material is not bulky and stays static free. The fit is comfortable enough that I don't notice I'm wearing it under a dress. I gave it two stars though because of one detail that I find excessively annoying: the adjustable straps don't stay put. I have to adjust them every time I wash it (where they also become very twisted), every time I put it on or take it off. The straps slip throughout the day as I wear it... you get the idea. The annoyance this poses to me outweighs the other good features that it has. I will ditch it after this winter, unfortunately. If readjusting does not bother you, than there is nothing else wrong with this item."
4,okay slip,"This slip is not gorgeous or luxurious, it is just okay. I wear them as nightgowns or around the house in the summer. One of the straps consistently twists around the hook which is annoying and keeps me from wearing it as often as I would otherwise. At least it was inexpensive but you get what you pay for, especially in this case."
1,Didn't Work,"When I received this in the mail it didn't work. Upon further inspection, it looks like FansEdge sent me an already defective product because the product had batteries in it already, which it was not supposed to come with. I called them and they were supposed to send me a return label to send the product back and a refund. I am still waiting 3 weeks later for both of these and now have to work with my credit card company to contest payment. I would not order anything from FansEdge again."
4,Entertaining,"Cd was full of praise to the LORD and very upbeat. Played it everywhere,even @ work.Even made a few copies for my co-workers & boss.Made me really proud to own this little gem."
5,successful book,"My criticism would be that people with emotional problems with God's grace can still be good spouses. On the other hand, it certainly helps make the marriage easier and with a higher probability of success to marry someone who is emotionally well-adjusted!A great book to help young adults to look at themselves and their relationships so they will have healthy marriages and families."
5,Merengue Callejero with a lot more to say.,"This is a great album. Its definitely Merengue Callejero, but with a lot more lyrics and suprises than the usual. There is a lot more thinking and production going on here than in most Merengue. And dont get me wrong I like most Merengue, but Los Potros really have something refreshing going on here. Although Oye Mi Ritmo is the first single and is slamming, the other songs will grow on you tremendously. Vengan Todas Mujeres Latinas is the jam. Rebeca99 and Esa Morena will grow on you if they dont catch you on first listen. I like this album more everytime I listen to it."
5,Great car for the price The kids (and myself) love it.,For the price this little car has a lot of features head and tailights and the ability to run another at the same time without interference due to the different frequencies available. These cars have been crashed into walls and each other over and over and seem to be ok. The only one that broke took a flight off of a desk and the steering linkage snapped on one wheel when it impacted the floor. Cant really complain about that. I bought extras for the price. What really matters is that it entertains the young ones and is helping them learn the controls before moving to more expensive models.
1,Waste of $15,"I disassembled this thing for pieces, and the construction couldn't be cheaper. The steering is achieved with an electric motor, not a servo, so it's ""all or nothing""; not very much fun. I recommend either get something much more expensive, or something much less expensive."
5,review,acting leaves something to be desired but the directing is magnificient and the plot it amazing. an excellent buy
4,Zoot Suit - Great!,"Zoot Suit is a movie I recommend to all (especially Latinos) who are interested in a small portion of neighborhood life in LA during World War II. The musical score is excellent and has a tendency to urge you to increase the volume. The acting is very believable, while the alter ego character (James Olmos) constantly challenges your mind to determine who he is and what he represents - until the end. All in all, very enjoyable."
5,GOOD MOVIE...!,"Very good movie. Well done, directed, written, acted. The story is amazing, it really is. And the music and the way that is made...WOW...!"
4,Great Disney Music,"If you're a fan of Disney music, you can't go wrong with this CD. I especially enjoy ""Fantasmic"". For those who have never been to a Disney Park, this music is from a terrific ""must see"" show, staring Mickey and his imagination. I also love ""The Siamese Cat Song"" from ""Lady & The Tramp"". Songs from favorites like Jiminey Cricket, Winie The Pooh, to newer the movies ""Hercules"" & ""Pocahontas"". The only song I wasn't fond of was ""Femininity"". This is volume 4 in a collection of 5, all of which are very good. These songs will have you humming through your day!"
3,Disney 4,"These are the obscure songs from Disney history - I've been a Disney music fan forever, and I didn't know maybe half of them. The disc is good for having the classic Disney mix of old and new, and it has a few gems that I haven't heard since I was young."
3,Makes the hair on your neck stand up!,"Well worth a listen, similar in atmosphere to the Tindersticks, but even less jolly. Would appear to have the potential of classic on it!"
3,perhaps a little too moody,"I bought this CD because I had heard the Johnny Cash version of I See a Darkness and wanted to hear the person who wrote that haunting song. This CD is the first I have heard of BPB. I like some of the songs, but overall, it is SO slow and so melancholy that it becomes too much. Makes Candy Says by the Velv. Underground sound positively upbeat. And this is coming from someone who loves slow, minor-key music. Also, Billy has a way of harmonizing with himself which makes it seem like he is singing out of tune. Kind of unnerving."
3,"Moody yes, but lacking in dynamics","This is the first CD I've heard of his, and I purchased it on the strength of reviews and word of mouth. It is moody yes, but there really arn't any dynamics within the songs. They are all slow, minimalist, with very little happening. The melodies are usually directionless, and songs often lack recognisable structure. Thus each song has a mood (generally dark) and really if you've heard part of a song, you've heard the whole of it musically. I don't mean this to be a fully damning review however. It works at what it attempts to do, and is not a bad album by any stretch. Listening to it, I just felt that it could be much more powerful and atmosphic if there were some variation in tempo and intensity."
2,"urethane coating, how about all urethane",It is my girls first year in ballet so I just wanted an inexpensive bag. If you want a really nice bag don't waste your money here. The entire bag is made of urethane and has a cheap feel. The biggest positives are the cute graphics and the straps work well.
4,Great Buy,"I read the whole play in one day. It isn't quite as good as the musical, but anyone who likes the music will enjoy the play as well."
1,formatting and grammar...where is it?,"I have to admit that I have real problems with books that lack editing. This is a case in point. This book is difficult to read because of all the grammatical and spelling errors. Misplaced modifiers abound, too. Perhaps these errors have been corrected in subsequent printing, but at least, the one that I read had multiple errors on nearly every page. By the way, what is with spaces between paragraphs?Living on the North Coast as I do, I understand that people living in Ohio might find the story intriguing because of the subject matter; however, I found it difficult to enjoy the story because of the stilted conversations and implausible situations."
4,Rainbow's End,"I highly recommend the book Rainbow's End by author Bob Adamov. From Civil War intrigue to Lake Erie island suspense, it is action/adventure packed with a touch of romance. Great reading from start to finish."
5,Bruce Rocks,"I have not heard the first two albums in years. Early Bruce is so different than his current music. Hearing ""Rosalita"" reminded me of all the concerts I went to. Greetings' ""Hard to be a Saint in the City"" is one my favorite songs ever: urban and edgy. Darkness has always been my favorite Bruce album. It still is."
3,E street boys,It was great to get Bruce and the boys together in one package.I only had the old buggered vinyl.these were the days when I lived Darkness and was immortal .Stan
1,Trying to get in touch with dealer and no success and not the only one,"When I received the Caravaggio book I knew immediately that I was not satisfied. The condition was listed as ""good"" but the binding was ripped. I contacted Amazon immediately and was told to contact the dealer. I was given a number to call but did not reach a person, I left a written request for information about returning this book. I have not heard from them and it has been over a week. I also read a review from a different unsatisfied customer. It was BHFO books and I actually would like some help from Amazon in contacting this dealer and getting my money back."
5,One of the best live albums ever,This is quite simply one of the very best live albums ever. Plain and simple!
5,Surprisingly good,"I do love that this sells as a 12 pack so I don't have to run out and get more every time I need to change the air filter but what I like even more is that these are excellent, and to my admittedly unprofessional eye, seem to last as long as the special (and expensive) 3M long lasting air filters, even though these are designed to be more frequently changed. From now on, I'll be buying these filters, and hope to continue to buy a 12 pack every 18-24 months, since these don't seem to need to be changed monthly."
4,Polyester Air Filters,the multi pack is a good way to have a fresh fillter whenit needs to be changed.
2,Noel even admitted its rubbish,"Oasis dogged it on this album.... Be Here Now and Dya Know What I Mean are the only 2 songs on here that don't drive you mad. It's still a fun album to own for like a month, but after that it will collect dust. I don't know what it is about Oasis, but their songs just tire very easily, unlike the songs of say, U2. Anyway I'm sure the next album will be great again. Yeah Yeah Yeah."
1,WHAT A SHAME!,"They are sold out but made a loooooong album..... Has anybody listened to the full CD without pulling the ""stop""buttom of your CD player???"
1,this album suxxxx,i could hardly stand to listen to this cd for more than five minutes.......it was so depressing and all the songs practically sounded the same.....get What's the story morning glory....it rocks
2,Not all that,"I am a Oasis fan and to be honest Be Here Now isn't very good . The only good songs are d'you know what i mean , magic pie , stand by me and all around the world {which is too long } . Its no where near as good as the others and isn't worth the money"
1,Bombastic over-indulgent arrogant rock star cliches,"There have been many comparisons of Oasis to the Beatles, often by the band itself; but Noel Gallagher cannot draw the distinction between inspiration and imitation. On their first two albums, they got away with mere imitation just because they came up with some pretty infectious melodies. But on this album, the melodies aren't even there. They've fallen victim to their own hype and have created a monster. For God's sake, do not buy this album. ""All Around the World"" is the best song, although like the rest of the album, someone should have turned off the studio tape halfway through the band's performance. Way too long and tedious. And if Noel is one of the richest musicians in England, can't he afford some cleaner production?"
3,Longer songs and bad production,"While this album tends to get mixed reviews, I do like it. It is not their best by far, but it does include some great songs like D'You Know What I Mean? and Stand By Me. I have to say, though, the songs go on for way too long and the production is horrible. Even Noel hates the production on this one. Most of the songs are 5 minutes and counting and they could easily be trimmed by a minute or two. The production is a mess. The album sounds like it was mixed underwater: everything is a jumbled mess. Anyway, it is not a horrible album and I love listening to it now and again."
5,By the Way...,"My review referred to the vinyl version of Be Here Now... -with the perfect large cover-art... -yes, it all makes sense now/then... -listen on headphones... Tape it!..."
5,"""the BEST OASIS album of all times""","I don't konw why everybody critic this GREAT album, I think it's Oasis best, we got excellent guitars, a very inspired Liam that can touch the roof with his voice and the other 3. There are also a lot of classics like ""d'you know what I mean?"" personally the best Oasis Chorus ever, we got ""stand by me "", ""the girl in the dirty shirt"" wich is the best song of the entire album, ""don't go away"" and a great song that define the hole spirit of the album: All around the world. A piece of advise: don't listen to the critics, first listen to it and you'll see."
2,Very disappointing,"When Oasis is good, they have catchy lyrics and well thought out arrangements.But when they're bad,they sound annoyingly loud and rushed.This cd shares a bit of each.With good tracks like D'You Know What I Mean,All Around the World, and Don't Go Away, you wonder how they made the crappy My Big Mouth,I Hope I Think I Know,etc.If you liked Whats the Story (Morning Glory)chances are you will not like this album."
4,Maybe not Oasis' best but still way good,"I don't see why critics and even other Oasis fans keep downing this album. And I certainly don't see why it was thought such a failure . . .""Some bands will never sell that many records in their whole career"" . . . With the exception of Magic Pie (it just rubs me the wrong way) I like every song on this album. Be Here Now is one of my favorite Oasis songs it's just plain head bobbin', foot tappin' fun. Don't go away is by far the best track on this album. And I love Girl In the Dirty Shirt. Oasis rocks and I'd like to talk to anyone who feels the same so e-mail me at yub_yub@excite.com"
2,Hasn't anyone noticed yet?,"Yeah, Oasis defined a period with Wonderwall, and yeah they had a few good tunes on the first two albums. But haven't you all noticed you can play Wonderwall and Live Forever directly over all of these tracks? I give'em 2 for being consistent."
5,Excellent.,"This is a fantastic album. I bought it after Definately Maybe and What's the Story (Morning Glory). It's longer, rougher, and heavier. It's just filled with great songs. The album as a whole may have some weak points, but songs like D'You Know What I Mean?, Magic Pie, Stand By Me, Fade In-Out, and of course, Don't Go Away, really make this a must-own. The album is a lot of a certain Oasis style that is unlike What's the Story, so I can see how this might be hit or miss for some people (especially if you want short songs, because the avgerage length here is 6 minutes), but I love it. Great stuff, highly recomended."
3,Too much of a good thing...,"Be Here Now starts off well enough...D'You Know What I Mean? at the time was quite different from anything else the band did. In fact, after hearing that song on the radio I was sure that the album would blow my mind...but it didn't. It's filled with songs like ""Stand By Me"", ""Magic Pie"", and ""All Around The World"" which are all wonderfully produced brilliant pop songs, but they all go on for over six minutes (the latter tops out at over nine minutes!) making the listner grow bored of the song and want it to all go away. I can't help but think the album would have sold much better had each of the songs ended at four minutes. Still, the mealodies and music make this cd worth giving a listen to. You may have more tolerance than I do."
2,"not terrible, but really not good enough","this is a poor attempt at a follow up to morning glory. I wouldn't say its terrible, but I wouldn't buy it again if given the choice, which is a shame really, because their first two were quite good"
2,A Disappointing Follow-Up,"Oasis achieved phenomenal success with the release of their 1995 album ""(What's the Story) Morning Glory,"" but then followed the unfortunate trend of having their next album suffer. Still, ""Be Here Now"" has its moments. The best song on here is obviously ""All Around the World"". It's long, pretentious, and has a stunning music video to go along with it; it's reminiscent of the Guns N' Roses' song ""November Rain"". The album also houses ""The Girl in the Dirty Shirt,"" which is the nasaliest of any song Liam's sung before or since. The rest of the album is mostly just OK, making this a major disappointment given the brilliance of their last album. Oasis completists will want this album; everybody else would be wise to just buy ""All Around the World"" as a single and leave it at that."
