class_index,review_title,review_text
2,Wepahey,"The rhythmically impaired Ivan, an unsuccessful bodybuilder turned ""singer,"" is known as the ""Colombian Elvis"" and is the ""author"" of such lyrical gems as ""I'm Going to Fusagasuga,"" with the following loose translation:I'M GOING TO FUSAGASUGA (presumably copyright by ""Ivan"", 1996)I'm going to Fusagasuga, I'm going to Fusagasuga, hey! I'm going to Fusagasuga, 'Cause that's where my girlfriend lives. Yeah!It is presumed that he will get to Fusagasuga, or wherever, as soon as he saves enough money for the bus fare... Hey, whatever makes the ladies sweat on the dance floor..."
2,"the good,and the bad","I have done several gifts from jars so when I saw these sets of little books I grabbed them up. I have to say, If I could do it again I would not buy this set. The ingred. lists are easy, but the amount the reciever needs to have makes the gift not so much worth it. You need multiple items to add. That makes for a not so good gift in my mind. I would not get this set!!!"
1,Very disappointing,"This book may have 128 pages, but it does not have anywhere near that number of recipes! Each recipe is printed 3 times! So there are maybe about 40 recipes, so I felt very let down. And you have to make sure to buy over-safe mugs. Most of the recipes have to bake in an oven. I don't need 3 pages of the same recipe."
3,Babe Ruth His Story in Baseball,"""Ruth thought there was a lot more to baseball than hitting home runs. He was a ball player. This is what the New York Times said about Babe Ruth. Who is Babe Ruth? Babe Ruth was one of the greatest baseball players to ever live! In his career he hit 714 home runs and batted .342 all time. He played for several teams, but the teams he was the most famous for were the Boston Red Sox and New York Yankees. He was a pitcher and a outfielder. He is one of the few pitchers to ever to be able to pitch and bat really good!You should read this book if you don't anything about Babe Ruth or if u want to learn more about Babe Ruth. This book tells you a lot of what he did and how all the fans went crazy for him. I recommend this book to any one who loves the game of baseball or loves to read about people."
2,Pre-Amos Moses...,"I'm a Jerry Reed addict. I've been a big fan for over 35 years. If you are ike me and love to hear the Jerry Reed from the 'Amos Moses', 'When You're Hot You're Hot', era (late 60's-early 70's) then this CD is probably not for you.I purchased this disc a while back but was sorely disappointed when I listened to it. The Jerry Reed heard on this disc is a very young Jerry Reed. He does not sing or play guitar with his signature sound which came later during his days with RCA and under the watchful eye of Chet Atkins."
5,Turtles and Husbands,"This delightful, funny, even suspenseful book is ostensibly about the experience of living with a ""turtle nut"" (my term for a turtle enthusiast). The book does deliver quantities of information on that topic, as well as about turtles as pets, caring for turtles, turtle conservation, and more.However, it's also a personal and touching chronicle of a relationship developing between a man and a woman.The author brings a light and humorous touch to the entire book. I often laughed out loud while reading it. And, believe it or not, Confessions of a Turtle Wife is a page turner! I could not put it down. (There is even a chapter about sex that includes a graphic description of the sex act-between consenting adult turtles!)A most enjoyable, informative, and uplifting book-I recommend it highly."
4,A humorous read.....;),"This story almost gave me a glimpse into my 4 year old sons future. He is absolutely in love with Turtles and has a rather large collection of them in various forms of toys, figures etc, we're members of the Turtle Society and our local Sea Life Centre that houses two special Turtles. Our next step is obviously getting a pet turtle. Certainly a fun read."
5,Great!!,I have locks (dreads) and I wanted a product to keep my hair moist in between washes and oiling...this works great...it last all day and it's non-greasy and very light...it also has a nice smell...would recommend it...
1,SO The New Formulary Sucks Arse!,"I'm like WTF Happened!!??!! This product recieved so many great reviews from everybody who has ever styled their hair in dreads or curls, I broke down and tried it (about 3years too late)... The formulary has changed, and unfortunately, so has the product. Some still swear by it, but it just feels strange on my hair, I'll stick with the old Jojoba oil + Water leave-in (or just plain Aloe) thank you very much. But, then also, maybe I used it wrong... I don't know, the product and the reviews just don't match up anymore. Sorry guys F--"
5,Save The Girls!,"Five girls go to a party to a nice house on a lakeside. Five girls disappear without a trace... Now another five girls go there, in order to spend the vacation with the Martins, the owners of the house, in particular with the lovely Ms. Martin. This time, you should not let them die a gruesome death! Because ""nice people"" can sometimes turn out to be... yes, that's right - vampires. The whole house is full of traps, that are intended to catch the poor innocent girls, so that the vampires can suck their blood... ugh. Luckily, the brave adventurer is there in order to cease to be hunted and to become a hunter instead! Set the traps so that they will capture the villains themselves, using precise timing and good organization.Night Trap was the very first game that used the FMV (full-motion video) technology with live actors. Although it didn't contain nudity or particularly gory scenes, it was considered one of the first games to have a mature content."
4,Not Just Another Sad Song....,"This was THE saddest story I EVER read....I swore off of B.McFadden because of this book...I was actually tired after I read this one. I had so much hope and the let down was so hard....I read this book quite a while ago and I've given B. McFadden/G. Holliday another chance (she's really one of my favorite authors ;-)) B.McFadden wrote this book and I read it. If a topic comes up about a sad story, I'll bring this book up. I'm just a sucker for happy endings and you can look at this ending in more ways than one."
5,Loved the book,"This book is one of my favorites written by Bernice McFadden. The other two were ""Sugar"" and ""Camilla's Roses"".I completed this book in one afternoon, and thoroughly enjoyed it. I could feel both Donovan and Campbell's pain. I highly recommend this book."
4,Cute book,"I was a little skeptical about getting this book because I read ""Sugar"" and ""This Bitter Earth"" and I didn't really like them at all. But I decided to give a sistah a chance. And I must say that it's not a half bad book. I'm glad I got it."
3,Leaves Much Unsaid,"I liked this book- I did. But it left so much unsaid or I at least felt unfulfilled at the end. Not a happy ending, but still an interesting read from one of my favorite authors. I recommend ""Sugar"" if you haven't read it already."
4,Loving Donovan: A Love Story in Three Parts,What I thought was a hopeful love story. Very compelling and exciting read. Everyone who reads will be inspired and can relate this story and the characters.
3,"Good idea, questionable delivery","When I read the reviews on this book, and the synopsis, I knew that I had to have it. Though the conversation and descriptive details initially drew me in, I was left highly confused 3/4 into the story. There seemed to be too many characters being introduced to follow. I almost had to write down my own thoughts in order to follow. I felt that too much of the content was used to create background and not enough time was spent developing this great love I hoped to read about. This is my first book by McFadden and, though I was a bit dissapointed, It will not be my last."
5,Loving Donovan,Book arrived in same condition as listed. The book was excellent and I finished reading it in two days. Thanks
3,Not What I Expected,"Overall, I thought the book was very well written, however, during the Donovan and Campbell relationship, I felt the author rushed through it. The author spent more time in the beginning introducing the characters which is fine, but it didn't tie into the ending as well as I had hoped. I was expecting more, but it never came and before I knew it, I was at the end. It was a fairly quick read, but be forewarned there are some very slow sections in this book."
4,Loving Donovan...,"I appreciated how this story gave a background to the desire or inability to love. How an individual's background impacts who, how, when, or if they will allow themself to ever fall in love.Initially, I did get a little lost following the characters, but by the end of the book I found myself moved and actually crying because of Campbell's desire to love and be loved and Donovan's desire to love, but his inability to love and trust even his own feelings (because of his ""Grammy).I am forever a Bernice McFadden fan."
2,Not Loving Donovan,"Being a fan of McFadden, I was very exciting about sitting down to read this Loving Donovan. After Sugar, I had quite expected this book to blow me away. Unfortunately it did not do this. I found the story line to be a bit ""choppy"". I didn't get a solid grip on the characters. For me if I can't visualize them, the author did not do his/her job.I will continue to support Ms McFadden but I hope her next book reflects the talent she so wonderfully produced with Sugar and her other novels."
5,Great For Little Hands,"I love these markers. They are easy for little hands to color. My 5 year old still loves them, and I got a new set for my 18 month old!"
3,Great start but bitter after-note,"We have a SodaStream soda/seltzer maker, and I bought the Torani Sugar-Free Black Cherry syrup with the hope that it would be a nice complement to SodaStream's flavor lineup, which is missing flavors we really like, like Diet Cherry Zero, or Diet Cherry Dr. Pete (Dr. Pepper). The cherry flavor is there with this syrup, but we find the syrup is not rounded out to be quite sweet enough. And no matter what sweetness, we always experience a bitter aftertaste. What we find is that using a little Equal to offset the aftertaste and enhance the sweetness will help, but of course, that is no good for phenylketonurics. We'll keep looking."
5,"I bought these syrups for Protein shakes.. I like the taste, there's not a nasty aftertaste.. not as sweet as I thought it would","I bought these syrups for Protein shakes.. I like the taste, there's not a nasty aftertaste.. not as sweet as I thought it would be, but i like it.. all for no calories."
5,I Believe the end is at hand,This is a great book. It teaches us to value God's word above all things. It increased my faith in the Bible. I read it 35 years ago and it spoke to me again. The vision of the end times he had is very close to fulfillment. Let us all be ready for the Lord's return.
2,old line of the product,I was disappointed with this product mainly because it wasn't the new line of the world collection. I have not read it anywhere in the description prior to the purchase.
5,Very cool signs.,"My son uses them constatnly. Some signs he knew before I got this set. Now that he knows them all, he always points them out when we're driving. Plan Toys has very good quality toys and this one fits well with all his other toys. They're very stable when he plays with them on a carpet. They're clear and provide for endless possibilities and fun.I would definetly recommend this to others."
2,"Cute, authentic, but the fall over VERY easily","Ordered for our Grandson to play with on a ""Road Rug"". They look cute and add a lot to the ""look"" but are not at all functional because they will not stand up for any length of time when you are playing on the rug."
5,Wonderful addition for cars or blocks,"I bought these signs for my 3 year old who is currently obsessed with road signs. These are awesome, sturdy, well constructed toys. Plan toys are environmentally friendly, educational and unique. The road signs are a fantastic addition to blocks or vehicles. They promote pre-reading skills and imaginative play. I look forward to purchasing more items from this company."
4,Nice Gift.,"I bought this for my four year old nephew, who is completely obsessed with signs. I was hoping they would be a little bigger, as these are only about two inches tall, but I think they are great for their purpose. They will go great with his train sets!"
5,Terrific addition to road or rail play,My two year old loves to add these to his road or rail play. He will often want to take one with him in the car and look at the signs as we drive. They make a nice gift too.Nice quality - nice details - sustainable design -- all typical of Plan Toys.
2,Did not work for my hair dryer,"I could not plug a hair dryer into this adapter, therefore I cannot recommend it. I tried 2 US hair dryers with 3 pronged plugs and neither would fit. I am giving this 2 stars (instead of 1) because it fit my US chargers that are 2 pronged. But as for my hair dryer, I ended up using a friend's adapter instead."
2,Inferior product - look elsewhere,"The big issue with these is that neither the US or EU plus will stay in. They simply fall out due to lack of friction. Maybe this a result of trying to accept too many different plugs or the hard plastic it's made of. Whatever reason, this is a very frustrating product. I'm going to ""donate"" mine to this UK hotel when done with them."
1,Don't buy-defective junk!,I didn't discover until I was in Hong Kong that this adapter was so poorly made that it couldn't even be plugged into the wall. This is a cheap piece of Chinese crap.
4,Great space-saver,"Works as expected. Only problem I have is that the hooks have an abrasive covering that was probably designed to prevent the bike from sliding around, but which unfortunately scratched away my bike frame's reflective stickers. Otherwise, it holds up pretty well."
5,Wonderful,I have 2 mountain bikes and 2 city bikes and I live in a very small apartment. With this product I can hang my 2 mountain bikes high and one of my city bikes below. The space a gained was great.
5,does the job,"Took just a few minutes to set-up and works well.Glad I bought it.**TAKE NOTE**As another reviewer mentioned, make sure you have a strong ceiling or you are anchoring the bike hanger below a stud, as it pushed a piece of my ceiling up. I do live in a poorly built apartment, but check before you put it up and you should be fine."
1,"Looked good, but...","This bike rack seemed like a great way to hang two bikes, but the top rack (on the upper bar) does not secure tight enough to hold a bike secure, it slides down. An expensive mistake."
4,you get what you pay for,"vertical rod snap-locks into place, further adjusting done by spinning the top and bottom feet open/closed. The top rack does indeed slide down which is SUPER annoying. fixed this (forever, hopefully) by throwing a spare allen wrench in the holes of the top part of the rod (the holes are used as part of the snapping/locking extension mechanism). this acts as a pin (like pins on workout machines at the gym) holding the top rack in place. still, keep your lighter bike on top. who knows when that allen wrench will sheer off."
5,"Easy, sturdy, and expectations met","After reviewing some of the (lame) issues previously posted here, I recommend that if you're going to set this up on a slick/smooth floor beneath a smooth ceiling, then improvise and buy some dense, tacky rubber matting and cut a couple of small squares to place under the supports. I placed a piece of 3/4-inch foam under the top support on mine to protect my textured ceiling. No biggie. It took me all of five minutes to assemble and install this unit, and it's rock-solid. I have plenty of room with a relatively low 92"" ceiling to store two bicycles (one mountain, one road) with ample room to spare. The unit complements the ""active, mobile urbanite"" look in my place, and frees up room for me to collect other sundry stuff. Best $52 I've spent in a few months."
4,Works Like a Charm,"This is a great, inexpensive storage solution for cyclists. Assembly was easy. Mounted my time trial bike on the upper and my heavier road bike on the lower and no slippage yet in over 30 days. I mounted the bikes so that the steering systems were facing opposite directions to maximize balance. I recommend mounting the lower bike high enough to allow broom/mop or vacuum access under the tires."
5,Great Value,"This is a sturdy product and a great value. Easy to assemble, I had my bikes hanging in less than 10 minutes. My only gripe was that the package was mangled on arrival but the product inside was in perfect shape."
5,Totally Worth It,"My husband had this installed in the garage and up in no time because it's that easy to do. I love that you can move it around also, which is why I opted for this vs. something that has to be installed stationary to the walls. I'd have like to spend less for something for this use, but the convenience makes up for it."
4,Works pretty well,I have to admit I am still terrified of dropping a bike on my head when I am removing one from the lower rack but so far the hanger has stayed put with surprisingly few readjustments. I bump into it with boxes on a fairly regular basis and that hasn't budged it either. I love how easy it was to install (10 min tops) and it's saving me a ton of space so I just smile about that and wear my helmet while extracting my bike.
3,Dumb Decision,This was a dumb decision on my part. Use it only if your bikes are the same price as the hanger.
4,Great rack!,"The package arrived and within 10 minutes, I was up and running with this bike hanger. I've had 2 fixed gears up for the past 3 weeks now and no problems with it whatsoever. I've read some of the reviews about bikes sliding down the hanger but that hasn't happened to me. Guess they need to tighten it up more. The price is right and it saves me a lot of room...very happy"
4,Better directions needed,"I was very pleased with this purchase. But the lack of good directions for assembly are needed. The thing that got me confused, was the fact that both threaded ends are directional. One is reverse threaded, so when you ratchet the pole snug, and turn the pole clockwise the ends expand.I wouldn't put heavy bikes on the top, and the manufacturer does recommend a weight limit for both bikes. It sure helps clear up some floor space. Give yourself 10 to 12 inches from the wall and your good."
4,"Works great, must be secured carefully",If possible anchor the top to the ceiling. Screw holes are provided for this purpose.Securing the upper bike holder is tricky. Our advice: make sure the clamp is already flat on the flat part of the upper pole from the beginning so it can't slide around to that point and suddenly be loose.You will need to cinch it down very well. Once we got the hang of it our bikes stayed put.
1,Only holds ONE bike,"All of the glowing reviews of this product would be accurate except for one thing - the hooks will not clamp onto one half of the pole. So effectively, this is a 1 bike hanger unless you have tiny bikes. The pole has two sections, a thick tube for one half, and a significantly thinner tube for the other half. The clamps will not even come close to holding on the thinner half. Both the pictures on this site, and the diagrams in the instructions show that you can clamp onto both halves, but this is NOT so. This issue is mentioned in one of the other reviews as well, and appears to be a design flaw rather than a manufacturing problem with the one I received."
2,Outdated for 2007,"I picked this up at the library looking for information on podcasting... unfortunately, most software guides are outdated the moment they're put in print, and this was no exception.Podcasting wasn't even covered,but I thought there might be some basics that I could make use of. But the information on GarageBand basics was TOO basic -- and so outdated that it didn't even apply to my 2006 MacBook.I found the sidebars to be distracting and uninteresting (what was with all the ukelele information). There's got to be a better guide out there. I'll let you know when I find it."
4,She's OK,"Right when I saw Kianna on the Teen Trends Website I Wanted her.When I went to Toysrus (I was not getting a teen trend) I saw Kianna In person and thought that she wasnt nearly as pretty as I saw her online. I still like her butI dont think I want to buy her. But who knows? I might just change my mind. Oh and by the way, the bratz Kianna is spelled Kiana and no way did this Kianna copy her."
4,"What Are You Talking About?- ""Copy Cater""","Whoever wrote ""Copy Cater"" is wrong. The Bratz doll's name is FIANNA, FYI, not Kianna. But I do have to agree with you. She is kinda ugly."
1,I wasn't talking about Fianna,There is a new girl in the Bratz group name Kianna. Go to the Bratz website or mgae's website and see for yourself. She is the Afriacan American one in the wild Wild West Collection. I don't like this doll. I think this doll is ugly.
1,Beautiful Doll...but...,That person's right. The name Kianna is from a Bratz doll. There's a Fianna AND a Kianna. This doll's great but maybe they should change her name...
4,Public Speaking for College and Career,Very pleased with the purchase and the timely manner in which I received my book - I was given a date in October and must say I was pleasantly surprised to received this in five days versus the projected (14) days and I did not pay for expedited shipping. This was awesome customer service. Thanks again.
4,Public Speaking,Book was pretty good and gave detailed information of speeches as well as examples of speeches. Can be helpful for oral class presentations.
4,Good instructional book,"As a minister of the Gospel, I need to be able to present information in a clear and comprehensive manner. This book was as helpful as a homiletics (the art of preaching) book that I used for preparing messages and presentations. It is complete and extensive, without being overbearing in its content. I would recommend it for anyone that will be engaged in public speaking of any kind."
4,Gift for a friend,I got this for a friend who needed it for a college class. She was pleasantly surprised by the good shape the book was in. It looked almost new. And its shipped in plenty of time for the start of her class.
3,Monroe's warranty service sucks,"Be cautious about the warranty. I purchased two sensa-trac shocks to replace the rear OEM shocks on my 2002 Sonoma. The OEM ones blew out (oil all over the place) the first time I hauled a decent load. The new shocks greatly increased my load capacity and improved handling - especially when heavily loaded. After a couple of years of hauling heavy trailers etc, one of the sensa-tracks started leaking oil. I removed the shocks and took them to a Monroe dealer. The dealer would not warranty the shocks and said to contact Monroe. Monroe has an online warranty claim form that directed me to a defunct web page. I next contacted Monroe customer service via phone and they would not warranty the shocks because they were purchased through Amazon. Amazon was then contacted and cheerfully agreed to send new shocks, in the meantime my truck sat on blocks for several days. Next time I would buy a brand other than Monroe. Amazon was the bright spot in this ordeal.Bigshrub"
2,Smell versus Package,"It smells like baby powder mixed with some type of chemical. It doesn't fit me well since I don't like those type of smells, but it may work for someone else.I think the bottle is pretty - looks like part of a ring, so at least I can use it for display."
5,Excellent description of historical and social aspects of an environmental cleanup,"The author provided an excellent description and analysis of the historical and social aspects of the remediation of mine wastes around Leadville, Colorado. She spent time living in Leadville, and gained access to the town's feelings about the cleanup, but also maintained distance appropriate for a journalistic treatment of the people involved. The telling of the story focuses on the people involved, not just the technical aspects of the remediation, which makes it interesting and much more relevant to understanding the challenges of environmental remediation projects."
4,Leadville,"This book crossed my path a couple of times. I have a belief, that when something crosses your path or presents itself three times or more in life, you must check it out. You can dive into it, or toss it aside. But, you must look into it. When Gillian walked into my place of business, that was the third time. Her and I traded services, and as I suspected, I was not disappointed. This book is very well written and informative. Upon reading it, you learn so much more about mining, the land and the culture of the area. For a few years, I lived in that area, and I found it to be a fascinating and informative read.Russ"
3,Literary Impressionism Leaves Something to be Desired...,"Conrad's mundane tale of the human condition is an example of literary impressionism at it's most infuriating peak. The author consciously avoids the statement of fact, only hinting at events that transpire. It requires a great deal of focus to read and leaves one feeling unsatisfied, as nothing is told, outright, to the reader. It's also a very difficult book to be tested on; the ""tale within a tale"" format makes it tough to comprehend who is actually narrating."
