class_index,review_title,review_text
5,The squirrels chirp back.,"This call works. I can't say that enough. If the squirrel is on the wrong side of the tree, bark and he will be visible."
4,Great singing,The 2 leads have spectacular voices but the guy who plays Populescu (Harald Serafin) cannot sing at all and is just played for laughs. Also the dancers in animal costumes during the overture has to be one of the most ridiculous things I've ever seen! The subtitles are not that helpful (except for the spoken dialog) because the English is forced to rhyme and loses a lot of the meaning of the original German.
5,Pravana hair paste,"I love this hair paste! It is no longer available to me at my local hairdresser, so I am very pleased to be able to get it through my favorite website, Amazon.com."
3,Why mp3?,"Allies is a band that needs to be made available on CD, perhaps a 2-fer... three of them. This one should be paired with Long Way From Paradise. I've got the cassette and it sounds as good as a cassette can (it was recorded on high-bias medium), but its a shame that this is not out on CD... or at least a nice lossless digital file with artwork.I give the recording 4 stars, the fact that it is only available as an mp3 (I prefer ogg vorbis for lossy and you really shouldn't transcode a lossy format to another lossy) gets a half star. Average it out to a 3 star rating."
3,Surf rack,The Bike Hopper Rack makes it easy to carry a body board on your bike. I used a backpack carrier and found it difficult to ride with a head wind. The rack should come with mounting clips.
3,From Back Cover,"One look at the ravishing red-haired beauty and Brigham Langston was captivated. But through Serena MacGregor had the face of an angel, she was a wildcat who spurned his advances with a rapier-sharp tongue. To hot-tempered Serena, Bringham was just another Englishman to be despised. But in the arms of the dashing and dangerous English lord, the proud Scottish beauty's hatred soon melted with the heat of their passion"
3,Too Predictable!,"The character of Serena MacGregor never is fully developed, she spends too much time waiting for Brigham. I really enjoyed the whole Macgregor series, but this story was not as good."
3,not as good as others,"didn't enjoy the book as much as the others in the macgregors series. it was still good, though. fast delivery and the book was in great shape."
4,I was surprised how much I liked Bradley Cole's music,"The lyrics along with Cole's restrained passion make for an electric combination. Although the tempo of most of the songs is upbeat, there is an undercurrent that is reminiscent of the desperation that comes from a last ditch effort. The result is a curious mixture that piques the ear. His voice is not the smoothest and the production is not the cleanest, but in a natural (organic) way it's just what the album called for. It's a mixture which calls the listener back again and again to pull the elements apart and marvel at the artistry behind the album."
1,This DVD is NOT NTSC format!,"In product detail, the format of this DVD is shown as NTSC, which is compatible with TV sold in the US. However, the DVD I received was ""PAL"" format, which is standard in Europe but NOT compatible with TV sold in the US. Please be careful!"
1,Country Bees,"This is NOT the Honeybees from the early 1960's.This is a modern (2005) country group.They sound like The McGuire Sisters doing country, backed by a Les Paul style guitar.If you like country music, you may like this group."
3,A Flawed Collection of Hit,"There is already a very fine review of this CD here on Amazon, but I would like to add the following comments. The songs ""Shutters and Boards"", ""Primrose Lane"",the original version (there are two included) of ""There She Goes"" and ""In the Misty Moonlight"" all play at the wrong speed. These songs run about 10 to 12 seconds fast. Not quite like the Chipmunks, but if you play the vinyl versions at the same time, you can hear that the pitch is higher and the songs keep getting farther out of sync. There may be others, but these were the only ones I could confirm in an A/B test. If you have forgotten the way the originals sound, you may not be bothered too much by this, but it still makes him sound a bit strange. That said, it is really hard to find a solid collection of his early hits and this set does meet some of that need."
5,my favorite album,"this is recorded in a huge cathedral and the cello and piano resonate in stirring ways - apparently improvised, there is a wonderful and tuneful interplay between the two artists - its lively, touching, exciting, quiet - each track is excellent"
3,Decent,"I bought this product thinking it would not really require gluing, and would easily snap together. This was not the case, however, and I ended up having to use a lot of the included tube of super glue to put it together. After the annoying construction, though, the windmill worked pretty well. It is more like a desk toy so I wouldn't really recommend it for $40. It is amusing, the windmill turns when the solar battery on the top of the structure is exposed to a light bulb, but $40 was a little much. I wouldn't buy this unless I needed it for some sort of experiment (the reason i bought it), or if i really needed a model of a modern windmill for some reason."
1,Not worth it,"This CD is just a collection of software that can be found on the internet. And most of it is shareware, which means you have to pay extra to use it."
1,There are much better products out there!,"I was rather dissapointed after receiving my order for this item. After an installation onto my computer that was less than smooth (it crashed Windows), I began to navigate through the various Palm utilities. To my surprise, most of these utilities were shareware programs. To legally use any of them, it is necessary to pay a fee to the company that originally created the software. (In other words, I paid for this CD, and I'd have to pay again to use the software!) There are much better Palm utilities available-this is one to skip!"
1,VERY MISLEADING! NOT FULL LICENSED SOFTWARE!,"This is a CD full of ""try-out"" shareware applications, not the full versions! Not worth even if you PAID ME!"
1,Worthless ~ Where is my rebate,"I've been waiting on my rebate for over three months now, they delayed the payout date again until February. Little use for the software and bogus rebate. BEWAREBTW -- this is shareware, you still have to pay AGAIN to get to use the software on this CD."
3,It pays to read the not-so-fine print...,"Useful for someone (1) with a slow connection, or (2) who doesn't have the time and/or inclination to chase these programs down, or (3) who'd like to have the shareware on a CD - otherwise fairly useless.The product review does state that ""the easy-to-use installation interface ALLOWS YOU TO TRY OUT these utilities, visit the developer's Web site, and view the program manual"" (caps added for emphasis). Obviously, the key words being ""try out"". It pays to read the descriptions and reviews VERY carefully!"
1,"Okay utilities, but the rebate is still missing...","Basically, the utilities were pretty useless, with one or two exceptions..."
1,Great Programs,it is great to have these programs because there are useful for my handspring visor platinum organizer.
5,Brilliant as always.,"The CD is amazing and my favorite song on it has to be the last mix for ""One Day"" we reminds me of the X-Files theme. The Come to Me remixes are also very good."
3,Needs Updating,"This book is about Picasa Version 2 when Version 3 is now available. There are changes between the versions. It is very difficult for a new user when what the book says is different than what is on the computer. Until the book is updated, it is not as helpful as it could be."
2,Picasa,"Book is dated; New version is Picasa 3, but most of the information is relevant. Some of the procedures lack detail and are difficult to follow."
4,Good for a new user,This guide is good for someone new to Picasa. I was a little disappointed that more in depth subjects were not included. I was more like the For Dummies series but with even less content. Good quick reference but will have to search further for a more advanced reference.
3,Very Basic,I returned this book. Picasa is so easy to use that few people will need a Visual Quick Start Guide. The Quick Start series is good but this program just doesn't warrant a guide at all.
3,Filter not made by Bionaire,"Realize when you buy this, that this filter is not made by Bionaire. It is adequate, and it fits the Bionaire Clear-Mist humidifier, but it is a cheap-looking filter, as opposed to the Bionaire filter that came with the humidifier. In my opinion, it is too expensive for what it is."
2,You Get What You Pay For,"I only used this lens two weeks before it drove me crazy trying to get it to turn out a good shot. After about 50% zoom the distortion and other aberrations become unbearable. It didn't really seem to increase my zoom level that much either. I could zoom in almost as much, and have a better picture, by sticking with my wide angle lens on a macro lens. If you're looking for a good telephoto lens, don't go cheap like I did and get this. Save up for something higher quality and with a higher lens multiplication."
5,Not your typical hardcore........,"The minute I heard samples from the two Death By Stereo albums, I knew I was looking at a great, talented band. Death By Stereo's singing/screaming style might seem skeptical at a first listen. (One might think they have no talent whatsoever). In fact, Death By Stereo has amazing talent. Who else can blend the high energy, harmonic intensity of Punk with the screaming solos and ballad styles of Metal. Death By Stereo's guitar playing style can be compared to many metal bands complete with the soloing. But the energy, and intensity of punk rock is still there; alive and kicking. Death by Stereo is definitely intense, but harmonic and mellow at times. It's not just a bunch of yelling, and not your typical hardcore band. And there's no way you could say that Death By Stereo songs sound exactly the same. Old punk fans and new punk fans alike will need to check out this band."
2,"Not horribly BAD, just not good either...","The aspects of the story that concern the antiques trade and the madness of Brimfield are interesting enough. I found the rest of the book to be very ho-hum -- there wasn't a single character who was particularly compelling or likable, and the story is mostly predictable and dull. I just didn't care what happened to any of these people.And, I hate to be too English-majory, BUT...WHO edited this book? Anybody? The number of typos, as well as all the times that the wrong form of ""it's"" or ""their"" is used, is just embarrassing. The biggest editing problem is the persistant pronoun confusion, with all the sentences that say ""She was so happy to see her that she called out her name and she smiled as she poured her a glass of wine and...""I know the spelling and grammar stuff are picky complaints. Maybe if the book had been *interesting*, my attention would have been drawn to the story rather than the typos."
1,Possibly the worst book ever written,"We have all had the experience of reading a book that speaks to our own experience, and identifying with it. Doubtless, this is such a book for some people, as evidenced by the other reviews. However, on its own merits, this book is simply horrible. The premise is ridiculous, the characters are unbelievable, and the story is internally inconsistent. The writing is so bad it could be a cariacture (remember Snoopy typing ""It was a dark and stormy night""?) and the editing (as noted by another reader) is non-existent. For anyone who has ever been to Brimfield, it is obvious that the depiction in the book is completely unrealistic.I am a big fan of a good story without requiring that it have ""redeeming social value."" Colleen McCollough is a good example of this kind of writer. But I do want my beach novels to be well written, and this one is anything but."
2,Reader Beware!,"The premise of the book - that people search for objects to complete themselves - was of thought provoking. The author's style, however, was far too overdone for my tastes. He repeated characteristics of both people and places, far too many times. How many times can he refer to Brimfield as ""the ultimate one-night stand"" -- I got it the first time."
4,A little pricey but cool toy,My 7 year old loves automoblox...they are well made and durable. They seem a bit expensive but on the flip side will probably last a lot longer than some of his other toys that are similar to these. I would definitely recommend them for any young boys who are into cars!
3,mildy disappointed,"Got these for my boys after trying the larger ones at a playdate. The full size ones are impressive but you really need to have about 3 cars at least to have fun. If you're not familiar with Automoblox, the car dissembles into quite a few pieces; the cab, tires and body all come apart - then they can be re-arranged as creatively as desired. I got the minis so that we would have a few cars to re-arrange. Three of the full size cars would probably be close to $90 which I think is a lot. The minis are fun, but I felt that the pieces were very cheaply made compared to the full size cars which felt very durable. Don't think I will be buying any more of these minis."
4,a lot of fun,we got manhattan toy mini pack for our 5 year old son for christmas. The cars are acutally a nice size and he has really enjoyed taking them appart and mix and matching the components. The cars seem to be well made.
3,Not too many parts to assemble,"It looks too basic for a 4 year old. I wish it had more parts to assemble to make it more interesting. I think these cars looked cuter in the Amazon pictures than in real life. It's a Christmas present and it's not Christmas yet,so we'll see whether it's a hit."
5,Is there life after Boswell?,"According to John Boswell's book, Christianity, Social Tolerance and Homosexuality, the Christian tradition was not anti-gay until the late middle ages. Professor Brooten's book makes us revisit that argument and rethink the hegemony of Boswell's thesis in gay circles. Her critique of Boswell's reading of Romans 1 is telling and accurate.Brooten's book is a very tight and carefully argued presentation of Christian tradition as anti-gay and (especially) anti-lesbian from the outset. The wider context of this argument is fascinating. It includes translations of spells and other original material never seen before. No one interested in gay or lesbian history can neglect this study!"
4,Shoegazing grunge or grungy shoegazing,"If you like 90's indie/alternative rock, you'll probably like this EP. You hear elements of hard rock, glam, goth, and a few more influences thrown into the mix and the end result is not bad-- better than average mid-to-late 90's indie rock. A couple of the tracks are weak, but the rest are pretty solid."
3,good but has some problems,"I had some problems with this item. The tabs are printed on clear plastic that are held in place on a backing sheet. You then remove a row of tabs and apply them to the actual divider pages, all 5 at a time. I found that sometimes when you tied to lift-up the tabs from the backing some of the backing paper came along with it making it so you could not adhere the tabs to the dividers.I also found that the tabs are very ""printer"" sensitive, they did not like my fancy laser printer preferring my far cheaper ink-jet printer. When you have an equal quantity of tab pages to divider pagers with no option to buy just the tab pages, any printing error renders both unusable, this is a real problem for such an expensive product.Additionally Avery's label software, DesignPro, is cumbersome and although usable on a Mac, not very Mac friendly and I feel not much better on a PC."
2,Sorry; A Skip For Me.,"the pop of tiamat's works, I could call this album ""a failed attempt at stoner rock"" somewhat with not so pleasing vocals and not that good music. not my style at all..a deeper kind of slumber go go go."
1,Difficult to believe,"I'm tired of seeing the best doom/death acts turn goth all of the time. Sure, it works with some acts, but Tiamat? As far back as Wildhoney, I have been disappointed with their musical tangents into the progressive realm as they didn't seem to pull it off well. I still had hope, however, until the release of ""Skeleton Skeletron"". . . now all I hear is poorly presented gothic music with little redeemable musicianship anywhere within. It's little more than gothic garbage. Listen to Xymox, or Diabolique, but please: if you see this album in the record store, pass it up."
2,Tiamat - gift from Sweden,"I am a big Tiamat fan, but this aint good record. Ideas are boring and atmosphere is too static. There are couple good songs, that`s all...Buy first ""deeper kind of slumber"", ""wildhoney"" or ""judas christ"". Also ""clouds"" is brilliant but style is raw...depends what kind of music u are expectecing...Juha Kainulainen, Finland"
3,Not the greatest successor,"And this is the successor to the masterpiece. What happend? Where's the melody, where are the guitars, where's the mood of 'a deeper kind of slumber', or 'Wildhoney'. If you liked those two, I can't guarantee that you'll enjoy this one. It definetly has quite a few positive moments. But actually that's probably the main flaw of this album: it's too positive. It doesn't have that deep philosophically-sophisticated atmosphere as that of 'a deeper kind of slumber'. It sounds kinda 'funny'. Especially annoying are pop-like female vocals in a couple of songs. Why doesn't Edlund find a new girlfriend to brake up with, since that's what brings his talent to it's peak. And he certainly could've done better than this!And yet it is enjoyable to listen sometimes. Unless it really drives you nuts, when you know exactly what's missing at one particular place. I am looking forward to the next one, and hope that it'll be more 'Wildhoney'-like, but that seems unlikely to happen."
2,What happened?,"I'm not sure what Tiamat is trying to do here. If anyone enjoyed the lovely intracacies and atmospherics of Wildhoney and A Deeper Kind of Slumber will be quite surprised with this one. I'm just wondering what happened to the guitar. It seems they decided to put the vocals in the forefront. This would be fine except Johan Edlund doesn't have much variety or range in his vocal abilities. I would say the one highlight of the album was The Church of Tiamat. This did bring back a few memories of the Tiamat I appreciate. This album will definitely not hurt any of their commerial appeal in Europe. Hopefully, the next album will continue on with their progression from A Deeper Kind of Slumber."
5,"No multiplayer, but...","Love this game as I did the first one. Actually this is even better as it adjusts to the level of your player, but I am used to playing ,multiplayer as well, and that is not an option!!!! I hope it comes soon.Wonderful game:-)"
5,A view of Huichol culture in the 1930's,"This book presents translations of some of the stories of the Huichol people as they were told to one of the first anthropologists to spend time with them. There are the usual errors of interpretation that you will find with an outsider looking in on an indigenous culture, but this text provides a rare look at these stories in a format that is close to the original."
1,Yawn...,"This book is boring. It was written by an 18-year-old aspiring literary agent who only wrote it to get her foot in the door. The way I see it, she's going to need bandages for all five toes, because the plot is underdeveloped, the characters are transparent, and the flow is poor. Save yourself the trouble of self-inflicting pain."
1,not at all what I expected,"The book has hardly any validity and it's not what I expected at all. This gentleman did not do his homework. Throughout the book it states that fascism in Italy did not exist but then it states that Hitler used Italian fascism as a model for his politics, this kind of oxymoron is not the only silly thing about this book....keep your money and buy something that actually explains history as it truly happened not as in someone's fantasy world"
4,From a teacher...Great supplemental information! Great Price!,"This little workbook is a wonderful addition to ANY Spanish curriculum...it adds plenty of vocabulary in the form of nouns, verbs, adjectives, you name it! The lesson explanations aren't TOO thorough, so I wouldn't depend on it for my student's first experience with the language, but as a review, for this price, I haven't seen ANYthing better than this!Lots of pictures to color, lots of words to write and learn, some games, and even little rhymes and songs!If you're sketchy on Spanish pronunciation, you might have trouble with this little book, there's no phonetic spelling throughout, but a small pronunciation guide on the first few pages.For a full curriculum workbook (weekly lessons, worksheets, and flashcards), try Flip Flop Spanish, which DOES come with a CD."
3,Good for Collectors,"I give this three stars, taking away two for the bad sound quality. It sounds like music on a cheap AM radio in the next room.Don't get me wrong. The performances are great, and every Ra album is important.I especially like the rare vocal version of ""China Gate,"" hitherto available on the studio ""Futuristic Sounds"" album issued a year later, in 1961. ""China Gate"" is a kind of Vaughn Monroe thing, but Ra was into exotic foreign settings at that time, like some of Les Baxter's records. It's historically interesting in retrospect because Ra was so avant garde elsewhere.If you are not a collector, you are better off buying any of the 15 or so excellent CDs issued by Evidence Records and available from Amazon."
1,The World of Inferior Recordings,"The Arkestra was evolving in these vintage performances, but the terrible sound quality diminish the impact.The tape sources for the octet at Majestic Hall and sextet at Wonder Inn sound as if they came from the audience and was ultimately for a private collection. There is absolutely no way that Sun Ra - or any artist - would have permitted the ragged bootleg quality for release immediately after the performances.Only for those seeking a complete catalog of ""official"" Sun Ra releases, the CD is a frustrating aspect of labels issuing material with inferior sound quality for supposed ""historical"" purposes."
4,"Oh, if only it sounded a little cleaner...","While the recording quality of these shows leave a lot to be desired, the music is inspired nonetheless. A great window into the variety and energy that made up Sun Ra shows (as I understand them, being far too young to have actually seen one)."
4,dark and moving,moving music . Stings most underrated album I think.Why should I Cry For You is excellent as is the title track.
1,Caveat Emptor,While the movie it self is a classic the DVD leaves much to be desired. I was disapointed to find that the DVD was in full screen as opposed to the wide screen I prefer. It also received no treatment whatsoever on the transfer. The titles are shakey as well as the picture. If i had to guess they transfered right from a video tape found at a local video store. If i had it to over again I would have stuck to my copy on VHS and spent my money on something else.
4,Hysterical,"I think this is a classic for all horror movie lovers. It is a parady of most horror movies made in the 60's and 70's. If you Like movies such as Airplane! , Transylvania 6-5000, Attack of the Killer Tomatoes, Top Secret, or the Files from Police Squad, this is another movie you need to have, or need to see."
5,Hysterical,"Like parodies?Great lines that stick in your head?So many laughs you'll be sore for hours?WHAT DIFFERENCE DOES IT MAKE!!This is a funny, funny movie that parodies quite a few hit movies... from Indiana Jones to Amytville (spelling? - can't remember). And lines that stick in your head for years, everytime you think of them will make you smile, and laugh all over again. All that and it's a musical too!This movie is so stupid it is just like the name ""Hysterical"""
3,Fritz........your pants are down!,"I saw this movie many years ago on HBO and thought it was a riot! This is a very silly movie that won't appeal to everyone. However, if you like movies that are 'so bad, it's good' then give this a try. C'mon, what other movies have apathetic zombies?"
3,HYSTERICAL,THIS IS NOT THE GREATEST MOVIE BUT I'VE SEACHED LONG AND HARD TO FIND IT TO GIVE IT TO MY DAUGHTER AS A GIFT BECAUSE SHE LOVED THIS MOVIE. SO I WAS VERY GLAD TO FIND IT AND GET IT A COUPLE DAYS AFTER I PURCHASED IT.
4,Good and silly,"This movie isn't Shakespeare, but it is awfully amusing. Growing up, my mother found this movie somewhere and, like most boys between 10-15, I could watch it over and over again. Since then, it holds a special place in my heart, but I did go back recently and watch it again and I still found it pretty amusing (so it isn't a matter of me favoring this movie for nostalgic reasons). It's full of visual puns and silly dialogue and ridiculous plot threads, but I would still recommend it to anyone who can avoid taking it too seriously."
5,Quick and non damaged,Order came in very quick and was exactly what I wanted. The product looked untouched and the quality was great.
1,Not 1st Edition as Picture Suggests,"It was quick, but it was no 1st Edition. If it's not 1st edition, it shouldn't have a picture of a 1st Edition Pack.... Take a picture of the actual product or specify that it's not 1st Edition.... That kind of makes or breaks it...."
