class_index,review_title,review_text
4,Perfect book for the complete newbie!,"I found the presentation and format of this book provided a good, quick, and easy read. Simple diagrams and explanations address those questions you feel too dumb to ask but probably should ask.It is a book I find myself coming back to re-reading items after I have tried them out on the water.This is the book to buy for sit-on-top newbies."
3,A very basic book.,"This book would be good for someone who has never even seen, much less paddled, a kayak. Otherwise, anyone who has been out 1 or 2 times will find this book a bit thin on content. I would recommend ""Sit-On-Top Kayaking"" by Dennis Stuhaug as a better, more comprehensive beginner's book."
5,Neo Lounge with Heart,"A lot of mid-90's releases that jumped on the retro-lounge bandwagon were either just aping a style for the irony or...just jumping on the bandwagon to make a buck. Not so Jim Ruiz. He really loves this kind of music, has totally absorbed it, and will sing its virtues to anyone who will listen, including all the friends and family he has convinced to be in his band. He has also used this musical style as a vehicle for some very impressive, heartfelt songs and performances on this release and the much more varied, better-recorded follow-up, Sniff. Both are fantastic, but if I had to pick one it would be this one."
5,"Best book on the market, detailed, thorough and complete.","Anyone who is interested in the career of a financial planner should consider Nancy Langdon's book the most complete resource. She covers every aspect of the career--the good and the bad. This book isn't what you'd expect, it tells the truth.What I like most about the book is the ""sensitive financial planning"" ethic and how financial planners differ from brokers.This book sees the career of financial planning exactly as it is...you will be able to assess financial institutions for what they really are rather than relying on just their marketing tactics when deciding on which company is best for you.I highly recommend this book for anyone who is interested in financial planning--no other book comes close!"
3,Good Information at a Basic Level,This book provides a large amount of information at a faily basic level. The information provided was useful. The book gives a broad overview of the industry and provides guidance for those considering a career in financial planning. Use this book as a starting point if you are considering a financial planning career.
2,Lacked content,The book was not as clear as it could have been and did not offer much new. I found the added comments scattered through out the book from others to be frustrating. The author failed to provide the nuts and bolts in a format needed to become a financial planner. She should have taken the opportunity to get down and dirty with her own experiences and shared those experiences with the reader. For someone interested in becoming a financial planner I would suggest they look at some of the other books available where you can obtain more information as save some money. I also thought the price was nto appropriate for the content.
2,over priced,"The book was weak and lacked original ideas or helpful hints. Further, I thought the paperback book was way over priced. The author failed miserably in the area of marketing. One of the most important components in a financial planning practice is the type of business you are doing, she provided very little information in that area, and what was provided was short and appeared to have been copied from the regulations and thus was not as clear as it could have been. I did enjoy the references to the email addresses she provided throughout the book, but also, very quickly I got tired of the frequent contributions from other she included in the book.I have not read any of the other books on the subject, but I would recommend exploring the others before attempting this book."
3,Good Cheerleader... but that's about it.,"I get the feeling that the author is a fun person who absolutely loves her job, loves writing about her job, and loves knowing that others out there want to be financial planners. The advice, however, is pretty bland. This would probably be a good book for someone who has not done a lot of research about financial planning but has expressed an interest in it (perhaps a high school or college student). For someone who actually is in the process of starting a financial planning job/career, they probably already know 95% of the stuff in this book. There are nuggets of information here and there, but for the most part, it's a feel-good about financial planning kind of book. If you want specific, in depth details about how to get started, I would recommend Rattiner's ""Getting Started in Financial Planning"" instead."
2,"Overpriced, Underinformed","There are much better choices out there, this is basic information that is way over priced.As a previous reader noted, all of the positive reviews were written on Sept. 9, 2003. For that reason alone I would not purchase this book. Buyer Beware!"
1,"outdated, disgusting planted reviews","First of all, this book is already way outdated. A few years ago it could have helped you, but now things have changed quite a lot. Try Jeffrey Rattiner's updated ""Getting Started"" book (2005 edition) if you are interested in becoming a financial planner and make a decent living managing other people's money. As an ex-planner let me offer this advice: it's a lot of hard work, very competitive, and no guarantee you'll make a lot of money. Plus, you really have to be the extroverted type to like this kind of job, i.e., a lot of kissing up to your clients (what else?).The 5-star reviews from Sept. 8 and 9, 2003 are obviously planted reviews, as so many others have pointed out. Really disgusting behavior."
5,"Shocking, fearless look into the world of the legal system","This newly released book (with an excellent forward written by Christopher Darden ( remember the O. J. trial? )) details injustices in the world of women and children within the context of our legal system. The tangled mazes and webs of the ""justice system"" are untangled for those first entering the often biased ""halls of justice"" in an easy to comprehend eyeopener by author, Karen Winner. When will enough ""injustice"" be enough? The author not only identifies problems but offers solutions to some, as well. There is even an accompanying website, kwinner@divorcedfromjustice.co"
4,Iteresting,This book was written amazingly.The describtions brought the book alive.For any sci-fi fan I recommend this book.
2,Very disappointing,"At first it seemed quite good. It was attractive and optical. The Microban thing was a plus, considering what happened to my last mouse.It immediately, however, proved to be far overpriced for its worth. Right after installing it, I noticed the cursor would slightly stutter. It was veering on its own to the left, despite however I was actually moving it.Now, after a little over a week of use, one of the buttons broke after barely a tap (and I'm a very dainty girl, mind you). It stopped being clickable, and when I investigated, the button fell into its hole and into the mouse itself. Now the button's somewhere inside there, refusing to be shaken out, and I can see all the glowing red doohickeys inside.Bottomline: Do not buy ths mouse."
1,This looks so LAME,I think that inline is so lame. If you want to see a REAL skating game get Tony Hawk 3.
2,Pointless wordplay,"The author of this book is not a native english speaker. As a result, his writing is fresh, lacking cliche'. Unfortunately, he seems to take a little too much delight in just putting words together, without making that wordplay serve his story. An unusual description of someone's hat is entertaining by itself, but if the person's hat has no importance for the story, it's just a distraction. If you have attention deficit disorder, you'll never get through this book, since it constantly diverts you to all manner of irrelevant things."
5,Stunning,"I was blown away by these stories - A Coin left me breathless, I haven't read such an impressive story about war since Tim O'Brien's The Things They Carried. Islands was a beauty, with a truly disturbing layer of brutal politics and history lying underneath the tale of a family holiday. I could go on about all the stories but I don't want to give too much away. Hemon is a fantastic writer."
5,Carrots Love Tomatoes,Great information on what vegetables like to be planted with and which other vegetables and which herbs will benefit or adversely affect each vegetable. Lots of great information not available anywhere else.
4,tomatoes love carrots,"The seller of this book was very quick to send it and I received it in less than 10 days. My son and I had decided at the last minute to plant a garden, so by time we received it, we were already moving ahead with the project. However, it did arrive in time for us to get some good use out of it. We found information that we were not aware of, such as planting cucumbers with your corn to help discourage the raccoons, not planting our tomatoes near the potato patch, using herbs and flowers to protect certain other plants, and etc. The garden is in, now all we have to do is to watch, weed, water and wait to see how all this plays out. I am sure that most novice gardeners will find this book as interesting and useful as we have."
3,Helpful,"This book gave me most of what I was looking for, that is, what vegetables should be planted together to get the best growth and prevent pests. I was mainly interested in a vegetable garden and this book covers everything, flowers, shrubs and vegetables. Maybe the additional information will be useful at a later date"
5,a must have gardening book,"I have read these books at least three times and frequently refer to it for reference. I finally decided to let the library keep their copies when I found this ""two for one"" at a price better than one by itself. I'm thrilled to have them both super handy. Very practical gardening knowledge; a must have for any one who grows their own food."
5,A gentle re-minding,"For those who've been exposed to neuro-linguistic programming or simply those who've read some of the wisdoms of the ages, this compilation of deeply considered prose is exquisite. With his unmistakable accent and lilting voice Deepak Chopra speaks of the mystical paradoxes inherent in the human experience of creation. Ranging from the concept of how the world which I experience is ONLY my world by virtue of my sensorial 'hard-wiring' to the contrasts between an internal or external locus of control, this CD is like one of those well-thumbed books which one refers to again and again. And the added bonus is that not only is it an auditory delight, but the most exquisite nature photography accompanies all the readings for those who wish to access the multi-media track. It should be a must for all NLP practitioners, those wishing to explore the ideas of universal consciousness and anyone looking to experience the pure delight of age-old wisdom."
2,Transforming or Transformation?,"I presume this is pre - Madonna! Help. Nobody can even understand this cd. I tried to listen to it with the volume up and even up higher, but no luck. I could not understand the words. I think it is a good idea he met up with Madonna and others as in the cd, ""Gift of love"", because his life as a wanne be musician - singer is over. The music background by Franke is really pitiful and unchallenging. More like boring. Speaking english would really help and may be I could understand this transformation and the the real meaning of the cd.I am sorry that I purchased this cd without hearing it first at Amazon, now I am stuck with it."
4,"Light, funny read with a few pieces of wonderful wit","While the story itself isn't exactly outstanding, the book is quite interesting and well written. There are enough twists and turns to keep anyone occupied, and for the keen reader there are quite a few lovely pieces of wit spread throughout the book. One example - ""... of such monumental ugliness as to be magnificently impressive, like Chicago""."
4,No con...,"Hilarious, and a good mystery to boot.Too bad the Kindle edition is carp-full of tyypoos. Bad conversion, I guess. But it's 99% readable."
4,Comic relief,"If the government or the economy is getting you down, try a dose ofGod Save the Markby Donald Westlake. The hero is the mark who never met a scam he didn't like. He trusts everyone until it's just too late. When he inherits $300k from an uncle he never heard of, he summons his best defenses. Alas, this time the money is real. There are, however, a few strings attached, such as people who will do whatever is necessary to acquire the money, perhaps even killing him, if necessary.When I read Westlake's humorous mysteries, and this one is a good example, I usually get about 2-3 spp (smiles per page) and 1-2 gfc (guffaws per chapter). Your mileage may vary, but I'd suggest you give it a try."
4,Clean and Funny!,"I really enjoyed this book! The different cons were very entertaining (I might have fallen for some of them myself!). The writer has some great sentences that make you laugh at how clever the phrasing is. My favorite was when the character is repeatedly telling people that his near death experience ""Wasn't a big deal,"" thus ""overstating an understatement."""
2,less than stellar,"I started reading ""God Save the Mark"" by Donald Westlake last week and halfway through it I did an unusual thing: I gave up. I've probably read about twenty books by Westlake, but that was the first time I had ever stopped reading one before finishing. But less than a hundred pages into it, I realized that I just wasn't enjoying the book. In fact it was starting to really annoy me with silly plot twists. And the worse thing; it didn't have the same charm as Westlake's usual caper fare. Very far from ""classic Westlake"" in my opinion. I knew before starting this book that it wasn't part of his wonderful Dortmunder series, but even Westlake titles that aren't part of that series are usually very good. Not this one. But I won't hold it against the very talented Mr. Westlake: this book was written way back in 1967, presumably before he honed his style."
4,"Smallish and ugly, but does the job","Bought this hat for a cheap headcover for an African safari. It definitely did the job, but it's a bit small for a size M/L. I'd say it's closer to a S/M, or even just a Small. It still provided ample cover.It's also ugly, but I guess I can't really knock that since the pictures wouldn't for a moment suggest otherwise.Also, it's really ugly.... Like... really ugly."
4,basic quality head covering,"though quite bland in color, this is a great camping hat. Cool, shady, somewhat stylish. Kinda expensive for the large size but I'm glad I bought it. It can be dampened with cool water and act as an evaporative cooler when in the sun."
4,Red Promotes His Records,"This CD is a compilation of ""transcriptions"" produced to be played on the radio on two different radio programs that promoted Brunswick ""electric"" records. As such they contain great period announcing for each cut.Most recordings are expanded recordings of specific releases or medleys of popular tunes of the day, some of which Nichols never actually released on commercial records. Liner notes are complete and its easy to pick out Benny Goodman, Glenn Miller, Pee Wee Russell and so forth as they take their hot solos.These recordings are probably as close as you can get today to the way hot dance music was played in person. For example ""I May Be Wrong"" follows the release closely, but at a slower tempo until the vocal, at which time they break out into extended jazz solos at a faster tempo than the release.A quality CD showcasing Red's style of hot dance music and Brunswick's record marketing circa 1929-30."
5,Wedding scrap book,The wedding scrap book helps you keep your memories organized. It's very cute and helpful.
2,Crappy Scrapbook,Very disappointed in the contents of this book. There were no extra pages or any pockets for momentos. Wouldn't bother for half the price.
1,It's Lousy,"I purchased this product to deter my cat from scratching at doors and furniture. After repeated doses it does nothing. She still continues to scratch where I have sprayed. I wasted my money. It says it is guaranteed or my money back and I intend to return it. How can you rate something which is lousy, so in order to complete this form I had to indicate one star."
5,Greatly expands PowerPoint and also works with Excel,"If you do a lot of PowerPoint presentations this program will be your constant companion. It's a PowerPoint plug-in that provides the following capabilities:- auto-enhance slides and graphics, including beveling, anti aliasing (for sharper text), gradient fills, text kerning and better shadow effects.- slideshow timing controls and better annotation abilities- ability to manage slides more effectively: you can jump to any slide with a click, reorder slides quickly and have more transition and color scheme optionsThis application also works with Excel, and greatly shortens the time it takes to create a chart, as well as provide more control over the chart's appearance.The main value of this program is for the frequent presenter or the presentation developer. It will save time and quickly pay for itself if you develop or deliver more than a presentation a week."
5,A pretty good end to the series,"I waited for this book for over a year, and I have to say, it was pretty much worth it. ""Final Confrontation"" tells the story of Jesus' ministry on earth,along with his resurrection, from an angelic point of view. I found the view points of the various angels and demons quite interesting, especially during his birth and crucifiction.I did find a few grammatical errors in the book, but other then that, I would definitely give this book five stars. Although I wish that the series would not have ended witht his book, I think that the author, D. Brian Shafer, did a fantastic job in both his writing and accuracy. You've probably all ready read about the life of Jesus through our (a human's) viewpoint. I would reccommend reading this book, so you can see it through a spiritual one."
4,Bishop as Pawn,"""Bishop as Pawn"" is the 3rd Father Dowling mystery by Ralph McInerny. Billy Murkin appears at the St. Hillary's rectory in Fox River, Illinois. He is the husband of Marie Murkin, the rectory's housekeeper, even though she hasn't seen him in 15 years. Later that night he is found dead of a gunshot wound in the rectory. It becomes apparent to Father Dowling and his friend Phil Keegan, captain of the Fox River Police Department, that Murkin had been living in Fox River all along under the name of James Dunbar. Then, Bishop Arthur Rooney is kidnapped from the rectory where he is staying on church business. Father Dowling wonders if he may have been the target of both crimes since they both happened at the rectory. Are the murder of Billy Murkin and the kidnapping of the Bishop related? Father Dowling works with Phil Keegan in solving the crimes. As always in this series, all loose ends are tied up. ""Bishop as Pawn"" is a good read."
3,Sweet and touching~,"This was a very nice read. It tells of the link between mothers and their children that cannever truly be described. We ahve all heard the stories over the years of mothers who know when a child has come to harm or needs them in some way. This book chronicles stories such as these.As a mother of grown children, it made me smile. I passed it on to a young friend, and it made her cry.I would indeed suggest this one to a friend, if that friend has a child. There is really not esnough substance here to hold the interest of a casual reader."
3,5 Stars if I EVER got it...,"Like another Caleca buyer, I never got it. Ordered early Sept. and still not projected to ship till Jan 25. Really wanted it as it was lighter weight, beautiful, very chip resistant, Micro and Dish Washer safe.I ordered 3 sets and was going to order a 4th. Plus I ordered additional accessories such as serving plates, casserols...just about everything they had in this pattern.Very bummed. Perhaps it was not to be."
1,Rate an Item - or rate an item never delivered,"I would say that for the frustration of having these on order for 5 months and still not having received them, money would be better off spent elsewhere. They look to be beautiful, and folks who actually do have these plates attest to their quality....however, they are not worth waiting for 5+ months for.Look elsewhere."
3,Wish I had known . . .,"I bought 8 sets of this pattern the end of 2005. Yes, that's seven years ago I know, but the glaze in my coffee mugs has been mostly gone (digested?) for the past year or so. Between two people, only 2 or maybe 3 of the eight mugs get used every day. I have had cups in the past get stained but never lose the glaze like this. Wish I had known."
4,A different Kinky twist,"Kinky's ""Guide..."" is a bit of a twist for the author, speaking as someone who has read virtually everything he's ever written. I have to say, it's clever, features some very unusual pieces for the author, and as always, will have you laughing out every orafice."
4,Another Great Book By the Kinkster!,"Even though I'm not from Texas I found this book to be both funny and informative. Once again Kinky has penned yet another satirical classic that everyone should enjoy. Not a ""who-done-it"" but a hilarious look into The Lonestar State and what makes it great!"
2,Don't give it to a true Texan,"I bought three copies, two for gifts, one for myself. After I finished my copy I decided I couldn't give my Texan friends the books I bought for them. A little of the Kinkster goes a long way. True, he turns a funny phrase, and only Dennis Miller can beat him for arcane references. But true Texans would not be amused."
4,"Small and Compact / However, not really sure if it works.","The Zadro is small and folds closed like a small flip cell phone. It can easily fit in a pocket or your purse.The Zadro only has one button that you press and hold for about 10 seconds. The purple light will come on along with a Red LCD light to let you know that it's working.All you need to do is simply hold the light over an object like a phone, toilet seat, keyboard, etc for 10 seconds and the unit is supposed to kill all of the germs.Unfortuately, since I'm not a scientist, I really cannot tell if germs are being killed."
2,Disinfection Scanner uses limited,"You can buy this product, it will kill bacteria, germs, and some things, but not all things. This product is limited to certain things."
4,Energizing and inspiring,"Imagine an 'elderly person' who is homeless by choice, and works her way through her life, travelling the world like a backpacking student? Dicky Jensen is this person. She travels the world on a strict budget and travels alone by choice. Not back and forth to Florida but to Brazil, Czech Republic, and Ireland. This book is simply what seems to be a small portion of her fascinating experiences, and if ever a person answers the question of 'what have you given back to the world?', she is it! I had the great pleasure of meeting Dicky Jensen at a book promotion, and after finishing the book, I do feel that it doesn't do her complete justice. She is so engaging and interesting, and the places she has been and the people she has encountered is astounding. However, the book is an easy and cheerful read, full of inspiration to get out and do something with yourself. I think it's worth the time spent appreciating her fine and meaningful life!"
5,Life after kids! Homeless and happy!,"Every wonder what you'll do when you kids are gone, and you are divorced or your husband has passed away? You will be in charge of your own life and happiness.This is a must read! Dicky says don't whine and mope about how you can't afford this or that, how you wish you could travel but this or that stops you. Dicky, who no longer has a home to call her own travels to amazing places, meets engaging people by staying in hostels, and finds life fun and interesting.It's a quick and inspiring read!"
2,not worth the money,"I purchased two of these and within a few days, gave them away. They are flimsy and the pockets stretch. But more importantly, the little ties that Graco provides to hold the bottom down (so it doesn't flap around) came untied several time per day. The ties are just six inches long and had to be ties to the pocket of the seat in front. Bad system and, like I said, we promptly gave them away."
4,20 year user,"As a user of Zeasorb for the past 20 years, I works better than any other drying powder I tried before. It was recommended by my doctor for excessive sweeting and has helped. As for the warning label, I take in more Acrylamide in the french fries I eat."
1,Research the ingredients first,"When I received this product, I saw that a warning on the back reads: This product contains Acrylamide, a chemical known to the State of California to cause cancer.Had I known this, I would not have ordered this product. It would be helpful if this warning could be included in the product description."
1,Contains carcinogens,"After I bought this, I read the back and was shocked to find this warning:WARNING: This product contains Acrylamide, a chemical known to the State of California to cause cancer.They should disclose in the product description. I'm not going to proactively rub carcinogens on my body."
