class_index,review_title,review_text
2,Ego trip,"This is what happens when an author has a super successful book. They lose touch with communicating from a place of genuineness. They let their ego overtake them. That's what happened here. Trying to take the simple and complicate it. Trying to take a unique position to be marketable. If you think about it the whole idea is ridiculous. Instead of embracing the gambit of emotions that consitute the human experience, Katie advocates/distorts acceptance as joy."
2,Not right for everyone,"My book group chose this book so I wasn't sure what to expect. I have not read any of her other books but have read alot of other self-help books and have done some reading about eastern philosophy. This book was annoying! I don't know if I didn't enjoy it because I hadn't read any of her other books or because I already had an understanding of what she calls ""The work"" from studying eastern philosophy. There were paragraphs here and there that I liked but most of it felt like the same thing over and over again."
5,Meet The Queen of Unconditional Love ~g~,"By far the BEST book I have read on the power of unconditional love in its purest form ... where you come away with the feeling of profound freedom and peace after doing The Work.In order to see things change, you have to change the way you see things. And this book delivers! Once you put the info into practice, all heaven breaks loose. ~g~"
2,This and loving as is...,"I read both the books and giving a collective review - the work works no doubt as questioning gives answers which are RELATIVELY true.I personally found both the books disturbing low of energy and a lot of gloom.Secondly the author keeps herself in a high point of reference and 'bestows' her observation to 'these' people. How interesting ? And i did read her chapter about humility!Save your money, just my opinion."
1,Disturbing interpretation of Buddhism and Taoism,"When I saw Stephan Mitchell's name as a co-author, I expected a wise work on spirituality. Byron Katie only used parts of his translation of the Tao te Ching as chapter headings.Byron Katie's message is that all events are joyous. To think this way would be to have no empathy and no compassion for others. The ""accepting of what is"" in Taoism is not a message of ""joy""."
5,Great entertainment,The film is charming. It is tragic and funny at the same time. The griots' chanting is magic as is Senegal.
2,doggie costume,The picture makes the costume look better than what it is. It is poorly made because it does not fit the dog properly. the neck is too short and the little hat/hood cant stay up and the supposed dragon tail is way too short. My dog is only 3lbs and it was still to big for the costume
5,5 Stars from a Germ Freak Parent,"This is a great book to help prevent you and your family from getting sick. When I brought my premature twins home from the hospital I was told it was very important to keep them from getting sick that first year because they were at such a high risk for contracting RSV (respiratory syncytial virus) which can be fatal. This book helped keep the germs away. Despite the unpleasant subject, it is a fun read. The author is really funny.Dr. Jenn Bermanwww.DoctorJenn.comAuthor ofThe A to Z Guide to Raising Happy, Confident Kids"
4,Serious Topic With a Light Approach,"With concern about a possible flu pandemic in our future, the tips in this book seem worth the effort. I know I've been coughing and sneezing for a month since my last airplane flight. Maybe with the preventive methods in this book, I could avoid such a miserable result.I knocked off a star because I really just wanted the facts and not some cutesy comments and a list of celebrities who are germ freaks."
3,Better then the First,"This is better then the first book, Something's Cooking, in that she does attempt to develop Angie a bit more. Unfortunately, this book and the next, Cooking Up Trouble, is probably the best Angie is going to get: after this she just gets downright annoying because she can't see past her own viewpoint. In this one though, you can somewhat accept Angie's ditziness as inexperience in the real world and her outgoing manner... too bad as the series progresses she doesn't seem to learn anything from what she encounters. The next book is Cooking Up Trouble."
3,Cookbook Mysteries,"The book was ok, but a little draggy. I read several mysteries where the main character is involved in cooking, and Angie is just not as exciting a character as the others."
2,terrible follow up to black-trash,"i was looking forward to the new sticky album after his first solo album ""black-trash"" which was a very good album, and had alot of consistancy. but after one listen of ""decade"" i was already bored, and thinking what had happened to the old sticky. i mean some of his lyrics are still very good and ill give him that, but the production is absolutly awful. i dont think theres even one good beat on this album, and even the guest appearences are lame. at least on black trash there were good appearences (i.e raekwon, redman, dave hollister). if your a hardcore onyx fan then this album may appeal to you, but if u didnt like the last onyx album ""bacdafucup 2"" then dont bother with this, and in my opinion this is a complete waste of money. my rating would be 1.5, just for the fact there are some good lyrics."
1,Dissappointment,"I've given this album alotta' tries but it's just not any good. It's completely devoid of Sticky's grimey style vocals and instead has these commercial street trash songs. The beats, as mentioned above, are garbage. They're something you'd expect fabulous or ludacris to spit to. There's one song that has alotta' features which is pretty good but still sticky's outshined by another rapper in that song, maybe X1 I'm not sure of his name. Either way, after Blacktrash sticky had become one of my favorite rappers, second only to the JediMindTricks crew. But after this, I'm thinking he just lost it. went the way of DMX after It's Dark and hell is hot. Save your money, buy a RassKass or JediMinds cd."
1,1.5 stars,"Sticky Fingaz was a dope MC in the 90's. Most of all the ONYX material is worth checkin out and as far as solo efforts, his first and Fredro's first were both excellent releases. This LP makes a great coaster for your studio. I was extremely let down by 85% of the material on this record. The beats were boring and average at best--The lyrical content I slept through. I just couldn't vibe w/it, for having so much respect and love for his work in the past for droppin ill tracks this was a huge let down."
1,what in the world happened!,"I WISH I WOULD OF CAME TO THIS PAGE AND READ ALL OF THE COMMENTS LEFT ON HERE BEFORE I WENT AND BOUGHT THIS GARBAGE, BECAUSE THIS ALBUM WAS STRAIGHT TRASH! NOTHING, AND I MEAN NOTHING, COMPARED TO HIS FIRST ALBUM!"
3,What happend to onyx,damn they used to be straight fire now this damn this album is better the dacdafucup 2 and triggernometry but god this is dissapointing as much as i love your music kirk jones7 of 10 lyrics 5.5 of 10 beats
3,Sticky,What has happened to the old Fredro and Sticky? they ain't the same no more. They've the lost the grimeyness from Onyx. They gotta go back and try to make it underground again and get back the old stuff.
1,garbage,"blacktrash was dope as hell and i was waiting forever for this album. of course, it sucks. I dunno what sticky was thinking, but he shoulda kept the same beats as the first instead of going the club-commercial-ass hip hop crap beats that are playing on the radio. w/e, dissapointment. check kirk jones, that ones dope. leave this where it belongs, in its original packaging box, taped and sealed.."
3,sticky's came a little unstuck!!,"The one thing you're GUARANTEED with a sticky album is entertainment baby and this is no different. Only not as entertaining as the previous joint he dropped ""kirk jones...."" As usual his lyrics are on point, sharp, funny at times and original. He has a knack of telling a tale or spitting a bar that other rappers spit but in his own style and with his own twist. Its just this album lacks the quantity rather than the quality. There's about 10 cracking joints here but there's also 6 weak ones with his boys on them,(they lack his skill and style and pure charisma),that really didnt deserve to be on this. ""Lets do it"", ""Hot now"", ""I love the streets"", ""Girl"",""Shot up"", and my two favourites ""Cant call it"" and ""I dont know"" with fredro starr are unbelievable. Theres at least another 4 bangers too. All in all, damn good album, worth the money, just not as good as ""kirk jones"". That said theres very little out there that is."
4,All the Things You Need to Know About Foreign Countries.,"As an artist I travel alot because it is required of me, but when one tours a country they'll never truly know what to expect, especially since tour guides only reveal the good things about their country. This book is really excellent for people who are interested in not only the physical beauty of a country, but its social and political standings. It's very informative and gets staight to the point."
5,"Soulfully Rocks without ""alternative"" pretentions","The latest album from Acetone rocks more than the self titled cd. York Blvd. is more along the lines of Cindy but more refined. The quiet moments are still here like on 19 and ONE DROP, BONDS but ITS A LIE, LIKE I TOLD YOU, and the opening track are great grooving rock that you can feel deep in your soul. Richie Lee's lyrics are perfect. they can be taken literally or in most cases seem to be impressionistic potraits of episodes in life.Buy this album, put the headphones on, relax and feel the the warm music of Acetone, dont worry Things are gonna be alright."
5,R.I.P. Richie! Long live Acetone!,"Even though I bought this album after Richie (Acetone's singer/bassist) died, I still believe I would think this is the best Acetone album ever! They really hit their peak with this one! Liquid smooth vocals over bluesy trippy guitar and bass lines have always been the Acetone formula, but on this CD they've PERFECTED it! Mark is one of the most underrated guitarists out there now and Steve's drumming always hits the mark perfectly! Stray is definitely my favorite track on this CD! It's really a shame we'll never get to see what else they had up their sleeve! I really hope Steve and Mark continue to jam and put out some new music, because talent like this should not go unused! So do yourself a favor and pick up this CD ASAP! R.I.P. Richie!!! Long live Acetone!!!"
2,Buscemi strikes out,"This movie is one of those primarily character-driven indie movies where, instead of interesting characters, We Duh Audience get to see several kookie/zany/offbeat/quirky-with-a-capital-Q characters tossed together, and then: Let the indie-zone ""comedy"" begin! (For other examples, see ""Inside Monkey Zetterland"" and ""Buffalo 66."")Trouble is, in this ""Vegas,"" 'quirky/offbeat/etc.' equals 'annoying and/or unpleasant.' I don't particularly require a movie's characters to be likeable, just interesting. The characters in ""Goodfellas"" are morally repugnant but fascinating. Here, Buscemi is a spineless gambling addict, and that's pretty much all there is to his character. I should care about him exactly why? Sarah Silverman plays his ""love interest"" but I saw no chemistry between them. Sarah S isn't given much to do except act uncharacteristically ""perky."" The actors are the only elements making ""Vegas"" watchable at all. For Buscemi fans only!"
3,So so,"A couple of funny scenes but otherwise pretty lame. It is a short indie film on a very very low budget. It seems that they just sat down in cafe and said, lets make a movie and went off and made one without much thought. I wouldn't pay money to see this or even to rent it. This movie could have been a lot funnier if they actually sat down and designed a script."
3,Texas Caves - Great Book except for spine.....,"The content of the book was wonderful, as were the pictures. I felt as though I was in the cave. Though I am alittle upset, the spine has already come apart after I read it a couple of times."
2,Difficult to read. Ambiguous. Pedantic,"The work is an arduous read, no doubt about it. Regrettably, though sociology and history (the two genres of the work) can be communicated in a clear fashion, the authors seem to be trying to one-up each-other to see who's the most intelligent. Unfortunately there is probably a paucity of works available on this topic, and there are diamonds scattered about in the work-but rest assured, you will have to dig deep to mine them."
2,Somewhat disappointing,"Even for the avid ""Daily Show"" fan (like myself), this book is a bit disappointing. Despite a witty and well written introduction by the Craigmeister himself, page after page of Five Questions tends to wear on the nerves a bit. It was interesting to read through once, but it is not the kind of book you'll read again and again. I suppose you get what's advertised, but you could always watch reruns."
2,Beware Mystery Lovers,"Don't let the title mislead you, this book is a poor excuse for a mystery. I was surprised to find that I had actually guessed the murderer and motive before I was even a third of the way into the book. Perhaps for someone who isn't a hardcore mystery fan it would take a little longer to figure it out, but still there's no genius to the murder mystery part. The plot was fast-paced, perhaps a bit too fast paced for my taste, but by being fast-paced it always has a interesting change of scenery. The romance in it was okay, at times it dragged unlike the story. Jim Walker certainly makes use of his knowledge of civil war history. (as far as that's concerned I'm impressed with the book) Anyone who enjoys reading Gilbert Morris's work will enjoy this book."
3,Fun Collection...way better than the film!,"Skip the film and but the DVD of the TV Series Season One. As far as the music goes, this is a fun little collection of assorted ""witchy"" music. Nothing out of this world original or amazing, but a fun compilation of familiar tunes that will come in handy when you're stuck in the freeway and in need of some toe tapping.Noteworthy are Ella Fitzgerald's jazzy spin on DING DONG THE WITCH IS DEAD and Steve Lawrence's swingin' version of the TV theme song."
5,Amazing.,"The movie, Bewitched, is truly a bewitching movie to say the least. I adore it incredibly and the music chosen was perfect for the movie. City of Love and 'Bout Time I feel are wonderful songs, just lovely for the selection. I like especially jazz and swing genres which was what many of the songs are based around in this soundtrack.**Great cd to all who aren't quite sure and are contemplating buying it, if you enjoyed the movie, you can take it with you wherever you go in your cd player or your mp3 player with the music from the title."
1,What a Failure,"This soundtrack could have been awesome. It is such a dud! First of all, prior to the film's release, the trailer shown in the movie theatre's had the most awesome, funky instrumental version of the Bewitched Theme and it never made it to the soundtrack. That is what I wanted the most. Nora's chop job on the film really took what could have been an amazing film and soundtrack and destroyed the concept. There are so many great tracks that could have been used on this LP. Nicole could have recorded Sabrina's I'm Gonna Blow You a Kiss in the Wind for instance. This was a failure in my book. One star is too much. Boring!"
3,Good oldies but...,"Some really great music on this one, but definitely not worth $15. Wait till the price goes down some, because if you like this music, chances are you already have most of it. A nice collection overall"
1,A Waste of Money,"This CD should have been all studio tracks. I think that she needs to polish up on her live singing. Maybe if she gets some vocal rest, she'll sound better."
5,Wishing You The Best,"I love this album. I have the cd and the DVD (if you don't have the DVD, then go it.. now!) This album is a blessing to me. I love I'm Still Here, I'm Coming Out, and It's Not Me. I like the rest of the album too. I think every believer should purchase this album, it will minister to you, and the DVD will make you shout where you may be watching it. I urge any and everyone to add Dorinda's DEBUT album to their collection.I CAN'T WAIT FOR #2 DROOPING THIS FALL"
4,Could be better,"I loved the album there are some anointed tracks on here but at the same time, some get too secular for my flavor! That is good in some cases but just not me. There are about 3-4 that i love extremely so I give it only a 4."
5,JUST AWESOME!,Dorinda is an awesome minister and songstress. Her album is only an extendsion of the things that God has blessed her to be able to encourage not only elder persons but also the younger generation to follow God. She ministers through her songs in such a way that you have no choice but to feel God's presence and her debut cd is no.1 in my book. I would encourage everyone and anyone who loves a cd not to only have one good song but the whole cd present itself in such a way that you can relate to every song to buy her cd.
5,Dorinda Clark-Cole,"~This album is beyond anything that is imaginable. Sad to say that I never really listened to the Clark Sisters, but after hearing the first song on this CD I am forever a fan of Dorinda. She exemplifies what an anointed woman of God can really become when she allows the Lord to use her accordingly. Her heart is in this album and so is the Anointed One. After purchase I put the cd in my changer and have not stop listening to it yet. I am a college student and I listen to it until I absolutely~~ have to get out of my car and go inside. I also have an extra copy for my apartment. I have begun to listen to hear in the mornings as I am getting ready for work or school. Keep the faith girl and do what you do best sing and preach. Thanks for being used by God and being an inspiration to all Christian Ladies. I have no one favorite, but I sincerely love them all, because they are gospel.~"
1,off the hook,"Well i think this Cd was off the hook. My favorite was you don't have to leave here, That song has been on repeat on my CD player from the first day i got the Cd. I love that Cd and hopes that it will bless others just like it has blessed me"
5,Awesome CD!!,"I've had the personal pleasure of being taught voice lessons by this dynamic WOMAN of GOD! This CD is AWESOME! In review of this CD, she gives you exactly what the Holy Spirit gave to her with you as a listner feeling the spirit right along with the music. This CD encompasses a style of variety for all age groups to enjoy. I recommend this CD to everyone to add as a part of their Gospel Music listening for the enjoyment of a lifetime!Dorinda (The Jazzy One),May God bless and keep you forever safe in his arms! You are so BEAUTIFUL and I Love you!Rafael"
4,It Feels Like Sunday Mornin',"The debut album from the beautiful Dorinda Clark Cole is an exceptional collection of down home ""Chuch"" music! Isn't that what we love about Dorinda...she takes us to church. Just listen to ""You Can't Take My Joy"" or ""Nobody Like Jesus"" and tell me it doesn't feel like Sunday morning. It was refreshing to hear the Clark sisters reunite on ""Show Me The Way"" and even more, to hear sister Jackie(whom we rarely hear) participate with ad libs. Of course there's Twinkie - wailing and giving the ""black flem"" like no one else can. Love it! ""It's Not Me"" will have you dancing while ""I'm Still Here"" will have you shaking your head and closing your eyes in agreement with Dorinda's majestic voice telling you about the grace of the Lord.Bottom line - It feels like Sunday morning! If you like good ol' gospel music, this CD will bless you."
4,Good Poker Book,"I agree completely with the last reviewer. I like the supportive and down to earth style of this book. He also presents stuff in ways that I haven't read in oher books and helped me to see it in a different light. Thanks Matt. A very good deal,+EV, for under $10:00."
4,Culinary holiday,I fell in love with this book (hard kind) in Istanbul. Sadly only available in softcover elsewhere. This book whisks me back to Turkey every time I take it into the kitchen. Food is exactly what we enjoyed off the tourist track while there. Home cooking not restaurant cooking. I can see the book wearing out!
1,Ingredients,"Most of the ingredients called for are not available in the average super market or even in a ""gourmet"" food store. I couldn't find most of the ingredients even in a community with a large international population. It was most frustrating as I was anxious to try the recipes. The photographs were gorgeous."
4,From a Turkish cook,"I am Turkish and (so I am told) a very good cook for 30+ years. I found some recipes in this book (Klasik kofte, salepli dondurma) that I could not find anywhere else and worked wonderfully.If you are having diificulty finding ingredients, try online sites like penzeys.com or tasteofturkey.com."
3,"Life, rivers and a philosopher","In the essay in which the author describes her initial encounter with graduate level philosophy, Kathleen Moore gave away a major distinction between herself and myself ... her first paper topic was on Descartes - as a undergraduate philosophy major, I thought Descartes marked the point at which Western philosophy became a waste of time. Admittedly my view has mellowed, but Kathleen Moore's essays lack the almost mystical quality one finds in the essays of Kim Stafford, Annie Dillard etc.Several of the essays, however, are charming especially her meditations on poking around, on her elderly neighbor, and on the funeral arrangements for her father. From her essays as a whole, one gets a sense of life fully lived in the details.This is a book I enjoyed, am glad to have read but am unapt to read more than one or two essays again."
2,"the word ""rivers"" caught my attention",I thought this book was about the rivers themselves--perhaps she had floated these rivers and was writing about the sights and scenes. My mistake. The essays are very well done and I appreciate her sincerity and insights. Although there is not a description of the Brazos River in the essay about the Brazos. I enjoyed the human interest but was left wondering how the daughter's relationship turned out!
2,Sluggish,"The concept for this story is very promising--one boy DOESN'T have magic, as opposed to the predictable boy who DOES have magic. And the world was beautiful and interesting. But the writing was so sluggish, I couldn't get into it. The paragraphs were too loooooong for the target age group. The plot chugs along at an agonizingly slow pace. Even the action scenes are sluggish, rather than exciting. I tried skipping every other sentence. A good editor should have eliminated a quarter of the pages, which would have improved the pacing. It's a shame no one did, because the idea is worth the effort. Instead, the intriguing concept fails due to the slow pace. I read stacks of books every month, and it's extremely rare for me to stop in the middle . . . but this one did me in. I stopped half way through and put it back on the shelf. I didn't even read the back page to see how it ended, which shows how bored I was. Sorry."
3,Fall in line with the harcore/metal legacy that Combat created decades ago,"This release completes the trilogy that is the Combat Records relaunch campaign. Just like their label mates, Look What I Did fall in line with the harcore/metal legacy that Combat created decades ago. Barry Donegan is a schizophrenic vocalist that screeches like Cradle of Filth and harmonizes like Incubus. The rest of the band takes their cues from the thrashers and metal gods of the past with furious riffs and pounding drum beats."
1,Worst band ever.,"Look What I Did is to music as Hitler is to the Jews. This band's live performances sound like the term ""sound check"" was never invented. Upon seeing/hearing this band, I instantly think, ""Between the Buried and Me"" wannabes, and ""I wish I made my money by randomly slapping my instrumet behind lyrics about my urges to rape women."" Worst band ever."
5,Perfect match...,...to go along with the shower curtain and towels that I purchased from Amazon. Framed these prints and hung in bathroom. They are pretty quality prints and tied the bathroom decor together nicely!
1,Palm Tree's pic(2),"I have traveled alot and with my new camera,I out do these pics that I had bought a few years back,to some one who dont travel there just fine,but now with my camera,would not have needed to buy these."
2,8x10,"I expected to get a much larger print. The picture led me to think they were atleast 11x13. These arrived and I was very disappointed. I matted them in a bigger frame and will use them. They were inexpensive, sometimes you get just what you pay for."
1,Not what I expected at all. :(,I bought them thinking I was getting something worth while. I was sadly disappointed. They look dull. They just look like they are very dark and not worth putting up at all. Sad. :(
5,Super Spinner!,"I use this salad spinner nearly everyday. It's perfect for a few small salads or a big one for just me. I like the pulling function, it seems to work very well, without a lot of effort on my part. I would recommend this particular model to anyone."
4,The product was delivered as promised.,I bought it as a gift to a friend. It is how he likes it that counts. I like it enough to be tempted to keep it though.
