class_index,review_title,review_text
2,? for those who own DVD?,"What is are the differences between the 2-Disc Special Edition & the regular version? What is added on the second disc? (And is this the reason some have complained about a ""cut"" version? Does one have the full version, while the other is edited?)"
4,best movie of 2005,I think it is a really entertaining movie. You probably will like it if you had never scene it. I saw it and I was shocked. I read the book and most of it was cut out.I am a huge fan of Harry Potter.I have all three movies.And I know I am geting the fourth one.But I could not enjoy the movie in the Theator because it was noisey in the theator.Harry Potter 4 has to much acton.I can not wait until the fift Harry Potter comes out.
2,Of course,"Well, we knew he would win. Little suspense, except the film was so dark I found most of it hard to see and I was therefore bored out of my socks. Excellent acting by the cast the CGI may have been great if I could have seen it."
5,EXACTLY LIKE THE BOOK!!!!,This movie is a picture perfect reverence of the book. Everything i pictured from the book came out in the movie. And the charactres in the film match the book's character's personalities. I'd give this movie 10 starts if i could. I sincerely ebcourage people to watch this movie.
3,Not too shabby,well i like all the harry potter books and movies but eh.. this one wasnt what i expected. for one thing they left out1.the quititch(sp?) world cup2.the blasted ended shrews3.winky/dobby4.the book is rather more detailed so i'd rather that u read the book FIRST then buy the moviedont worry the movie wont go anywhere!!
4,Excellent movie!,"Didn't give it 5 stars simply because ""Harry"" is no longer the cute little boy (due to the time between the books being turned into movies) he was in the first one and Ron is getting kind of funny looking.Arminie (sp?) might be a granny before they get the last one done! LOL!A nice family flick all the same."
2,not the best harry potter movie,I thought the the new movie sucked. The acting was good but the movie went to fast for my liking. When I watched it in theaters the movie was just at the begining of the yule ball and I had to go to the bathroom so I go to the bathroom and I come back like three minutes later and the yule ball was over. The movie went to fast for my liking but I'm going to buy it anyways
2,not the best harry potter movie,I though the the new movie sucked. The acting was good but the movie went ot fast for my liking. When I watched it in theaters the movie was just at the begining of the yule ball and I had to go to the bathroom so I go to the bathroom and I come back like three minutes later and the yule ball was over. The movie went to fast for my liking but I'm going to buy it anyways
1,unplayable,small print on back of CD case states that the productis authorised for sale or rent in USA and Canada only. Not surprisingly CD will not play on my UK CD player. why does Amazon despatch an unplayable CD to an address in the UK?
3,"Very dark, but not that way...","I loved this movie; it is my favorite of the four thus far. I feel that it kept its pacing much better than the previous movie, despite the excising of huge sections of the book.However, I write this review to point out that I found the transfer of the movie so dark that it was nearly unwatchable. Everything was so dark that in many shots, people were mere silhouets against the background. I saw this movie in the theater, and remember that the shots weren't like that then. Cranking up the gamma worked, but then the picture was washed out.I'm glad I rented before I bought. I'll wait until another edition comes out (after all 7 movies are out?) before purchasing."
3,Not the greatest Harry Potter movie,"As a fan of the Harry Potter series, I found the movie disappointing. I know that not everything in the book could make it into the movie, but more content then what was used would have made ""Goblet of Fire"" better. They skipped around so much it made it hard to follow the plot line. I would have liked to see the Dursleys and the rest of the Weasley clan in this one. Hagrid and Professor McGonagall seemed to be relegated to the background and the scene of Harry talking to Sirius in the fire was not realistic looking. Not too crazy about Michael Gambon as Dumbledore; the late Richard Harris was much better in the role.The movie didn't do the book justice. I can only hope ""Order of the Phoenix"" is better. Don't waste your money on ""Goblet"" and put it towards the last book in the series when it's published."
2,Bad Movie,"This was the worst Harry Potter movie out of the five. It was also my second favorite Potter book (the seventh was the best) and that made the movie more disappointing. They left out so many good parts from the book, and the parts they left in where messed with. I would not buy this if I where you, if you want to buy a Potter movie, buy the third, that was the best one!"
4,Great rainy day fun,"I still like the third movie best, but this was at least better than the first two."
5,Harry Potter Goblet of Fire,As always I have found the Harry Potter Potter Series great. This latest was no disappointment. I think its originator Ms J. K. Rowling has done an excellent job with her books and now to see the video is fantastic.
4,Another good movie,"I hate to be repetative, but I must for my review of these movies. It is hard to take all the rich details of a thick book and squeeze it into two hours and expect it to make sense to anyone who not a fan of the books. This is just the highlights of a great series brought to film for those who want to see what, up till now, their imagination had to make up."
5,excellant extra features,"The DVD was very good with lots of extra special features that added to the story line. Lots of newer interviews. The section on the composers of the various movies was good. Sine Goblet is my favorite of the series, it was a worthwhile investment."
2,Italian language available ?,Someone could tell about italian language on ultimate edition ?Thanks for helpHarry Potter and the Prisoner of Azkaban (Ultimate Edition) [Blu-ray]
1,Not paying for something of lesser quality...,"I was prepared to purchase this (as well as year 3) but once I read that neither set includes extended versions of the films, I decided to save my money. There are plenty of other things more deserving of my hard earned money. If the ""powers that be"" want my money, they should re-release this with an extended cut of the film just like they did with years 1 & 2."
1,Disappointment - NO EXTENDED versions,Like theHarry Potter and the Sorcerer's Stone (Ultimate Edition) [Blu-ray] andHarry Potter and the Chamber of Secrets (Ultimate Edition) [Blu-ray] Ultimate set I expected these to be extended as well.But there are not extended at all... same as previous Blu-ray releases.Too bad :(
2,lacking,"No extended cuts that are aired regularly on TV and no lossless audio. The extras make it a tempting buy, but WB skimped on the crucial aspects of the ""ultimate"" editions this time"
3,Somewhat disappointed,"While all of the additional material included in 3 & 4 is very cool, I was expecting the extended versions of the movies to also be included as they were for 1 & 2. This is disappointing, especially since that was one of the reasons I really waited to buy the Ultimate Editions."
2,worst of the potter films,"This was a bad movie all around. Dumbledore played as aggressive & angry toward Harry is so far from the books. Harry's developing rapport with sirius was virtually eliminated. Not doing the scene at the dursley's was a huge mistake...one of the best scenes in the book.In short, no plot, poor character development, only the last 20 minutes of the film was any good...the graveyard scene was decent.The action is not enough to make up for the lack of depth and continuity. OTP is a much better film by far.Interestingly, Chris Columbus said he would have made GOF into two movies. He may have been on to something."
4,Great Adaptation of book...,"It's Harry's 4th year at Hogwarts. After attending the World Quiddich Cup where the Deatheaters came out to wreak havoc, Harry worries about his dreams of Voldemort. But, Harry expects that at Hogwarts this year things will be quiet. However, someone has entered him into the Tri-Wizard Tournament and he has to compete even though he is underage. The tournament is dangerous and in the past contestants have died. This year is a test of friendship, loyalty, and honor.To fit the time frame many of the subplots and build up to some of the major themes were left out. You can enjoy the movie and have a great time viewing it, I know I did. But read the book, it will just add to the experience."
4,Release date,"Those who have said HP4 will be coming out in March or April and the Warner Bros has it for pre-order. Are you ABSOLUTELY positive? I've been on Warner Bros official site and it says that the DVD does not yet have a release date. Looking back on all of the other films, they were released 6 months after the film was released in theaters, which pushes the release date out until May. I really hope I'm wrong on this and you people are right. I'm looking forward to getting my hands on the DVD!"
1,What a dirty trick,"Ran into Bestbuy today grabbed the first DVD of Potter I saw. Got home, it was one disc no special features. Why not just make one edition like with all the other Potter movies? What a dirty rotten trick pulled by Warner Brothers. (...)"
2,BIG Disappointment,"I was expecting the extended editions just like the first 2 movies. Now I am sorry I bought 3 and 4, they are the same as the movies I already own."
1,Another crappy rush job!,This whole film is just too rushed and it left out too much story from the wonderful book and it keeps the continuity errors from the third film. It and the third film only deserve one star for some good acting. My suggestion is that you stick with the book series and the first two films.
4,Sin escenas adicionales,"Al igual que en las ultimate edition de HP 1 y 2, esperaba encontrar escenas extendidas en HP 3 y 4 ultimate edition...Fue una decepcin darme cuenta que no venan escenas adicionales."
2,Not very different from upscaled DVD,Harry Potter and the Goblet of Fire [Blu-ray]It is hard to believe that this was not just an upscaled version of the standard DVD which I have also have. There does not seem to be any extra detail.
1,Betrayed,If you are a fan of the book do not watch this movie. They have turned what may be the best book of the series into an amusement park ride - all flash and no substance. As the books evolve J K Rowling has targeted an older and more mature audience. This movie targets the mindless.
3,Meh. It's ok.,"Great special effects in the dragon fight, lake, and maze. The movie's shot really darkly, and the differences between Harry and everyone else seem just a little contrived and over the top.On balance, it's just about an ""OK"" movie. The special effects were very well done."
2,Sub Par for a long term Potter fan,"I, Sir Charles Butterweight, am dismayed and perplexed before this latest installment in the once delectable Harry Potter series. I shall accord the directors a chance to redeem themselves in the next opus, although I feel compelled to state now that if it is anywhere near as bad as this one, it will definetly count the last for old Charlie boy."
2,"WAIT TO RELEASE ON ""BLU-RAY"" DVD"" BY SUMMER!!","All new and old titles going to comes out in ""BLU-RAY"" this summer! If u DVD collector like I am Then stop buying any DVDs, Just rent instead for now!!. I Owen over thousand DVDs in pass 10 years and STOP buying DVDS since DEC/05 ...Because all old and new titles going release on ""BLU-RAY"" & hit store this summer! Then start buying DVDS again like I will do. Included this movie ...U get crystal clear picture and sound. I stopped buying any DVDS for while now!! I guess better wait then be sorry!!!"
1,one star is WAY too good. -10 is more like it.,"Harry Potter is entirly overrated. The movies are horrible, and the books are really quite shallow and uninteresting. What concerns me is the amount of evil things, gore, and even bad examples being set by the characters. (I'm Harry, and I'm going to pout over little things and blow up in incredibly immature tantrums.)Harry Potter is just horrible. Don't buy it. Don't even think about it."
1,were we all watching the same movie?,"I thought this was a lame excuse for a HP movie! I realize the book was quite long, and this could have made for a long, long movie, but there was so much left out that several times I felt that I had come in in the middle of something. Had I not read the book I wouldn't have really understood many things that were going on, and then there are the plot lines that weren't followed UP! I am afraid, in this case, ""Potter Stinks"" is the correct slogan. Aside from the usual excellent performances by all the cast, it was a couple of hours wasted. Back to the wonderful book!!!!"
4,Great Continuation!,"I'll start by saying that I loved this movie. So, why four stars?There was quite a bit left out that was in the book. While I understand that material had to be left out due to the length, it was a shame to have cut out S.P.E.W.!Also, while the actor who played Voldemort is very good and fit the role, I would have prefered to see Rowan Atkinson as Voldemort. (There was a rumor going around that he had been cast in the role, and I think he would have brought so much more to it.)Other than those small issues though, they did a wonderful job with the fourth Harry Potter installment. I can hardly wait for ""Order of the Phoenix!"""
2,"picture/manufacturing quality is lacking, pixelation problems abound","While everyone else is talking about the direction and editing of this movie, has anyone noticed that the picture quality on DVD is much worse than you would expect from a blockbuster. I expect that they cut costs in manufacturing. I remember when everyone was saying the DVD/CD was the greatest next thing because it would not break and could store vast amounts of information. There was poor picture quality and pixelation the first time through on this Harry Potter 4 DVD. Its like guns, guns don't kill people, people kill people. In this case, poor DVDs don't make pixelation; manufacturers who won't make quality DVDS make pixelation problems. Shame on them!"
3,Underwhelmed,"I left the theatre feeling like the goblet was half full. Passable but not memorable. I hope the movies aren't losing it, while the books are putting it all together. Make 5 & 6 fast."
2,TOTAL CRAP-WORST OF THEM ALL,"THE PACING OF THIS FILM IS JUST AWFUL, THE CHANGE OF DIRECTORFOR THIS ONE, IN MY OPINION WAS A BAD MOVE. IF YOU ARE A POTTER FAN YOU WILL PROBABLY LOVE IT."
1,Enough Chumps Will Buy It Anyway,"Goblet of Fire, the movie, is an unacceptable hash. Sure, the original is a long book. Did the mercenaries running this franchise think perhaps to make it into two movies and sell them both? I understand that a film adaptation of a novel is an adaptation, not a copy in another medium, but it must still be a finished work in its own right. GOFtm is so disjoint and illogical and the progress through it so unmotivated that a fair amount of what happens in it makes no sense. It would be a complete waste of money even if the book did not exist. This is not a film but an insult. Slapdash, haphazard, chopped up exploitation. The cinematic equivalent of a Barbie doll."
3,"Boring, but must-have for HP fans","This wasn't a bad film. It wasn't a good film, either. I knew they'd have to leave out most of the book, so that's not what disappointed me. The tournament was boring! They spent so much time on Harry getting chased by a dragon outside of the tournament area (unseen by the crowds, and not part of the book), that they had to short-change the rest of the tourney. Not worth watching a second time, but if you're collecting the films and the books, you need this. I also bought the first DVD I saw, and it had NO extras. Not a conversation, not a deleted scene, nothing.I wish they had done two films, and had Harry's family and the Quidditch game on a separate disk just for fun.Like I said, not the worst film in the world, but not a good film either. And is Daniel Radcliffe short? It looked like he was lots shorter than anyone else in the film."
4,Not bad...Not bad at all.,"AJB...I don't where you got your DVD that is under 2 hours, but mine is 157 minutes (2 hours 37 minutes)...exactly like it was it the cinema, that aside, good movie. On par with the rest of the films."
5,Great movie even after reading the book,"These movies only get better, as do the books. The only reason to be disappointed is if you read the book first and actually expected them to put all that detail in the movie. That would make it a what? 8-10 hour movie? No thanks. My daughter and I both read the book before hand and thought the movie was awesome. If your the type that becomes disappointed in movies after reading the book, then wait until the movie comes out and watch it first. The books can only get better."
5,Worth the money,Even those who are not die-hard Harry Potter fans will like the Goblet of Fire. I wasn't a DHHPF and I thought the movie was great. Now I'm hooked.
4,It's great!!!,This movie was great and I like it. This movie scene was excellent. This movie was another big hit for Harry Potter series. I enjoyed the movie.
5,Enjoy the entire film series!!,"I have some of the films on HD-DVD as well, but there is no differnece in quality between the two. Great film!!"
2,Read the book skip the movie.,I would have liked this movie if I hadn't read the book first. The first 3 movies did some justice to the books. This one followed none of the fun story lines and couldn't because of time contraints. The story wasn't 100% all about the contest and the ball. They show a hint of the reporter and her lies but what Hermoine does to her in the end and how she got her scoops that is the real fun part. This movie was all about eye candy graphics and time contraints. I suggest you watch the movie before you read the book (if your interested in the potter movie series) But my ultimate suggestion is Read the book skip the movie.
3,It was okay...,"This movie has great effects and it is chop full of action, but honestly as the movies progress the acting gets worse, a couple examples: Emma Watson as Hermione yelling at Harry ""I'm not an owl!"" please.. and Daniel Radcliffe's really bad crying job when he comes back from the graveyard with Cederic's body.. don't get my wrong i am a huge harry potter fan but this movie and the acting just didn't cut it for me."
3,Flawed but entertaining,"This movie was the most empty of all four films so far. I did not like Newell's direction at all. I'm not sure he ""gets"" the Harry Potter universe. The fourth book has so much depth to offer a story line, yet Newell missed it completely. The movie is nothing but special effects and people moving from point a to point b.I understand the book was very long, but this film lacked serious relationship and interaction between the characters.Its a shame that these films cannot be produced fast enough to keep up with the maturing cast. The actors are already too old for the roles.Very disappointed in this film and the direction.Having said that, it should be enjoyable for fans of the series, and there's enough in here to keep attention - simply because the film moves at such pace.If you'll like Harry Potter you'll like this one, but if not then it won't help convert you."
3,The low price 1 disk only has the movie. No features. Doh!,I got the regular widescreen by mistake. I really wanted the special features and there are NONE on the one disk set!!! Doh!
2,"Should have been exciting, ended up boring",I found the book to be incredibly exciting and I assumed that all that entertainment would translate easily to film. I guess not!It wasn't until I tried to watch the movie on DVD after seeing it the theaters opening night that I realized how very boring the movie is. I have been unable to watch it all the way through a 2nd time.
2,not nearly as good as 3,"Come on! The character development was terrible, and the cast poorly directed. All one has to do is compare this film to the previous one to know that is far under par"
3,Disappointed in DVD,"I bought this DVD, not realizing that there was also a deluxe two disk set (we've never had these options in the past). I and my children were very disappointed to find that this DVD is just the movie (which we had seen at the theater). We had been looking forward to the deleted scenes, interviews, and interactive features. Obviously, we loved the movie itself, or would not have bought this one. Just beware that this is movie only with NO EXTRAS."
2,Disappointed,"I was very disappointed that when ordering, nothing was said about there being another version, the 2 disk version, with all the extras. That's what I usually get the Harry Potter DVD's for. Especially the deleted scenes. Being incapacitated by surgery at the moment, I can't begin to tell you how let down I was when I got this DVD, only to find out that I spent my money on something I didn't really want. The movie, itself, is great, but I've seen it in the theatre already. Amazon needs to be more specific with their pre order information."
2,MAD MAD MAD,Has anyone else noticed that there have been scenes left out of the DVD that were shown in the theater??? Like when Harry was falling asleep in divination and he saw the ladybug? Or the scene after he finds Barty Crouch passed out? There is a lot missing in this movie and my friend just got the 2 disc version and they aren't in her movie either. Maybe they are in her deleted scenes but THEY WEREN'T DELETED!!! What happened to 15 minutes of my movie. RUNNING TIME IN THEATER: about 170 minutes; RUNNING TIME ON DVD: 157 minutes..... you do the math!
5,Harry Potter and the Goblet of Fire,Wonderful addition to the Harry Potter series... I cant wait until the next one comes out... I will be one of those people waiting in line when the last book is released....
3,This one let us down a little,"OK, you can't compress War and Peace into a 2-hour film. But a little of the World Cup could have been pressed in, surely no one would have complained. And there's no excuse for turning Harry's beautiful finessing, all in front of a rapt & gasping crowd, of the broody Horntail into just another wreckage-strewn chase scene - certainly it saved no time.Moody: Gleeson doesn't quite fill Mad-Eye's boots, seems tempted to ham it up a little. For me, Moody's less flamboyant, more hard-bitten, harsher featured.Voldemort: Ralph Fiennes, a fine actor, is sort of wasted in such a one-dimensional role. Not his fault, but whence all the accolades?Still, a good film in other respects, very watchable; just, given the material, not as good as it should have been and in that regard (for me), the least of the four."
5,very good,"he loved it, its played perfect, what else is there to say. he has probably played it 50 times and it still plays perfect"
2,Poor streaming video quality,"This was my first amazon instant video purchase and if this is the level of quality I can expect then I'll stick with Netflix. The video was supposed to be HD and the on-screen menu indicated I had the bandwidth for a ""high quality"" stream but any dark scenes (which there's a lot of in Harry Potter movies) were splotchy with muddled colors. I use Netflix on the same PS3/internet connection and never have issues like this.The movie itself is good but the poor streaming video quality made it almost unwatchable."
4,Must read in every young person life as a prelude to Lord of the Ring Trilogy..,Reading it at 35 years later and after the LOT movies is just not as intense. Don't think Hobbit should be made into 3 movies. LOT trilogy is my favorite of all time. HOBBIT is more mundane.
3,The Hobbit in Review,"The Hobbit is a book about and hobbit named Bilbo and 13 dwarves. The dwarves take Bilbo on an adventure to regain their treasure that was stolen by a talking dragon. On the way Bilbo and the dwarves run into goblins, trolls and elves. All three of these creatures capture them but they end up escaping. They meet a man who can change into a bear and the Lord of the Eagles. They finally make it to the mountain where the dragon lives. The dragon is killed by a guy from lake town and the dwarves with Bilbo reclaim the treasure. A couple of days later every person who knew about the treasure was there to take the treasure. They a have the Battle of Five Armies and the dwarves keep their gold. Bilbo goes home and lives the rest of his days in his hole."
2,Gaak!,"Friends kept badgering me to read this book and I finally gave in. It was so-so for the first fifty pages, but after that point I felt as if I was slogging through mud. Get to the friggin' mountain already, Bilbo! The Hobbit is little more than a high-falutin' fairy tale with a cheap ending. I feel sorry for anyone who believes it to be ""the greatest book ever written"" (see other reviews). Truly, you need to widen your reading experience."
2,Unsatisfying!,"This book is a shame because J.R.R. Tolkien writes very well; but the topic is not interesting at all. How can you expect one to read about dwarves fighting a dragon, dwarves going to war with elves, 'Wood-elves' imprisoning dwarves?, or the evil, horrible 'Wargs'!? You can either like or dislike a book like this."
1,Waste of time and money,"Horrible audio, terrible voices, vast majority of the book was left completely out of the production. Please fine a better one"
