class_index,review_title,review_text
1,"Cliched, derivative, passable","Eragon is a fantasy novel written by Christopher Paolini. He started when he was fifteen, and finished when he was nineteen, which is truly a noteworthy accomplishment. This book has been hailed as a phenomenon, and has become an international bestseller. But honestly, I wrack my brain trying to understand how and why. For those who have read and love Eragon, I hope you become exposed to real fantasy and science fiction soon. For those of you who haven't read this, let me make a suggestion: read Lord of the Rings, and watch the original Star Wars trilogy. You'll know all you need to know about Eragon, and you'll save your money."
1,"An awful, awful book","This is probably the worst book I have ever read. It left me lukewarm towards the characters, not really caring whether they lived or died. The plot was slow and predictable, with parts taken almost directly from other popular pieces of liturature. The writing was atrocious. I could not even finish this book, that's how bad it was. I can not imagine why anyone would like this. Sorely disapointed."
3,Okay but immature writing,"The bottom line is that this book was written by a fifteen-year-old and has the immature style that is to be expected from someone so young. The book has potential, but there are all those niggling details to take care of. I see that it was published by his parent's publishing company, which explains a lot. I don't think a major publishing house would have touched it without major editing. It is way to early to be comparing this kid to Tolkien, Eddings, or Jordan, but I think Paolini has promise and I look forward to what he will be writing in the future as his style matures."
2,Needs works,"I picked up this book based on some of the hype generated around Paolini. While I have to agree with some of the other reviews regarding the writing style and the portions of the story which are influenced from some very geat Authors. Even though Paolini has taken plot lines from other Authors I will wait to see where these stories end up. I don't want to trash his first effort completely and look forward to seeing what the next volume has in store. Hopefully, the editing issues can be resolved by then."
3,Not Very Original,"I first bought this book when all the hype started about its young author self-publishing his first book while still a teenager. I didn't like it; in fact, I never finished the novel and gave to a friend -- who also didn't particularly like the novel, but finished it anyway. First, it was very poorly written. You can tell a teenager with little life experience wrote the novel. Second, The dialogue is stilted and immature at the same time. Third, The characters are very two dimensional, and there is nothing original in this novel. The writers pulls from many sources: Tolkien (of course, who doesn't), Robert Jordan, Anne McCaffrey, and Terry Brooks among them. So why did I come back to it and give the story 3 stars? I enjoyed the audio version. Gerard Doyle rises above some of the bad dialogue and gives each character a voice of his or her own; and by the end of the story I find myself interested enough to listen to the next novel, again read by Gerard Doyle."
4,A great book to read with my boys.,"I enjoyed reading Eragon. Now I am reading it to my 3 boys. I was constantly amazed that it was written by someone who was so young. I was captivated by each page and I could not wait to find out what happened next. My boys love sword fighting, dragons, magic and heros and they love Eragon. We are looking forward to the next book.Larna"
1,"Um actually, Eng's right","Eragon does suck and Dragons: Lexicon Triumvirate is much better. Had any of you actually read both books, you would see what I mean. Hell, why even read them? I'm 10 and just by looking at the concepts, I can tell that Eng beats Paolini."
1,Ewww I dont even have to read it,"I wish he came up with better ideas, too much like Lord of the Rings and Star Wars. I understand taking elements, but taking the same entire story is pretty terrible and another thing. This book is like taking a paper bag, and turning it inside out, it appears different, still a paperbag, but what they have in common is that you can wipe your ass with them. :-)"
2,Not memorable for many adult readers,"Christopher Paolini did an amazing job to write this book at the age of 17. However, the imagination and originality of Eragon is lacking. It seems as if the plot is derived from a mixture of a number of past fantasy novels. Overall, the plot contains trite ideas and themes. Character development, and especially emotional development, are areas that are weak. It is a fairly good book, especially for younger readers, but there is not much substance and originality to make it memorable for older readers."
2,Agreeing with B. Capossere's review ...,"I agree with B. Capossere's lengthy and thoughtful review. This was a 17-year-old fantasy book written by a 17-year-old. My 12-year-old son loved it, and that is to be expected. But where was Paolini's editor? For my part, I felt like the work jerked me back-and-forth, as the author would run deep for a bit, then shallow, then back and forth. While I enjoyed the story as a reflection -- as Capossere points out -- of greater fantasy writers, with some tighter editing, this could have been even better.Still, hurrah for Paolini for self-publishing and believing in his work enough to see it through! I'll look forward to reading his works in 10 years or so ...."
2,hard to understand,"I'm a very good reader. I read the fifth Harry Potter book in two days (like 900+ pages). This book took me about a month to read B/C it had a lot of unnecessary detail and probably could have been written much better in about 300 pages. I'm not surprised that lots of other kids like this book, it was sorta fun and exciting (key word: sorta). The other main reason I didn't enjoy this book was because so much of it was copied from LOTR, which I read also. I don't think Christopher Paolini meant to copy certain parts of the book, but that's not really much of an excuse. There's too much plagarism for it to have been ""Subconsious""DON'T READ UNLESS YOU'RE A FANTASY FANATIC AND DON'T CARE ABOUT PLAGARISM OR ARE LESS THAN 13 YEARS OLD!!!!!!!"
2,Not too great,"this book is a major acomplishment for a 15-16 year old, but so much stuff is ripped off of LOTR. It's really predictable and you can see what will happen chapters early if you are 13+ years old. what really bugs me is that Paolini describes EVERY SINGLE THING in the book. i mean, do we really NEED to know what all the unimportant characters look like with so much choppy detail??? also, sometimes the characters speak like it's Middle Earth, and sometimes they speak like it's Today."
1,"Ah, youth.","Amazing? The best book ever? Incredibble [sic] writing? Ahhh...to be young and stupid again! These youngsters will probably be ashamed to remember their bright-eyed, glowing praise for what is not even a sub-par fantasy knockoff when they get older and discover real fantasy. I read this to my kid. I was ashamed to have finished the book, even in that capacity. He lost interest about 1/2 way through--I lost it much earlier. I guess you can't blame the kids for their poor taste. I listened to the Monkees when I was younger ;-) Consider ""Eragon"" the Monkees of fantasy novels....it looks pretty but their isn't much there when you actually stop and pay attention to it."
2,"not bad, not great","Alas, having been steeped in Tolkien and CS Lewis, I have extremely high standards. This book is not bad, and kudos for the author being so young, but I was not personally thrilled. I shall read the sequel but I went ahead and gave ""Eregon"" away."
3,Names and Events,"I have this book and while it is a good read I have to agree with B. Capossere's review of the book. While reading this book, I also saw the comparisons with Star Wars and the Lord of the Rings. For example, take the title of the book, ERAGON. If you've read the Lord of the Rings or seen the movie, you can definitely see the link to Tolkien. As for the Star Wars link, that goes into more of the plot of the book but again, it is defnitely apparent. I also saw a link to Dungeons and Dragons while reading. The story is different but the names are taken on the basis of other works and I think that even for a 17 year old, there should be more imagination in the world created. Would the story have lost it's appeal if different names were used? I don't think so. But it is a let down in the imagination aspect when similar names and events are used because your mind automatically goes to the other stories."
2,To put it more succinctly.....,"There is nothing innovative in this book. What was innovative of Tolkien, LeGuin, and Mcaffrey has been regurgitated in Eragon. It is remarkably well done for a teenager's mimicry of greater works, but will remain just that. Mimicry. Two stars instead of one because it was readable."
1,does NOT own his own company!,"Look, I don't really like Eragon, but I would like to clear some thing up. A lot of reviewers have dissed Paolini becuase supposedly his parents ""owned their own publishing company."" Well that is FALSE. His parents self published some books of their own, and they helped him self publish Eragon, but the key here is SELF-PUBLISHED. While I don't personally like the book (too cliche for me) I have to give him a hand for how he marketed it. Paolini did it the good old American way by publishing the book himself and then fighting tooth and nail to get people to buy it, by traveling the country, giving his own lectures in libraries and schools, and trying to sell it himself in bookstores. To make a long story short, he worked hard to get Eragon picked up by a traditional publishing company, so whether you liked the book or not, stop giving him a hard time for something that is not accurate."
1,"Am I expecting too much? Nope, not at all","Cliche, ripoff, no use of the word said, it's all been said why this book is crap.All right, there's lots of cliched pulp fantasy out there, but at least these mediocre books accept what they are. If you'll check out Paolini's website, you'll see the arrogance he's developed from writing a mediocre pulp fantasy book that thinks it's going to be a classic."
4,Promising but an amalgamation of cliche.,"Hmmm. I liked this series. It is good, well written which is a surprise because paolini was 16 when he wrote eragon. There is a good plot, mysterious characters, questionable allies, horrifiying enemies, elves, dwarves and ... dragons.which basically meanis that paolini hit every cliche in the fantast genre.Not only that but the gedwey ignasia ( is that how it is written) is reminiscent of Edding's Garion and the white mark on his palm. The dragon is reminiscent of the dragons of McCaffrey's Pern. Even the jokes in later books(though subtle) are sometimes reminiscent of Eddings.not one original thought. (again not surprising - remember sixteen). Still, the plot is promising and I hope that Paolini develop his story better. As a matter I have just read the second book and I know for a fact that the story does develop more maturely.Way to go Christopher."
3,tipos,save your money and buy a paperback c op y that isn't full oft ypos ]:=$ wow. do somethingabowt it
5,Duncan,Anyone who dosen't like Eragon has a bad taste for books. The best book in the world is this book. The first thing I couldn't belive was it was writen by a seventeen year old!
5,Good,This book is really good. I like it alot and I don't get why everyone else doesn't. I say read this book and don't listen to the other people.
4,young author writes great story,"If you love McCaffery's Pern books then you will probably enjoy this series too (2nd book is out already). Author wrote this book at 15, second at 19, can't wait for next book to come out."
5,Awesome read,"This was a really great book. It shouldn't matter how old the author was when it was written. All that matters is that is was a good book, and the rest of the series is as well."
5,Audio Book purchase - Eragon,The book is excellent. We live way out of town and it's nice to have something like this. It stirs the imagination of my children and shows them that books can be exciting. The service I receive through Amazon.com has always been excellent.
2,Ergaon...uh oh,"Christoper Paolini graduated from high school at the age of 15 and in my opinion he should have waited a good deal longer to write Eragon. See, Eragon is not that bad of a idea just poorly executed. The writing falls flat on all facets and in my opinion cant compete with the likes of Robert Jordan, CS Lewis, and even JK Rowling. Considering how many people dislike his book I would not be suprised to find his next book, Eldest to be a real jaw dropper. Critiscm only makes you stronger and Paolini is gonna need alot of it to succeed in this biz. All told Eragon is Poor, unorginal with flat bordering on boring writing. If your new to the genre or 14 and younger I could reccomend it (but I wont). Bottom Line: Wait and see how Eldest is before you try Eragon."
3,"Good, but...","It started off well, but the ending took a bit longer to get to than I expected. There was great tension building up until the last 1/4 of the book and than when the final conflict came I thought ""Finally! We've reached the end!"" Still, I though the book was well done, with a good history, backstory, mystery, and adventure all rolled into one. I'm expecting the next book, Eldest, will have all the good points of the first, with none of the flaws of the first."
2,Cliche,"The plot of this book is the classic coming-of-age story (with dragons, albeit) that one sees in works such as Harry Potter and Star Wars. You can basically cross out the character names from synopses of those and replace them with the character names from Eragon. The story line is classic, but this book doesn't even bring any interesting twists to it.The characters are archetypes, with no personality quirks that would have made them actually interesting.If the author was given an assignment to write a book based on this classic story type, this would have been an admirable response. As it is, it's mind-numbingly boring. It's amazing for a book written by a fifteen-year-old, but it's still not very interesting."
2,Long winded any one,"When I was a little kid, I started and read this book, and I found it quite good, then I read decent fantasy novels. This book is so immensity long winded that if you cut it down to important details, it would have been maybe thirty pages. In addition to having a paper thin plot that anyone could guess the ""twists"" the author blatantly rips off other authors and works as opposed to creating his own ideas. The ancient language is Latin and dwarves speak german! Urgales are simply orcs. All of the characters are shallow and make nothing but one terrible decision after another. Also, the magic users in this book are super weak and whinny ""oh, I can't heal him easily, it a paper cut, better draw on my magic reserves!"" seriously, this book is nearly as bad as Harry Potter. Don't waste your time on this book if you can read above a third grade level."
3,Good book but,"I liked this book a lot, it really managed to get me hooked. Of course, sometimes you'll get a little deja vu and think, ""I've seen this before"". Yes, many parts in the book seem to resemble Star Wars and LOTR."
2,Disappointing,"I purchased this relatively unknown book due, in part, to the positive reviews on Amazon. I was misled. As an avid reader, this book was underdeveloped and poorly written. The numerous typos are distracting and the characters lack depth. I forced myself to read the book, hoping it would improve but it did not. Save your money do not buy this book."
1,Not another one (groan),"Not another ""this is a children's book, so don't criticize it"" reviewer. Wendelin Van Fan, here's some stuff for you.Wendelin said that criticizing Eragon is like ""13 year olds criticizing Berenstein Bears."" First off, how do you know the ages of the reviewers? Many of them are in fact ""young adults"". I'm sixteen and I know a crappy, cliched book when I see it.Second, Paolini obviously didn't mean for Eragon to be as immature as you think it is. His own website shows his pretentiousness in quotes like ""I strive for a lyrical beauty somewhere between Tolkien at his best and Seamus Heaney's translation of Beowulf."" He's comparing his own work to established classics, so why shouldn't we do the same? Face it. Eragon's not a decent children's book. It's a poorly written adult book and anyone, no matter how old he or she is, has the right to criticize it."
4,Still A Pretty Cool Book,"A lot of people say that Eragon is formulaic and stupid, and to a point I agree. A lot of the plot seems straight from a ""How To Write A Fantasy Coming-Of-Age Epic Story"" guide, but even so, I say the book is well-written, at least. I have read other books by people this age, and Eragon definately sounds the most mature, by far. My only real critique is that Eragon seems to become unconscious in almost every chapter of this book. So, I guess I would call it: good, but with flawed moments.Still, you have to admit it sounds a lot better than most teenagers' writing (I would know, I am one). And yes, I am going to buy Eldest when it comes out. (Sigh) I guess I sold out to The Man."
5,Eragon (Great new book),"Of all the books I read last year this one was the most exciting. The only 3 to come close were by some pretty famous authors like Melanie Rawn, John Marco, and Robert Jordan. The difference was this book was just so hard for me to put down that I read it in just 3 evenings. I would highly recommend this book to anyone looking for a little something new!"
2,Disappointing,"You can tell this book was written by a kid. I've found it very dull reading, and can't imagine why it's sold so many copies. Maybe it's the novelty of it having been written by a home-schooled kid, because it certainly isn't the gripping narrative. Nothing happens in this book for pages and pages. And the emotions that Eragon expresses; well, as I said, you can tell it was written by a kid because there's just no sophistication to the language or story telling. You'd be better off reading the Artemis Fowl series (fun and funny), of if you're older, the His Dark Materials series (sophisticated and thoughtprovoking)."
1,not very good,"Christopher is trying to create an elabrate world of destiny, magic, and dragons, the cover and introduction looked cool but the text was the corniest thing ever! cornier than any sitcom i've ever seen!!! i mean it had unneccasary chapters and stupid magic, no offense chris i appreciate the effort. If you (reader) think it looks good read it: opinions are like armpits everyone has and they all stink"
1,A REAL STINKER,Eragon is a total joke. I'm like the only one I know who finished it. Most of my friends tossed theirs. Does any character do anything it makes sense on it? Stupid. Stupid. Stupid. Stupid. Stupid. Stupid.
1,Stick to Harry Potter,"Want original fantasy that is interesting, new, and fun to read? Steer clear of this book. I suggest Terry Brooks' original ""Sword of Shanarra"" series. It is not high fantasy but it's better than this rip-off. Ech. I had to take a shower once I finally finished it. Boy am I glad I borrowed and did not buy this stinker!!"
4,The book that changed my view of reading!,"When I first picked up Eragon I said to myself, ""This is a big book. I'll never be able to finish it."" And so I picked up the book, sat on my bed and started to read. It was like a whole new adventure with every changing chapter that I got through reading. The book would calm down for a chapter and then suddenly new people would come to life and appear in the story. I could not believe it. I was half way through the book! Now I have started on the second book and I can't wait to finish it so I can go on to the next adventure.I rate this magnificent book 4,1/2 stars. Go to the closest library and get this book! NOW!!"
4,A great first novel and beginning to a series with alot of potential!,"This book was awesome from start to finish...paced very well, written very well, and a great plot. Unfortunately the movie butchered it, like most movies usually do. A great read!"
2,Familiar characters,"One word best describes this book: Derivative. The author didn't have to do very much description of his fantasy world because all the players were ""borrowed"" from other authors' worlds --- especially Tolkien's. Paolini didn't have to explain the relationship between elves & humans & dwarves, since Tolkien fans already know all that. Fine; it's fan-fiction. But I was very disappointed that Paolini didn't give Tolkien a mention in his Acknowledgements section.Paolini even tried to mimic LotR by including some ""translated"" elvish poetry. That was by far the most embarrassing part of this book. Prose was stilted (really needed some professional editing), but the poetry was just . . . awful. Glad it was only attempted once.Despite the book's flaws, I did enjoy the story line, and did read the book all the way through. I may even borrow a copy of ""The Eldest"" when it comes out. But I would not pay money for it."
5,"Harry Potter for kids, Eragon for teens!","A book you don't want to put down once you get going and one that you'll want to read many times, each time something you didn't notice comes to life and you love it even more. Few books can do that do you, and this one did to me. Like Harry in Harry Potter Eragon is thrown into an andventure that will change him and the world he lives in. However, it is much more mature with our man character already becoming a young adult with bloody fights and battles."
3,Eragon,"This is a good book for people who like fantasies. However, it is very long. Some of the fantasy parts were incorrect. Magic does not come from dragons and it can be learned by anyone who wants to learn it. Also dragons can be both good or evil and none of the dragons were evil. Eragon and company made a great team, even though they still had there differences. Overall this could have been a better book."
5,I LOVED this book!!!,"I absolutely adore this book! I didn't want it to end (that's saying something cuz it sure is long)! The charcters are very developed. I felt like I knew Eragon and Saphira. At the end, my stomach was in knot from the excitement and suspense. Paolini creates a world that feels very real. It has a history, laws, and many different races of creatures. Don't pass this book up!"
1,Borderline Plagiaristic,Eragon is a fluffy version of Lord of the Rings or the Wheel of Time. It shouldn't have been published.I recommend reading The Golden Compass by Philip Pullman instead of Eragon. It is much deeper and much more original.
3,Eragon Book,"The first time it was shipped, it was damaged because of poor packaging. But, I sent it back and the second time you sent it priority and it was packaged very well. However, it is a lot of trouble to have to send it back and wait and wonder if the next shipment is going to be okay."
4,Awsome Book,I recommend this book to anyone who loves fantasy and suspence all in one book. although it had some slow parts the ending was great and i cant wait to read the next book.
3,Eragon,"Whew! It's generally not a good sign when it takes me longer than a week to plow through a book, especially when it's not terribly long. Paolini has a beautiful writing style and has the most detailed descriptions which, as a writer, I appreciate greatly, but as a reader bored me to no end. The story and characters themselves were captivating, inviting, and interesting, and made you want to read, but the overly lengthy descriptions and explosion of unnecessary details seemed to swallow the interest and the pleasure in reading it. Eragon is an excellently written novel in its own right, and my rating is not at all judged on Paolini's talent as an author-it's just judged on the ""enjoyability"" level the reader can gain from this novel as a whole, which was only so-so on my scale.Read the specifics?[...]~Thalia Anderson"
4,Very Excellent...A new Fave...just a little unoriginal,"ERAGON has joined my favorites shelf for a long time. I truly enjoyed the story, which, yes was a bit like Star Wars and Tolkien and Anne McAffrey...but then, what books aren't? I mean, how many books have you read that changes the, say, elves from Tolkien's traditional silver-haired, long-living graceful creatures to anything else? The public just wouldn't accept it.Despite the resemblence to Tolkien and the names, which were, yes, very much like those of the LOTR's, I really loved this book. The story keeps you reading, and in fact, my only complaint about the actually narration and the events is that Eragon tends to black out way too much. I felt like every other chapter began with ""as Eragon blinked and opened his eyes..."" or ended with ""and suddenly it all went black.""Otherwise, a highly entertaining read...I attribute the ""copycatting"" of other authors as just a sort of respect andlooking-up-to to them. Please read! I highly reccomend it!"
4,Good but needs some work,"I thought that the novel was, on the whole, an entertaining read. Although the author clearly mixed the plots of Star Wars and Lord of the Rings, he did it in such a way that I was still wondering what would happen next. I am extremely interested in reading 4th book."
