class_index,review_title,review_text
3,A Wonderful Book But...,"These are wonderful interviews by Tom Brokaw. And they give you a sense of pride in our country. But ""The Greatest Generation""? In Vietnam, the soldiers were fighting in the dark, They didn't know why they were fighting (this generation did) and the people at home were against them. But they fought brillantly under the most horrendous circumstances. I have a friend who received 2 silver stars, 6 bronze stars, 2 purple hearts (face and leg) and 2 commendations. He was a green beret. He is not considered a hero by the citizens of the United States. A wonderful book, Tom. But come down to earth. The greatest generation was those who fought in Nam. It's easy to fight when you are right. But not so easy to fight in the dark. END"
2,TV scripts don't always make good books,"There are some touching chapters in this book, but overall, some of the material was less-than-gripping. As I read this book, I could imagine the text as part of a TV news story script complete with old pictures, natural sound, some long pauses in the piece as the camera pushes in or pulls out on the shot. Coupled with the video, these chapters would be powerful. Without the video, they read a bit on the dull side. I can't argue with these people being called the greatest generation but I would argue with those that claim this book as the greatest tribute to the greatest generation"
1,Now we know why he is a newscaster,"Brokaw delivers a lightweight, sketchy, collection of interviews with World War Two vets, which unfortunately has made him a lot of money and spawned equally mediocre sequels.There are an infinite number of far superior books covering the same ground."
1,Contains Transfats,The nutritional information on the packages I got do not match what is on the website here. Each bag has 4g of trans fats. Why the discrepancy? Why do they need to add that to sunflower kernels?
4,Golden Dawn - Updated for our times,"The Golden Dawn by Israel Regardie updated by the Ciceros is a very complete edition. It is a hard read, only because of the detail and sheer volume of information. But it is very illuminating."
4,"Good foundational book, but not everything!","I read this when i was completley new to the golden dawn studies. I would have to say the golden dawn is a really indepth studied, and wouldn't have anyone read these book just out of sheer interests. This book gives a good foundation, but going on to reading the more advanced and classic books by isreal regardie,alister crowler, and Mathers, this book cant tell you the half of it. A good read, but the golden dawn is extrmeley confusing to those unfamiliar!"
3,Just to clarify,"Chic and Sandra Tabatha Cicero have provided the magical community with a wealth of information on practical magic and especially the Golden Dawn system of magic. I have found more than a few of their books helpful. I think that our dear reader from Puyallup, WA is probably just a very devoted member of his or her Order, but his or her views aren't those of the Order as a WHOLE. I think it's pretty safe to say that ANY book by Chic and Sandra Tabatha Cicero would be good to have as a reference book, regardless of whether you belong to a Golden Dawn Order or not."
3,"Does what it says, but isn't inspired or inspiring","Having just finished this book I found it to be a very introductory thesis on the Golden Dawn. It left me wanting.The background on Hermeticism, the first part of the book, is the best part. It's a consise overview of the Western Mystical Tradition.The history of the GD was brief and painless but not new or enlightening.The overview of the work of the GD covers only the introductory grades and is brief. If you're at all familiar with the subject, you'll find it to be a dull retelling of what so many other authors have already revealed.All told the book does what it set out to do - give a boiled down explanation of this influential group. But it looks at it from so many angles, so briefly, that it can only offer the most superficial treatment of each part. This translates into a very superficial appreciation for the GD.Readers with any familiarity with the subject will be dissapointed. Readers without any foreknowledge may wonder what's the point."
5,The teachings and basics of the Golden Dawn belief system,"""The Golden Dawn"" is one of the most respected systems of magic in the world: over a century old, it has its roots in long-reaching traditions. The Essential Golden Dawn is a beginner's guide geared for newcomers to Golden Dawn. The Essential Golden Dawn is written by experts on the topic and explores both the history and the spirituality of this tradition, explaining ideas of magic and magical philosophy and exploring the teachings and basics of the Golden Dawn belief system. An outstanding introduction."
2,Problem With Batteries - Beach Audio Renegs on Return,"The first phone went out within 30 days. Got along without it, until the second phone stopped working.Beach Audio instructed me to re-order, and they'd send me a Return Authorization. Then they renegged.I will not do business with Beach Audio again."
2,Problem with handsets taking/holding a charge,"I bought this phone system about 6-7 months ago. I was happy with the performance, but very recently, two of the handsets failed. I thought it was a battery issue, so I replaced the batteries($30). That doesn't seem to have worked, as both of the handsets still won't take a charge. I have an older 2.4Ghz Vtech which has worked fine for the past 4-5 years, but more recent experiences with VTech have turned me off. Look elsewhere for a more reliable phone system."
1,VTech i6775 Review,"Years ago, I had purchased some VTech products and was very displeased with the their quality. At that time, I swore never to buy VTech again.While recently seeking cordless phones with speakerphone options, I came across the i6775. The price was right, and some time had passed, so I bought two sets (home and office) in June, 2006.There's only a three month warranty on these units, and one set recently (11-2006) died. After finally getting through to VTech support and troubleshooting with them, we couldn't revive the system. The phones are useless, and I'm stuck with them.You can guess my advice."
3,Okay,"This seems to be sturdy and nice looking. Don't order this unless you are sure because there is no canceling it. I ordered it by mistake and tried to cancel it minutes later - no go. But all in all, it's worth keeping once you have it."
4,"Very good on preparation and appreciation of tea, would have liked more on the processing","The strengths of this production lie in the detailed instructions for the preparation of various types of tea, mainly Chinese, and the bits and pieces of tea lore imparted in the interviews (although individuals familiar with the world of tea aren't going to learn much new from them--but it does bill itself as an ""introduction"" so no surprise there). The videography is artful and the selection of tea vessels used during the preparation of the various teas is a visual delight. My only real complaint is that the amount of footage of the processing is much less than I expected from reading the promotional blurb. Personally I would have liked to have more material on the processing."
5,Great Tea DVD,"This is one of the most informative DVD's on tea,and how to prepare tea around today I highly recommend it. Benedic Chin"
2,Disappointed...,"I bought this to get better fuel mileage, but didn't get it.It will give you more power, but forget it if you're looking for better economy.Even using hypermile techniques (light foot, coasting as much as possible) there was no change in economy."
4,bose system,"I am really happy with my radio/cd player, it has great sound, and I am not having to go into my daughter's room to use our stereo, which is right below my neighbors' bedroom, the sound quality is perfect, and I definetely have liked everything that I have purchased from Amazon over the years."
3,High standby power consumption,"It's hard to find information on the power consumption of many products, even though the cost of energy can sometimes add up to be more than the purchase price. I found a report on the web from someone who had surveyed ""stanby"" power consumption of all the electronics in his house. This product had one of the highest standby power consumptions: about 6 W. That's when the radio and CD player are off. It's much higher than it needs to be just to run the clock--typical clock radios are 1 to 3 W. I ended up getting the Sony ICF-CD831 instead, which consumes around 1.5 W. Of course, the sound quality (and the price) are much lower so it isn't directly comparable."
1,realllly....,"i dont think this should be listed as ""bullet proof"" or even bb proof. some idiot will get hurt with these.found this while searching for kevlar"
1,never got here,i wouldnt trust the company it never got to my house i thnik the mail man stole it from me!
3,ITS OK,"Alot of pockets, and big SWEAT letters. But all useless. no where to put your pistole, and big pockets..... i don't know what they are for. The mag pouches are ok. big and deep. others... not so much."
1,No. Just No.,"looks cool. Key word people ""looks"" cool, it isn't bullet proof, please don't think it is, or that pockets make you look the part."
2,I don't know why you buy this,"Not comprehensive or outlined or organized. A lot of talk with nothing. Beginer stuff like RSI, MACD and MA are 1/3 of the book, another 1/3 on Dow theory. Charts patterns, nothing in here like projection of target price, failuer rate and trading tactics. You want a good book on price chart patterns. I suggest ""Encyclopedia of Chart Patterns"", Bulkowski."
2,Technical Analysis of stock trends is a tiring book.,"BORING. I started to read about the Dow Theory with old fashioned charts of defunct stocks. There are supplements to the text to bring in modern stocks, but maybe one should retire this book."
1,Tech Analysis is a bunch of BUNK,This book along with all other books and seminars on tech analysis are mere ploys to make the authors wealthy.
5,Excellent Dow Theory Explanation,"Robert Edwards description and analysis of the Dow Theory is, as Professor Bassetti so astutely states on page 48, a ""magisterial presentation"". I am proud to have been asked to add my interpretation to the update since Dr. Edwards death. Believe it or not, the Dow Theory is alive and well in the 21st Century and this book will help you understand why.Jack Schannep"
1,Reprint of a old-edition (1948 ?! ),"The book is the reprint of a old edition date back 1948 with some little update up to 1963. The Amazon's Search-Inside(TM) refer to another update version of the book (9 ed.). The book's style and content is very old, the charts are hand-made and frankly speaking now it's possible to do much better and the calculation of indicators now can be exact. If you are interested to the prehistory of technical analysis a would suggest ""Welles Wilder - New Concepts in Technical Trading Systems"". Modern and better books are those of Achelis and Colby."
2,Project Manager,The book is a reprint of a much older book. Since the original book was written there have been a number of significant advances in computing power and software and this book is very much dated.
5,A must-have,I still havn't finished this but what i have studied has been of great help in identifying chart patterns and warning me off otherwise recommended stocks. This edition in particular seems to be the ultimate edition to own as the later editions get away from the original authors' intentions.
3,"Thorough, slightly boring and expensive","Edwards and Magee is considered one of the bibles of technical analysis. While it covers the basics well (head and shoulders tops, etc.), the shear number of not so well known patterns can be overwhelming. I would doubt most people could (or would) finish this book. It's more of a reference book. John Murphy's Technical Analysis of the Futures Markets is a much better choice. Murphy covers trendlines, patterns, stochastics, Elliot Wave, money management and a host of other technical topics. Don't be fooled by its title -- it's quite applicable to stocks."
4,Technical Analysis of Stock Trends,"Good book, if you really want to learn stock analysis. It gets you thinking for yourself about the movements of stocks. There is no way one can absorb all the information provided within the text. It is a guide and reference for those who want to devote time to stock analysis. I am now more educated on stock trends, but still require the book for periodic refreshers. If you're buying this book for casual reading, find another book. Although very good, this book is very intense and reading it will consume some time. Dedication is required to finish the book, but the potential for success is great, much greater than a lottery ticket."
1,Worst service ever,"The product itself is great, but it came in a plain brown box that didn't even fit the telescope and with part of it sticking out of the box. There were no instructions and no star chart. After 3 months of dealing with this company and filing a complaint with Amazon I am still having trouble with them. I will be reporting them to the Better Business Bureau and today will file another complaint with Amazon. I would never order from this company again."
3,Good children's telescope,"This product was purchased for a five year old's birthday. The knobs and focusing dials are rubber coated and contrasting colors making them very fun to play with. The image quality is good for this range of telescope. Great tripod, sturdy. The map light and lit up dials are a plus for the kids. I would recommend for a first time telescope."
5,Wonderful book,"This book is filled with beautiful pictures that any one would enjoy. I bought it for myself, but my mother ended up with it. The photographs are amazing."
5,Almost impossible photography,"The photographs in this amazing book are not only beautiful, they would have been almost impossible to capture without extreme patience and technical skill. Being a photographer for many years I was amazed to read in the end pages how the images were taken. Using a 4""x5"" camera!To be able to place a subject like a cat in front of a large-format camera which manually needs to be carefully focussed on a ground-glass at the back of the camera, the lens set to the required aperture and shutter speed, lens cocked, the film-holder dark-slide inserted and then, above all, choosing the decisive moment to take the exposure, is an amazing feat!What a fantastic photographer, a master artiste."
5,Great!,This is a really cute book with beautiful pictures. I like the quotes that have been included as well.
3,Selling Out??? Yes and No,"I've had Volumizer for a little over a year now. I always liked the album and promised myself I would buy the actual album the day it came out without listening to any of the new songs. Well I achieved my goal, and when I heard Grown Up, Lemon Drop and Lost & Found I wanted to cry, it was obviously an attempt to get radio play and to sell more records. The new songs soundd almost boybandish, Special J is barely in any of the new songs, the lyrics are too wholesome, and they aren't the 2 Skinnee J's I've been listening too since Super Mercado."
3,Not as good as supermercado but the J's are still kickin it,"This cd still hasn't come out and I don't know why. It is a great cd and i'm sure would sell. it however isn't as good as supermercado, but is still good and very worth checking out."
5,MAN THESE POPS IN SPACE,this cd good yeh it cool i listen and lie down yeh it good buy it but dont hop
5,Not Supermercado but close.,"You either love 2 Skinnee J's or hate them. I happen to be in the first part of the equation. I have listened to Supermercado numerous times and catch them in concert whenever I can. This CD has been 4 years in the making. It is a good listen. I have had the final release for two days now and have listened to it no less than five times. But where are songs like ""Stockholm Love"" the first single that was released in 2000? This CD is definately worth buying, but it will be more meaningful if you see some of these songs performed live first."
3,Very good cd but.....,"If you heard the last version of Volumizer with Stockholm Love and Secret Frequency, thats the better one. the 3 new songs are all really bad and don't sond like 2 skinnee js and dont fit with the rest of the cd at all. aside from the 3 bad songs grown up, lemon drop and lost and found the rest of the songs are really good and if you liked super meracd or their previous eps then you like these songs. the cd is worth buying even with the few horrible songs."
1,SUGARJAY,"To those of you first hearing the j's you might actually like this record. But to those of you who like the previous intelligent hip hop stylings of return of the new and improved, sing earthboy sing, and supermercado you might find yourself staring at your cd player thinking what is this? I had a promo of this record last year before they switched labels and i didn't really like it back then but i figured when the new version comes out maybe it will be better..sadly i was very let down. It's almost like they are a completly new band. More alternative sugar ray/gimmicky radio songs instead of hip hop. I think the fact that they lost amays and andy action had something to do with it but i could be wrong. if your a j's fan who knows you might like it. if this is your first time definatly pick up supermercado first"
4,Volumizer is volumtastic,"The 2SJ never cease to amaze me. I've been waiting for ""Volumizer"" for about a year to come out... the wait was worth it. The album is a concoction of beats and instruments that is sure to make anyone a fan for life. Join the 2SJ army!If you loved ""Supermercado"" then pick this baby up."
2,"Big fan of Adams, but this book ...","I am a big fan of Dougles Adams books, at least in general.But this book is, at best, only marginally funny. Others have explored this topic, and with better results.The problem here is that Adams tries to make funny sounding words for things that don't have a name (like that little twist between link sausages), but constrains himself to using the names of small cities and towns from around the world. Occasionally, he hits a home run, but most of the words are strike outs.Disapointed.PS the 'name' for the link between sausages is kerry. Why, I don't know, and I have no idea why some think this is humorous."
2,pointless.,"Unlike Adams' other works, this provides no satire, and very very little humor. The entire purpose of the book is to identify cities and towns whose names do not obviously make sense, redefine the name as a noun and bestow upon it a nonsensical definition. The only reason I didn't rate it a one or half star, is because it wasn't offensive, aside from the $8 lost."
3,"Please, some more.","I didn't know until now that this book existed. What I am doing is reviewing its predecessor, The Meaning of Liff. That, I have to say, is as funny a book as I've ever read. It had me in hysterics, even when I was ill, unemployed and going through divorce. It might not be too obvious to US readers just how funny this is, if you're not familiar with some of the stranger place names (Quaking Houses, for example, is close to where I live in N. E. England. Shaking Houses isn't far from there.) Consett isn't the last course of a meal, it's a nearby village. Why 3 stars? It's provisional. I'm sure that reading this would result in 5+ for reasons given."
2,Not as good as I'd hoped...,"I don't feel it's up to Adams' usual standard, nor as good as ""sniglets""--remember them? I don't like the idea of using existing words--usually proper nouns. More imagination was needed. And I didn't get the illustrations."
2,Not what I was expecting.,"This book is set up as a dictionary. If you enjoy reading dictionaries, then please purchase this book. The humor was lost on me because of the format."
5,I love it!,"This book is wonderful- I really loved it and laughed out loud more than once. It' not for everybody, but it does have a wonderful sense of humor and it describes perfectly several situations you have lived trough. Too bad for the very British ones that I missed, not being British. But overall a wonderful read."
2,This book is pointless.,You can't learn much from this book. This book contains only questions and answers(with explaination). That's about all. Nothing much. Don't expect this book will teach you how to install SQL. It will only ask you to refer to book online.
3,great bag,it a perfect bag for shoes. a bit too big though. probably just enough size for size 13 shoes.too pricy for a small piece of nylon fabric...
1,One of the biggest blunders,"MTL really screwd-up bigtime by issuing the same UPC number to their entire music catalog. Most Marketplace sellers on Amazon upload their product by UPC, so you can end up with any title from the MTL catalog. Before purchasing this title or any title from the MTL line, be sure to inquiry as to what the Marketplace seller is offering! This will save you a ton of stress.As far as the album ""SOUL HITS, Vol 1"" goes... it is definitely worth having and is chocked full of classic soul jams we all love. It is definitely a great addition to any collection... if you can find it!Good Luck!"
2,This ain't the one...,"If you are looking for an axe to take down trees larger than 4-5""... This ain't the one for you. This is a camp hatchet with a longer handle. It is to light to have enough energy to cut effectively. There is a reason this thing sells for about $30. I used to like Gerber products, but anymore it seems like cheap china crap, is all that they are selling. I have a Gransfor Brunks axe and it is a joy to swing, this thing is all work. It took 4 times as long with the Gerber then it did with the Gransfor's. I thought it would be a good back up or second axe. While it will cut wood, the effort expended is not worth it. If at all possible go for a better axe.Pros:CostSharp out of the boxCons:To lightNot energy efficient (you have to work to hard for what you get)Made in ChinaCheaply made"
2,Short axe,Good quality but not manly. Seems to be the length for a teenager. If looking for a small axe it is fine. If looking for a man's axe look elsewhere.
4,Historic and amusing,The cards are a mixture of characters and caricatures of golfers in the far distance past.Masters and duffers combine in an interesting and amusing collection. The dress is so different to what the modern golfer wears. Collectors will value.
5,"FAST SERVICE: CLEAN, NEW BOOK",This was a very interesting read about the beginning of the modern foodie movement and the Frenchman responsible for it. The historic recipies included make it possible for a modern reader to eat as royalty once did.
5,Thomas Light,Perfect for a tiny bathroom. Was looking for a nautical look and ahcieved that with an upadated twist by picking the brushed nickel.
2,another brick i have to carry to the surface,I'd rather shoot myself than lean from this book again.
4,"Book great, cassettes okay...","This book is clear and comprehensive, yet simple enough for a complete beginner. The reader can choose to learn just spoken Hindi or to also learn to read and write since all of the dialogs are written in romanized Hindi as well as in the Devanagari syllabary. The cassettes are necessary, but poor compared to the cassettes from other courses. The dialogs are read only once, very quickly, with almost no opportunity to practice repeating what you hear. The leftover space on the tapes are filled with discussion in English of questionable utility."
3,a nice book but not the best,"I actually looked forward to receiving this book. As English is my native tongue, and I had studied French/Japanese at school, I was looking for an easy book that would teach me the hindi alphabet and provide me with some easily referenceable vocabulary. Whilst this book provides some assistance on both, I didn't find the layout to be very useful. I would have also preferred more attention on how to write the characters.I'd still recommend this book, but a little more visual assistance (the book is a bit dry, as it is predominantly textual) would have enhanced my learning speed, as well as more romanization of hindi words, especially for beginners such as myself."
4,Unlocking the mystery of the Hindi language,"If you have been learning Hindi by the Pimsleur language system, you may have wanted a book to answer your questions. This is the book. It is excellent. However, if you plan to use the book and tapes or CD's to learn to speak Hindi, it is lacking. The best of worlds would combine the two into a single system."
3,Very Detailed,"If you are looking into learning Hindi, this book is super duper detailed. I was looking for something that was more conversational Hindi, and what i got was something that was way more than i bargained for, in turn, turning me off to the entire thing. This book is for those who really want to learn hindi inside out upside down."
