class_index,review_title,review_text
5,Sam Does It Again,"Sam Hawkins books are always a must have to me. I cross stitch a lot as I don't get out too much, and find his books composed with care. They inspire you to add and subtract bits so they ' live' for ever as I have not found one I could not return to and get another idea from. Well laid out in easy to read formatt. Clearly explained from cover to cover. Unusuall designs also included. An all round good buy."
1,Quality Takes A Fall,"I must have missed something, considering the amount of praise heaped on the author on the dust jacket, I thought I was about to read War and Peace. There was nothing new here, and the story line moved around like a heart monitor display - no consistent track - grabs something here, something there. This really is a very disappointing book."
2,Aln interesting book,"This book had an interesting story, but not captivating. I would have to think a bit before reading another book by this author if it was of the samw genre. There is a lot of information contained within but again, the story was not captivating for me.J. Robert Ewbank author ""John Wesley, Natural Man, and the 'Isms'"""
2,"beautiful, but...",I love the look of this headband. The colors and patterns are beautiful and unusual. It is very comfortable as well. The only difficulty is that the plastic relaxes. The second day I wore it the headband fell off when I turned my head. Not exactly the look I was going for. I have found that I can curl it up and put it in the bag they sent my hair combs in and it will return to it's former shape. It cannot be worn for more than a few hours without losing it's shape. Too bad!
3,Nice but overpriced,"It looks pretty good, and is comfortable for longer periods of time than most headbands, but at this price, I won't be buying any more of their multitude of styles and colors. One time purchase only."
4,Comfort Headband,"France Luxe has a very nice product. Their headband quality is very good, the color is beautiful, nice shine, but I would like to see a few more comb teeth for support."
5,I love this book!,"Why didn't I hear about this book until recently? Duprau is an eloquent writer and this is a deep and touching story. Filled with humor and insight, this book is about two women, their Zen practice, their love for each other and the tenuousness of life. More nuanced than Natalie Goldberg, Duprau's sense of irony carries the weight of her story."
1,not worth the money,This book stinks. There's so much focus on Buddhism that the characters are poorly developed.
5,The BEST book on fertility that you will ever find!!!,"Especially if you are older and ttc, please buy this book! It will give you so much hope and information! It explains all the reasons why acupuncture, having a natural, healthy diet and lifestyle, and taking herbs will help you find better health--and help you get pregnant! PLEASE do not think twice about buying this book. I have recommended it to many of my friends and they have all gotten so much out of it. You will, too! Get it, you will not be dissapointed!"
4,Proven methods of fertility reviewed by a male.,"As a male, I bought this book for my wife (who had 3 miscarriages). I started reading the book as it promoted nutrition and health as a way of making the whole woman strong enough to conceive. I really felt for the author, Randine Lewis, after her trials of losing her babies. But was also inspired by her research, persistence and hope to conceive. I have not grasped all of the Chinese Traditional Medicine described. However, by following the nutrition, herbal and massage methods, my wife is feeling better and more hopeful in her latest pregnancy. We now have a beautiful baby girl as of February 2009. Thank you Randine."
3,It Didn't Completely Work For Us,"My wife and I bought this book with great excitement. After adjusting our diet, trying acupuncture and Chinese Herbs, we realized we were not getting any closer to our goal: having a baby. We recently bought a few IVF books - most of which were filled with garbage - until we read ""What to Do When You Can't Get Pregnant"".This book takes you step-by-step through the IVF process in a conversational voice, dedicates an entire chapter to ""Living a Fertile Lifestyle"" and lists a number of complementary therapies like acupuncture, aromatherapy, biofeedback, breathing techniques, guided imagery and so on.We had no luck until we stepped up our treatment plan and tried guided imagery and IVF. Together they worked beautifully.Whatever you do - make sure you read ""What to When You Get Pregnant"" along with this book. We can't say enough about it. It worked for us!"
2,Confusing,"This book must be read a few times before it is fully understood. Additionally, what is prescribed is difficult to access thereby limiting the usefulness of this book."
5,Very practical advise,I am already seeing an acupuncturist to support fertility. I appreciated the added insight this book gave to TCM and the authors willingness to work along side western medicine for positive pregnancy outcomes. Highly recommended.
4,Following the Dr's Advice,"I've been seeing an acupunturist for a year now. Throughout my treatments, I've had great results for several other issues ignored by regular doctors, but I still haven't been able to get pregnant.Recently he gave me this book and I nearly ate it up. It has really helped me to be more proactive with my treatments. I was a bit overwhelmed with the sections on herbal suppliments and I've left the responsiblity of deciding which herbs to use with my acupuncturist, but there is also lots of good advice for diet, lifestyle, and at home treatments. I've found the book to be a great source of information for anyone who is open minded to the power of combining Eastern and Western medicine. I hope the changes I've made will make the difference, and if it does, I'll gladly change my rating to 5 stars."
3,Not necessarily well written but makes a lot of sense,"This book made me hopeful that I can actually heal and improve my chances to conceive naturally. The book is poorly written with a lot of repetitions, illogical structure and bad selection of examples that sound like excuses. If you don't believe in Chinese Medicine this book is not going to convert you. But if you believe and if you can get through the book you will find a lot of good practical advice there."
4,New Israeli Study,This book is really great considering it offers natural ways of conceiving...THERE is a new study out of Israel - that HYPNOSIS doubles IVF success rate!! www.ourjerusalem.com. I also read and followed Michelle LeClaire's book/method of HYPNOFERTILITY and it worked. www.leclairemethod.com
3,Pregnancy is possible,I havent tried anything but then it turns out i became preganant before i even got to read the book so either it was the guys last few girlfriends or im just extremely firtile. but i would recommend trying this book if you want to consider trying to get pregnant
4,Very Imformative,"This book was very informative and helpful for someone trying to concieve naturally. Some of the information was not new to me for example some of the diet recommendations but acupuncture and chinese herbs as natural methods to enhance fertility was a plus. It inspired me to look into TCM in my area and began seeking treatment naturally before spending thousands of dollars on Western medicine fertility clinics. I am hopeful and glad I read it....I was not comfortable with the idea of hormone supplements and really stressed over the idea of what is called ""unexplained infertility."" I encourage every women struggling with troubles trying to conceive to follow channels you are most comfortable with and exhaust your options before settling on one medical ideal. Thanks for sharing your stories and recommending this book."
5,Understandable and practical,"This book was recommended by my acupuncturist and has a wealth of information! It really helps you understand the practice of acupuncture, herbs, and what YOU can do to maximize the benefits!"
5,First 28 Day Cycle EVER!,"I'm not pregnant yet, but after taking the recommended herbs for one month, I had my first 28 day cycle ever. I feel better and like my husband better. ;) I would recommend this book for any woman with abnormal cycles that wants to feel ""normal""."
4,Interesting reading,"Very informative. Love the author's perspective which is a combo of Western medicine, Eastern medicine, and a woman who has suffered through this. I have made multiple changes in my lifestyle since reading this, and feel more positive now. I can't say if they have improved my fertility (still not pregnant), but I do think I am headed in the right direction now."
5,It WORKED for us!!!!!!!!,"An absolute MUST for infertile couples. I was fed up of western medicines answers to my 'unexplained' infertility and so purchased this book as an alternative. Within a few months of acupuncture and dietary changes, we became pregnant after YEARS of being unable to conveive. (Now my 1 year old is running around giggling at his new found ability to walk). The book makes a lot of sense and is very user-friendly. It addresses many of the known causes of infertility from both the western and eastern perspective. I had to read it a few times to really digest all of it, but I recommend to all infertile couples without reserve. It even offers suggestions for treating male infertility."
5,for lay people and professionals alike,"Although the main approach to infertility in this book is from traditional Chinese medicine standpoint, it is a very hands on, help yourself to better fertility kind of book. I have read many books on infertility and this one gives the most self-help tips.Dasha Trebichavska,licensed acupuncturist treating fertility issues in San Francisco"
4,Very informative,"This book is really detailed and packed with information. I learned a lot about my own body and how/why it does what it does. In particular, I found the acupressure sequences described to be amazing. I recommend this to anyone who has been given a dark diagnosis or been told they ""just won't get pregnant"". Try this out! It could be what makes your dreams come true.Another great ""alternative"" and/or complement to ART isThe Fertile Female: How the Power of Longing for a Child Can Save Your Life and Change the Worldby Julia Indichova. She has a website and workshops too - you can check her and her work out at [...]. Blessings to you all!"
5,Interesting book if you want to take fertility cure even further,This book really takes you deeper into the mysteries of Traditional Chinese Medicine and gives you useful guidelines for improving your health and hopefully also your fertility.
3,Wiggles Pillowcase,My grandson is a big wiggles fan and this was purchased to make his visit more enjoyable. It did the trick.
4,My 2-year old loves it.,My son loves the pillow case. Price is reasonable. I'm thinking of getting another one for him.
2,There are far better books on the writing process,"This book was intended as a master's thesis and in many ways it reads like one, rather than a book intended for a general audience. It is overly personal in tone, focusing too much on the author's own experience rather than using literary examples. If you are looking for good books to develop your own writing, you would be better off with On Writer's Block by Victoria Nelson, Writing a Novel by Dorothy Bryant, or any of the books on fiction writing by Nancy Kress or John Gardner."
4,Not the prettiest gloves but they do the job,"I use these when doing yardwork, digging or transplanting flowers & plants to keep the dirt to a minimum and also to avoid getting blisters. They do the job although I wouldn't mind if they came in some more interesting colors/patterns besides mud brown."
5,Engaging,"This book is compiled nicely, and without wordiness which can make studies of ancient Rome dull. Watch for the addressees of Pliny's letters to learn more about the interaction of Rome's movers and shakers. Read and then reread as you will have missed details if you go too fast!"
1,Disappointing,Karaoke: Bryan Adams & ForeignerThis is not a Karaoke CD as there are no words appearing on screen just the audio. They give you the words on paper to sing along. Definately not what I expected and I am very disappointed. Would not recommend to anyone and it should not be listed under the karaoke catergory.
3,Yummo !!!!,"Wonderful earthen heavy smell, this deep flavor should be used spareingly until you get the flavor intensity as you desire. - TIP ** Keep it in a dark cupboard sunlight ruins it. Adds a mysterious flavor to salad dressing's."
1,junk,I PURCHASED THIS ITEM FROM AMAZON IT LASTED 7 WEEKS AND THEY REFUSE TO REPLACE IT OR FIXIT AS I LIVE IN BRASIL. ITS JUST JUNK AND THE LOCAL NEC DEALER SAID IT HAD BEEN REFURBISHED ONCE WAS NOT A NEW ITEM. IN OTHER WORDS A REPALCE AND RESHIP AS NEW. GOOD LUCK IF YOU BUY THIS OR ANY ITEM FROM AMAZON. THE NO SERVICE COMPANY.
2,Not that great,"The concept is a good one for a guide book of a very scenic region of the United States. However, the actual implementation of that idea if poor. The maps are horrible. Bad copies of old maps that are barely readable. The directions are confusing and difficult to follow. The writing is stilted and often confusing. Overall, I can't recommend this book at all."
5,Just the good ole' noise.,"This double set showcases the insane noise that was AxCx before they signed to Earache Records. You get all of the classic out of print 7"" records along with stuff that is only availble here, like the swell demo from 1988 and some really crummy live recordings. If you don't already have the Greatest Hits Vol. 1 and Old Stuff 2 CD's I'd highly recommend this, or if you do have those and are a collector geek like me then you need to get this anyways. Oh yeah, they cover a Muppets song on one of the Another EP tracks, its spooky."
1,Just crappy noise...,"Every song sounds like a young kid having a tantrum. It's really just noise. It doesn't incorperate any actual talent. Most songs are devoid of a beat. It's friggin' hilarious and is obviously a total joke, but it's only funny for so long. You can't actually follow a beat or get into any songs any more than you could get into the beat your TV makes on a channel you don't get."
4,This is gonna rock!,"As soon as I saw Top Gun: Combat Zones I thought to myself ""I have to get it"". I used to enjoy playing the Top Gun game for the original NES, and this game looks fifty times more fun. You can fly eight different planes, from the classic F-14 Tomcat to the exotic V-22 Osprey, to the old-but-true F-4 Phantom. You can fly in various campaigns from the Arctic from the Gulf (you know which one) to South East Asia. Unfortunately, this game has no two-player mode as far as I could find. Half the fun of combat flight games is dogfighting human opponents (Incase you were wondering, the other half is a mixture of good graphics and fun gameplay). If it were not for this minor fault, I would've rated it five stars. Otherwise, it looks like this game is gonna ROCK! Definitely something gamers should buy."
1,Top Crap,"This is one of the worst games ever made. I remember the old NES version and if you played that today, it would be about 20 times better. DO NOT WASTE YOUR MONEY ON THIS CRAP!Seriously, there are tons of games so much better than this it's ridiculous."
5,great game,I love it looks like a great game.can't wait for it to come out. Ilove the movie and I like jet fighting games
3,Nick-seasoned gamer,"I tell ya, this was one sweet game, but waaaaaaaaaaaayyyyyy too easy. The controls are great and graphics are superb, but it almost seemed that the further i got into the game, the easier it got and before I knew it, I beat the game. And another bad part is there is no multipleyer (which they could have easily made for it) and hardly andy replay value. There are some bonus planes to unlock, so that should take you a little longer, but like I said, it was tooooo easy. I strongly suggest renting, not buying this game"
4,Good game with some bad design features.,"I really like flying games and this is a good one, but there are a few annoying items.I've crashed several times because when messages come in, control of the aircraft is stopped and returned at the end of the message. This is OK most of the time but for others it means a crash. A message window in a corner would be much better.The heads up display differs depending on the display option selected (plane in the picture or not). There is no heads up display in quickstart free flight.Afterburner or lower thrust means near-instant speed changes."
2,not horrible,"caetainly not great though. Everything seems way out of proportion in this game. The aircraft all move incredibly slow. There no sense of speed whatsoever. the scall of the vehicles is so out of whack it almost makes me want to quit playing in disgust. Tanks about about a fifth of the size of an F-15, let alone trucks. Hell, apparently f-15's are even bigger than battleships! But don't worry, battleship can also be destroyed easily with bullets. the graphics are a little better than one would find in a nintendo 64 version also. If there's any saving grace to this game it's that it is TH EONLY flight sim game on game cube. It is kind of fun to try to spot a small group of bombers in the clouds over a city too, but that's about it."
3,Pretty Good,This game is pretty good. It is very realistic but it is really hard. This game doesn't have multiplayer either which dissapoints me.
2,refuses to grow on me,"Philip Glass and his music are large inspirations in my life. I listen and live his music on a daily basis. I just got finished listening to ""The Photographer"" - a masterpiece he composed years before this. Unlike ""The Photographer"", ""Symphony No. 5"" feels thin and exhausted. There are fragments of this piece that stand out and are lyrical and beautiful. The first two sections -""Before the Creation"" and ""Creation of the Cosmos"" - are perfect. The rest muddles together in my mind until the disc stops. Rarely will I ever even put in part two. I wonder if it is different live and in person, but at home in my stereo, it grows tiring and unpassionate."
5,Saw This On Good Morning America,"Then I picked it up and read it. An amazing book. I was able to use the advise immediately and found that it helped me get what I want at work and at home with my husband and children. I don't expect to need the chapters on cars, houses or divorces but the other chapters are directly applicable to things I have to deal with every day."
3,"Okay, but much better negotiating books out there.","This book has a lot of suggestions for how women can be more effective negotiators. However, if you're looking for a book to read I found Women Don't Ask by Linda Babcock to be much more insightful and a much better read.This book is written by a man and his daughter and some parts of it come off as a bit patronizing. There are a number of instances when the daughter recounts anecdotes about how her father taught her negotiating skills that somehow just bothered me."
5,Theory Development any1 can understand,"If you are a social science student doing research and would like to do something different (from theory verification) this is the book for you. Grounded Theory as explained by Glaser and Strauss is useable, even to the novice. Soon you too will be on your way to theory development!"
3,i have to admitt it,"This game when i first got it was hard. The first level was the easiest of the game, but the other levels are a lot harder than that. I have to say that this game was somewhat boring. It had poor graphics and when u aimed it was not exactly acurate. This game has a good and bad side. The single- player was boring. The mode with multiple players was AWeSomE. The multi- player mode had tons more wepons than the single- player mode. I reccomend u should only rent this game, and not buy it."
4,An honest opinion,I will admit that this isn't the best game I have ever played but it is still a very good game. I have to admit that the best part about this game is the price. You just can't beet $10 for an above average PS2 game.
3,The same old thing...,"This game has not changed at all since Turok on the N64, a pretty game and fun to play but having nothing new to surprise me really let me down. I didn't purchase the game until it was really cheap because of all the bad reviews in mags and from peers. I would be {upset} if I had spent half a bill on this game. If you never played the originals it might be a nice buy."
1,Suspicious Reviews - AVOID THIS GAME!,"I find it suspicious that most reviews are anonymous, or written before the gamer has played the game. This game is HORRIBLE! The graphics on the PS2 version are worse than the N64! The framerate lags at a low teen figure, the textures are amateurish, and the movement looks like a hastily created episode of South Park. I bought this game, played it for six hours, and returned it in disgust! AVOID THIS GAME at ALL cost. No wonder it has been so over-hyped!! It is a horrible example of a rushed, unimaginative, terrible game!!"
1,"Good, but not good enough","OK. First off. The game was alright, but not as good as Turok 2 for N64. You have so many missions too do in TE, but they are very short. In Turok 2, they gave you like 7 missions, but they lasted a long time. The weapons in TE are good, but again the weapons in Turok 2 were better. I would advise you to just rent the game and not buy it. I bought it and I wish I wouldn't have. Just my advice."
2,"Beautiful, but bad play control...","I am not a fan of first person shoot em up games, but after reading reviews of this one, I thought I'd give it a try... Mistake. It was a very beautiful game as far as graphics and scenery, but the play control was CRAZY DIFFICULT! Options weren't easily accessed, and jumping is near impossible! If you aren't a fan, but think you'll give it a try, don't waste your time. I took mine in to a trade in video game shop and got Arc The Lad, instead."
4,Turok Evolution,Turok is a hot game.You go through tons of levels facing raptors and dinosaurs with guns.Watch out 4 the snipers!The game also has a great varity of weapons.At some points this game gets fustrating because a level could last up to a half hour and if u die at the end u have to start over. but in other cases this game is great.
1,DO NOT BUY THIS GAME!!,"I thought this game would be awesome judging from the screens and movies that I had seen online. I rented before buying and was instantly sorry for wasting just $5 on this game!The graphics are bland and cartoonish...the graphics in Turok 2 were far more impressive (even though the frame-rate was problematic). The game suffers from HORRIBLE pop-up...grass will suddenly appear just 3 or 4 feet in front of you. The characters in the game are lacking in detail and the AI is lousy.The weapons are cool, but after watching the animations one or two times they become old. Overall, I was supremely disappointed with this game. I have been a fan of the Turok series from the beginning and I am a big fan of the PS2. However, this game looks like a rushed product that does not tap the full power of the PS2. Don't waste [your money.]"
3,"Ultraviolence, but still just another first-person shooter","I rented this game because I was a huge fan of Turok 1 for the N-64. After playing it for a while, I realized that it's just another Doom clone. The graphics, especially the blood and gore are crazy violent and explicit, and some weapons would make Ghengis Kahn jealous. For example, there is a weapon called the ""swarm bore,"" which is a gun attatchment that fires hundreds of tiny fast-spinning screws that bore into the enemies (lizardmen) flesh and tear off its limbs and head, with much blood and drill in bone and flesh sounds. AND YOU THOUGHT GRAND THEFT AUTO WAS VIOLENT!!! Anyway, its just another FPS, and it should be kept away from young children."
5,EXCELLENT!!!,"I LOVE THIS GAME, IT'S JUST SO BRUTAL ON DINOSAURS AND REPTILE ARMIES (MUTANT LIZARDS)!!! THE GAMEPLAY IS SO HEART-STOPPING, THE STORY IS JUST FANTASTIC AND THE WEAPONS ARE JUST TOTALLY AWSOME!! THE MULT-PLAYER IS UNLIKE ANY YOU'VE EVER SEEN (OR IN THIS CASE PLAYED)!!! THE LEVELS ARE OUTSTANDING, THE GRAPHICS ARE EXCELLENT, MAKE THAT PERFECT!!! THE LEVEL OF DIFFICULTY IS PROBABLY HARD, WHICH IS WHAT I LIKE ABOUT IT, AND I'VE COMPLETED THE GAME!!! BUY THIS IF YOU HAVE GTA3, OR GTA:SA OR SNAP YOUR GTA:VICE CITY DISC AND REPLACE IT WITH THIS ONE, OR IF YOUR JUST BORED OR ALL YOUR GAMES SUCK JUST SO LIKE REALLY BAD OR YOU JUST LIKE BUYING OR COLLECTING VIDEO GAMES!!! MUST BUY!!THANKS FOR READING!!!"
5,pull my pants down!,"Turok is a very fun fps with lots of ugly dinos and this one looks to have great graphics and intense game play. i had an old version of this and it had this one gun which drilled this bomb thing into an enemies head and blew it up. thats freakin' pretty tight. and the multiplayer was awsome too. shoot the monkey. thats all i have to say. well, maybe not. one person is a monkey with no gun and all the other people have to go and kill the monkey beore it reaches the thing that turns him back to normal. its really a blast. it's just to bad this comes out so close to need for speed (sept. 9th)."
