class_index,review_title,review_text
1,A shocker!,"Oh my, that this book misses the mark so badly is laughable (you have to laugh or you'll cry!). The author doesn't truly understand the subject matter at all with numerous bad implementations of the GoF patterns. This shows a lack of true understanding of the GoF patterns in the first place as well as a lack of true understanding of Java (interfaces leaps out as an example here).I agree with another reviewer. The only book worse than this is Volume 2."
3,good parts,"Bought this book for my nephew. His comment was ""there are a lot of good parts, but you have to search for them."""
4,Approachable and informative,"As well as it's intended purpose to describe patterns in java terms I've found some very useful coding snippets extra over the pattern descriptions. I've learnt more about the jdk packages from the books frequent referal to pattern usage in the java api. Only 4 stars though; the book has many typographical errors and the layout could be better - especially the page headings, chapter number and chapter name; it would be much more useful to have chapter name, pattern name instead; I hope the author can manage this in his follow up volume which I will certainly buy."
5,The patterns book for Java,"Just a quick one I'm afraid. Having bought this book yesterday I'm pleased to see that it covers not only new patterns but also GoF ones from a Java perspective. Whilst patterns can often be language neutral, having someone ground them in your current implementation language makes understanding them much easier. I was pleased with Larman's book earlier this year but it's focus was more towards the software lifecycle. ""Patterns in Java"" covers the UML language enough so that you can understand the diagrams in the following sections. It also briefly covers the lifecycle, but the main focus is definiately on usable, realistic patterns to help you solve specific problems. This book is a pre-requistite to designing any vaguely complex Java application. If you were holding off by the Gang of Four book until it was updated for Java, don't wait anymore. Buy this instead."
5,Just what I needed,Have been looking for a java centred patterns book for some time and this fits the bill. Very useful examples and I particularly liked the way that examlples of a pattern's use in the jdk are highlighted.
1,"Patterns in Java, Volume 1","This is a book which illustrates strongly the old saying ""Don't judge a book by its cover."" The title of the book was so attractive that almost every Java Developers that I know of bought it for reference. However, it turns out to be a nightmare to most. The material in the book was so poorly explained that I got lost reading it even after a few times. Sometimes, the author tried to illustrate the implementation of the Pattern by presenting a Java Code fragment. the code was so incomplete that I had no idea what is going on. Furthermore, in the chapter about Snapshot Pattern. The author first describes the pattern by mentioning a typical computer game example which is an interesting introduction. He should have explained more based on this example instead he confused readers by mentioning about serialisation and jump straight to game model class without any class diagrams."
1,Disgrace!,"I pity the individual whom selected this book as their first exposure to Design Patterns. A total abuse to the Java programming language or any language. After reviewing Mark's explanation of the Composite and State Patterns, they were far from ""Grand"". Illustrations are incorrect or incomplete; I am not sure which. The coding examples do not reinforce reusability and are incorrectly implemented. USING CASE LOGIC FOR THE STATE PATTERN! I nearly lost my lunch.On your next camping trip, take this book with you; it will make a great firelog. NOW THAT'S REUSABILITY!!"
4,I guess Mark isn't a member of the communist party,"...I've read about 8 or 9 patterns in Grand's book. The writing is good, and clear, but lacks the snooty vocabulary of Rational publications (thank goodness!). I think this book is an excellent resource - to the point, and if you don't know C++ or SmallTalk, you'll get a lot more out of this book than you will from Gamma et al."
4,Decent,"Informative, even though author ""invents"" a few patterns that are not part of the known lists (e.g. the Gang of Four encyclopedia)."
3,Other Java Design books,"I read the first chapter of this book and it does seem easier than the Gof book, although the reviews scare me away. On the other hand I'm afraid I'll get confused with the multiple inheiritance of C++ in Gof. Another book to consider is Bruce Eckel's java design patterns book. It isn't out yet, but it's at his web site. I liked his book about object oriented programming. Maybe I'll just print it out."
4,John Karlen is Willie Loomis,"Willie Loomis was played for 4 episodes by actor James Hall. As this tape's cover indicate, this tape features the debut of actor John Karlen in this role. Karlen would play Loomis for the rest of the series. I don't know why Mr. Hall was replaced, but those of us familiar with John Karlen's work are happy and relieved to see him appear.Otherwise, this tape features a lot of Willie leering greedily at the large jewels in the family portrait of Barnabas Collins, and at any young women he might run into. Carolyn Stoddard actually pulls a gun on him at one point. The show is just a few days away from getting really interesting."
3,"Solid, but outdated","This is a good book to learn the basics of networking from. Sadly, it is extremely outdated (it has a lot of details about Token Ring, for example, and focuses on NT 4) and has not received a refresh. But if you are looking for a comprehensive book to learn the rock bottom fundamentals of networking, this is a decent choice. I am sure that there are comparable, modern books out there, but I am not aware of them off hand."
5,Decidedly different and delightful,"If you really want to know about Wales before you travel this is the guide for you. This is a book to be read and digested not just skimmed through. It is rich in history, art and literature. It gives a deep understanding of the people, the land and its culture. It is not a travel guide per se but will certainly inform your travels. This is not for the lets hit the high points crowd."
5,Stupid Comments,None of the reviewers actually talked about the contents or value of the book. I don't care whether they are for or against hunting. Either read and rate the book or shut up.
3,This Is Bleak Stuff Folks ...,"This is a vivid, intense, and ultimately overwrought book, about a Mexican Indian girl who is forcibly separated from her three year old daughter. Susan Straight has a whole lot to say about the plight of the illegal immigrant and those that live on the fringes of our society. She plunges the reader into the horrors of migrant labor with examples of violence, prevalent drug use, and sexual predation. Her characters are great-hearted people, with big dreams, but instead of focusing on the plot (how about some interaction between the main characters?!?!), Susan Straight instead chooses to hit us over the head with her thoughts on love, race, and class."
2,A novel or a sermon?,"To be fair, the author was poetic with her words. But she got lost in what felt like a moral crusade to preserve life. The reading felt choppy with points of view just popping up for no apparent reason, with chapters hinging on unbelievable details (like a guy having sex with his girlfriend and not noticing she is five months pregnant.), with main characters acting deliberately dumb. It was painful to read. I can tell the author has a gift with words and hope next time she doesn't get lost preaching to the masses."
5,A Must Read!,This book is excellent. Susan Straight is an awesome writer. I own all of her novels...this is a great addition to any collection.
4,"Good collection, but....","This is a very good early collection of stories done in the Gullah vernacular commonly found among Blacks in the Charleston SC-Savannah Ga. area. However, Gonzales did his job a bit too well in that his phonetic recitations of these tales are almost indecipherable to those not famimiar with the dialect. Folklorists may also be interested to know that some of these tales make reappearances in Joel Chandler Harris' ""Uncle Remus"" tales (which came out at around the same time, so it may be the other way around) and some forty years later in the collections of the Black folklorist Zora Neale Hurston. But either way, if you have the patience, give it a try. BUT BE WARNED-Once you get the flow of the dialougue, these stories were written from a very patronizing point of view in the early 1900s and the politically correct may want to take some heart medicine before reading this."
2,Vista users stay away,"This joystick is very old. No vista drivers. With plenty of searching one might be lucky to get drivers for XP. My advice is spend the extra cash and get a Logitech Extreme 3D Pro, a joystick that is much better and compatible with wider range of operating systems."
3,Sterling Silver Lime Quartz Stud Earrings,These earrings are knock-your-eyes-out large! They are pretty but don't seem to sit right on my ears. I like them anyway. The lime quartz is pale and sparkly. Think they would be good for someone not as petite as I am. They stand out from the ear like a little box in their setting. I paid $19.00 for them awhile ago and feel they would be good for the right person.They look smaller in the picture.
1,Absolute worst b film I have ever seen!,"I watched this film via an alternative purchase. Don't waste your money on this one! If I could have given it a minus five stars, I would have. I really like a good disaster film, but this was the absolute worst. Cheesy, tacky acting, special effects the same and story line not much better. Asylum should not have produced this film. A five year old probably could have come up with a better film!"
1,worst SY FY ever,"My husband and I watch a lot of SY FY movies. This one takes the cake! We were laughing out loud at all the mistakes as they happened. Just as an example: the movie takes place in and around Los Angeles. They show a map of the super cyclone rolling across southern FLORIDA! Ming-Na is supposed to be from NOAA, she hands someone her card who reads that she is from the National Oceanic Atmospheric ASSOCIATION! Come on! who was consulting on this! What a bomb!"
2,yuk,it is 1 stupid movie i have seen better movies than that . better action movie than this its so fake n stupid
1,Worst Ever,The movie began with a good idea but whoever produced it put no money in it. I have never seen a movie so poorly done. The worst part was that it was filmed in Southern California so the sun was shining all the time even when it was pouring rain or hailing. They drove thru raining oil but when they got out of the car it was sunny again. An entire ship was lifted by a tornado but the people inside we barely moved around. And since it was the stars they weren't hurt. Camera shots were spinning around people or following them down hallways while they talked over and over again. Helicopters were flying into tornadoes and fiery hailstones. Really stupid. If I could I would give it minus 5 stars!
1,TIS AN ILL WIND THAT BLOWS NO GOOD,"SyFy's latest disaster film is really disastrous. SUPER CYCLONE is tedious, laughable, and offers an annoying performance from Ming Na, who I remember from her Judge arc on TWO AND A HALF MEN. Ming has the emotional depth of an oyster. The usually reliable Nicholas Turturro is as stiff as the tailored suit he wears throughout the film. As always, the science is preposterous and there's more talk than action. A good disaster movie should have disaster scenes which SUPER CYCLONE offers very little. It's really a boring waste of time!"
1,We all should have died in the water,"What can be said about bad CGI, bad scripting and universally bad acting? If I had only jumped into the boiling water early on I could have saved myself at least an hour of lame movie-making. About the only way to make this watchable is to have robots and a silly human making snide remarks while eating popcorn in the back of the theatre."
2,Ship forgot to roll,"Normally I would happily watch Ming Na read 'War And Peace' out loud. But this offering was hard to view. Being a retired U.S. Navy CPO, and having been through a few REAL typhoons, I pretty much gave up early on when the actors were bouncing around the wheelhouse as they were being buffeted by the cyclone. I could'nt help but notice that the inclinometer on the bulkhead aft of the binnacle never moved. Oops!"
1,Watched for the humor....,"A friend recommended that we watch this just for the ""awfulness"" of it and he was right! It is so bad that scarcely 30 seconds of the film can pass before your eyes without seeing some horrible mistake. It's beyond obvious that the production company just doesn't care. In all fairness, they are noted for horrible movies."
5,I Liked it A lot,The movie showed what can happen people/companies did to deep in the earth and end up with A disaster on their hands
1,Don't go there,"My laptop came pre-installed with Instant DVD/CD but my experience is the same as many of your other correspondents; I have yet to burn a DVD successfully - it appears to go all the way then either slows to a trickle, never quite completing the burning operation, or simply crashes. Their web-site is no help, I've installed the most up-to-date patches but there's no improvement and apparently no help. I think I will go back to Nero if I can actually remove this successfully from my PC!"
1,Copying DVD's - Don't waste your money!,"I have used several Pinnacle products in the past and when Instant CD/DVD came out I bought the package right away. Having already had a few DVD's ruined with scratches, I thought I would back them up. What a mistake as it turns out Instant CD/DVD will not copy any copy protected movies, and practically all are protected. Buy DVD X Copy or try some of the free programs. Don't waste your money if you are buying to just copy DVD's. If for other reasons, go ahead, as the package has some nice features."
2,Water problem,Not too satisfied the water keeps comming out from place where we put the water for steam
4,Did the job,"The insulation works. I climbed to over 19000ft and the insulation kept the drinking tube on my platypus big zip (3ltr) from freezing. I found the mouthpiece cover very useful too. It kept my mouthpiece relatively clean at lower altitudes as well.What I didn't like was the wrist pain that I got from first putting my drinking tube through the insulation. I don't know if I missed something, but it took about an hour of slowly coaxing the tube through the insulation as it was really tight. I notice now that after use, the insulation moves around quite freely and I bravely pulled it out before sticking the big zip in the dishwasher (as I think reinserting the tube through the insulation would not be as painful).I've heard that the tube/mouthpiece freeze at high altitudes in spite of the insulation. Wasn't the case for me.I think it's a bit expensive though. It would be nice if amazon/platypus had deals on buying a hydration unit with the insulation together."
3,It's OK,"This author did not match my expectations. His stories were brief, no detail and not very convincing. He did not examine the paranormal"
3,OK Book,"Just finished reading ""Ghost House"" and I have to say this was not my favorite ghost house story. It was an OK read. Probably a better book for younger people."
2,doesn't work very well...,Only worked on very smooth glass for us... which was disappointing. But very funny when it does work :)
5,A non-Shafferian play by Shaffer!,"Shaffer's work seems to be synonimous with mystery, impact, ritual and theatrical pyrotechnics. How strange, then, to see him in this, his first major play, to see him attempting something very close to a kitchen sink drama.Indeed, there is a smack of Ibsenesque drawing-room realism so far removed from the 'total theatre' of Equus and Royal Hunt that some readers may find disconcerting. But, nevertheless, Shaffer's tender understanding of the emotional pressures of middle-class family life make this play just as extraordinary and gripping as any of the later, more popular successes.The play does exhibit Shaffer's characteristic love of linguistic versatility and, as with all his plays, is extremely relevent. I for one cannot but feel moved by the characters' tender denunciation of love and sexuality.A must for anyone wanting to find new layers to an original and penetrating writer."
5,Required reference for every speaker,If you can't find a humourous anecdote here you can't find one anywhere. Perfect for the reference shelf of speakers and writers.
2,Bla,"They were not as nice as I wanted them to be, I ended up returning them. I was expecting them to have more ""sparkle"", but they were pretty dull looking."
4,Provocative,This is an interesting and persuasive book that challenges preconceived notions. A good read.
3,A different point of view...,I bought this book on the strength of the Booknotes interview of author Bellow. I mean: how can you possibly end up praising nepotism? What's he got to say about it? The historical material is fascinating in the way that Bellow can show a different side or point-of-view for some famous (and some less famous) historical figures and how nepotism played into their successes (or failures). Less convincing is the set of conclusions he makes from his research. But I still enjoyed the book pretty well. It'll make a good paperback someday.
1,The B.S. of Silver Spoonery,"Bellow's book is a fascinating read; partially because the subject is infuriatingly destructive to any business and partially because Bellow managed to trade on his father's name to get it published. It doesn't mean that I respect Jaimie Wyath or Arlo Guthrie any less -they've cut their own paths successfully with skill and self-reliance.Listen: Nepotism is handing the reigns to family, buddies and cronies. Integrity is when nepotism gets avoided, which is what you may want to do here, unless you need a reason to boil over."
4,Interesting take on a little-examined subject,"It has been said that some things are so common that no one ever bothers to notice it. One of these things is probably nepotism; the topic of this book. Adam Bellow, son of the famous author Saul, looks at the practice, both accepted and expected, over the centuries in multiple societies. Through it all, the author argues the point that nepotism is one of the primary forces that holds societies together; and should not be looked down upon as it commonly is. The book also shows that the US is quite exceptional in its dedication to remove nepotism from public and business life. All in all, a great book to read."
4,"Superb women's reading, best for Pagans.","This book practically leaped off the shelf, into my hands, and I'm so glad that it did! This is easily one of Z's best and most accessible, and she shares well-researched ideas that others often overlook, despite their importance. Her map of what happens in what years of your life... well, that proved amazingly accurate. Almost spooky. I wish I'd had this info fifteen years ago.This book relies heavily on Pagan and Wiccan themes, as well as astrological cycles. If you're offended by them, even slightly, this isn't the book for you.Likewise, though this information is often as true for men as it is for women, most men won't warm to Z's attitudes or writing style.However, if you're a woman who embraces diverse spiritual references and contexts, and can accept the logic (if not the science) of cyclical influences in our lives, this book is compelling. If you're approaching age 30 or 50, this is the road map."
2,Waiting for his awakening,"I thought maybe Stormer had gotten smarter in the intervening years, and added some real factual info to the book...Too bad. Still the same ol' same ol'."
4,Great Ape Friend,"Toy is a very cuddly, appealing soft sculpture. My grandkids love sitting and watching TV with him and even playing ""catch"" with him. Overall, a good purchase. Vendor provided good description and fast service both times I've done business with him/her."
3,Not bad,"I recently purchased a pop up camper and was instructed to make sure to cover the wheels when storing it. I wanted to make sure to protect my investment, but didn't want to break the bank. These are a decent product. They are a medium weight canvas material that do a good job covering the tire. They fit several diameter tires and have a metal wire running through them to ensure they stay on the tire. I like the quality given the price point and would recommend the product as an entry level tire cover."
4,obsession,"The depths of pain inflicted on others have been described more graphically elsewhere.I was intrigued by the depth of focus and energy by a single individual: An individual who will risk everything searching and using his wits to find the truth.Not a pleasant read, but a worth the time."
5,Nazis vs. Newspaper Reporter,"This Forsyth novel is set in Germany in 1963, right after the assassination of President Kennedy. It follows the story of Peter Miller, a German newspaper reporter attempting to discover the whereabouts of a former SS concentration-camp commander that is of particular interest to his personal history. There is lots of intrigue and suspense along the way, one main Nlotline involves the Nazi association ""ODESSA"" and its attempts to find safe haven for ex-SS members in the aftermath of WWII. Forsyth even manages to work in the Mossad and the real life Nazi hunter Simon Wiesenthal. Supposedly the movie version resulted in the arrest of the true ""Butcher of Riga,"" Eduard Roschmann, by the Argentinian police. According to reports he then skipped bail and died in 1977 in Paraguay. A fascinating story, if you like historical suspense/thrillers, you will love this read."
3,Interesting but...,"Not bad, written after his first novel, the Day of the Jackal. Applying the same formula that immortalised the book as one of the best ever written, the Odessa File is gripping and draws you into the realms of semi-fiction that Forsyth is an expert of. However, I was dissapointed with the ending. Seem more like a story from a TV soap."
3,The Odessa File review,"The Odessa File was a great book. It caught my interest with the first chapter. It was an interesting story with good characters. Also, the more I learned about the SS and Nazi's during WW2 and what they continued to do after the war, the more I know we need to continue to write more books on the subject and remind people of what happened and not let it happen again. It was a good suspenseful novel. I will definitely read more books written by Frederick Forsyth."
4,Skip The Last Half,"The author's description of Nazi attrocities is outstanding!!!!It should be required reading for every class in Holocaust Literature. The book also revealed a great deal of information about the Jewish ghetto in Riga, Latvia that could almost be a book in itself.However, halfway through the book I became very disappointed. The plot degenerated into a cheap thriller. Such a cleverly researched book should never have been coupled with such a poorly written plot.The horrors of The Riga Ghetto recently made news because of an investigation by The Latvian Holocaust Commission. Unfortunatly, even sixty years after the horrors of The Riga Ghetto, The Government of Latvia couldn't overcome it's antisemitism and Abraham Foxman of The World Jewish Congress resigned from the commission."
4,A very good spy novel,Forsyth has written a believable thriller. The book move along with very little padding. The characters are interesting. The interrogation of Miller by the Odessa Chief could have been improved. The questions asked by the interrogator to see if Miller was really a former SS soldier (instead of someone else) appeared to correlate very highly with the training he received. Other than this the book is suspenseful and is hard to put down. Excellent read at 1 AM on a Saturday or Sunday morning.
3,Fun but a little lacking,"As we follow the exploits of a most determined reporter, The Odessa File becomes an espionage novel that quite successfully delivers a thrilling adventure amidst a Cold War European backdrop. While much of the novel is written in a tone typical of genre literature, it does contain a few interesting plot twists and an excellently descriptive portrayal of the primary antagonist during his years as and SS officer. Not a landmark piece of fiction, containing a few implausible discrepancies hidden within the plot, it does certainly entertain. For those who are fascinated by the Third Reich and the subversive exploits of the myriad of second-rate war criminals who escaped prosecution after World War II, this will be a quite enjoyable read and a fun insight into some real-world personalities."
5,Great Book,"Good Stuff, not as good as The Day of the Jackal, yet one of the greatest novels i have ever read."
4,One of the best Forsyth's ever !,"The second book by Forsyth still is one of his best. It's better written than ""DAY OF THE JACKAL"", for sure. The main character Peter Miller is very credible. The funny thing is that, with passing years, almos all Forsyth's characters seemed like robots withou personality or feelings. But in ""ODESSA FILE"", they are totally alive and kicking !"
