class_index,review_title,review_text
1,Huh???,This is very odd. In 1998 Garth Brooks had success when he put out a box set with a similiar theme. However for some artists that kind of treatment doesn't work and it falls flat. I like Toby Keith but this box set is just a way for a record company to make money buy repackaging three CD's (None of which are any good or have any worth) and make an extra buck. It's just sad.
2,Effortless and Misleading,"When I bought this box set, I expected to recieve compact discs that were fully remastered with 24 Bit Technology. Instead, they sound exactly like the original discs I already have. While you may find several top quality country hits in this set, the sound quality isn't up to snuff for today's standards. So now I'm stuck with doubles of everything and out thrity bucks."
2,Toby Keith CD's,"Although the CD's themselves are in fair condition the box in which the set came in is terrible, seperating from its backing the plastic tray which holds the CD's could have at least been re-affixed to the card?"
3,"Inspirational, Yet Repetitive","I would have enjoyed this book more if I had not already read The Prayer of Jabez by Bruce Wilkinson. This version lays out much of the same information, with a few insights for women tucked in. The overall message of both books (which is valuable) is the same. I felt I was reading something that I had already read before. However, the prayer works, as many people have discovered. If you have not read one of the books from this series and you are looking to have a closer walk with God, you will find inspiring information."
4,"An ecletic mix of country, rock, and pop music.","The Beta Band's new release is more than an album, it's an experience. From the first chords of ""Dry the Rain"" to the murmers of ""The House Song,"" listeners will be capitivated, if not a little perplexed. Although the inevitable Beck comparisons could be made, the Beta Band are very different from the country-pop star. Unlike Beck, they produce their own sounds, and their songs certainly aren't anything close to danceable. Yet their county-folk roots shine through, and mix with their rock n' roll power chords, making a truly enjoyable mix of sounds. The lead singer's strong, deep vocals add an edge to the songs, making the Beta Band's U.S. debut one of the most interesting albums of the year. It's one you can listen to again and again, but never hear it exactly the same."
3,Beta Bonus,"I bought this CD on a spree and didn't even know who the band was, I'd never seen high fidelity, I just sorta like the cover. It turned out with the money. Dry the Rain is the best song, in my humble opinion, and needs to be listened to again and again. It's a good CD to chill with."
2,not exactly all that deep or intricate,"well, it's kind of hippy, hoppy, someone learned to play the slide, and i suppose there are some beats on it, but man, it sure is a great big disappointment--this music is not challenging or interesting or even all that different. if you just want something that will go in the background or maybe while you're chemically enhanced, this will do as well as a doors record or something else, but it is not worth any hype at all. it's like low rent version of Arnold or maybe Gomez. they obviously think that they are very cool though. Hmmmmmmmmmmmmmm... hubris......"
5,Meets all expectations,"The Beta Band first came to my notice when I saw ""High Fidelity"". Being intrigued I first picked up the soundtrack, and then this disc. This is a masterful disc. For those listeners who are not adventurous, The Beta Band may not be for you. The band can not be shoehorned into any neat category and the music is 180 degrees from today's incarnation of pop music.Given the previous high marks granted to this disc, ""The Three E.P.'s"" could have been set up for a big fall in my opinion. Happily this proved not to be the case. This disc has become one of my most heavily played discs and will remain so for a long time. Personal favorites are ""Dry The Rain"", ""She's The One"", and ""Needles In My Eyes"".I must have for the musically adventurous!"
4,A new way to discover music,While listen to this EP i found that music as discover a new way to reborn. This guys have made a very original and fascinating mixture of diferent sounds and influences of all kind. Just waiting for the album. Keep on with the good work!!
3,Not bad,"I like the self titled album better. Some really good stuff, particularlythe first few tracks, but also some questionable stuff on there as well."
5,The Beta Band: I can't wait to witness them...,THE BETA BAND is what was good about the Beach Boys and Love & Rockets.
3,"A few great songs, with some filler.....","OK, I admit ""dry the rain"" was one of the big reasons I bought this CD, but other songs like ""the house song"" and ""dogs got a bone"" are pretty good as well. However, some of the more instrumental stuff, like ""monolith,"" doesn't grab me - yet - though I can see it growing on me with time. The variety and the (mostly) mellowness of this CD makes it well worth the price"
4,The closest thing I can compare this to is...,"'Meddle'/'Atom Heart Mother' era Pink Floyd. That's not a bad thing -- that's a good thing (I did say 'Meddle' era, not the later stuff, after all) V-e-r-y atmospheric, v-e-r-y psychedelic. Oh, I know, it's probably neither of those things to a lot of you, but that's MY take on this collection. And it's probably a reference more people can relate to than obscure/British bands a lot of people have never heard of. Hey, I LIKE this cd. But I didn't find it groundbreaking. It's simply tilling some ground that hasn't been harvested in a while."
5,This is your brain talking - 'BUY THIS ALBUM',Beck meets the Stones . . . the party starts there . . . by the time the everyone's feeling comfortable with their cocktails . . . Primal Scream drops in for a righteous time. Beg Borrow or steal - Beta Band rocks with some originality of their own and some originality of their early brethen. Probally sound as good in your garage as they do on this album.
5,Balm for wounded ears,"If you think that today's young musicians only make hardcore, ska, punk and other kind of noises, you must change your mind right now. Listen to this record, made by four art students. It's delicate, involving, vibrant, at the same time. The first E.P., ""Champion Versions"", is sublime and the best of them; the third one, ""Los Amigos del Beta Bandidos"", is excellent; the second one, ""The Patty Pattty Sound"", is less inspirated than the other two, but pretty good too. In my opinion, the highlights are ""Dry the Rain"", ""B+A"" and ""It's Over""."
4,stoner rock!,"i feel guilty listening to this, due to the fact that i have short hair. but it's great stuff. the beta band has succeeded in setting the wild rumblings of the baked mind to music. (if you actually understood that last sentence, you'll love this album....)."
5,High Fidelity did the band a disservice?,"How can one say that a small, underappreciated, terrific band was done a disservice by having their music disseminated by a fairly good movie soundtrack? Dry the rain happens to be a great song that isn't necessarily in the same vein as monolith, but a good representation of the band nonetheless. After all, the band wrote it, recorded it, and made it the A side to their first EP. So who cares if their latest albums are more spacey, less poppy. The fact of the matter is, all of their output, including Dry the Rain, is amazing and interesting and innovative. To whoever is reading this 'review' - buy everything you can find by The Beta Band - it's worth it. And don't listen to those who seem to think this music is esoteric and above those who were initiated through Dry the Rain. I bet a good deal of those fans wound up loving the crazy and out stuff the band has to offer as much as the popcraft."
1,Disappointing,"This review is for people possibly looking into the Beta Band because of their single on the High Fidelity soundtrack. Drying the Rain is a great song, but unfortunately the formula that makes it a great song does not carry over to the rest of the album. It really is just a bunch of noise. Main stream music fans should pass this up and stick to the soundtrack. Trust Me."
2,Learning how different tastes are,"This CD isn't bad if you like repetitive lyrical phrases without meaning, looping samples, speech that repeats and says nothing (like ""pushin' out"" over and over and over and over again). I can perceive some talent somewhere in here, but this group is making music CDs that mostly lack music. Where's the music?Some songs start, seem to have potential to develop into something, and then don't. Now, having said all that, there are a few worthwhile cuts, a couple that are quite good. So ultimately, if you like to have more music than incoherent mixes of various sounds, then you have simply to decide whether or not you're willing to pay $3 or $4 a cut.I'll admit: maybe I just don't get it, but if you can find a place to sample everything on this album I think you'll find I'm vindicated."
5,"The ""Prince of Preachers"" tells it like it is!","""My college lectures are colloquial, familiar, full of anecdote, and often humorous; they are purposely made so, to suit the occasion. At the end of the week I meet the students, and find them weary . . . and only in a condition to receive something which will attract and secure their attention, and fire their hearts.""So starts this timeless collection of lectures that the ""Prince of Preachers"" presented with insight, humor and passion to aspiring ministers.Fascinating titles include ""The Minister's Fainting Fits""; ""Posture, Action, Gesture, etc.""; and ""On the Choice of a Text,"" there are 28 of Spurgeon's classroom discourses on homiletics. Topics include the call, open-air preaching, ordinary conversations, using illustrations, and conduct outside the church, Amazingly powerful and practical over 100 years after the last lecture was delivered."
5,"Must read for all pastors, especially for aspiring pastors","Absolutely every subject that a pastor needs to cover in regards to his salvation, personal life, and pulpit ministry is covered extensively in this compilation of Spurgeon's various lectures at the Pastor's College. If you feel the call to the ministry, this will strengthen you if you are truly called. If gives a real glimpse into the life of a devoted preacher and contains exceptional examples from Spurgeon's life. Awesome read."
5,Inspiration for enriching ministry.,"I am using the book ""Lectures to my Students"" by C. H. Spurgeon in my Homelitics class. Spurgeon's insights have enlarged my horizions as to how I read and analyse The Holy Scriptures. The book has enhanced my teaching greatly."
2,Tiny Print,"Seller did a great job getting this to me in a timely fashion, no complaints there; however, the text within the book is terribly small, looks like someone zoomed out and then printed all the pages, they don't even fill the page normally (2 inch margins on the left and right and 3-5 inch margins on the top and bottom). Was excited to get the book, but not very excited about the print size"
1,A wonderful teaching aid,"This is one of the most helpful books for teaching that I have found. Spurgeon is known as ""Prince of Preachers"" and he really is a great teacher. I an certanly thankful He left some of his work for us to use. His ancedotes are great."
1,THIS IS AN ABRIGED EDITION - PLUS IN VERY SMALL PRINT,This is an abriged edition (although it says unabriged in the product description) and the print is VERY small.
1,Great content...Poor format,"These are great lectures by Spurgeon, but the format of the book is very poor. It is a photo reproduction of one of the original editions and the type is VERY small and hard to read. There are other editions, Eerdmans for example, that are much better for a similar price."
5,Fascinating History Of A Unique Time And Place,"If this was a fictional account about the section of New Orleans called ""Storyville,"" no one would ever believe it. That it is true is wonderful, monstrous, fascinating, horrible, and damn good reading. The birthplace of blues, jazz, Dixieland and the beginning of the ""Black take"" on music that has swept the world and reinvented itself many times...right up to the present. The sex in this book and the way it was practiced and viewed at the time is unbelievable; it boggles the mind. This book cries out to be the basis for a movie, a musical, and/or a TV series. The cast of characters defies explanation. If this book doesn't blow your mind, you don't have one. Great!"
3,An Interesting Collection,"Be warned that this is a one-CD collection: the second disc listed on the liner notes is not included. The songs that are part of the collection run the gamut, all of them representative of the Salsoul stable of artists. Innocent soul-oriented dance songs like ""Dr. Love"" sit side by side with the gospel-inflected pop projects of Loleatta Holloway (""Hit and Run,"" ""Runaway""). Included are a great remix of ""I Got My Mind Made Up"" and original versions of Inner Life's ""Moment of My Life"" and Love Committee's ""Just As Long As I Got You."" The incredible Walter Gibbons remix of the latter song is available on the Forever Disco CD."
4,Slowdive meets Radiohead,"Very nice couple of songs. ""Winternight"" sounds like early Radiohead or Catherine Wheel with a slight Slowdive atmospheric sound in the background. A nice mix. ""Jumble Sailing"" has kind of the same atmospheric sound to it, but is a cute pop song. Too bad their album ""Lido"" isn't all like this."
2,It was good while it lasted...,"The device worked wonderfully when it worked. Unfortunately for myself, it died after only two weeks of light use. Your mileage may vary."
3,"Great for the size, but average for the sound","I've had my AX2 now for about two weeks. So far, I really like it for it's size and weight. It's small enough so that I don't look like the Borg (Star Trek) when wearing it, and I don't feel any weight on my ear. I got used to the ""antenna"" used to hold it in place almost immediately. But unfortunately, the sound quality could be better. The speaker inside the earpiece delivers a lot of treble with little bass. Inside this seems to be okay, but outside I've had to ask my girlfriend to repeat statements a lot. If you plan to use the AX2 indoors, I'd definitely recommend it. But if you're looking for a bluetooth headset for outdoors, I might consider looking at other brands with better overall sound quality."
4,Excellent headset but you should baby the battery.,"After having owned 3 different headsets I can safely say this has been the best for me. Sound quality is excellent and it is the only one I can effectively use in the car on the highway, others are just not loud enough. A tip I would offer is to not leave it in your car, the cold weather killed the battery and not I am left with a, very light, paper weight. Replacement batteries are $20."
4,signal not very good,"i ended up not using it that often. great in the car, and near distance.however, compare to the cell phone signal, it has some low level noise.you can still continue the conversation, however..."
3,AX2 Bluetooth headset,"I got this headset at a real low price. reception is good as long as you are carrying phone in your pocket or it is closeby. very light weight and once you get accoustomed to wearing it, it is easy to fit in the ear."
2,Quick Tip,When I first got my Bluetooth device I was very happy because it is compact and very useful when driving.After a month I started getting a lot of static and even thought I had my cel on my belt.
3,Average headset,"When I first received this I thought that it was cheap feeling and I really didn't like it. I had a blue tooth heavy duty motorolla before, which felt more high quality. I now have grown to like this item. I don't like how you have to turn it on and off all the time. I wish there was an easier way. You have to hold down the button for 3 seconds. Sometimes there is static on the other end. The battery life is okay. Nothing spectacular. Overall I'd give this an average score."
4,ok,you still feel confined to the phone because you can only get about 10ft away from the phone before it starts getting static!
2,"""You Get What You Pay For""!","I have purchased several bluetooth headsets in my attempt to obtain a good quality sound. I purchased the Nextlink AX2 with the hopes of solving my search. I was not impressed. It was loud enough (as they stated), but with the volume turned up it created an echo for the recipient of the call. It is a ROYAL pain trying to get the thing in your ear while driving. Once in, it was fine. I hung up on several calls while attempting to secure it in my ear.I have put the whole thing back in the package and will try to return (though for the $30 less shipping both ways) it probably isn't worth my time.I have gone to the expensive H700 MotorolaAs they say -""you get what you pay for"""
1,waste of money,"the earpiece is a waste of money, gave it as a christmas gift, but shouldn't have. It's a toy, very low volume, you cannot hear and cannot be heard!!!Could not return it because I lost the receipt...Total Waste!!"
1,Not durable at all...move on to another headset,"I had this headset for 3 days. Dropped it from waist level and now it doesn't work. I could have gotten better use out of $30 by purchasing a fairly decent bottle of wine...it would be gone too, but I would have had more enjoyment out of it. This unit is very small, and getting it into the ear is awkward, and is impossible to do without pressing one of the volume up/down buttons, which means you will have to re-adjust. If you have larger hands, like I do, it is a little odd to handle...hence, the greater possibility of it being dropped. The sound was mediocre at best, and everyone I spoke to (in the short 3 days that it did work) said there was an echo on their end. Not recommended. Move on to another."
3,good voice quality but very fragile,really good voice quality and weightless - but whats the use if it would last only for a week - this thing cracked open in a week of usage and would not work.
2,"Nu Stylz, lol","Anyone else think it's hilarious that they have this imaginary group nu stylz? I mean, it's nsync, everyone can tell (right?). Well, about this CD, I wouldn't reccomend it. If you're an nsync fan you HAVE all these songs. Although it is only five bucks, so if you like these songs but don't have their album it's worth it. Hope it helps. Don't you think it's weird though, nu stylz, nsync... weird."
2,A little disappointing,"I wasn't too happy when I got this book in the mail. It simply does not have very much material, even for a baby. All my granddaughters teach their children simple signing starting at a few months and pre-verbal signing is great for eliminating much of the frustration of not being able to express themselves, but it seems to me that the pictures in this book would be difficult for them to catch on to. Obviously, the adult would need to teach the signs but I don't think they would be able to recognize them from the pictures after they learned them."
4,Fast becoming one of baby's favourites!,"""Get your fingers ready to twinkle...""That's how storytime begins with this book, which will encourage active participation even in babies who aren't signing.Very cute pictures of babies and helpful captions for parents on the pictures of signs make this a book you will enjoy together again and again.The series is slightly inconsistent in that only one book - Itsy Bitsy Spider - features a lovely REVIEW of signs on the back page (maybe they had an extra page because that song is short?). I found the review very helpful, and wished the other books in the series had one, too...it gives the baby yet another signing sing-along opportunity!Still, I think Twinkle Twinkle is her favourite of all these books, and we have had many MANY requests to read it in just the few weeks it's been here.Recommended for ages 1-2 only, as it's a very basic song that older toddlers will probably not sit still for for long."
3,"Very simple, little disappointing, but my 2 year old enjoys...",I bought this book because my son loves to sing Twinkle Twinkle before bed. I was a bit disappointed with how simple & short the book is but my son does pick it up from time to time... he enjoys the hand-drawn illustrations of the other kids & following along since he knows the words by heart.
5,Reebok Women's DMX,These are absolutely the best walking shoes. My husband and I walk 4 miles every morning and I have tried all different kinds of shoes. The Reebok DMX is the most comfortable and I would recommend it to any serious walker.
2,Disappointing Follow up .........,"The book is definately a disappointing follow-up from Mail Order Bride. Its so hard to like Annie, who is out for herself and very immature. Usually in historical romances a 20 year old is a little more mature. So it makes it difficult to root for her and Colin, when all you want to do is smack her in the head.I love Maureen McKade's books, and I would tell you to read this, just to get closure from the whole Trevelyan tale. But man oh man, Kate and Trev raised a brat!!!!!! I expected way better. Sorry, Ms. Mckade..."
4,NOT THE BEST BUT A GOOD FOLLOW UP!,"Face it, Annie Trevelyn is a spoiled brat, progessive thinking for her day or is she trying to rebel by being shocking. She is very naive or just ignores her father's knowledge that actress usually end up being kept by some man. He didn't want that for his child.The problem is that she is not a very lovable brat at that. And Colin McBride or ""Laddie"" as Trev knew him wasn't exactly interested in that kind of wife. Colin, at thirty two, should have been a bit smarter than to trust her. And to get into trouble by befriending her actor troup, wow!But let's face it - she is the personification of many of todays kids - I guess there are some in all generations. [grin]I will admit to being supprised at who turned out to be the villian - I never guessedRecommended --M [with questions] but I did love finding out about Kate and Trev's extended family."
1,Our unexpected wasted time,I am a very big Maureen McKade Fan . I have got 2 of every book that she has . I waited so long to read this one . But when I got it I sat down to read it and I have to say I was crying at the end becuse it was so painful to read . It was a very disapointing night . This is one book that I will not be keeping :-( It was very laging in many areas . Along with unbelivable . I am usally able to loose my self in her books and forget any kind of day the world has put me threw but not this one. You know it a great book if you laugh and rut on the people in it but this one you sipmly can not.
3,Great for fans,"This is a good book, but then again it's the only one ever written about Freddie Prinze, Sr. I agree that there are alot of things left out of this book, which sort of leaves you scratching your head. Maybe the book was written in a hurry in an effort to put out some truth. It would have been nice to have a more well rounded story of what Freddie's life was like growing up, which would have included more information about his father and other aspects of his life. Also, there wasn't that much information on Freddie's then wife Kathy. It would have been nice to have had her input, but as the book stated, it was about a mother and son. I really wish someone would write a more detailed account of Freddie's life, he's missed alot, and many of the fans would enjoy it. If you are debating on getting this book, I would recommend reading it, of course it's sad, but you do get a glimpse of what Freddie was all about, through his mother's eyes."
5,To a very special comedian who is missed.,I enjoyed reading this book written by his mom. It gave me insight into the way Freddie was raised and how he was when he was younger. One thing Freddie had... he was a gifted comedian. I read this book probably 8 years ago and I still cherish my copy. I thank his Mom for writing it and for giving his loyal fans a bit of comfort by hearing her side of the story. God bless her.
5,The Best,I love this CD. Out of all his music that I own this is my favorite. Great diversity of songs. Really shows what he can do. I don't know how you couldn't like it if you like Nelly.
1,here we go again!,"holy crap once again this faggot NElly comes out with a horrible album, omg dont get this, paul wall song is whack, the only good song to listen to is Nasty Girl. Nelly is still whack and always will be, listen to true rappers like NWA, Nas, Eminem, Dre, not these bubble gum rappers like Mike Jones, slim thug etc.Seems to me like hip hop is getting worse and worse every year, where the days where people would talk about important things rather then cars and girls.This nelly guy collaborated with NSync WTF!! and Tim Mcgraw also WTF! XTINA, Fat Joe, Lil Flip all horrible people and yet he does it. I dont think he cares about what his fans think, wish he wouldve stuck with something like Country Grammer only thing but this CD is just horrible dont get it!(...)"
