class_index,review_title,review_text
4,Hmmmm...,"Since there was a series of albums in the early 1960s, all with the same title (""A Meiga Elizete""), it would be great if the song titles were included, so potential customers could know which record they would be getting. I've heard the first album in the series (which has ""Vai Querer"" and ""Projecao"" as the first two tracks...) and it is quite nice!"
1,disapointed,I have his album December which I love this one however is not good I was actually relieved when a few of the songs were finished
5,Another 5 star outing from the Excellent Solo Pianist,"Winter Into Spring, by George Winston, is another fine offering from this gifted pianist. IF you are new to Mr. Winston, welcome, you are in for a treat. If Mr. Winston is old hat to yopu, enjoy the opportunity to own these once fantastic albums of now even greater CDs. Simply another 5 star CD from Mr. Winston. This is a CD to put on in the background and play all day."
1,Winter,"My reiki therapist recommended this CD so I bought it. Booo.. Being a music lover and a pianist, I would say don't get this...it lacks substance and melody."
3,Winter Into Spring,"I always enjoy George Winston's work. It never fails to transport me to a blissful place--although I must plead guilty to being a piano enthusiast. I have many of Winston's CDs, my favorite being ""December."" So although ""Winter Into Spring"" cannot begin to compare to ""December"", I have enjoyed it immensely."
4,Winter Into Spring,"What can one say about George Winston that hasn't already been said. He is a true artist. For sure he has varied his musical style with the years. This CD selection harkens back to the ""December"" fare. It too evokes serene thoughts and a tranquil mood that opens up to the dawn of new life with spring."
5,Wonderful Product,Both my dogs fur is very soft and they do not shed very much. People always comment on how soft and shinny their coats are. I free feed my dogs and put this in a bottle with a pump and put one squirt in each bowl.
1,Don't waste your money,"My husband and I are awaiting the birth of our first baby. I am so excited and anxious which makes me a sucker for products like this. I bought the listener at 5 months. The only noises you can hear are stomach noises and that's only when there is no static. I am now 8 months and have still failed to hear the heartbeat. I can't tell you the countless nights I have laid in bed listening and trying to hear the heartbeat. The microphone and cd are nice. I have used those. But overall, the set is a big waste of money. I was very disappointed."
1,A Star is too much credit for this product...,"I bought this item and tried to hear my baby's heart beat but the only thing i got was a little thump, which if you read the manual it says that a kick sounds like a thump, well no it wasn't my baby kicking; it's the sound of your finger holding down the activate button(incase your wondering, even in a quiet room it picks up any little noise that happens outside your window etc...). I put it over my heart and it did detect it then i put it on my thigh and GUESS WHAT I HEARD?? THUMP THUMP, unless my baby's kicks echos throughout my whole body than i would've kept this product and treasured it, but in my opinion (take it if you want thats whay it's an opinion)I would buy something else that'll come to more use for you or your unborn baby or other children you might have."
2,Thumbs Down,"My husband and I are very disappointed with this product. We cannot hear the baby's heartbeat at 33 weeks, we can only hear my heartbeat. We bought this product to do what it is advertised to do, and it doesn't. We sometimes use the music and headphones, hopefully my baby enjoys that aspect of it."
1,A complete waste of money and time.,"A real disappointment. We got our hopes up and tried for months to hear the heartbeat. Now 29 weeks, still nothing but horrible static and every creak of the movements of the cords and my hands! impossible to avoid! If im lucky, the only thing heard over the static is my digestive system. woo hoo! anyways, this thing picks up conversations of people in the next room as well as any TV or music playing in the house. Such a let down! and we're mad that we wasted our money."
2,Doesn't pick up heartbeat well,I am 34 weeks pregnant and have only heard his heartbeat three times with it. It amplifies every movement of the cord and the clicking on/off button is very loud. I do like that my son reacts to it and kicks wherever I place the amplifier piece so that has been the only benefit. If I haven't felt the baby move in a while I will use this and sure enough he will kick it and I know he is alright. Unfortunetly that is not the only thing I wanted it for- I really wanted to hear the heartbeat. My midwife says not to use it very much because the babies don't like the feedback it produces. Don't order it expecting great results.
1,28 Weeks and still can't hear a thing,"We can't hear anything with this monitor - not even our own hearts with the receiver right over our chests! My mother-in-law, who's a nurse, said that at this point in my pregnancy a cheap stethoscope would work better. We're disappointed that we spent the money on something that we had been excited to try."
1,Wish I read reviews first,"I thought this would be a great purchase, but found that I am unable to hear the heartbeat. I hear all the other noises in the room but not the baby, wish I didn't waste my money."
1,What a waste,I received this as a shower gift and was really anxious to use it. At 8 months pregnant I couldnt hear a thing. I moved the microphone everywhere on my belly and nothing. It does however pick up every sound in the neighborhood. Don't even think of buying this piece of junk!
1,basically useless,"When I first saw the Bebe Sounds prenatal listener, I knew that I had to have it! The idea of being able to listen to my little one's heartbeat at home was thrilling. Every month, I had loved going to my prenatal appointments just so I could hear her. Unfortunately, I tried time and again with this device and was unsuccessful in ever really knowing what I was hearing. I tried from week 20 until 34 weeks when I just gave up. Although I followed all of the directions, this product only helped me hear one thing - my husband complaining about all the money I wasted!!! Please don't make the same mistake. If you want to hear a heartbeat, rent a doppler like your health care provider has. Check the classified ads in mom/baby fitness magazines. I wish I had."
1,Don't Waste Your Money,"I purchased this in my 5th month of pregnancy and I am now in my 8th month. The only thing that I have heard with it is my own heartbeat and the sounds of my own stomach growling . When I visit the doctor, my baby's heartbeat is very strong and loud but I have not been able to get ANYTHING with this. In my opinion, it is a waste of money and time."
1,"Zero Stars, if possible.","I also purchased the Bebe Prenatal listener from another store. I just returned it today. I tried it everynight as detailed in the users manual and only heard faint wooshing and my digestive noise. Never heard anything as described in the manual...kicks, hiccups or the heartbeat. My husband was always worried that I could not hear the heartbeat and I had to calm him saying ""the manual says it may take awhile to hear it or that we would not hear the heart beat everyday"".... Well that got old, my baby moves all the time and at some point, the heart should have been in a favorable position for me to hear it. The manual stresses to read the directions closely and don't get discouraged...2 months of trying at 6 + months was enough. It only took one month to get pregnant, and that should be the effort, not trying to hear on this device. I'm buying a stethoscope tomorrow from a medical supply store as I've already missed out on 2 months of hearing the heartbeat at home."
1,a waste...,"As many others have stated, this product is NOT worth a penny. It's a waste of plastic unless you're interested in hearing the quietest sounds around you rather than baby.I've heard people say that it might depend on the weight of mom, but I can tell you, that is not true at all. I'm a thin woman, and not once did I hear baby's heartbeat, and I tried EVERY DAY, until my last month when I finally gave up. Baby was moving so much that I didn't need to hear the heartbeat to know everything was ok.Save your money on something more useful. And if you're that concerned about hearing baby's heartbeat, try renting a doppler from a hospital or typing something like ""rent fetal heart doppler"" in a google search and rent one online."
1,Not worth the money,"We bought this product when I was 28 weeks pregnant. My husband is convinced he has heard the heartbeat, but I'm not sure. We definitely hear lots of other noises, but whether it's my digestive system or the baby, I don't know. I am now almost 34 weeks pregnant and we'll try again to hear it this week, but I am not very confident. We bought just the monitor, not the gift set. All I can say is, maybe it will work in the next few weeks, but I would never buy it again."
2,ehh..,I never heard a heart beat with this device. Money thrown down the drain & purchase regreted :(
1,don't waste your money!!,i don't normally write reviews but this thing is a piece of junk and i wanted to do whatever i could to keep others from wasting their money. all you hear is generic noise. i am now 36 weeks....one month from delivery and i never heard a heartbeat. i would always try right after getting back from the doctor's office and hearing a heartbeat. nothing.
3,"Never heard a single heartbeat, even with twins inside.","Tried right up to a week before delivery and never was able to hear either of our babies heartbeats (twins). We could hear them moving around from time to time, but that was about it.The speakers are fun though. Every time my wife would hook them up it would get the babies kicking all over the place. So it was worth it just for that to us, but I suppose if you held a pair of headphones on there it would work just as well."
3,"It's ok, but I would have gotten something else","I got this as a gift from my mother-in-law at 6 months. At that time we honestly could not hear anything, besides my stomach growl. Now at 35 weeks, my husband & I can actually hear her heartbeat. I can listen best about 30 minutes after eating a meal. You MUST however be in a room with COMPLETE silence to hear anything at all. My husband likes the microphone. As he sings to our baby, we can see her move around in my tummy towards the microphone. Overall, even though we are only really now actually getting to enjoy the product, I would say to save your $$ and get something else."
1,HUNK OF JUNK!!!!!,"WHAT A RIP-OFF!!! I would actually give this product LESS than one star if I could. I was so eager to buy this product, but my 9-month pregnant girlfriend insisted I shouldn't waste my money, and instead gave me hers a few days before she delivered. It never worked for her, and now, at 7 months along, it still hasn't worked for me. All I can hear is gurgling-type noises, which sound EXACTLY the same as when I hold the device up to my HUSBAND'S stomach! I have lots of pregnant girlfriends, and I have yet to find a single person who has used this product with any amount of success. If you really want to clearly hear and acurately measure your baby's heartbeat at home, consider renting a doppler device instead, (see babybeat.com or storkradio.com). These devices are of doctor's-office-quality, and you can rent them for around $30 a month. Otherwise, DO NOT WASTE YOUR TIME OR MONEY ON THE BEBE SOUNDS!!!! THIS PRODUCT IS A JOKE!!!!"
1,Don't Bother,"At 30 weeks pregnant, I thought for sure that I would be able to hear the baby's heartbeat. I hear the movement of the monitor's cord, the creaking of the joint in my finger, and the slight movement of the monitor over my stomach as I inhale and exhale, but I don't hear the heartbeat. It is very frustrating to try to use this product. It says to be patient, and I am a very patient person, but I know when something isn't going to work -- and this won't work, no matter how many times I try. I would not recommend this thing to anyone. Don't waste your time or money!"
1,The Pregnancy Purchase that I Regretted the Most,"I read the reviews, which were mostly bad, then bought the product anyway. I figured that if I followed the instructions it would work. I tried desperately to make this product work. I used it all through my pregnancy (to the last month) and it never worked for me. I am still resentful about it. It's been my biggest waste of money so far (the diaper genie being the next biggest.) Hope this was helpful."
2,save your money and your hopes,"Luckily, I did not buy this product. My mother bought it for me hoping to hear the sounds of her first grandchild's heart. I am currently 35 weeks and have not heard the heart. I hear the rumblings of movement, I hear the creaking in the joint of my finger as I hold the button down, alas, no heartbeat. I have been very let down by this product, as has my mother. I followed the instructions to the letter (they stress in the instructions that you cannot use the product without following every word of their instructions).What a bummer product this is."
1,Don't Waste Your Money,I never write reviews but felt compelled to write this one. I was very excited to learn that I could hear my first baby's heartbeat without waiting to go to the doctor's office. I purchased this product and I am now in my 25th week and can hear EVERYHING but the baby's heartbeat. This product is such a waste of time. I wish that I could return it.
3,50/50,"I found my baby's heartbeat after a few tries...but it is definitely not as clear as I would have thought from reading the package. I recieved mine as a gift, I don't think I would have spent that much money on this item. I started using my monitor during the end of the 8th month.A very interesting aspect of this product is the reaction I got while using the small speakers and CD. My baby kicks like crazy every time I turn it on. I really think he enjoys the music. I haven't needed to use the belt to hold the speakers in place...I just place them in the elastic part of my maternity pants and they stay just fine.I would recommend one of the prenatal listeners that become a baby monitor for after the baby is born if you intend on buying one of these. At least that way you can get some use out of the thing if you can't get a heartbeat and don't like mozart."
1,Don't buy this product!,"I purchased this product when I was only a few months pregnant. I thought that I would be able to at least hear something around 20 weeks. Well, I am now 38 weeks (two weeks until my due date) and I still cannot hear much. Just this week I started hearing something, but who knows if it is really the heartbeat! If you really want to hear your babies heartbeat I recommend renting a doppler. You can get one online and use them from 12 weeks on! DO NOT BUY THIS PRODUCT!"
1,Don't even bother...,I bought this item and let me tell you it was a waste of money. I never got to hear the heartbeat only the cars driving on the street. You do get to hear your own stomach and bowels moving but that's not what you're getting it for. It's a piece of junk.
1,A piece of junk!,"I thought that I would get some peace of mind being able to hear my baby's heartbeat with this product. BOY WAS I WRONG! I totally wasted my money! I want to try and return it. All I heard was some loud, obnxious clanks! And I heard these sounds regardless of what I put it up to...stomach, chest, arm, leg, etc. And the product instructions say that you can hear when the baby moves and kicks Well, I watched my stomach jump from the baby's movements, while using the device and didn't hear a darn thing. DO NOT WASTE YOUR MONEY ON THIS THING! IT DOES NOTHING!"
1,Don't waste your time or money!,"I was so excited to get this as a gift, until I tried it. I may as well get two paper cups and connect them to a string instead!It is absolutely useless!!!! It doesn't matter how far along you are, my friend is about 81/2 months pregnant and can't hear a thing either!Diana"
1,Don't Buy!!!,"Do not buy the Bebe Sonds Prenatal Listerner. This product does not work, even on medium sound. The only thing this product did was make my wife worry that something was wrong with our son. Even at 8 months, it still doesn't work yet the baby is alive and kicking. This thing is a joke and a waste of money. So don't even think that it will work for you and that you should give it a try. This company should be sued."
3,"If you have patience, it works wonderfully!","My wife and I purchased this product and after a couple of minutes were able to hear the babies heartbeat. So much so in fact that we were able to use our computer to create a disc of the heartbeat. The only drawback was that any other sounds were amplified, but the pros outweight the cons. Great product!!"
1,what are these people thinking,"this item is only good for ease-dropping. it is better than a glass to the wall. doc says half of the peeps think they are hearing the baby, but are really hearing their heart...which can beat fast at times...especially after you bother with this thing long enough and get frustrated. after 4 weeks i bought a doppler on ebay for $130, you can get them now for $70ish. if you rent they are $20-50 per month."
1,Not So Helpful,We were anxious to hear the baby's heartbeat. This listener will not provide you with what you expect to hear. I could only use it for the last few weeks of the pregnancy. In order to hear anything you must be in a silent room and have ultrasonic hearing. You can hear a faint heartbeat in your 9th month if you practice often. It is not worth it. Invest and rent the dobbler if you need real reinforcent on a regular basis especially from early on.
1,Complete Waste of Money!,"This is a piece of junk! I absolutely do not recommend this product. My husband bought it for me and it is awful! We have tried and tried again to hear our son's heartbeat! I am 25 weeks pregnant, and the packaging says you will be able to hear the heartbeat at 20 weeks! All we can hear is static. It makes the same sound if you put it on your arm! This item is a peice of junk! Do not waste your money!"
1,waste of money,"I am six months pregnant and still cannot hear my baby's heartbeat. I do enjoy using the fetal speakers and mic to play music and read to my baby. He gets very excited when hearing my voice; however, I purchased this item mainly to hear his heartbeat. I wish I had read the reviews prior to purchasing ...you will NOT hear your child's heartbeat with this monitor."
2,"Quiet as a Mouse, Still as a Rock","I just bought the prenatal listen by itself and was dissapointed that I had to hold the monitor and the button down the whole time I was trying to listen. Any slight movement of your hand or finger while holding the device or pressing the button can sound like a kick. This thing takes alot of patience but if you can be still as a rock, quiet as a mouse you can hear the baby's movements, I haven't been able to hear baby's heartbeat yet, just my own and I'm 20 wks."
2,Needs to Improve,This system does not work as well as it states it will. It tries to give you a warning that if you are not that far along you will not be able to hear the baby heart beat and it also says the heart beat won't sound like it does in the doctor's office. My husband and I purchased this when I was 5 months and I'm now 8 months and we still can't honestly say we have heard the heart beat. We basically uses this now to talk to our baby. I wouldn't recommend spending the money on this.
2,"Nice idea, but...","We were looking forward to purchasing this item to hear our baby's heart beat. Unfortunately, we haven't had much luck with it... it's hard to find the heart beat, you can hear any external sounds and even hear your hand moving around on the device. We're going to keep trying though... maybe it will work sometime in the 7 weeks before our baby is due..."
1,Bad Product that doesn't deliver,This Prenatal heart listener is junk.All you hear is Stomach and Intestine noises. I Would buy a book or something instead.
1,Waste of time and money,"I bought this product at 4 months, I couldn't wait to use it. I am now 8 months pregnant and haven't heard any sign of a heart beat, I hear my food digesting though to remind me of how fat I am now. Don't waste your time or the money. By yourself a weight watchers package deal for after the baby comes..."
1,Very Disappointed,I haven't been able to hear the heartbeat once and I am 26 weeks along. At first it scared me to use the monitor and not hear anything but the cars passing outside. Waste of money!
2,Can't hear the heartbeat!,"We bought this product as soon as we found out that we were pregnant and I couldn't wait for the fifth month to hear the heartbeat. I'm now over 8 months pregnant and still can't find it. I do enjoy listening to him moving around but I'm really not sure if it's him or just my own stomach rumbling!I enjoy using the product to play Mozart music and to speak to him, but I wouldn't have paid the money just to do these things."
3,Bebe Sounds Prenatal Listener,"Well I purchased this for my daughter, she was very excited about it. The first one we received was defective, the CD of music kept skipping so we requested a replacement. Haven't been able to find the time to hear the baby's heartbeat lately, when it was first received she couldn't hear it. Basically all that is used from this is the CD and the microphone, she just hooks it up to her CD player and plays the baby music. Not sure if I would ever pay full price for this or not. Glad it was on sale."
1,NEVER WORKED,Ive had 2 pregnancys and My sister in law and I were pregnant at the same time. We both would try using this monitor and never heard anything but ourselves. Mine doubled as a toy for my 2 year old. Dont waste your money.
1,WAY too sensitive... don't bother,"That horrendous sound you're hearing is actually the tiny bit of friction in the nuckles of your fingers because this device is SO sensitive, it will pick up EVERYthing. We found it to be so rediculously sensitive that it was impossible to differentiate the baby's heartbeat from other sounds such as the mother's digestive system. The worst part was trying to keep still enough to eliminate these parasitic noises. Even the most impercievable joint movement in the user's hand is picked up loud enough to block out all other sounds. Spend your money on something else."
1,Not worth a cent!,This product is not worth your hard earned money. Spend a few extra dollars and rent or purchase a doppler.
1,useless,"I do not own the bebe sounds deluxe kit, but I own the regular one-headset version and IT DOES NOT WORK. Do yourself a favor and buy something you really need with the money you would be wasting on this."
1,Listen to 99% of the reviews -- Not worth it!,"I bought this set for my husband for Christmas b/c I thought it would be cool for him to hear the baby whenever he wanted to. I spent the extra $$$ on the deluxe set b/c of the fact I could play music to the baby. Well, I was 6 months pregnant and we couldn't find a heartbeat anywhere. Even if the room is totally silent we still couldn't find it and I read the instructions! I bought it online for $40 and am selling it now on Ebay for 1/2 that. I'm in my 8th month and still don't hear anything. I guess I just was hoping I'd get it to work. Don't bother."
1,Waste of money and source of anxiety,"DO NOT BUY. This product stinks - it doesn't work/detect until well into the pregnancy (when you are less concerned than earlier); instead, rent the better/more sensitive version. Of course, not hearing a hearbeat totally stressed you out, so save yourself the anxiety. The better (rentals) detect earlier, will give you more peace of mind when you most need it. They said they would give me a refund, but never sent it and said they didn't receive the monitor which I had shipped back to them."
2,Disappointed,"Someone gave me this monitor in the beginning of my pregnancy. I am now eight months pregnant and I have yet to find my baby's heartbeat on this monitor. I have followed the directions and it still does not work. Even in the quietest room, all I can hear is a humming and an occasional thump from my baby. Definitley a waste of money."
1,Not worth the money,When my husband and I got this product we couldn't wait to hear the baby's heartbeat. I was 5 months pregnant then and am 7 months now and have yet to hear it with this product. I like playing music for the baby but you can do that with just a CD player and headphones...
1,What a waste!,"My husband and I tried patiently to hear SOMETHING with this thing. We finally gave up when, at 27 weeks, we both SAW the baby kick the very spot where we had the listener placed. The manual says that kicks sound like a ""thud."" We heard nothing but the same old ""whooshing."" I was shocked since this thing picks up every sound outside and around the belly loud and clear. Anyone who hears heart beat or hiccups with this listener must have a much softer internal ""whooshing"" going on!"
2,Had to be on a weird angle to hear,"I tried from 4.5 months through my 6 month of pregnancy to hear my child's heartbeat. Finally after numerous attempts, arching my back while sitting and placing it right above my navel I hear my child's heartbeat."
